id,bid,正文,原始图片url,视频url,位置,日期,工具,点赞数,评论数,转发数,话题,@用户
4084322489313217,EznC0D4Nb,和朋友一起出去吃饭，我一直问他你想吃什么，他也问我，我说随你，看你想吃什么。后来走了很多路，他急了：“你能不能有点主见啊？”我一时间竟然不知道该怎么说。想来每次出门和朋友们一起吃，我很多次都会问他们想吃什么，每次尽量按照他们的意愿来。其实我在做自己事情的时候有自己的主见，但是一和别人一起，就总想优先考虑别人的喜好和感受。就和我以前在感情中一样，每次总是想着让对方先选择，让对方先开心。这种看似软弱的行为，很可能让别人觉得你在讨好或者没有主见。其实何尝不是呢？我多想不考虑任何人的感受，爱咋咋地我就这么屌，可是真的很难做到啊。感觉自己一辈子都会活在别人的眼光里，靠着讨好别人的欢喜让自己觉得其实还是有人喜欢的来增加信心。说白了还是自己内心太软弱没自信，所以才会畏畏缩缩。其实我也不知道我到底在说什么，只是最近内心觉得太压抑了，也不知道该怎么排解……,,,,2017-03-12,卖屁股来的iPhone 7,2275,723,298,,
4084281279725344,EzmxxEO0o,"我只是想暂停截个图😳你为什么要嘴角抽搐成这样？😂😂😂😂真的壮士来一发嘛的秒拍视频（使用#秒拍#錄製,免流量看熱門短視頻!） ",,"http://miaopai.video.weibocdn.com/oHT0jEVvlx079qJEZdV601040200nBEx0E013?Expires=1580474429&ssig=ZNG%2F5D4%2F31&KID=unistore,video",,2017-03-12,秒拍客户端,435,147,22,秒拍,
4084275923628120,EzmoUfdQ4,内心戏太多的人终究很难幸福。 ,,,,2017-03-12,卖屁股来的iPhone 7,1703,352,116,,
4084239449730129,Ezls4EPfz,我可能要被拉黑了。。。。。。 ,"https://wx2.sinaimg.cn/large/67e8c7fdly1fdj9iy69haj20ku0kudnu.jpg,https://wx4.sinaimg.cn/large/67e8c7fdly1fdj9ixj3e2j20ku0cx42n.jpg",,,2017-03-11,卖屁股来的iPhone 7,1264,531,24,,
4083904401093015,EzcJG4Alh,和朋友们聊天，聊到男女之间有否纯洁的友谊，好多争论不休。我觉得是有的，但是也有不少人（男生居多）觉得没有。你们觉得呢？（Ps.当然就算是朋友，有一方有对象了，双方还是应该自觉保持距离的） ,,,,2017-03-11,卖屁股来的iPhone 7,911,717,50,,
4083539164544793,Ez3eAj4j7,朋友问我，认真的，究竟喜欢什么样的人。我想了半天也不知道。但是我年少时候，总幻想要和一个机车男谈恋爱。纹着酷酷的纹身，扎个酷酷的小辫，有一身酷酷的肌肉，对感情酷酷地执着…经常载着我驰骋在大路上丛林里荒漠上，带我到山上看树木流水，拿起相机拍着属于我们的瞬间，然后就着草丛做爱。总之整个感觉就是酷酷酷酷酷酷的。如今我还是拥有这一份不切实际的少女心，想要谈场如此这般的恋爱，哪怕不问归期不看前程。真心希望每个人少女时代的梦能够如愿以偿。,,,,2017-03-09,卖屁股来的iPhone 7,735,336,37,,
4085552351886840,EzTBF7UQU,我回答了 @吴霈 的問題，問題價值￥111.11，大家快來花1元圍觀~ 微博问答 ,,,,2017-03-15,卖屁股来的iPhone 7,66,49,3,,吴霈
4085328400363658,EzNMs1wBs,这两天我妈妈来看我了，她说：“要不然我在这里看着你直到你谈恋爱了我再走吧。”我：“……………那你在这里我不是更不方便谈恋爱了么………”她：“有什么不方便，你带男孩回家的话，我就出去玩。”我：“？？？？？？？？？？？？？？？？？？？？？？？？？？？”妈，你想什么呢？？？？？ ,https://wx4.sinaimg.cn/large/67e8c7fdly1fdmqjeiqcgj207e05qt8n.jpg,,,2017-03-14,卖屁股来的iPhone 7,939,261,27,,
4085306414240642,EzNcZhNbs,#肖骁又立功了#挺少奶奶@肖骁Mix ！特烦那些说我炫富的！我每天都坐一千多万的地铁上班，我炫了吗？我和中国工商、建设，农业等大型国有银行有长久的业务来往，我说过吗？再强调一遍，我想低调但实力不允许，这就是我日常的生活 ,https://wx4.sinaimg.cn/large/0067NbT0ly1fdmjzxcirkj30go217n3g.jpg,,,2017-03-14,微博  weibo.com,306,66,313,肖骁又立功了,肖骁Mix
4082290286390306,EywKgqOps,想在身上纹个美人鱼………网上搜索“美人鱼”找找图片做参考………一开始都很正常很漂亮，直到我看到了这张…………………………这是张飞鱼吧……………………………纹在身上一定老霸气了……………………… ,"https://wx4.sinaimg.cn/large/67e8c7fdly1fdd1kh4dzxj22c02c0u10.jpg,https://wx3.sinaimg.cn/large/67e8c7fdly1fdd1n84rhwj20g40g4q3x.jpg",,,2017-03-06,卖屁股来的iPhone 7,620,229,107,,
4081906599059365,EymLpC0KN,人有多坚强就有多脆弱。晚睡熬夜都能撑得过去的你，却因为要早起而忍不住哭出了声。美食吃撑了都停不住的你，却因为一顿饭没吃而心情颓废败坏丧失生活乐趣。做手术疼的都没哭的你，却因为他的一句话情不自禁流泪到双眼红肿。 ,,,,2017-03-05,卖屁股来的iPhone 7,1315,165,95,,
4081749581538732,EyiGa6sig,我现在的状态是，想谈恋爱又不想。想去爱人也被人爱着，可是喜欢和牵挂一个人的感觉真的太难受太难受了。自我评价太低的我，总是害怕失去，所以处于感情中的我其实很粘人很卑微，很难像个女王一样昂头。想过如果谈了恋爱我想和你们分享快乐，可是又害怕如果哪天分手留下一地尴尬却要笑着故作坚强偷偷哭泣，不想被大家看笑话。我不喜欢处于感情中的自己，也很讨厌失恋后的自己。所以可能也许单身这个身份才是永远适合我的。,,,,2017-03-05,卖屁股来的iPhone 7,1932,533,212,,
4081728072604095,Eyi7taVrx,我多想和你一起，去吃遍所有小吃，去看遍所有云朵，去走遍所有沙滩，去爬遍所有高山，去游遍所有小巷，然后用遍所有姿势，睡遍所有旅舍的床…我们都会给对方都拍上美美的照片，就算拍成表情包也会哈哈互相嘲笑…如果一切都无法实现的话，那就静静地和你待在一起，疯狂地做爱做爱直到古稀…,,,,2017-03-05,卖屁股来的iPhone 7,780,448,83,,
4081003032953668,ExZg3conO,“我通过了你的朋友验证请求，现在我们可以聊天了。”“我通过了你的朋友聊天请求，现在我们可以恋爱了。” ,,,,2017-03-03,卖屁股来的iPhone 7,1184,148,35,,
4082789085112745,EyJIMls3D,“是不是有钱了就没有烦恼了？”“没钱有没钱的烦恼，有钱有有钱的烦恼。但我宁愿做个有烦恼的有钱人。” ,,,,2017-03-07,卖屁股来的iPhone 7,794,106,38,,
4082423924414521,EyAdOiwpX,【简单的月经二三事】 ,"https://wx2.sinaimg.cn/large/67e8c7fdly1fdddy6xwh4j20hs1ql150.jpg,https://wx2.sinaimg.cn/large/67e8c7fdly1fdddy6i8s6j20hs1ku16w.jpg,https://wx3.sinaimg.cn/large/67e8c7fdly1fdddy7gdaoj20hs23e184.jpg,https://wx2.sinaimg.cn/large/67e8c7fdly1fdddy7rui6j20hs0tqjz2.jpg",,,2017-03-06,卖屁股来的iPhone 7,1318,3358,868,,
4082416295037747,EyA1vl8xZ,【粉丝投稿】哈哈哈哈哈哈哈哈哈哈哈哈现在商场都这么玩了嘛？？？？？？？？？？ ,"https://wx3.sinaimg.cn/large/67e8c7fdly1fdde327jxuj20ku112aof.jpg,https://wx3.sinaimg.cn/large/67e8c7fdly1fdde32l010j20zk0k0qgh.jpg,https://wx2.sinaimg.cn/large/67e8c7fdly1fdde32vy8uj20zk0k0qcf.jpg,https://wx3.sinaimg.cn/large/67e8c7fdly1fdde33d798j20zk0k019d.jpg,https://wx2.sinaimg.cn/large/67e8c7fdly1fdde33nyvbj20zk0k0dn3.jpg,https://wx4.sinaimg.cn/large/67e8c7fdly1fdde3415kjj20zk0k0k1z.jpg",,,2017-03-06,卖屁股来的iPhone 7,1986,781,1299,,
4080866836043665,ExVInpmet,哈哈哈哈哈哈哈哈哈哈哈哈哈哈哈哈哈哈哈哈哈哈哈哈哈哈哈哈哈哈哈哈哈哈哈哈哈哈哈哈哈哈哈哈哈哈哈哈 ,https://wx4.sinaimg.cn/large/67e8c7fdly1fd8i6tccvqj20ku04rwf9.jpg,,,2017-03-02,卖屁股来的iPhone 7,1006,229,107,,
4080584344655232,ExOmKjx2o,前阵子瘦身减肥去了……给大家看一下我的减肥历程………不是非常励志，也算是有点效果吧哈哈哈哈过了年又想继续减脂塑型……于是给我的粉丝20个免费名额！我们一起减！！💅🏻报名链接：网页链接点进去直接报名！！前20个和我一起减肥（免费的！！）！3月5号截止报名，3月12号开营！ ,"https://wx2.sinaimg.cn/large/67e8c7fdly1fd7lj784dlj20hsajz4qr.jpg,https://wx3.sinaimg.cn/large/67e8c7fdly1fd7ll9u1cij20hs0tv4ne.jpg",,,2017-03-01,卖屁股来的iPhone 7,227,163,22,,
4080565139327566,ExNRLD8wC,美女被困水箱，与黄鳝共处。这个邪恶的桥段也只有《我是你的夏威姨》这个综艺才想得出来，好多网友表示，看了几期，万千孩子死在自己手里。 ,"https://wx3.sinaimg.cn/large/0067NbT0ly1fd7eey1j88g308c069qp3.gif,https://ww2.sinaimg.cn/large/0067NbT0jw1fd7ef0ba0bg307905g7wh.gif,https://ww3.sinaimg.cn/large/0067NbT0jw1fd7ef2q5h1g30c809ux2h.gif,https://ww3.sinaimg.cn/large/0067NbT0jw1fd7ef4mnihg30d609wx4k.gif",,,2017-03-01,微博  weibo.com,495,278,421,,
4080196996615581,ExEhZrL0V,论如何一句话结束聊天。 ,https://wx2.sinaimg.cn/large/67e8c7fdgy1fd6d99p4qwj20hs0vktm7.jpg,,,2017-02-28,卖屁股来的iPhone 7,803,371,24,,
4080145410863081,ExCWN3CwF,哈哈哈哈哈哈哈哈哈哈哈哈哈哈哈哈哈哈哈哈老北京的大耳帖子，请你吃，管够！！ ,"https://wx4.sinaimg.cn/large/67e8c7fdly1fd67bfy729j20hs0k615k.jpg,https://wx4.sinaimg.cn/large/67e8c7fdly1fd67be8rz2j20hs0k6174.jpg,https://wx3.sinaimg.cn/large/67e8c7fdly1fd67bj1kcdj20hs205kjl.jpg,https://wx3.sinaimg.cn/large/67e8c7fdly1fd67bk22xoj20hs0u71e4.jpg",,,2017-02-28,思聪淘汰的iPhone 5s,467,394,180,,
4080121318891783,ExCjVBj9R,感觉现在越来越觉得一个人比较自在了，越来越懒得和别人一起出门玩了。一想到要一起出去玩，还要洗澡洗头，化妆打扮，还要考虑去哪里玩，想想等会儿吃什么，总得顾及别人的感受和喜好，就觉得索然无味了。还是一个人好，做什么都随自己的心情自在。也许这是单身太久的后遗症，也是单身的原因吧。 ,,,,2017-02-28,卖屁股来的iPhone 7,1098,198,49,,
4079931798887317,ExxofBhZP,我朋友说：“要是你在酒吧，有一个很帅很帅的男孩想要和你一夜情，你会去吗？”我：“不会。”他：“为啥？”我：“你说他很帅很帅的话，干嘛要找我？我就会怀疑他是不是有病。”朋友：“难怪你单身还没有性生活。” ,,,,2017-02-28,卖屁股来的iPhone 7,1547,333,53,,
4079895015317780,ExwqVmjoE,"和朋友们在外面一起吃饭，突然有很强的手机震动的声音。“谁的手机在响？？”“肯定不是我的。”我很确定得说,“因为根本不会有人找我。” ",,,,2017-02-27,卖屁股来的iPhone 7,1174,153,40,,
4078417353689058,EwTZBftGW,【粉丝投稿】也许婚前试性爱真的有必要？ ,https://wx4.sinaimg.cn/large/67e8c7fdly1fd0ov1ef5nj20hs13ugz7.jpg,,,2017-02-23,卖屁股来的iPhone 7,373,893,24,,
4078083327134999,EwLiQtW8D,我妈妈跟我打了一通电话，又在催我赶紧做个宽双眼皮，嫌弃我双眼皮太窄了简直看不到。头一次见到这样催着让女儿整容的家长。。。我一气之下说：“怎么了，难道我真的有那么丑吗？！”妈妈：“是的。”我可能有个假妈妈[攤手][攤手][攤手][攤手][攤手] ,,,,2017-02-22,卖屁股来的iPhone 7,1351,341,11,,
4078436852470907,EwUv3amNl,和男神过了个情人节......感觉他再也不会理我了........................ ,"https://wx4.sinaimg.cn/large/67e8c7fdly1fd0b0ib6lij20ku2x47in.jpg,https://wx4.sinaimg.cn/large/67e8c7fdly1fd0b0jk8cpj20ku3344e3.jpg,https://wx4.sinaimg.cn/large/67e8c7fdly1fd0b0kuoz3j20ku438k8z.jpg,https://wx3.sinaimg.cn/large/67e8c7fdly1fd0b0m4oq2j20ku5egdx2.jpg",,,2017-02-23,微博 weibo.com,1147,737,1095,,
4078431718722759,EwUmLABbF,吴……………吴奇隆？？？？？？？ ,"https://wx4.sinaimg.cn/large/67e8c7fdly1fd0qimre1ej20ku11215o.jpg,https://wx1.sinaimg.cn/large/67e8c7fdly1fd0qimzr4uj20zk0k0wi3.jpg,https://wx3.sinaimg.cn/large/67e8c7fdly1fd0qin6898j20hi0g9wfj.jpg",,,2017-02-23,卖屁股来的iPhone 7,1246,338,124,,
4075961756626859,EvS6XrNWP,好久没有正常画人了………………………刚刚又练了一下手………………………… ,"https://wx4.sinaimg.cn/large/67e8c7fdly1fcsust7yn9j20rs0rswqh.jpg,https://wx4.sinaimg.cn/large/67e8c7fdly1fcsustn1bxj20rs0rsdut.jpg,https://wx2.sinaimg.cn/large/67e8c7fdly1fcsusspbz7j20rs0rs7gs.jpg,https://wx4.sinaimg.cn/large/67e8c7fdly1fcsusroyghj20rs0rsgzu.jpg,https://wx2.sinaimg.cn/large/67e8c7fdly1fcsusv6s3sj208c08c0ta.jpg,https://wx2.sinaimg.cn/large/67e8c7fdly1fcsusu3idtj20rs0rsdul.jpg,https://wx4.sinaimg.cn/large/67e8c7fdly1fcsusukia6j20rs0rs7ka.jpg,https://wx2.sinaimg.cn/large/67e8c7fdly1fcsuss7nq7j20rs0rstos.jpg,https://wx3.sinaimg.cn/large/67e8c7fdly1fcsusuzop0j20rs0rsqfc.jpg",,,2017-02-17,卖屁股来的iPhone 7,898,603,30,,
4075582603616962,EvIfqfaW6,反正早晚要走，何必牵强留恋。 ,,,,2017-02-16,卖屁股来的iPhone 7,1202,294,51,,
4075554795852597,EvHwzoywJ,最幸福的事情，就是什么都不做，窝在床上一边吃零食一边看电影💅🏻 ,https://wx4.sinaimg.cn/large/67e8c7fdly1fcrk3s97s0j22io1w04qv.jpg,,,2017-02-15,卖屁股来的iPhone 7,1120,649,18,,
4075484410883196,EvFH33HL6,不吃夜宵，12点睡，7点多起，一日三餐，定期健身，拥有爱人，稳定性爱，这是我目前最希望的事情。 ,,,,2017-02-15,卖屁股来的iPhone 7,1299,380,72,,
4075376407754639,EvCSQwxkP,收到朋友给我寄的情人节礼物………………………………………………………………………………… ,"https://wx3.sinaimg.cn/large/67e8c7fdgy1fcqzm4wvnuj22c0340hdt.jpg,https://wx1.sinaimg.cn/large/67e8c7fdgy1fcqzm22up2j22c0340qv5.jpg",,,2017-02-15,卖屁股来的iPhone 7,1397,725,31,,
4075193443574599,Evy7KeZUP,情人节，一个悲伤的故事 ,"https://wx4.sinaimg.cn/large/67e8c7fdly1fcqelk5dhdj20ku112dkh.jpg,https://wx4.sinaimg.cn/large/67e8c7fdly1fcqelkdozjj20ku112q60.jpg,https://wx4.sinaimg.cn/large/67e8c7fdly1fcqelktnp3j20qo0qoai4.jpg,https://wx4.sinaimg.cn/large/67e8c7fdly1fcqell93bpj20qo0qotf1.jpg,https://wx3.sinaimg.cn/large/67e8c7fdly1fcqelllc29j20qo0qodlv.jpg,https://wx2.sinaimg.cn/large/67e8c7fdly1fcqellwe6rj20qo0qogq0.jpg",,,2017-02-14,卖屁股来的iPhone 7,993,353,29,,
4075051244520088,EvuqoiXSE,握草，我他妈在纹身店，刷朋友圈刷到一个看起来很普通很正常的视频，结果点开开始嗯嗯啊啊岛国女优的呻吟！！！！我还放的最大声！！！！我他妈我这边两个大男人啊啊啊啊啊啊啊啊！！！！尴尬死了啊啊啊啊啊！！！！他妈我还要不要做个人了！！！！ ,https://wx2.sinaimg.cn/large/67e8c7fdgy1fcpy998oxmj201a01aq2p.jpg,,,2017-02-14,卖屁股来的iPhone 7,1513,383,14,,
4075008516585724,EvtjtrDfm,如果公公都是谢广坤这样的，我情愿一直静静地做一只单身狗 #乡村爱情9#下部啥时候播呀？快来个大神把谢广坤收走吧…… ,"https://ww4.sinaimg.cn/large/0067NbT0jw1fcp3r9lijoj30zs2i8e81.jpg,https://ww1.sinaimg.cn/large/0067NbT0jw1fcp3rdri38j318o3ya7wh.jpg,https://ww4.sinaimg.cn/large/0067NbT0jw1fcp3rlgdxtj318o3hnttj.jpg,https://ww1.sinaimg.cn/large/0067NbT0jw1fcp3rp5kizj318o4et4qp.jpg,https://ww4.sinaimg.cn/large/0067NbT0jw1fcp3rt25t1j30zs3zxdv2.jpg,https://ww2.sinaimg.cn/large/0067NbT0jw1fcp3rwg9rij318o1i0aqo.jpg,https://ww2.sinaimg.cn/large/0067NbT0jw1fcp3s2duguj318o39b7wh.jpg,https://ww1.sinaimg.cn/large/0067NbT0jw1fcp3s6uwpwj30zs3rcb29.jpg,https://ww4.sinaimg.cn/large/0067NbT0jw1fcp3sbe02tj318o1jealb.jpg",,,2017-02-14,微博  weibo.com,616,219,599,乡村爱情9,
4074851100328646,EvpdA1nuK,情人节来了，你想好怎么秀恩爱了吗？评论里秀一波恩爱吧！！！我已经做好准备接招了，狗粮也买好了（正在吃）！！单身狗们和我一起吃狗粮吧。😳然后再互撩！！！！！！！ ,,,,2017-02-14,卖屁股来的iPhone 7,762,1338,4,,
4074739988934848,EvmkmBums,决战食神的彩蛋真的有毒，又搞笑又能让人飙泪，15年前陪你看大陈小谢恶搞《迎春花》笑出眼泪的人，15年之后，还在陪你看《决战食神》吗？#有情人吃成家属# 微博视频 ,,,,2017-02-13,微博  weibo.com,553,191,395,有情人吃成家属,
4074481981006872,EvfCe4dVS,“为什么没人喜欢我，可能我不讨人喜欢吧。”“嗯？汪！” ,,,,2017-02-13,卖屁股来的iPhone 7,1150,288,12,,
4074474757904463,Evfqzxajl,“我今天走了一万多步，怎么没有人给我点赞？！”“其实你只要走一步，就可以得到一个大大的赞。”“真的吗？怎么走？”“走到我心里。” ,"https://wx4.sinaimg.cn/large/67e8c7fdly1fco42bo9tfj202t02njr8.jpg,https://wx1.sinaimg.cn/large/67e8c7fdly1fco42bjczjj203203ct8k.jpg",,,2017-02-12,卖屁股来的iPhone 7,1994,212,96,,
4074350425993140,Evcc2p95y,哈哈哈这妹子活生生把自己男友逼弯了？！两个男人和一个女人之间的故事，结尾真心狗血！说说你和基友是怎么相熟的故事吧~~ AmazingWorks的秒拍视频 ,,"http://gslb.miaopai.com/stream/3XL5bKTTGvvAIROVvUbxzw__.mp4?yx=&refer=weibo_app&vend=weibo&label=mp4_hd&mpflag=0&Expires=1580474466&ssig=C0OwbM2jYh&KID=unistore,video",,2017-02-12,微博  weibo.com,421,140,362,,
4074105872945461,Ev5PBcmfr,你以为别人愿意和你聊下去，可其实他们都是礼貌性回应而已。 ,,,,2017-02-11,卖屁股来的iPhone 7,1441,368,99,,
4073755414113681,EuWIlhg9H,情人节快来了，时间不多了！！！！赶紧在评论里互撩起来吧！！！！！发照片发情话发段子随意！！！！爆出你们的地址！！！！单身狗们一起约着过情人节吧！！！！！我先来，北京朝阳区望京！！！！！！ ,,,,2017-02-11,卖屁股来的iPhone 7,1122,6114,33,,
4073753107176783,EuWECu70z,我决定了，情人节前一定要找个人一起过，如果做不到，我就把这条删了。 ,,,,2017-02-10,卖屁股来的iPhone 7,1185,467,23,,
4072641368926382,EutJuBs9U,“我家的三只猫想你了。”“你不是只养了两只猫吗，还有一只？”“喵~” ,,,,2017-02-07,卖屁股来的iPhone 7,2168,685,421,,
4072308647409183,Eul4Qv5sX,我爱的人是个无赖，他一直赖在我心里就是不肯走。 ,,,,2017-02-07,卖屁股来的iPhone 7,1147,241,32,,
4072306994726305,Eul2bjPwJ,我记得那天，你说一起拍个合照吧。我点点头，好呀。于是我紧紧挨着你脸，对着镜头使劲儿睁大眼睛微笑。你头上洗发水味道淡淡的真好闻。你看着我做作的表情忍不住笑着说，来，把头转过来。就在我转头之后，猝不及防你就吻了上来，然后按了快门。这是我们的第一次接吻，也是我们的第一张合照。 ,,,,2017-02-07,卖屁股来的iPhone 7,1182,345,21,,
4072247678964937,EujuvBCbL,爸！！！！！！！！你怎么了爸！！！！不要发这种标题党文章给我好嘛！！！！吓死宝宝了…………… ,https://wx2.sinaimg.cn/large/67e8c7fdly1fch09uvb3dj20hs0vkwhn.jpg,,,2017-02-06,卖屁股来的iPhone 7,962,314,9,,
4072187679868714,EuhVJFpiO,我爸最近怎么跟鸡和鸟过不去啊。。。 ,"https://wx4.sinaimg.cn/large/67e8c7fdly1fcgtdy0k82j20hs0vk154.jpg,https://wx2.sinaimg.cn/large/67e8c7fdly1fcgtdxhasfj20hs0vk160.jpg",,,2017-02-06,思聪淘汰的iPhone 5s,879,180,2,,
4072174430599894,EuhAn2w3I,#超级碗# 美国春晚引爆太空城！Lady Gaga从天而降啊啊啊！！！我的gaga女神真是太美太炫酷了啊啊啊啊！！！好想也在现场啊啊啊啊啊啊啊！！！！！！！ 微博视频 ,,,,2017-02-06,搜狗高速浏览器,2796,668,778,超级碗,
4072108508526496,EufS2zM88,粉丝在网上看到，发给我的。。。😂😂😂这是谁画的啊？？？？？？？？？ ,https://wx3.sinaimg.cn/large/67e8c7fdgy1fcgk95b2utj20cs2a1dm1.jpg,,,2017-02-06,卖屁股来的iPhone 7,811,173,40,,
4071944561104608,EubBC4Dmg,“你怎么没找女朋友啊？”“因为我的要求有点高，我喜欢漂亮的、可爱的、阳光的。对了，你怎么没找男朋友啊？”“因为我不够漂亮，不够可爱，不够阳光。” ,,,,2017-02-06,卖屁股来的iPhone 7,2299,387,52,,
4071582168861750,Eu2b6Bbls,最近比较缺表情包了[愛你][愛你]评论里发一些你们觉得最有意思好玩的表情包，互相收藏吧~~[愛你][愛你] ,,,,2017-02-05,卖屁股来的iPhone 7,981,3036,31,,
4071574824649601,Eu1Zgjvzz,卫信加了一些粉丝，有个粉丝过年前一天发了一个红包给我，我点了下发现是50块有点惊讶。于是我问他怎么发这么大的，等他回我了，我也回个红包给他。结果问了几遍没回我，我就忘了…年后他又发红包给我，这次我没敢点，在祝他新年快乐后，问他为什么发红包又不说话？他依然没回我。过年祝福的人很多信息不断，我又忘了这事。不过记住了他的头像和名字。今天刷朋友圈，无意中刷到他的，我点进去看了下，都是分享的公众号和音乐。于是我主动问他，为啥只发红包不说话？结果他又给我发红包，我说一句他发一句………我不敢点，也给他发了一个红包，他没收。后来翻了翻朋友圈，翻到之前他说他有抑郁症的一句文字。我就赶紧问他抑郁症怎么样了，他终于打字回我了“在吃药”。我让他好好治病吃药，他只一直发红包，继续什么都不说。突然觉得很难受，抑郁症的人有时候做事可能别人没办法理解，但是他们其实最需要别人的关心和理解，这种心理我自己很明白。我想知道我的粉丝中有多少有抑郁症或者抑郁倾向的人？治好的如果愿意分享，可以分享你们治愈的经历；还在受抑郁症折磨的，一定要好好治疗下去！！,,,,2017-02-04,卖屁股来的iPhone 7,1045,673,23,,
4071436504894204,EtYoakxcM,我的一个微信名叫“网瘾少女”，群里一个人说我给了他灵感，然后他把名字改成“性瘾少男”…………我？？？？？？？？？？？？？？ ,https://wx4.sinaimg.cn/large/67e8c7fdly1fcef4v4lcqj20ku0kuta0.jpg,,,2017-02-04,卖屁股来的iPhone 7,2037,473,32,,
4071225900250596,EtSUu13bS,三岁时的第一口冰淇淋，五岁时的第一支彩色铅笔，八岁时的第一张音乐唱片，十二岁时的第一本漫画书，十六岁时的第一套爱情剧，十八岁时的第一部色情片，二十岁时的第一次逃课约会，二十四岁时的第一次独自旅行；昨日的温酒，今夜的星空，明天的早餐。以及，那天第一眼的，你的笑容。 ,,,,2017-02-04,卖屁股来的iPhone 7,1703,498,127,,
4070999797867245,EtN1Nx0D3,你们迟到了吗~[攤手] ,,,,2017-02-03,卖屁股来的iPhone 7,540,459,9,,
4070836929101190,EtIN6CbDo,其实真的很羡慕长得好看的人，第一印象就能让人喜欢，犯了小错也很容易让人原谅。拍照片不用P，甚至连化妆都不要太多就能很好看。如果只是好看，至少也能赏心悦目；如果还有才华有内涵，更令人艳羡。 ,,,,2017-02-02,卖屁股来的iPhone 7,4149,546,183,,
4070829999812936,EtIBVFaNa,@林遭遇 886，友谊已到尽头，绝交吧。 ,"https://wx2.sinaimg.cn/large/67e8c7fdly1fcchffvv07j20ku112422.jpg,https://wx1.sinaimg.cn/large/67e8c7fdly1fcchffgs9aj20qo1bftkl.jpg",,,2017-02-02,卖屁股来的iPhone 7,1288,204,18,,林遭遇
4070502177922440,EtA5bxeZi,年少的时候，谁都有过很可爱的爱情。衣服要穿情侣款的，牙刷要红蓝配套的，电话要用情侣号码绑定家庭套餐，手机也要用同牌子同型号的；会亲手做记忆相册；会傻傻地种情侣树，每天还得浇水；甚至和他聊天的每句话都在本子上记下来，用彩色铅笔画个高兴或生气的小脸…也许是年纪的增长经历了许多，可能是心理成熟不再有童心，似乎感觉以后不会在恋爱中再做这些小孩子一样的事情。可是我仍然希望有那么一个人。每天早晨我做完早餐后，会偷偷在他的脸上画个小猫胡须。而他醒来就和我嬉闹着然后吻住我脱掉我的内裤。,,,,2017-02-02,卖屁股来的iPhone 7,1656,802,137,,
4070494183528894,EtzSieO1E,你们的手机号码后三位是什么？？评论里写上，如果相同的就互相撩撩吧~~~我先来~~179！！！！ ,,,,2017-02-02,搜狗高速浏览器,830,12510,63,,
4070486868121988,EtzGuy4TO,和阿红一起看电影，我找厕所找了半天，她一眼就看到了，然后霸道地说道：“你真是个美丽又一无是处的笨女人。”然后我开始手舞足蹈得在厕所演起来了：“哦！我好笨，可我好美丽！我就是想要做你那美丽又一无是处的笨女人！”等我扭完，看到两个阿姨从厕所洞出来，像看智障一样看着我。 ,,,,2017-02-01,卖屁股来的iPhone 7,2284,179,31,,
4070457110548790,EtyUv2iLs,我妈比我还惦记你们 微博视频 .  查看图片,,"http://us.sinaimg.cn/003EG2r3jx078rTeZAj5010401005pWx0k01.mp4?label=mp4_hd&Expires=1580474506&ssig=5cVJXOm7vR&KID=unistore,video",,2017-02-01,卖屁股来的iPhone 7,1305,196,14,,
