id,bid,正文,原始图片url,视频url,位置,日期,工具,点赞数,评论数,转发数,话题,@用户
3854286264056092,CmMeuh1aQ,【所谓的弱者定理】这些就是所谓的弱者定理，道德绑架...弱不是用来要挟他人的，而要自己要变得强大。#帮你是情分，不帮你是本分# ,"https://ww2.sinaimg.cn/large/67e8c7fdjw1et5nrhf591j20k015pmzw.jpg,https://ww1.sinaimg.cn/large/67e8c7fdjw1et5nrht7g8j20jk18gtca.jpg,https://ww3.sinaimg.cn/large/67e8c7fdjw1et5nrhb44xj20k00u0ac5.jpg,https://ww1.sinaimg.cn/large/67e8c7fdjw1et5nri9flqj20k011utbb.jpg,https://ww3.sinaimg.cn/large/67e8c7fdjw1et5nrirht9j20k015mado.jpg,https://ww2.sinaimg.cn/large/67e8c7fdjw1et5nrpwd22j20k017z77e.jpg",,,2015-06-16,思聪淘汰的iPhone 5s,43356,20776,45182,帮你是情分，不帮你是本分,
4466566047186763,IrVGAu9Bx,我是属蛇的，吃东西喜欢直接吞，就比如哥哥的下面呢。 ,,,,2020-01-30,有性生活的iPhone客户端,1863,564,105,,
4466201923144574,IrMdidc2W,#全国人民花式抗疫大赏# 这个铁钉足球如何？还有家庭冰壶劳动人民，尤其是宅在家中的劳动人民智慧果然不可小觑！ 壮士来一发嘛的微博视频 ,,"http://f.video.weibocdn.com/0016bUeAlx07AxIwIzCw0104120033Tk0E010.mp4?label=mp4_hd&template=368x640.24.0&trans_finger=6038099a530779e853bb78b617dbd3ab&Expires=1580473881&ssig=JEshEbVRDz&KID=unistore,video",,2020-01-29,有性生活的iPhone客户端,1873,1192,344,全国人民花式抗疫大赏,
4464787800606232,Irbqs2xHW,我…我晚上抹了痔疮膏，因为忘了把指套带回来，就直接用手指抹的…抹完后我去厕所洗手，用了消毒液还洗了好几遍，洗完我拿纸巾擦干净，然后又洗了一遍后，再洗脸刷牙…我妈正好经过问我干嘛，我脱口而出说刚抹了痔疮膏。然后她看着我拿着毛巾擦脸，表情难以言喻。刚刚我上厕所，看到毛巾被她扔到垃圾桶了。,https://wx2.sinaimg.cn/large/67e8c7fdgy1gb9avps0hpj205i05474f.jpg,,,2020-01-26,有性生活的iPhone客户端,600,184,137,,
4464364435995793,Ir0pBp9Ml,#春晚#  ,"https://wx3.sinaimg.cn/large/67e8c7fdgy1gb7ya40pg3j20u00rmwlu.jpg,https://wx1.sinaimg.cn/large/67e8c7fdgy1gb7ya4qhmoj20ii0fq3ze.jpg",,,2020-01-24,有性生活的iPhone X,4740,488,1217,春晚,
4464026220638539,IqRC62G71,我真服了我妈。我妈又在胡思乱想，让我有空去看医生，说我以前谈恋爱谈了好几次怎么一次意外怀孕都没有，是不是不能生。我？？？？我也不好直接说戴套了，感觉怪不好意思的，就说你别多想啊，那个都有全面的安全保护措施的。我妈“切”了一声：“戴套了就戴套了，说这么文绉绉。”我？？？ ,https://wx4.sinaimg.cn/large/67e8c7fdgy1gb6vfby0nyj20cx0ag751.jpg,,,2020-01-23,有性生活的iPhone客户端,13015,1097,682,,
4463872968656333,IqNCUAjUh,#听歌想不起歌名太难了#我能想到最浪漫的事，就是和你一起卖~卖~电~脑~【顺便再领领QQ音乐听歌识曲红包，#新春新玩法#重点！！>>网页链接 ,"https://wx2.sinaimg.cn/large/67e8c7fdgy1gb6dsdmy0mj20u03i3b2d.jpg,https://wx3.sinaimg.cn/large/67e8c7fdgy1gb6dsdhc93j20u03i3u11.jpg,https://wx1.sinaimg.cn/large/67e8c7fdgy1gb6dse0p9bj20u03i3u10.jpg,https://wx2.sinaimg.cn/large/67e8c7fdgy1gb6dsefo2dj20u03i3hdx.jpg",,,2020-01-23,搜狗高速浏览器,143,131,178,"听歌想不起歌名太难了,新春新玩法",
4463723378884598,IqJJDBhhY,武汉全市交通禁严了🙏 ,https://wx2.sinaimg.cn/large/67e8c7fdgy1gb5wmiodcwj20u00yigxj.jpg,,,2020-01-23,有性生活的iPhone客户端,366,109,20,,
4463178979525081,IqvzzDXUl,#刘昊然风衣藏红包# @刘昊然turbo 身穿绿色风衣，英气十足！打开藏着满满红包，看来弟弟的春节过得很不错~萌哒哒的草莓的秒拍视频 ,,"http://miaopai.video.weibocdn.com/002eclf1lx07AjczyKP601041200ccil0E013.mp4?label=mp4_720p&template=720x1280.25.0&trans_finger=1f0da16358befad33323e3a1b7f95fc9&Expires=1580473896&ssig=gWCljx8ZNC&KID=unistore,video",,2020-01-21,有性生活的iPhone客户端,2276,632,402,刘昊然风衣藏红包,刘昊然turbo
4462996920792630,IqqPW3kcm,我为啥说算命啊星座啊之类的娱乐开心消遣就好，不要太当真呢，因为很多时候“算命”“星座”“星盘”之类的都有心理暗示。【我以前做过“算命的”】高中的时候，不知突然流行一股“测字”之风，就是让求测者随机写一个字，然后问一个问题，测者将字拆开算出问题答案。我也加入了这个行列，只不过我是测者，而且很多人都说我算的准。为什么呢，我先举个例子。隔壁班女孩小一来向我测字，什么字我不记得了，她要问的是，她和她刚交的那个男朋友能不能谈下去。我装模做样拆了字，然后跟她说，他们两个谈不了多久，两个星期最多，最早明天就得分。果不其然，第二天她跟我说，她和他说分手了，说我果然神婆测得太准了…那个男孩知道后骂我了我很久……其实他们两个谈不久在我预料之内。因为我认识小一，虽然不算熟，但也知道那个男孩是舔狗追了很久，某天她也不知道怎么的就答应了，而且我们都能看得出来她对他其实还是很冷淡，各种不满意。她来找我“测字”，其实已经反应了她的犹豫不决和后悔。我记得我问了她喜不喜欢他，对他感觉如何？她一直苦着脸“ emmm”，我就知道是不喜欢了，所以他们是一定会分的。她自己都不知道怎么答应的，那就说明她有点冲动型，那她分手也极易会这样。至于我为什么会说最早明天，其实我这个是给了一个心理暗示。她自己其实就想分了，只不过缺个人给她勇气，而我给她定了时间，潜意识里已经有了“明天分手”的暗示了。再加上我把字拆开，根据拆开的横横杠杠撇撇的说得头头是道，这种暗示加她自己的偏信，所以她等不及第二天早上就分了。（她跟那个男孩说找我测过了，我一直很准的…那个男孩把我骂死了…）我这么做对那个男孩确实不太好，不过我只是定了时间，她本身就已经想分手了，不过早晚的事。至于其他的问考试成绩啊之类的，说得模棱两可就行，根据他们平时成绩还有最近状态，话不要说太绝，就能八九不离十。如果你和对方不熟不认识，问他们一些问题，根据他们的回答还有微表情来分析就差不多了。现在一些网上给你算的，还可以根据你们的盆友圈圈微博等再加以分析。（我之前朋友推给我一个说算命很厉害的人给我算测过，我加了直接屏蔽盆友圈，然后很多问题我都三缄其口或者不说重要信息，果然对方就没有一个说对了，我作为一个前辈冷笑ing）当年我免费给同学们测字了很久，基本上都是根据平时的一些细枝末节和他们的神情去解答，内心确定的可以说明白一些，不确定的就别太绝对，话里有话就行，其实对我来说也算是个试验……想想如果我继续了下去，现在可能也是一个江湖骗子壮大仙了,,,,2020-01-21,有性生活的iPhone客户端,1786,344,371,,
4462609988240854,IqgLQyzP0,“偷偷进我朋友圈算什么，有本事就进入我和我的生活。” ,,,,2020-01-20,有性生活的iPhone客户端,1168,190,131,,
4462241111557012,Iq7aT6x36,你是我的充电器吧。这样插着的时候，我会浑身过电，能感受到你源源涌进的爱意。 ,,,,2020-01-19,有性生活的iPhone客户端,873,369,79,,
4461699408995556,IpT5aBK9C,同一个世界同一个妈哈哈哈哈哈哈哈哈哈哈哈哈哈哈哈哈哈哈哈 ,"https://wx1.sinaimg.cn/large/67e8c7fdly1gazg7ejblzj20u00o7n3f.jpg,https://wx2.sinaimg.cn/large/67e8c7fdly1gazg7g0ptkj20n00eejto.jpg",,,2020-01-17,有性生活的iPhone客户端,1243,138,195,,
4461530315925401,IpOGroRsZ,一对情侣不可能一辈子不吵架，重要的是如何处理吵架的核心。如何解决核心并不是网上说的那样哄哄就好了。感情中没有任何一个人是傻子，每个人都有自己的观念和想法，同样应该针对双方的性格和事情本身做出更好的处理方式。事情应该得到最优化的解决，哄是一方面，理清楚缘由是一方面。如果双方没有确定这次吵架结束并完美解决（比如有一方被哄了傻傻地好了或者是有一方内心里其实不服气），以后会突然清醒想到或者再吵架的时候也容易再想到这次事情，就很容易被翻旧账。长此以往架会越吵越大，感情会越吵越破裂。所以，我的忠告就是，好好地并且认真地吵每一次架（底线以内的），然后解开绳结再往下走过去。,,,,2020-01-17,有性生活的iPhone客户端,1562,276,390,,
4461469528183442,IpN6oykT0,姓许，女孩儿！！！来取名！！ ,https://wx4.sinaimg.cn/large/67e8c7fdgy1gaypt2zag9j20qb1cwq8k.jpg,,,2020-01-16,有性生活的iPhone客户端,657,440,2,,
4461452422878967,IpMEOc4WX,完了，我好像快秃了…………有没有姐妹们评论里分享一下你的秃……（秀发浓密的别发！）（为什么这一块那么大的空白，是不是斑秃了） ,"https://wx1.sinaimg.cn/large/67e8c7fdgy1gaynsuu1qgj21o02801ky.jpg,https://wx4.sinaimg.cn/large/67e8c7fdgy1gaynlssoanj209l093jrz.jpg,https://wx1.sinaimg.cn/large/67e8c7fdgy1gaynsvrzflj21o02801ky.jpg",,,2020-01-16,有性生活的iPhone客户端,1759,511,109,,
4461391618589725,IpL4JA2zX,#肖战白色枫叶毛衣##肖战工作是我的女朋友# 看完肖战春节求生指南视频后，我真的太喜欢穿毛衣的肖战了，特别是这身白色枫叶毛衣，仿佛明天就是春节了~萌哒哒的草莓的秒拍视频 ,,"http://miaopai.video.weibocdn.com/002zgSLblx07AblVqz3201041200h3nt0E013.mp4?label=mp4_720p&template=720x1280.25.0&trans_finger=1f0da16358befad33323e3a1b7f95fc9&Expires=1580473910&ssig=ads8oeYNDb&KID=unistore,video",,2020-01-16,有性生活的iPhone客户端,1459,687,442,"肖战白色枫叶毛衣,肖战工作是我的女朋友",
4461372248688593,IpKzuAsiB,突然翻到的做了全飞秒后不近视了这些都没有用了有需要的嘛？500度的隐形眼镜和护理液送给你 ,https://wx2.sinaimg.cn/large/67e8c7fdgy1gayemwhgzej23402c0u0y.jpg,,,2020-01-16,有性生活的iPhone客户端,232,249,2,,
4461131458574566,IpEj7zYDs,我有个疑惑，同样是熬夜掉毛，为什么是掉很多头发而不是掉腋毛bb毛🐔毛呢？ ,,,,2020-01-15,有性生活的iPhone客户端,688,218,3,,
4461060054371878,IpCrXilka,我妈让我做几个拜年视频给她………谁能想到我给自己做了一个沙雕的相亲视频？？？ 壮士来一发嘛的微博视频 ,,"http://f.video.weibocdn.com/004izqfflx07Ab5n7wwg01041200w5uy0E010.mp4?label=mp4_720p&template=720x1280.24.0&trans_finger=c3f00996be5378650057cf237d7bfffd&Expires=1580473910&ssig=dl9MfdxC6p&KID=unistore,video",,2020-01-15,有性生活的iPhone X,3846,727,991,,
4460432636615480,Ipm7ZrKZi,三个人排位叫三排，那三个人匹配是不是叫3匹？ ,,,,2020-01-14,有性生活的iPhone客户端,1891,318,352,,
4460340060041934,IpjIG0aUm,#春节倒计时# 人类历史上最大规模的迁徙又要开始了，年度纪实类大片《返乡的诱惑2020》即将震撼上映，这画得不就是本壮士么！！和壮士我一起干了这杯@CAMUS卡慕干邑世家 ，做最绽放无界的主演！#卡慕VSOP##随心随境 绽放无界#→CAMUS卡慕VSOP干邑白兰地700ml礼盒装 法国进口洋酒 ,"https://wx3.sinaimg.cn/large/a66d0169ly1gauyqz3nl9j20u01hcb29.jpg,https://wx3.sinaimg.cn/large/a66d0169ly1gauyqzgs5sj20u01hc1kx.jpg,https://wx1.sinaimg.cn/large/a66d0169ly1gauyqzrm7dj20u01hce64.jpg,https://wx1.sinaimg.cn/large/a66d0169ly1gauyr0zx5oj20u01hcqtg.jpg,https://wx4.sinaimg.cn/large/a66d0169ly1gauyr1e9ffj20u01hckjl.jpg,https://wx1.sinaimg.cn/large/a66d0169ly1gauyr1tftvj20u01hc1kx.jpg,https://wx1.sinaimg.cn/large/a66d0169ly1gauyr2thxsj20u01hckil.jpg,https://wx4.sinaimg.cn/large/a66d0169ly1gauyr34kogj20u01hc1kx.jpg,https://wx4.sinaimg.cn/large/a66d0169ly1gauyr3i2z6j20u01hc7u3.jpg",,,2020-01-13,微博  weibo.com,2257,1394,474,"春节倒计时,卡慕VSOP,随心随境 绽放无界",CAMUS卡慕干邑世家
4459706649007361,Ip3f2BNe1,基爱直男，多此一举。 ,,,,2020-01-12,有性生活的iPhone客户端,250,1679,230,,
4459458606211401,IoWMYq3RT,这个偷我盆友圈段子的王者小哥也太敬业了吧？？？？？？？？上一条→ 微博正文 ,"https://wx1.sinaimg.cn/large/67e8c7fdgy1gasau1jrbcj20pz1csgp8.jpg,https://wx3.sinaimg.cn/large/67e8c7fdgy1gasau20q88j20q61dmjv8.jpg,https://wx1.sinaimg.cn/large/67e8c7fdgy1gasau2atb3j20l906laam.jpg",,,2020-01-11,有性生活的iPhone客户端,2303,346,231,,
4459158583325472,IoOZ4dX6E,13000公里，从拉萨一站站打卡到北京，我觉得这事挺牛的！@东风风光官方微博#看中国的风光乘东风的风光# 东风风光官方微博的微博视频 ,,"http://f.video.weibocdn.com/000E6yH5lx07zNsFkDYc01041200VPTG0E010.mp4?label=mp4_720p&template=1280x720.25.0&trans_finger=1f0da16358befad33323e3a1b7f95fc9&Expires=1580473910&ssig=vdahV%2FO8i%2B&KID=unistore,video",,2020-01-10,微博  weibo.com,2708,1418,617,看中国的风光乘东风的风光,东风风光官方微博
4458967079777282,IoK0bF1w6,嗯，我有了。 ,,,,2020-01-09,有性生活的iPhone客户端,612,268,2,,
4458764776197144,IoEJTq09W,很久没说话的一位游戏网友（王者加得，大概快两年了，上次说话还是去年6月）突然让我别删他，默默看着我就好我还以为他一直偷偷暗恋我呢看了一眼他盆友圈，我懂了 ,"https://wx1.sinaimg.cn/large/67e8c7fdgy1gaq3184xppj20ow1axgpa.jpg,https://wx4.sinaimg.cn/large/67e8c7fdgy1gaq318fgukj20tj1kt79e.jpg,https://wx3.sinaimg.cn/large/67e8c7fdgy1gaq31ztkptj20sm0towmf.jpg,https://wx1.sinaimg.cn/large/67e8c7fdgy1gaq31m5iskj20u013mnd3.jpg,https://wx4.sinaimg.cn/large/67e8c7fdgy1gaq318w46xj20tj1a2dkb.jpg,https://wx4.sinaimg.cn/large/67e8c7fdgy1gaq34pc1axj20g00bq75f.jpg",,,2020-01-09,没性生活的iPhone客户端,929,127,407,,
4458403319236428,IovkTCKOE,哈哈哈哈哈哈哈哈哈哈哈哈哈哈哈哈哈哈哈哈哈哈哈哈哈哈哈#追星女孩见爱豆穿什么# ,https://wx2.sinaimg.cn/large/67e8c7fdgy1gaoxnautrjj20u00lk0xv.jpg,,,2020-01-08,没性生活的iPhone客户端,3375,463,464,追星女孩见爱豆穿什么,
4458174859688387,IopopEEoj,朋友在美容院前面和健身房前面遇到的雪人哈哈哈哈哈哈哈哈哈哈笑死我了#美容院雪人vs健身房雪人# ,"https://wx2.sinaimg.cn/large/67e8c7fdly1gao7c66aybj20tf0mzgs7.jpg,https://wx3.sinaimg.cn/large/67e8c7fdly1gao7bypxphj20u00u0tft.jpg,https://wx4.sinaimg.cn/large/67e8c7fdly1gao7bzty4vj20u00u0wln.jpg",,,2020-01-07,没性生活的iPhone客户端,2389,354,724,美容院雪人vs健身房雪人,
4458034719516624,IolKnDVHW,哈哈哈哈哈哈哈哈哈哈哈哈哈哈哈哈哈哈哈哈哈这样就更头疼了吧哈哈哈哈哈哈哈哈哈哈 ,"https://wx3.sinaimg.cn/large/67e8c7fdly1ganrbb6m50j20yi1cegxn.jpg,https://wx4.sinaimg.cn/large/67e8c7fdly1ganrbbvdlqj20l712v42r.jpg,https://wx2.sinaimg.cn/large/67e8c7fdly1ganrb9iz3wj20q10wkwhp.jpg",,,2020-01-07,没性生活的iPhone客户端,5920,879,1723,,
4457912489980433,IoizeFSmJ,早上睡醒后继续睡觉是回笼觉，回笼觉一般睡得都很久很爽，所以可能这就是为什么大家做爱做完了又会再做一次回笼爱了。 ,,,,2020-01-07,没性生活的iPhone客户端,2150,486,358,,
4457539254833625,Io8RfkhrH,我妈现在开始撺掇我网恋了。不知道她哪儿来的那么多案例，又是谁的朋友某某打游戏网恋结婚了，又是谁的女儿网上冲浪网恋订婚了……然后就说，你天天打游戏，就没遇到一个打游戏的小伙子？？还是你游戏打的不好，别人都看不上？我？？？？？？？？？？？？？ ,https://wx3.sinaimg.cn/large/67e8c7fdgy1gam6eu5pj1j205i05474f.jpg,,,2020-01-06,没性生活的iPhone客户端,2555,459,206,,
4457514269634972,Io8cWEquM,#孙若微读朱瞻基家书痛哭#这段简直他妈的鲨我！！朱瞻基从战场上寄回来的这封家书真的太好哭了，整场戏不管是朱瞻基的的文字还是汤唯边念信边哭都很有感染力，孙若微念到朱瞻基说“这场仗凶险万分，如果我回不来了”的时候一秒爆哭更是要命，镜头还时不时切到太子爷时他给的面部细节反应，最后一口血喷出来也是真情实感地在赚我眼泪！亲情、爱情、友情交织在一起，这段也太好了8！！！！不过能不能别虐弱鸡夫妇了啊！！！  壮士来一发嘛的微博视频,,"http://f.video.weibocdn.com/002nnoIMlx07zVtMUYVG01041200zM5b0E010.mp4?label=mp4_hd&template=852x480.25.0&trans_finger=62b30a3f061b162e421008955c73f536&Expires=1580473911&ssig=EUX1slKU0W&KID=unistore,video",,2020-01-05,搜狗高速浏览器,782,253,126,孙若微读朱瞻基家书痛哭,
4457457067597516,Io6IGvSsA,哈哈哈哈哈哈哈哈哈哈哈哈哈哈哈你就说分开没分开吧 ,"https://wx3.sinaimg.cn/large/67e8c7fdgy1galwyzo7scj20u00krgrn.jpg,https://wx1.sinaimg.cn/large/67e8c7fdgy1galwyz113jj20u01401dx.jpg,https://wx3.sinaimg.cn/large/67e8c7fdgy1galwyfadp1j20u0140tiv.jpg",,,2020-01-05,没性生活的iPhone客户端,2292,551,541,,
4456727397309462,InNJNuFwy,？？？？？？？？？请问是做哪种俯卧撑啊。。。 ,https://wx4.sinaimg.cn/large/67e8c7fdgy1gajl6ajah8j20tm0k1ah6.jpg,,,2020-01-03,没性生活的iPhone X,1799,408,205,,
4456635009290117,InLkMCYMB,哈哈哈哈哈哈哈哈哈哈哈哈哈哈哈哈哈哈哈哈哈哈哈哈哈哈哈哈哈跟女友打赌输了哈哈哈哈哈 #你和对象打过的赌# ,"https://wx3.sinaimg.cn/large/67e8c7fdgy1gajajg8ns3j20u00rkwmc.jpg,https://wx1.sinaimg.cn/large/67e8c7fdgy1gajaju2uv4j20u01sw1aj.jpg,https://wx2.sinaimg.cn/large/67e8c7fdgy1gajakaktqgj20u00q9q9t.jpg",,,2020-01-03,没性生活的iPhone客户端,4463,1103,927,你和对象打过的赌,
4455854252162295,Inr1v94vJ,哈哈哈xswl！山争大哥真的商业奇才！无时无刻都在宣传电影，竟然还把广告埋在#宠爱彩蛋#里。因为这个新春祝福，还多笑了五分钟 新浪电影的微博视频 ,,"http://f.video.weibocdn.com/00065KhDlx07zO4LUOsE01041200SWHX0E010.mp4?label=mp4_720p&template=720x1280.25.0&trans_finger=11ccc9c970f47cffd9369c72510b3033&Expires=1580473910&ssig=uCZ4Pp4%2Fl%2B&KID=unistore,video",,2020-01-01,影视资讯 · 视频社区,2776,1375,610,宠爱彩蛋,
4455643651747051,InlxP7kuf,对不起，很久没有发微博了，主要是………就，告诉大家一件事情，我恋爱了。对方对我很好，不离不弃，很爱我。他就是@我  抽奖详情 ,,,,2019-12-31,没性生活的iPhone客户端,2345,616,837,,我
4454632887503051,ImVfyvtSX,卧槽！！！有个朋友出钱请我演戏，过年假装他对象回家，一天一千，车马住宿全包…………我他妈心动了！！！！！！要不要去啊？？？？？？？？？？？ ,"https://wx4.sinaimg.cn/large/67e8c7fdgy1gacwl2cffij20q31djn7l.jpg,https://wx1.sinaimg.cn/large/67e8c7fdgy1gacwl1seirj20q80xqdmg.jpg",,,2019-12-29,没性生活的iPhone客户端,1855,354,26,,
4454544475769661,ImSWXocX3,给大家分享一下我做完全飞秒手术半年后……………… ,"https://wx2.sinaimg.cn/large/67e8c7fdgy1gacmfd1duqj20qe17ugw1.jpg,https://wx1.sinaimg.cn/large/67e8c7fdgy1gacmfcjj3pj20qe1plqjm.jpg,https://wx2.sinaimg.cn/large/67e8c7fdgy1gacmfbxnsnj20qe1q87jc.jpg,https://wx3.sinaimg.cn/large/67e8c7fdgy1gacmf9rxg5j20qe23i1gf.jpg,https://wx3.sinaimg.cn/large/67e8c7fdgy1gacmf7pcimj20qe2ho1kx.jpg,https://wx1.sinaimg.cn/large/67e8c7fdgy1gacmf8nclsj20qe2tr4qp.jpg,https://wx1.sinaimg.cn/large/67e8c7fdgy1gacmfbe0lkj20qe20wqme.jpg,https://wx3.sinaimg.cn/large/67e8c7fdgy1gacmfareh8j20qe1ewtop.jpg,https://wx4.sinaimg.cn/large/67e8c7fdgy1gacmfa8n2hj20qe1bxk0b.jpg",,,2019-12-28,没性生活的iPhone客户端,1687,806,426,,
4453872192198229,ImBsD9dRj,时刻提醒自己：被屎咬了，不要咬回去，而是要冲到下水道里。 ,,,,2019-12-26,没性生活的iPhone客户端,978,109,948,,
4453191942489557,ImjLsarE9,一个人说一件开心的事，点赞最高的3个，我每个发100软妹币~ ,,,,2019-12-25,没性生活的iPhone客户端,1551,522,29,,
4452826140620085,Imafs2Bjn,不开心的事不开心的人你离开就好了，何必想那么多呢。 ,,,,2019-12-24,没性生活的iPhone客户端,660,111,211,,
4451737899274443,IlHWdCUHN,爱我的人我也爱你，不爱我的人我求你爱我一下呗。 ,,,,2019-12-21,没性生活的iPhone客户端,2258,481,586,,
4451365130299217,IlyeZ1fQ5,我的心都被你操了，你让我操一下又能怎样？ ,,,,2019-12-20,没性生活的iPhone客户端,3270,561,516,,
4451359191338437,Ily5p5CbH,我像个渣男。家里的猫老是“喵喵”叫，有时候就会觉得影响到我就觉得好烦哦。而外面的猫对我“喵喵”叫一声，就觉得可爱得不行甚至想带回家。我真是个渣壮。有时候想想，在对待人的方面，其实很多人很多时候也是如此。 ,https://wx4.sinaimg.cn/large/67e8c7fdgy1ga2gnijbi0j20j60j5wgh.jpg,,,2019-12-19,没性生活的iPhone客户端,1937,357,345,,
4451265565917026,IlvEooPhU,你知道#00后跟90后代沟有多大# 吗？据最新发布的 #00后手机使用行为报告# 显示，90后还在喝肥宅快乐水，而00后却已经开始菊花枸杞养生了…… ,"https://wx2.sinaimg.cn/large/67e8c7fdgy1ga25t2sr0fj20m80i3my3.jpg,https://wx4.sinaimg.cn/large/67e8c7fdgy1ga25t3c5raj20m80joaaw.jpg,https://wx2.sinaimg.cn/large/67e8c7fdgy1ga25t2fh7mj20g00a1dgc.jpg",,,2019-12-19,没性生活的iPhone客户端,2263,664,424,"00后跟90后代沟有多大,00后手机使用行为报告",
4450990192957839,Iloufcpt5,我：“妈你给我拍几张照片。”妈：“拍完了，很不错，非常好，真好看，我真会拍照！”我：“我康康…嗯？？？？？？？？”#我们父母的抓拍技术# ,"https://wx1.sinaimg.cn/large/67e8c7fdgy1ga1a5p21aqj20xi0u04qp.jpg,https://wx4.sinaimg.cn/large/67e8c7fdgy1ga1a5kkoxqj20u00us4qp.jpg,https://wx1.sinaimg.cn/large/67e8c7fdgy1ga1a5q7lzbj20os0ncgtp.jpg,https://wx4.sinaimg.cn/large/67e8c7fdgy1ga1a5qp69bj20bk07hjsr.jpg",,,2019-12-18,没性生活的iPhone X,2643,516,396,我们父母的抓拍技术,
4450514563349995,Ilc76e3ub,哈哈哈哈哈哈哈哈哈哈哈哈哈哈哈哈哈哈哈哈哈哈哈哈给你几张图快去调戏别人！！！！ ,"https://wx1.sinaimg.cn/large/67e8c7fdgy1g9zrldmep4j20q11dmgv6.jpg,https://wx2.sinaimg.cn/large/67e8c7fdgy1g9zrrlqj62j20q7119ti2.jpg,https://wx3.sinaimg.cn/large/67e8c7fdgy1g9zrlen2gwj20pq1bwnbc.jpg,https://wx4.sinaimg.cn/large/67e8c7fdgy1g9zrlf2j6aj20u00r8wh2.jpg,https://wx2.sinaimg.cn/large/67e8c7fdgy1g9zrlczzroj20u00xejtm.jpg,https://wx3.sinaimg.cn/large/67e8c7fdgy1g9zrlff2syj20ts0wy0uz.jpg,https://wx2.sinaimg.cn/large/67e8c7fdgy1g9zrlfq84pj20ay0bawf4.jpg,https://wx4.sinaimg.cn/large/67e8c7fdgy1g9zrmbo6ioj20g00g040j.jpg,https://wx2.sinaimg.cn/large/67e8c7fdgy1g9zrmbyianj204g04gq32.jpg",,,2019-12-17,没性生活的iPhone客户端,9862,2000,1474,,
4450420321673137,Il9F671g5,你有没#遇到的过心态会崩的事# 但是后来想起来又很好笑的事？一大早要笑死我哈哈哈哈哈哈哈哈哈哈哈哈朋友一同事拿别人笔改图纸，还的时候才知道用的是写完就消失的练字笔哈哈哈哈哈心态崩了啊 ,"https://wx1.sinaimg.cn/large/67e8c7fdgy1g9zgq3ssnqj20ty1cx142.jpg,https://wx3.sinaimg.cn/large/67e8c7fdgy1g9zgq4db79j20tp1d115a.jpg,https://wx2.sinaimg.cn/large/67e8c7fdgy1g9zgtgdxdxj20hs0gqtas.jpg",,,2019-12-17,没性生活的iPhone客户端,560,67,201,遇到的过心态会崩的事,
4450136060975869,Il2gC45RP,#梦想中的婚礼造型# 你有没有想过你以后会有一个怎么样的婚礼？虽然我对象还在迷路中，但我很早就幻想有一个特别的婚礼了……在明星中，我比较喜欢诗诗的婚礼！评论里写写你的心里的婚礼叭~~ ,"https://wx3.sinaimg.cn/large/67e8c7fdgy1g9yk5voje7j20dw0opmxx.jpg,https://wx3.sinaimg.cn/large/67e8c7fdgy1g9yk5w9mdkj20dw0n5q3j.jpg,https://wx3.sinaimg.cn/large/67e8c7fdgy1g9yk5vzrjjj20iw0scdla.jpg,https://wx2.sinaimg.cn/large/67e8c7fdgy1g9yk5vd6a7j20m80xcn3x.jpg,https://wx1.sinaimg.cn/large/67e8c7fdgy1g9yk5wz0jaj20hs0qodiw.jpg,https://wx1.sinaimg.cn/large/67e8c7fdgy1g9yk5wkgy4j20fe0lwwhp.jpg",,,2019-12-16,没性生活的iPhone客户端,1793,268,174,梦想中的婚礼造型,
4449739502223683,IkRX09ktR,哈哈哈哈哈哈哈哈哈哈哈哈哈哈哈哈哈哈哈哈哈哈哈哈好像我就是这样诶#你给异性怎么买东西# ,https://wx1.sinaimg.cn/large/67e8c7fdgy1g9xah3ebmsj20yi1pctkd.jpg,,,2019-12-15,没性生活的iPhone客户端,4759,824,1453,你给异性怎么买东西,
4449182129083413,IkDs0C70F,“我输了，最近好像有点迷。”“怎么迷了？”“迷上了你的身子。” ,,,,2019-12-13,没性生活的iPhone客户端,474,173,203,,
4449086608186316,IkAXWylDm,新烤箱到了！！！！！我来试试烤个小饼干！！！15分钟后见！！！ ,"https://wx3.sinaimg.cn/large/67e8c7fdgy1g9v7ms7590j23402c0hdt.jpg,https://wx1.sinaimg.cn/large/67e8c7fdgy1g9v7mpxzoqj23402c07wh.jpg",,,2019-12-13,没性生活的iPhone客户端,420,166,700,,
4448686824533247,Ikqz8j1iT,#过年回家相亲注意事项# 哈哈哈哈哈哈哈哈哈哈哈哈哈哈哈哈哈哈哈哈哈哈哈哈哈又心酸又好笑 ,https://wx1.sinaimg.cn/large/67e8c7fdgy1g9txq0zthpj20yi1jun8g.jpg,,,2019-12-12,没性生活的iPhone客户端,6260,836,1312,过年回家相亲注意事项,
