id,bid,正文,原始图片url,视频url,位置,日期,工具,点赞数,评论数,转发数,话题,@用户
3941686528985341,DhuskBHuR,世界未解之谜之一：明明自己肠胃特别不好，总是生病上吐下泻。却还依然瘦不下来。 ,https://ww2.sinaimg.cn/large/67e8c7fdgw1f0whjz9sccj205s05q0sm.jpg,,,2016-02-12,偷的思聪的iPhone,6340,661,1029,,
3941506903661776,DhpMCfmAU,在大理和粉丝们面基聊天。有人问到：“怎么你自己一个人出来玩，你朋友像贱贱他们怎么不像你一样出来玩啊？”我说：“我这个人嘛就是这样，挣多少花多少就图个现在开心。我和贱贱不一样。”他：“哦，他喜欢省钱？”我：“不是，因为他的钱要给刘文静。” ,,,,2016-02-12,偷的思聪的iPhone,3870,222,130,,
3941266976784827,DhjxDst2H,没有拉过肚子或者便秘的过年，不算过年。😥 ,https://ww4.sinaimg.cn/large/67e8c7fdjw1f0v5dd4rmaj205s05q745.jpg,,,2016-02-11,偷的思聪的iPhone,9194,1538,1867,,
3940374785673892,DgWkCnO2o,成长环境教育环境的不同很容易造成三观的差池，爱只能让你们荷尔蒙冲动下的性生活愉悦。而时间会将荷尔蒙抽离，你才发现不过是酒醉人酣梦几回，该分开的还是会分开。 ,,,,2016-02-08,偷的思聪的iPhone,2253,217,214,,
3940286873156555,DgU2Pdfab,刚刚买吃的，小哥一直在给我推荐这个推荐那个……我说：“不要了不要了我一个人吃不完的。。。”小哥说：“吃的完的吃的完的！你一个人一定吃的完的！！”#我胖怪我咯？你这样做生意我还会买么# ,https://ww1.sinaimg.cn/large/67e8c7fdgw1f0s0slyorqj205s05q745.jpg,,,2016-02-08,偷的思聪的iPhone,3914,157,78,我胖怪我咯？你这样做生意我还会买么,
3940284473597033,DgTYXf5KF,一个人旅行，最无奈的是想吃很多东西，但一个人却吃不掉。。。。😥😥😥还有好多想吃的。。。。 ,"https://ww1.sinaimg.cn/large/67e8c7fdgw1f0s0hx10pdj20ku0kugrg.jpg,https://ww2.sinaimg.cn/large/67e8c7fdgw1f0s0i4o4j5j20ku0rswlp.jpg",,,2016-02-08,偷的思聪的iPhone,3419,410,67,,
3940232552436311,DgSDdadNl,【小技能get√】洗澡后镜子总会全是雾…就算擦了之后立马又都是雾…很麻烦…告诉你一个小诀窍——洗澡前，在镜子上用肥皂水（肥皂少点）擦一遍，再稍微擦干。这样水蒸气再多，肥皂水擦过的地方都不会太模糊！（可以看第二张图的上下分层，上面没擦肥皂水的，用毛巾擦下立马就起雾了…） ,"https://ww2.sinaimg.cn/large/67e8c7fdgw1f0rudwxz99j20qo0zk7cq.jpg,https://ww2.sinaimg.cn/large/67e8c7fdgw1f0rudxrfvpj20qo0zk7bd.jpg",,,2016-02-08,偷的思聪的iPhone,1587,254,108,,
3940204207925464,DgRTuxfM4,其实爱对了人，春节每天都过。 ,,,,2016-02-08,偷的思聪的iPhone,3424,398,334,,
3940065384554916,DgOhAj6Wo,哈哈哈哈哈哈哈哈哈哈哈哈哈哈哈哈哈哈哈哈哈哈哈哈哈哈哈哈哈哈哈哈哈哈哈哈哈哈哈哈哈哈哈哈哈哈哈哈心疼 ,"https://ww2.sinaimg.cn/large/67e8c7fdgw1f0rbd98bapj20ku112djw.jpg,https://ww4.sinaimg.cn/large/67e8c7fdgw1f0rbd8lm12j20qo1bgdno.jpg",,,2016-02-08,偷的思聪的iPhone,4007,291,254,,
3940050385128232,DgNTolw5q,如果注定老无所依，我将会记得我曾撕心裂肺般爱过你。。。。。。。。。。。。。。。。。你，你，你，你，和你，你，你，哦对了还有你。 ,,,,2016-02-08,偷的思聪的iPhone,2681,454,1007,,
3940046371332804,DgNMV5AIQ,我在南方的深夜里冻成傻逼。。。。 秒拍视频 . ,,"http://us.sinaimg.cn/002ae85Yjx06ZbTWoavm010401000EwJ0k01.mp4?KID=unistore,video&Expires=1580474923&ssig=sOf39rfazE&KID=unistore,video",,2016-02-08,偷的思聪的iPhone,1915,214,36,,
3940042060326707,DgNFY1mZt,红包口令：我爱你。没什么，我只是想听到有人和我说这三个字 壮士来一发嘛 的红包 ,,,,2016-02-08,偷的思聪的iPhone,1185,1088,19,,
3940021037529959,DgN83vASX,感觉#春晚# 每年都会有一个关于贪污受贿的小品…… ,https://ww2.sinaimg.cn/large/67e8c7fdgw1f0r69xg2j6j205s05q745.jpg,,,2016-02-07,偷的思聪的iPhone,4618,146,130,春晚,
3939986531641192,DgMep6SWQ,#春晚# 又是你们？？？？ ,"https://ww2.sinaimg.cn/large/67e8c7fdgw1f0r2b98kv3j20bh07ymy0.jpg,https://ww4.sinaimg.cn/large/67e8c7fdgw1f0r2b85bm0j207p06zwek.jpg,https://ww3.sinaimg.cn/large/67e8c7fdgw1f0r2baqv2pj208c08c0su.jpg",,,2016-02-07,偷的思聪的iPhone,6222,524,3448,春晚,
3939914657476950,DgKmtvn5Y,他们都说高考和春晚是每年的段子手大考。但是春晚考试尤其非常极其特别重要，尤其对我而言。因为高考段子考的不好最多是失落一阵子；而#春晚# 段子要是写的不好或者出现失误，还就拿不到新浪爸爸包的5000块压岁钱…毕竟，我是个嗜钱如命的营销号。😥 ,"https://ww3.sinaimg.cn/large/67e8c7fdgw1f0qu1cxf6pj202o02q0sk.jpg,https://ww3.sinaimg.cn/large/67e8c7fdgw1f0qu1dhoiqj20c80fh3zc.jpg",,,2016-02-07,偷的思聪的iPhone,3046,139,55,春晚,
3939674956925385,DgE7Rt3BL,你说我变了。只是因为你没有看到你想看到的那一种我，所以失望了。其实我一直没变，只是说的话唱的歌笑的泪哭的眼写的字涂的画会随着心情或境遇有所不一。但是我还是我，从未改变。变的只是你的永远执着不变的期待。 ,,,,2016-02-07,偷的思聪的iPhone,4363,377,418,,
3939663104297448,DgDOKi1XG,因为抽奖平台居然抽到@漫画榜 了，我私下底和他认识，所以就不算他了。我重新再抽一个人，把他的机会留给别人，希望他不要打我。 ,,,,2016-02-06,搜狗高速浏览器,2354,348,51,,漫画榜
3939655583974589,DgDCCgFYh,晚上刚做的美甲…………有那么难看吗？？？！！！（拍了那么多照片，有的还特地美图了……不就是为了得到夸奖嘛！！） ,"https://ww4.sinaimg.cn/large/67e8c7fdjw1f0q0ad0uhqj20hs1p9wkf.jpg,https://ww4.sinaimg.cn/large/67e8c7fdjw1f0q06d3wcdj20qo0qotdg.jpg,https://ww4.sinaimg.cn/large/67e8c7fdjw1f0q06ee6ehj20qo0qodka.jpg,https://ww2.sinaimg.cn/large/67e8c7fdjw1f0q06do612j20qo0qo0ya.jpg,https://ww3.sinaimg.cn/large/67e8c7fdjw1f0q09t6mraj20qo0qodk4.jpg,https://ww3.sinaimg.cn/large/67e8c7fdjw1f0q06eh0enj20qo0qogq7.jpg",,,2016-02-06,偷的思聪的iPhone,3249,2150,55,,
3939617578720160,DgCDjAAvK,准备美甲！！！！快说！！！什么颜色好看？！！💅🏻💅🏻💅🏻💅🏻💅🏻个人偏向大红……💅🏻💅🏻要不要做个图案。。。😂 ,"https://ww4.sinaimg.cn/large/67e8c7fdjw1f0pvwtsh4zj20qo0qo0z9.jpg,https://ww2.sinaimg.cn/large/67e8c7fdjw1f0pvwu3li6j20qo0qo45f.jpg",,,2016-02-06,偷的思聪的iPhone,1744,1203,19,,
3939594338638700,DgC1PAfjS,如何正确地反驳这种提问 ,https://ww4.sinaimg.cn/large/67e8c7fdjw1f0pt9c1awhj20ku0qcadl.jpg,,,2016-02-06,偷的思聪的iPhone,2482,217,138,,
3938727996516608,DgfuvrlgA,我喜欢榴莲榴莲糖不行榴莲酥也不行只要价格最贵的榴莲正如我喜欢祝福文字的不行图片的更不行只要带着红包的祝福 ,https://ww1.sinaimg.cn/large/67e8c7fdjw1f0n1r5fb44j202s02aglf.jpg,,,2016-02-04,偷的思聪的iPhone,2567,290,367,,
3938585709016599,DgbN0BPD1,笑点随着心情变化。开心的时候笑点就会很低，不开心的时候笑点就飚高了。 ,,,,2016-02-04,偷的思聪的iPhone,3337,225,154,,
3938503358188239,Dg9Ebym8n,【一个小问题】男生为什么不喜欢戴套？ ,https://ww4.sinaimg.cn/large/67e8c7fdjw1f0mbx92bsij20ku0gjmyl.jpg,,,2016-02-03,偷的思聪的iPhone,1131,622,37,,
3938424731529478,Dg7Bn6pT0,今天帮公司配的电脑主机终于到了，等会可以组装起来了我很开心…然后我说：“我最喜欢电子产品了！！！我的钱也大部分都花在电子产品上！”同事小薛默默地说：“对啊，你的男朋友也是电子的…”#单身狗怎么了！我男朋友有不同震感不同频率你们行么# ,"https://ww2.sinaimg.cn/large/67e8c7fdjw1f0m2tgcml1j209s080jrm.jpg,https://ww2.sinaimg.cn/large/67e8c7fdjw1f0m2tgqgjgj20ac0aiaa6.jpg",,,2016-02-03,偷的思聪的iPhone,2011,186,43,单身狗怎么了！我男朋友有不同震感不同频率你们行么,
3938384067757084,Dg6xMwxYg,以前关注了好多民谣歌手啊乐队啊。几年了，他们一个个越来越火越来越火了。感觉爱不起他们了。 ,https://ww2.sinaimg.cn/large/67e8c7fdjw1f0ly8wygtpj20hs095q3f.jpg,,,2016-02-03,偷的思聪的iPhone,2639,283,118,,
3939236216064066,DgsIdprxw,请让我安安静静地做一朵盛开的白莲花。 ,"https://ww4.sinaimg.cn/large/67e8c7fdgw1f0oo522xt4j206j057747.jpg,https://ww2.sinaimg.cn/large/67e8c7fdgw1f0oo52f95kj202s02aglf.jpg",,,2016-02-05,偷的思聪的iPhone,3074,212,52,,
3939095480871769,Dgp3e3EMN,有没有红包不要紧。只要别让我发红包就可以了。 ,,,,2016-02-05,偷的思聪的iPhone,2872,153,57,,
3938944242614862,Dgl7iaYfc,不开心一般都是因为两个事情——感情和工作。说白了就是没人要和穷。 ,,,,2016-02-04,偷的思聪的iPhone,4091,475,983,,
3938940655800802,Dgl1vol3k,盆友我来和你说点掏心窝子的话——开心是一天难过也是一天那为什么要难过呢？吝啬是一天大方也是一天那为什么要吝啬呢？贫穷是一天富裕也是一天那为什么要贫穷呢？所以盆友，有敬业福么，给我一张。 ,https://ww2.sinaimg.cn/large/67e8c7fdjw1f0nq5u6johj206j057747.jpg,,,2016-02-04,偷的思聪的iPhone,1500,259,104,,
3938226572056665,Dg2rL8D21,在公司加班，隔壁的男孩一边工作一边在和他媳妇语音（开的扩音）。他媳妇说：“我…我想你了。”他一把抓住手机，把脸凑上去低语：“操，我他妈的更想你！”#好好的加班，又被莫名地喂了一把狗粮# ,https://ww4.sinaimg.cn/large/67e8c7fdjw1f0lg5ut8acj20g40c3q4e.jpg,,,2016-02-03,偷的思聪的iPhone,2734,290,194,好好的加班，又被莫名地喂了一把狗粮,
3938199833691536,Dg1KDfukU,我是一个有骨气的博主，你不关注我就不关注呗，咋滴呢我最屌！你要是关注了我，我就恨不得跪下来给你舔脚叫爸爸。 ,,,,2016-02-02,偷的思聪的iPhone,4828,979,35,,
3938169257267785,Dg0XjuuGl,#春晚#我是微博上奶最长的小（lao）清（se）新（qing）博主，靠奶上位。猴年#春晚#，不要说我没有长奶，因为这是上了保险的财产，一般我都是放在家里保险柜里的。主业是甩奶秀妈搞暧昧，副业是写小清（se）新（qing）的段子和科普来和我一起点评春晚咯，万一有奇怪的发现呢？ ,https://ww3.sinaimg.cn/large/67e8c7fdjw1f0l9lcf8oij20lv0zk43c.jpg,,,2016-02-02,偷的思聪的iPhone,1497,386,26,"春晚,春晚",
3938012377723854,DfWShwpki,说的没错呀………… ,https://ww1.sinaimg.cn/large/67e8c7fdgw1f0krky8nfsj20fx0bp75i.jpg,,,2016-02-02,偷的思聪的iPhone,2278,556,223,,
3937892227078963,DfTKutHyP,早点睡吧，别以为你晚上思考得多，白天就会变得更好一样。除了打瞌睡，你得不到别的收获。 ,,,,2016-02-02,偷的思聪的iPhone,3621,280,222,,
3937853900266338,DfSKG17hM,【粉丝提问】女友在夜店跳舞，一是觉得工资高，二是跳舞是她的向往。我觉得女孩子穿那么少抛头露面不好，她怪我小心眼。女友在夜店跳舞我该管吗？能往结婚的方向走吗？ ,https://ww3.sinaimg.cn/large/67e8c7fdjw1f0k9azl7ozj20ku0wk0xb.jpg,,,2016-02-01,偷的思聪的iPhone,937,1274,37,,
3937846719633903,DfSz5Eqdx,在性生活中，大家都是优秀的演员。 ,,,,2016-02-01,偷的思聪的iPhone,2415,596,21,,
3937785239027399,DfQXVBSrd,每个人都必须为自己曾经做过的事情承担起任何后果。无论是好是坏，这是你应得的。人不能只是慢慢长大，却没有学会成长。 ,https://ww3.sinaimg.cn/large/67e8c7fdjw1f0k1gyjv19j20hs0efgmt.jpg,,,2016-02-01,偷的思聪的iPhone,2033,123,227,,
3937625376886427,DfMO5sTtp,For the rest of my life. ,https://ww4.sinaimg.cn/large/67e8c7fdjw1f0jj2u9kihj20qo190wl3.jpg,,,2016-02-01,偷的思聪的iPhone,2275,645,246,,
3937516895590108,DfJZ7nsf2,我我要我要你的我要你的爱你为什么还不来我我要我要你我要你的我要你的爱让我们快做起来 ,,,,2016-02-01,偷的思聪的iPhone,2282,784,71,,
3937475296485997,DfIU1rdiR,说起来可能你不信，其实我的真实身份是沙特阿拉伯的公主💅🏻。我的真实名字叫默罕默德·查理斯·铁柱·二妞·丽芬子·长奶·怡·壮壮·SB·大黑·狗蛋·莉莉周。 ,,,,2016-01-31,偷的思聪的iPhone,4004,648,39,,
3937300419016060,DfElXBPuk,有个粉丝和我说，你的男朋友还没来，只是因为他是路痴，我只要慢慢等就可以。我想了想，这么久都没遇到，他特么应该不是路痴，可能是瞎了，或者已经死了吧。 ,,,,2016-01-31,偷的思聪的iPhone,3675,343,113,,
3937163131409785,DfAMx5UKt,一个人单身久了之后，甚至觉得能有一个真心的拥抱都奢糜至极暖到哭。所以，以后就给我一个拥抱让我感动下吧…抱不到？那没关系，还有一种方法也会让我心生温暖，感动到颓然落泪——发红包。 ,https://ww1.sinaimg.cn/large/67e8c7fdjw1f0i20mzz14j201h01e3ya.jpg,,,2016-01-31,偷的思聪的iPhone,4037,563,2255,,
3937030985357038,DfxlomtBQ, ,https://ww4.sinaimg.cn/large/67e8c7fdjw1f0hmv3iw4yj20hs0htgm1.jpg,,,2016-01-30,偷的思聪的iPhone,8560,325,15,,
3936932117185929,DfuLVu9o5,早安，我知道你醒来的第一个动作就是找手机。别看了，他并没有给你发信息。 ,,,,2016-01-30,偷的思聪的iPhone,3878,655,292,,
3935975975525902,Df5TLnbxs,挂个骗子 ,"https://ww2.sinaimg.cn/large/67e8c7fdjw1f0e9pe8wz9j20ku0lnacz.jpg,https://ww3.sinaimg.cn/large/67e8c7fdjw1f0e9peflaaj20ku112jv9.jpg",,,2016-01-27,偷的思聪的iPhone 6s,2101,228,42,,
3935816340324926,Df1Ki1mwK,谁特么在我身上施了封印？！我动不了了！！！我和床快合二为一了！😂😂😂救我！！ ,,,,2016-01-27,偷的思聪的iPhone 6s,2634,342,62,,
3935718575043758,DeZcBla6W,作为我的星标好友，如果不是因为平时需要经常联系的原因，那么我一定是喜欢你，要么就是想睡你。 ,,,,2016-01-27,偷的思聪的iPhone 6s,1312,249,85,,
3935690867502294,DeYtUvtGK,和哈哈哈哈哈哈哈哈哈哈哈哈哈哈哈哈哈哈哈哈哈哈哈哈哈哈哈哈哈哈哈哈哈哈哈哈哈哈哈哈哈哈哈哈哈哈哈哈哈哈 ,https://ww1.sinaimg.cn/large/67e8c7fdjw1f0dcyjrt0cj20k00zkgol.jpg,,,2016-01-27,偷的思聪的iPhone 6s,2200,325,235,,
3935681275506297,DeYern6rf,一直在异常登录，以为被盗号了...后来又以为手机IP被控制了，吓得我赶紧清空了相册。 ,,,,2016-01-26,360安全浏览器,2805,711,33,,
3935604306116453,DeWeipFat,哈哈哈哈哈哈哈哈哈哈哈哈哈哈哈哈哈哈哈哈哈哈哈哈哈哈哈哈哈哈哈哈哈哈哈哈哈哈哈哈哈哈哈哈哈哈哈哈哈哈哈哈哈哈哈哈哈 ,"https://ww1.sinaimg.cn/large/67e8c7fdjw1f0d30o39gvj20k00zkq58.jpg,https://ww3.sinaimg.cn/large/67e8c7fdjw1f0d30o4apxj20jz0zkdhs.jpg,https://ww1.sinaimg.cn/large/67e8c7fdjw1f0d30o3dmcj20go0m8wfp.jpg",,,2016-01-26,偷的思聪的iPhone 6s,2191,812,1235,,
3935587347751882,DeVMWwwCm,机长竟然戴着手环开飞机，通常电子设备是需要关闭的吧，这样做不会影响通讯吗？ ,"https://ww1.sinaimg.cn/large/005Ko17Djw1f0d01ijd7cj31kw13z7mw.jpg,https://ww1.sinaimg.cn/large/005Ko17Djw1f0d01o7s23j31kw13zk7k.jpg,https://ww4.sinaimg.cn/large/005Ko17Djw1f0d01u46mgj31kw13z4gc.jpg,https://ww2.sinaimg.cn/large/005Ko17Djw1f0d01zqjaej31kw13zndd.jpg",,,2016-01-26,微博  weibo.com,1512,6576,18099,,
3935335375176665,DePexlIGB,主动的次数太多了，最后总会变得更想放弃。 ,,,,2016-01-26,偷的思聪的iPhone 6s,3368,434,301,,
3935157789096280,DeKC6Camc,这死库水穿着游泳有意义么……………… ,"https://ww1.sinaimg.cn/large/67e8c7fdjw1f0bnpicp3mj20ku0j0gn1.jpg,https://ww3.sinaimg.cn/large/67e8c7fdjw1f0bnpi6essj20jz0zkjvo.jpg",,,2016-01-25,偷的思聪的iPhone 6s,1338,400,67,,
3935118156253594,DeJAbqeQq,为什么南方下雪，南方人就算瘫着也要坚持从床上爬起来看？因为这概率等同于你男神正眼看你一眼的概率。 ,,,,2016-01-25,偷的思聪的iPhone 6s,2680,238,95,,
3935090314745575,DeIRhjUxx,现在的我。。。。 ,"https://ww1.sinaimg.cn/large/67e8c7fdjw1f0bfzksab7j206405hjre.jpg,https://ww3.sinaimg.cn/large/67e8c7fdjw1f0bfzkcod4j207806g3yn.jpg,https://ww3.sinaimg.cn/large/67e8c7fdjw1f0bfzkxup5j20k00f0dgz.jpg",,,2016-01-25,偷的思聪的iPhone 6s,1785,281,206,,
3934907887262577,DeE72utkl,这枪造的，简直太丧心病狂了！ ,https://ww2.sinaimg.cn/large/005Ko17Djw1f0atvpj77kj30jg5jje81.jpg,,,2016-01-24,微博  weibo.com,1023,192,1252,,
3934838899492734,DeCjLDPuC,我在外面的厕所拉屎，拉了一半拉不动了休息了会，然后在外面的那一半就冻硬了………………怎么都下不去………感觉我屁股上长了个野生JJ……我脚已经蹲得不是自己的了……怎么办？？在线等，挺急的……… ,"https://ww2.sinaimg.cn/large/67e8c7fdjw1f0an3sbggcj201y01gdfn.jpg,https://ww3.sinaimg.cn/large/67e8c7fdjw1f0an3sftxfj205f05uglo.jpg",,,2016-01-24,思聪淘汰的iPhone 5s,9269,4101,2041,,
3934722478712658,DezhZAyyK,昨晚上和被子做了合体运动，今天早上发现卡住了，怎么都使劲儿都出不来了。 ,,,,2016-01-24,偷的思聪的iPhone 6s,2703,426,41,,
3934493750493367,Detl524lx,今天去滑雪，一开始很紧张速度快了就要摔倒。教练说，你明明可以停的很好，但是你为什么要紧张？不要当成一件难事，就很轻松地觉得自己在飞一样。慢慢地我就好了，能很顺利得滑下来，忍不住多玩了几次。通过这件事，我明白了一个深刻的道理——滑雪特么的千万别穿薄袜子！！！！ ,,,,2016-01-23,思聪淘汰的iPhone 5s,1690,107,6,,
3934354650674256,DepIJ2Pp6,洗完澡后抹身体乳，比特么洗澡还累热的一身汗………… ,,,,2016-01-23,偷的思聪的iPhone 6s,3110,439,34,,
3934344948780087,Dept4AQ6j,早安，宝宝们！记得起来吃早饭哦~不吃早饭对胃不好~~~ ,,,,2016-01-23,偷的思聪的iPhone 6s,1728,239,17,,
3934281451182386,DenOF4XAK,晚安，你为什么还不睡？傻瓜们，快睡吧。 ,,,,2016-01-23,偷的思聪的iPhone 6s,1635,428,15,,
3933863857968347,DecX7xqVJ,突然感觉自己很伟大，一句话就帮助了别人…………我自己都感动地想哭……😂 ,"https://ww3.sinaimg.cn/large/67e8c7fdjw1f07j3w2u6lj20ku112gq3.jpg,https://ww3.sinaimg.cn/large/67e8c7fdjw1f07j3vjvosj20ku11242a.jpg",,,2016-01-21,偷的思聪的iPhone 6s,2778,305,35,,
3933737190770885,De9EP3exD,。。。。。。。。。。。。。。。。。。。。。。。。。。。。。。。。。。。。。。。。 ,"https://ww2.sinaimg.cn/large/67e8c7fdjw1f074l0mensj20ku112gpp.jpg,https://ww1.sinaimg.cn/large/67e8c7fdjw1f074l0f5psj20yi06fdh2.jpg",,,2016-01-21,偷的思聪的iPhone 6s,2178,443,262,,
3933697369522937,De8CADXlL,来来来来，大家说说，想听什么性知识科普？【之前做过的有安全期、古代避孕、生殖器崇拜、初次啪啪、遭遇强奸、露阴癖、SM、性高潮、为何长阴毛、艾滋病、baby的形成、处女膜、弟弟的大小、“黑木耳”是否就是滥交、古代大姨妈、古代男子性事、女子性事、男人为什么长乳头…】大家还想看什么？ ,,,,2016-01-21,偷的思聪的iPhone 6s,904,490,10,,
3933688016758566,De8nvsmd8,我说我过年想换个萌萌的头像，然后群里的傻逼就画了这些。。。我才不会用这些一个都不用 ,"https://ww3.sinaimg.cn/large/67e8c7fdjw1f06ywx1b0rj20ku0ej3z7.jpg,https://ww3.sinaimg.cn/large/67e8c7fdjw1f06ywwvy1oj20ku0oc75m.jpg,https://ww1.sinaimg.cn/large/67e8c7fdjw1f06ywxn60ej20ku0lugmv.jpg,https://ww4.sinaimg.cn/large/67e8c7fdjw1f06ywxuvyrj208n0fbaah.jpg,https://ww3.sinaimg.cn/large/67e8c7fdjw1f06ywya3zlj20au07iglq.jpg,https://ww4.sinaimg.cn/large/67e8c7fdjw1f06ywye1a9j204507et8q.jpg",,,2016-01-21,偷的思聪的iPhone 6s,1840,331,64,,
3933673730940787,De80t3WJZ,【我还是处女，但是无师自通学会用手…四个月没来大姨妈，会不会怀上了手指的孩子？？】你特么在逗我？不来大姨妈就去看医生……怕处女膜没了？处女膜的科普我早就讲过…就算处女膜破裂过，但处女膜还在！！！所以根本没关系的……… ,"https://ww1.sinaimg.cn/large/67e8c7fdjw1f06x6yb2jwj20ku112dla.jpg,https://ww1.sinaimg.cn/large/67e8c7fdjw1f06x6yjo12j20ku0hljty.jpg,https://ww1.sinaimg.cn/large/67e8c7fdjw1f06x6yrj6dj20ku0uptcf.jpg",,,2016-01-21,偷的思聪的iPhone 6s,1266,495,59,,
3933652834186383,De7sLhz4j,有人让我扒皮ayawawa，不过我真不认识。。。但是想起来关注她挺久，以前还半信半疑过一阵子……所以就想不如说说我对她的这种婚恋理论的想法吧…… ,"https://ww2.sinaimg.cn/large/67e8c7fdjw1f06uumiibkj20ku0qb763.jpg,https://ww4.sinaimg.cn/large/67e8c7fdjw1f06uumoaxwj20ku0xbtc2.jpg,https://ww2.sinaimg.cn/large/67e8c7fdjw1f06uumrz1oj20ku0xb0x5.jpg,https://ww4.sinaimg.cn/large/67e8c7fdjw1f06uun7c4fj20ku0x4n17.jpg,https://ww2.sinaimg.cn/large/67e8c7fdjw1f06uunfc35j20ku0x2gpr.jpg,https://ww2.sinaimg.cn/large/67e8c7fdjw1f06uunne10j20ku0s0goz.jpg,https://ww4.sinaimg.cn/large/67e8c7fdjw1f06uunrszgj20ku0nv0vd.jpg,https://ww2.sinaimg.cn/large/67e8c7fdjw1f06uuo0ovvj20ku0s9q5q.jpg",,,2016-01-21,偷的思聪的iPhone 6s,4598,2777,1894,,
3933506255837062,De3Elouua,今天不小心把猫关在房间了，然后回家一看………………… ,"https://ww1.sinaimg.cn/large/67e8c7fdjw1f06e18pw0ij20qo0zk14n.jpg,https://ww2.sinaimg.cn/large/67e8c7fdjw1f06e20fjv8j20k00k0q5g.jpg",,,2016-01-20,偷的思聪的iPhone 6s,2632,615,90,,
3932935142943822,DdONcclP0,为了做这顿早饭，我他妈要迟到了。。。。。。 ,"https://ww3.sinaimg.cn/large/67e8c7fdjw1f04k15l4npj20qo0zkwn4.jpg,https://ww3.sinaimg.cn/large/67e8c7fdjw1f04k15zlzzj20zk0qoaj7.jpg,https://ww1.sinaimg.cn/large/67e8c7fdjw1f04k16idtsj20qo0zkahn.jpg,https://ww1.sinaimg.cn/large/67e8c7fdjw1f04k17a8i1j20za0qotim.jpg,https://ww4.sinaimg.cn/large/67e8c7fdjw1f04k182nuhj20zk0qoaid.jpg,https://ww3.sinaimg.cn/large/67e8c7fdjw1f04k18ppk0j20zk0qoai2.jpg,https://ww3.sinaimg.cn/large/67e8c7fdgw1f04kd48dxej20rs0kugpk.jpg",,,2016-01-19,偷的思聪的iPhone 6s,1819,423,44,,
3932905036209001,DdO0Dq3fb,有什么话我们为什么不能躺下来好好说？ ,,,,2016-01-19,偷的思聪的iPhone 6s,1348,389,55,,
3932783162392578,DdKQ4a2pY,【你喜欢叫床么】啪啪啪的时候，一般女生会叫的多吧？女生叫与不叫，男生的生理心理会有什么区别嘛？（男生有多少会叫的，怎么叫？我似乎问的有点多了………） #长奶私信# ,"https://ww2.sinaimg.cn/large/67e8c7fdjw1f042txb22gj20ku112jv8.jpg,https://ww3.sinaimg.cn/large/67e8c7fdjw1f042zwa54vj208c08cwet.jpg",,,2016-01-18,偷的思聪的iPhone 6s,586,630,10,长奶私信,
3932453716496329,DdCgHrfZv,哎哟我操这样写黄文是傻逼吧😂😂😂😂😂😂😂😂 ,https://ww4.sinaimg.cn/large/67e8c7fdjw1f0315y34gqj20ku0h5mzx.jpg,,,2016-01-18,偷的思聪的iPhone 6s,2676,445,398,,
3932426998722090,DdBzBAB0S,【粉丝求助】自慰棒被奶奶发现了，我该怎么办？？？？？（这个女孩之前投稿问用黄瓜捅自己会不会得妇科病的…）#长奶私信# ,"https://ww3.sinaimg.cn/large/67e8c7fdjw1f02y2amgjtj20ku112dly.jpg,https://ww3.sinaimg.cn/large/67e8c7fdjw1f02y2afgltj20ku112dm3.jpg",,,2016-01-18,偷的思聪的iPhone 6s,1252,1077,151,长奶私信,
3932206307132215,DdvPEtVpJ,最近叫鹏鹏的都有点火！《太子妃升职记》的芃芃虽然雷得观众里焦外嫩，但还是美得不行不行的，这边刚大结局，另一个鹏鹏就马上上线了！你看过带着猪走红毯的女明星么？！这也太雷人了吧，但看了一下现场照，居然也是美得叫人不舍得吐槽，这画风。。。鹏鹏，你们赢了！#林鹏带猪走红毯# ,https://ww4.sinaimg.cn/large/67e8c7fdjw1f01q0dtbv4j20gf93ohdu.jpg,,,2016-01-17,微博 weibo.com,2125,449,783,林鹏带猪走红毯,
3932070134853208,Ddsi1kmxy,我也是这样呢 ,"https://ww4.sinaimg.cn/large/67e8c7fdjw1f01t4jyb40j20ku0fttae.jpg,https://ww4.sinaimg.cn/large/67e8c7fdjw1f01t4j9f6wj20c805ujrw.jpg",,,2016-01-17,偷的思聪的iPhone 6s,1668,515,665,,
3932051704801231,DdrOik91d,【女友妈妈不同意她和患糖尿病的我在一起】女友不介意我有糖尿病，但是她家人不同意，让她去相亲。我很爱她不想失去她，但我怕她坚持不住……求网友给我出主意😭我该怎么办😥😥#长奶私信# ,"https://ww1.sinaimg.cn/large/67e8c7fdjw1f01qurr013j20ku112q7s.jpg,https://ww2.sinaimg.cn/large/67e8c7fdjw1f01qusz961j20ku112jvl.jpg,https://ww3.sinaimg.cn/large/67e8c7fdjw1f01quqhhb8j20ku112wio.jpg,https://ww1.sinaimg.cn/large/67e8c7fdjw1f01qut25blj20ku11242z.jpg",,,2016-01-16,偷的思聪的iPhone 6s,822,1408,155,长奶私信,
3931738755976045,DdjFxp4DP,谁知道这是个什么电影？？？？？？？？？ ,https://ww4.sinaimg.cn/large/67e8c7fdgw1f00r29zba0j20hs0u1gnn.jpg,,,2016-01-16,偷的思聪的iPhone 6s,2259,1226,400,,
