id,bid,正文,原始图片url,视频url,位置,日期,工具,点赞数,评论数,转发数,话题,@用户
4171501521564151,Fu0526yUf,我真的是没话说了，@网易阴阳师手游 ball ball你们，不想用心做副本就把荒骷髅删掉吧。1、这辆车的第二阶段出现了bug，本来无论杀对杀错，只要杀掉两个就能进入下一阶段，今天足足杀了四个部下才结束。2、我得到的信息是“【战】击杀错误的部下不会影响奖励”，我一看到就懵了，连忙去查战斗机制，发现上面只写了会有惩罚，但没说具体是什么惩罚。所以呢？要证明这条信息是不是正确，我还得先成功击杀一次？可我都不知道这条信息对不对，怎么正确击杀啊！！3、图一是击杀错误部下后，荒骷髅aoe打过来的惨状，伤害又调高了吧？4、我超不爽，真的是屎一样的体验。,"https://wx4.sinaimg.cn/large/83d61c19ly1fl9n6hrasqj20vk0hszti.jpg,https://wx4.sinaimg.cn/large/83d61c19ly1fl9nbtllmhj20vk0hsafr.jpg",,,2017-11-07,iPhone SE,7,13,0,,网易阴阳师手游
4170156890253730,Ftr6h140q,60抽21片碎片，概率还是不错的。祝大家早日拼出陆生哦 ,https://wx4.sinaimg.cn/large/83d61c19ly1fl5czm0u2fj20vk0hs0wy.jpg,,,2017-11-04,iPhone SE,10,14,1,,
4169729347720441,FtfYGworf,【体服有趣的小bug】……槽点太多竟不知从何吐起…… ,https://wx4.sinaimg.cn/large/83d61c19ly1fl3zvzoxe1j20vk0hs0w8.jpg,,,2017-11-02,iPhone SE,3,2,0,,
4169454965749875,Ft8Q8o7NV,图一是我十分喜欢的一位数据大佬发的声明，尊重他的意思所以没有直接转发。其实我昨天凌晨发了一条微博的，希望连粉和非连粉能和平共处。如果真的要守护连连，连粉该做的应该是努力拉战友，而非树敌。当然，无脑连黑除外。后来，因为某种莫名的想法影响，我把那条微博设成了私密。现在我还是打算发它发出来。说到底，玩家之间何苦内斗呢。,"https://wx4.sinaimg.cn/large/83d61c19ly1fl34636hjwj20cd06fjrt.jpg,https://wx2.sinaimg.cn/large/83d61c19ly1fl34ci4gpmj20hs0vkgrd.jpg,https://wx3.sinaimg.cn/large/83d61c19ly1fl34dz8qi4j20hs0vktfb.jpg",,,2017-11-02,荒川送我的iPhone,8,11,0,,
4169338048877662,Ft5NyBfu6,发布了头条文章：《“荒骷髅”副本机制与攻略详解》 “荒骷髅”副本机制与攻略详解 ,,,,2017-11-01,微博 weibo.com,144,66,169,,
4169269602203078,Ft41a9f7w,再给你们看一些奇怪的阴阳寮成就……等到关服都完成不了的那种 ,"https://wx4.sinaimg.cn/large/83d61c19ly1fl2j32wik7j20vk0hsq6j.jpg,https://wx2.sinaimg.cn/large/83d61c19ly1fl2j31x9umj20vk0hstc5.jpg",,,2017-11-01,荒川送我的iPhone,7,8,0,,
4169268029420121,Ft3YCDwBr,黑蛋入手新途径：先如图一所示捐献觉醒材料提高建设度，捐材料可获得新货币“功勋”。寮的建设度满了后，管理可花费寮勋章提升寮等级。等寮到了6级，成员就可花费“功勋”换黑蛋了。图三是我捐了10个觉醒材料获得的资源。图四告诉我们：寮内死人变多了会降级，都给我活跃起来。图五：管理可以知道哪些人没参与寮建设。,"https://wx3.sinaimg.cn/large/83d61c19ly1fl2ioyo01ij20vk0hs0x3.jpg,https://wx4.sinaimg.cn/large/83d61c19ly1fl2ioyd1axj20vk0hs77s.jpg,https://wx3.sinaimg.cn/large/83d61c19ly1fl2iqwbmt3j20vk0hsgp0.jpg,https://wx3.sinaimg.cn/large/83d61c19ly1fl2ivvdo4cj20vk0hsgpa.jpg,https://wx3.sinaimg.cn/large/83d61c19ly1fl2iwocxrzj20vk0hs78t.jpg",,,2017-11-01,荒川送我的iPhone,3,5,0,,
4169241211488025,Ft3hn6f6p,做了一份非常非常粗糙和理想化的追月神和辉夜姬的供火对比：1、开局假定自带两鬼火。2、不考虑高速式神插队情况。3、辉夜三技能供火概率是67%，被动挨打回火概率是40%，所以我这个数学渣为了省事就当作辉夜三技能每回合必回一点火。不过还是很想问问@燃玉 大佬关于辉夜回火量的问题。4、同样为了方便，只计算了前三轮的回火情况。结论：追月神能帮助队伍快速度过三火和四火的鬼火疲软期，在前期的回火量和辉夜姬平起平坐，到了后期则是辉夜回火更多。因此追月神比辉夜姬更适合先手队。（其实功能性上也很明显，追月神加攻加速，适合先手。辉夜姬加抗加防，开局放幻境，适合后手）,"https://wx3.sinaimg.cn/large/83d61c19ly1fl2fk4ftwzj20hs0vkn1r.jpg,https://wx3.sinaimg.cn/large/83d61c19ly1fl2fk435mfj20hs0vkgq6.jpg,https://wx3.sinaimg.cn/large/83d61c19ly1fl2fk4rnjmj20hs0vkwj0.jpg,https://wx1.sinaimg.cn/large/83d61c19ly1fl2fk526o9j20hs0vkaek.jpg",,,2017-11-01,荒川送我的iPhone,4,9,0,,燃玉
4169120033191580,Ft07Vdoh6,和人讨论一目连的群盾厚度，提到御灵本。我说我打御灵不用盾系，带个五星书翁一分钟半就能解决战斗，很快的。结果被说装x、秀式神、找存在感。我很确定对面不是在开玩笑。我真的相当无奈了，三套针女都是暴击的，真天还是411的针女，书翁技能只有132，普通招财，速度只比输出快一点。就这样还被说是装x？我真的是瑟瑟发抖不敢说话。况且有书翁的情况下，一分半真的不算快。,,,,2017-11-01,荒川送我的iPhone,7,6,0,,
4169052009921489,FsYmcFD21,体服更新概要：SSR概率2.5倍up、未收录、新式神奴良陆生和追月神（SR）、荒骷髅、狗子的为崽皮、抽卡得陆生碎片、同心之兰得追月神碎片、一目连单盾伤害下降群盾厚度提高、数珠驱散概率下降、阴阳寮可升级 ,,,,2017-10-31,荒川送我的iPhone,3,0,2,,
4168292677072759,FsEBttFWL,我提交一个数珠的bug，你们说这是处罚相关问题？处罚数珠吗？改了两遍措辞还是无法顺利提交，该改改你们的关键词检测系统了，现在这样谁还有热情帮你们测bug？@网易阴阳师手游 ,"https://wx4.sinaimg.cn/large/83d61c19ly1fkzeu3z51bj20vk0hsq5t.jpg,https://wx1.sinaimg.cn/large/83d61c19ly1fkzeu38owtj20vk0hsdj8.jpg",,,2017-10-29,荒川送我的iPhone,4,4,0,,网易阴阳师手游
4168288801463683,FsEve68LN,刚刚发的那篇长微博里提到的数珠2.0bug 定安猿类的秒拍视频 ,,"http://f.us.sinaimg.cn/003tPycClx07foueLHEk010f0100GdHi0k01.mp4?label=mp4_hd&template=v2_template_ld_720&Expires=1578099779&ssig=7Ga9%2BlaAoM&KID=unistore,video",,2017-10-29,荒川送我的iPhone,0,1,0,,
4168285287397508,FsEpyv2qE,发布了头条文章：《被动群体推条的机制（数珠、金鱼姬）》 被动群体推条的机制（数珠、金鱼姬） ,,,,2017-10-29,微博 weibo.com,10,9,4,,
4167208076365164,Fsco7qHRW,茨手手的新皮肤！白发！奶子！买买买！ ,https://wx4.sinaimg.cn/large/83d61c19ly1fkvybzukvfj20hs0np0wp.jpg,,,2017-10-26,荒川送我的iPhone,4,0,0,,
4167181892274091,FsbHT9xAT,粉丝控评真的巨恶心，这和那些在公共场合大声嚷嚷的人有什么素质上的差别。我们并不关心你家仙女拿的是a类奖还是野鸡奖谢谢，我们diss的是她居然凭一部抄袭作改编的电影拿的奖 ,,,,2017-10-26,荒川送我的iPhone,5,0,0,,
4165136820329732,Frkvo1nMg,图一是大佬的异想天开，图二是萌新的信以为真，图三是我的回复 ,"https://wx3.sinaimg.cn/large/83d61c19ly1fkpc110xtqj20hs0c4wfi.jpg,https://wx1.sinaimg.cn/large/83d61c19ly1fkpcfnfaodj20hs0c4t9o.jpg,https://wx1.sinaimg.cn/large/83d61c19ly1fkpcfn8533j20hs0ki41e.jpg",,,2017-10-21,荒川送我的iPhone,5,2,1,,
4164336127781575,FqZFWwElh,本来看连连的传记就够心疼了，现在看到连连有这么多脑残亲妈粉，顶着护崽的名号到处招黑，更心疼他了 ,,,,2017-10-18,荒川送我的iPhone,10,1,0,,
4164182822134064,FqVGG8Xao,小鹿九层攻略敌方：镜姬金鱼姬、被服+地藏跳哥、薙魂萤草、（忘了什么御魂的）荒、返魂香小松丸我带的阵容是：神乐（冥蝶+解控疾风，神祭属性没洗）、薙魂暴击桃花（试过无暴击桃花，效果不太好）、返魂香兵俑、爆伤破势犬神、针女花鸟、心眼丑时之女。带丑女是因为地藏跳哥实在打不动，理论上带般若封印或者白字输出都可以，敌方抵抗并不高。带兵俑是因为萤草只要被控住，就不会在我方暴击时给奶。小鹿经常把我方推成奥运五环，所以带花鸟抵消眩晕还是不错的。神乐的作用主要是给对面上减疗和拉丑女补草人。要注意的是，第三层每打死一个敌方单位，剩余敌方单位就会恢复大量血。所以要逐个击杀。建议击杀顺序是：跳哥、荒、萤草、金鱼姬、小松丸、小鹿男。,"https://wx3.sinaimg.cn/large/83d61c19ly1fkmap2d0cjj20vk0hsn27.jpg,https://wx1.sinaimg.cn/large/83d61c19ly1fkmap2ys5pj20vk0hs79m.jpg,https://wx1.sinaimg.cn/large/83d61c19ly1fkmap3ezmkj20vk0hsn39.jpg,https://wx3.sinaimg.cn/large/83d61c19ly1fkmap3ql9fj20vk0hsgrx.jpg,https://wx3.sinaimg.cn/large/83d61c19ly1fkmap1hlvyj20vk0hsag9.jpg,https://wx2.sinaimg.cn/large/83d61c19ly1fkmap42wa3j20vk0hstex.jpg,https://wx4.sinaimg.cn/large/83d61c19ly1fkmap4hdhaj20vk0hswkg.jpg,https://wx4.sinaimg.cn/large/83d61c19ly1fkmap4urwqj20vk0hsgqc.jpg,https://wx4.sinaimg.cn/large/83d61c19ly1fkmapye5p5j20fk09o0tu.jpg",,,2017-10-18,荒川送我的iPhone,22,31,14,,
4155802011220192,FnpFf57qw,@网易阴阳师手游 这种阅读理解0分的客服请你们辞退掉好不好？ ,"https://wx4.sinaimg.cn/large/83d61c19ly1fjvk5qtaouj20vk0hsjxb.jpg,https://wx3.sinaimg.cn/large/83d61c19ly1fjvk5r3u58j20vk0hsjvb.jpg,https://wx3.sinaimg.cn/large/83d61c19ly1fjvk5rc8xuj20vk0hsado.jpg",,,2017-09-25,荒川送我的iPhone,0,0,1,,网易阴阳师手游
4155440361700022,FngfW78fI,140抽7个SSR……难道……我是欧洲人？ ,"https://wx1.sinaimg.cn/large/83d61c19ly1fjuetzqi89j20vk0hsjxp.jpg,https://wx3.sinaimg.cn/large/83d61c19ly1fjuetzzpuzj20vk0hsq8o.jpg,https://wx3.sinaimg.cn/large/83d61c19ly1fjueu09705j20vk0hsn3j.jpg,https://wx3.sinaimg.cn/large/83d61c19ly1fjuetzb4rrj20vk0hsq86.jpg,https://wx3.sinaimg.cn/large/83d61c19ly1fjueu0it26j20vk0hswkj.jpg,https://wx3.sinaimg.cn/large/83d61c19ly1fjueu0vm4ij20vk0hs0yz.jpg,https://wx3.sinaimg.cn/large/83d61c19ly1fjueu1at73j20vk0hs0yv.jpg",,,2017-09-24,荒川送我的iPhone,11,16,1,,
4152298282215405,FlWw49ikl,系列委派第一环【虫之印】，委派奖励还是很有梦想的。以及该委派钦定了巫蛊师出场，如果不委派巫蛊师而委派其他五个六星式神的话，成功率只有70%-80%。 ,"https://wx1.sinaimg.cn/large/83d61c19ly1fjkdvrg5r7j20vk0hsagy.jpg,https://wx1.sinaimg.cn/large/83d61c19ly1fjkdvoq8owj20vk0hsaf0.jpg,https://wx2.sinaimg.cn/large/83d61c19ly1fjkdvtcmorj20vk0hswl0.jpg",,,2017-09-15,荒川送我的iPhone,6,1,3,,
4151684508642922,FlGy6AgpY,我觉得玉藻前这次的技能机制这么平庸原因是：策划团队的智商不足以设计出既有特色又不破坏平衡的技能。跟彼岸花一对比就能发现这点。彼岸花的花海机制很有特色，但破坏了平衡（削弱前）。小鹿的拉推机制和彼岸花的花海机制应该反映出了策划团队智商的最高水平。 ,,,,2017-09-14,荒川送我的iPhone,6,5,0,,
4151257285405002,Flvr2mG5s,【体服有趣的小bug之】悲歌？从前的黑豹：啊！博雅大人死了！大家伙！一起跟对面拼了！！我将献祭我的生命给大家助力！！哀声悲号！！现在的黑豹：博雅大人你受伤了！有没有事！我去给你买创可贴！喂！你们几个快点打别偷懒！博雅：你回来！买个鬼创可贴啊！创可贴有协战重要吗！ 定安猿类的微博视频,,"https://f.us.sinaimg.cn/001nfiuOlx07ebwuDq2Y010f01003pTV0k01.mp4?label=mp4_hd&template=v2_template_ld&Expires=1578099797&ssig=duhiB0ILXE&KID=unistore,video",,2017-09-12,荒川送我的iPhone,3,1,0,,
4150526758819955,FlcqLB0tl,五辅助博雅输出，妖琴拉兵俑补控或者拉镰鼬拉条，基本没有我出手的机会。博雅没走推拉路线而是强攻，所以节奏还算快。大概打了十五分钟左右，要是裁判旗没出bug的话估计还能快一倍。 ,https://wx3.sinaimg.cn/large/83d61c19ly1fjeqfuagi9j20vk0hs7ax.jpg,,,2017-09-10,荒川送我的iPhone,6,0,0,,
4150179714431070,Fl3p1iAIS,对面的阵容：散件镰鼬、招财兔子、火灵火机、针女狗子、针女妖刀，很标准的双拉一波。神乐带了可以解控的疾风和群体增伤的炼狱。我带的是：招财镰鼬、火灵火机、破势荒川、返魂香兵俑、日女花鸟（花鸟带错了，应该带薙魂桃花）。博雅带了在对面行动后触发攻击的影分身和带击退效果的多重箭。开局对面先手，我被打成了下面这个仿佛已经死亡的惨状。然而博雅放出影分身后，局势开始一点点回转。博雅和花鸟推条，兵俑控制，影分身输出。虽然我最后还是被团灭了但我也把对面减员至只剩神乐和镰鼬。从中可以看出，博雅已经不是从前的斗技废材了。ps 带解控的疾风真的非常非常克制返魂香。我开局减员这么多，是因为对面的狗子被我返魂香晕住后，神乐拉狗子解控（是的，所有不能行动的状态都能解，包括眩晕和变形），狗子又吹了一波……如果对面带的是辉夜而不是火机，说不定妖刀还能开出大来，把我彻底打残。,https://wx3.sinaimg.cn/large/83d61c19ly1fjdm96fkjrj20vk0hs7b2.jpg,,,2017-09-09,荒川送我的iPhone,3,2,0,,
4149939057614024,FkX8RvWKQ,刚刚取关了某漫画社的三个成员，接下来会逐步清理我转发过他们的相关微博。取关三个原因：1、抄袭。2、戏精。3、漫画剧情太烂分镜太烂，我觉得他们只适合画插图。 ,,,,2017-09-09,荒川送我的iPhone,7,3,0,,
4149863563817988,FkVb6g1es,这个不是bug，是想给大家看看，在博雅的豹眼里激活神祭技能【嗜血】后（增加30%吸血），结界里的小僧队可以直接用双拉一波莽了……（可能一直有大佬是莽的，但像我这么咸鱼的人，以前只能用兵俑荒川控杀） 定安猿类的微博视频 ,,"http://f.us.sinaimg.cn/001410U6lx07e5obHcHK010f0100txvx0k01.mp4?label=mp4_hd&template=v2_template_ld&Expires=1578099797&ssig=S0LbZvLt3j&KID=unistore,video",,2017-09-09,iPhone SE,18,16,20,,
4149813971294099,FkTT75qEz,【体服有趣的小bug之】龙：雷你自己打，盾你自己破，我就走个过场。 定安猿类的微博视频 ,,"http://f.us.sinaimg.cn/000GhCA6lx07e5aDFL68010f01004vdD0k01.mp4?label=mp4_hd&template=v2_template_ld&Expires=1578099797&ssig=OHGQ7cdqBu&KID=unistore,video",,2017-09-08,iPhone SE,3,1,1,,
4149674589590930,FkQgiEf2q,那就发个老视频剪个彩，【体服有趣的小bug之】惠比寿：椒图你不要拉我！让狂风暴雨都冲我这把老骨头来吧！！ 定安猿类的微博视频 ,,"http://f.us.sinaimg.cn/0015Rib8lx07e4yBkPfG010f01009o7Y0k01.mp4?label=mp4_hd&template=v2_template_ld&Expires=1578099797&ssig=QEbuLrEkPp&KID=unistore,video",,2017-09-08,iPhone SE,5,1,0,,
4149670441799079,FkQ9C7y1p,想录一些体服有趣的小bug发在微博上……不过在现在阴阳师这个退坑的风口浪尖上发这些会不会不太好并没有批判程序员的意思，只是想大家看着乐呵乐呵，以及体会一下体服人民水深火热的生活（发就发呗你还宣布一下，膨胀了 ,,,,2017-09-08,iPhone SE,13,3,0,,
4149477521074023,FkL8s4voX,官博和攻略组底下的评论真是没眼看。一堆说玉藻前太丑天皇眼瞎的。拜托，哪个妖怪用原型去勾引男人的？小唯是扒了画皮去勾引王生的？白娘子是用蛇身吸引许仙的？再者，这是阴阳师，妖怪就该有妖怪的样子。这不是奇迹暖暖，不是你的乙女乙男游戏。你不是阴阳师的爸爸，嫌丑不喜欢你可以去玩别的游戏。跑去喷画师只会显得你很没素质。,"https://wx1.sinaimg.cn/large/83d61c19ly1fjbdt4yvgbj20hs0npwhz.jpg,https://wx2.sinaimg.cn/large/83d61c19ly1fjbdt5cfaqj20hs0npn10.jpg",,,2017-09-07,iPhone SE,23,17,1,,
4149204207786744,FkE1CwFGE,发布了头条文章：《体验服神祭系统初步解读·八百篇》 体验服神祭系统初步解读·八百篇 ,,,,2017-09-07,微博 weibo.com,3,4,8,,
4149123877429446,FkBW3vaJM,发布了头条文章：《体验服神祭系统初步解读·博雅篇》 体验服神祭系统初步解读·博雅篇 ,,,,2017-09-06,微博 weibo.com,18,1,21,,
4149099026673797,FkBhYs09T,发布了头条文章：《体验服神祭系统初步解读·神乐篇》 体验服神祭系统初步解读·神乐篇 ,,,,2017-09-06,微博 weibo.com,14,10,39,,
4149055364512695,FkA9yiVXp,发布了头条文章：《体验服神祭系统初步解读·晴明篇》 体验服神祭系统初步解读·晴明篇 ,,,,2017-09-06,微博 weibo.com,37,11,59,,
4140524284245091,Fh0dKhOld,其实我感觉地域鬼王和真八歧大蛇是阴阳师的测试性活动，测试啥呢？先来看一下旧版阴阳师是如何对待玩家的：魂十、业原火、御灵副本出货率下调，限时御魂buff让玩家不得不赶快肝。这是老玩家最爱抱怨的内容之一。然而玩家只从自身出发，觉得这游戏好肝好看脸好不爽，却没想过如果六星不下调会有什么后果：届时人人都有满暴暴伤输出、理论最高命中控制、理论最高速度拉条，pvp尚可一玩，毕竟有不同套路，但pve呢？pve的boss面板属性就放在那里不会变，打得过那所有人都打得过，打不过那所有人都打不过。就算一开始打不过，只要有一人过了，阵容御魂一分享，瞬间所有人都过了，这样的pve有意思吗？这也是从荒川秘闻副本开始，所有pve副本都看脸的原因。当玩家的练度到达一定程度后，游戏该用什么来提高终点的难度，好让玩家有所追求？一是修改游戏机制（一个boss穿两套御魂），二是让难度变得看脸（嘿，你猜我这个荒川会不会触发轮入道？）。然而民怨四起，官方意识到老这么拔高终点却不给玩家一点支持也不是办法。于是新版阴阳师针对出货率下调采取了什么补救措施？推出旧蛇皮和金蛇皮道具。旧蛇皮兑换任意御魂，金蛇皮兑换指定御魂，玩家获取六星御魂变得比以前容易了，但仅仅只是变容易了，你仍需要肝，或者氪。官方不可能完全舍弃肝度，扫荡模式更是别想，点击就送屠龙宝刀的游戏你爱玩？或许真的有人爱玩。但自古以来都应该是玩家选择游戏，而不是游戏屈服于玩家。不喜欢玩需要肝的游戏的玩家，可以选择去玩《EVA破晓》。不喜欢玩恐怖游戏的玩家，可以去玩奇迹暖暖。《生化危机6》加强了射击体验后，销量上升了吗？《零濡鸦之巫女》新增诸多宅男福利后，口碑变好了吗？氪氪因为阴阳师降低难度、没有可玩性而弃坑，这不是阴阳师的问题（因为我们知道即使是现在的山兔本也依然不简单），一部分玩家觉得阴阳师太肝，也不是它的错。这只是一个游戏自身的定位问题，是休闲，还是重肝（相信黑魂系列的虐心程度也使得相当一部分玩家不想再碰，但它留住了好这口的玩家）。一款游戏想要做到所有人都满意是不可能的，而新版阴阳师护肝的改动也是对自身定位的一次调整。说了这么多好像有点偏题，但我想说明的是，或许旧版阴阳师骗氪骗肝，但新版阴阳师的确开始在挽回玩家方面作出了很大的努力。因此地域鬼王、真大蛇不会是官方设计出来恶心玩家，或者是骗肝骗氪的。（插句题外话，之前的ssr未收录活动可以说是阴阳师改良的第一步，就这还有人说是骗氪。我只想对这类人说滚出阴阳师，屠龙宝刀比较适合你。）地域鬼王一个最大的亮点是难度可调节。这让低练度玩家和高练度玩家都有奖励可拿，并且奖励有差别。但问题出在哪里呢，地域鬼王是跨服玩法，正式服想要拿前几名是难上加难，因为这不仅需要高练度，还要求玩家具有一定的操作和欧气。所以一些休闲玩家就觉得闹心，为什么我玩个pvp是跟别人竞争，玩pve还得竞争？不想竞争？那就去打真大蛇呗。真大蛇太难而且奖励不好？奖励的事我们之前已经讨论过，单纯嫌难就去刷假大蛇呗。什么？假大蛇又肝又无聊？你还是去玩屠龙宝刀吧。一个没有竞争、奖励好、难度不高的pve玩法是玩家们想要的，但可能实现吗？光难度就众口难调，有人觉得镰鼬本不算难，有人觉得难到爆炸。官方为了调和这一矛盾推出了难度自助调节系统，什么？你嫌低难度的奖励差？你凭什么能拿跟高难度一样的奖励？其实还有另一种解决办法，就是取消跨服，排行仅为本服。就我在体验服的感受来说，只要卡池深一点、练度高一点，前几名是可以躺拿的，于是又有人要说了，这个玩法好无聊啊……就目前玩家对地域鬼王的评论来看，官方想以自助调节难度系统来满足不同玩家的需求，并没有成功。（虽然我挺喜欢这个玩法，但毕竟我在体服，站着说话不腰疼。）最后再来说一说真大蛇。真大蛇难度高、奖励低，堪称史上体验最差的副本。但为什么官方还是把真大蛇实装到了正式服？虽然大部分玩家玩了几次真大蛇就不玩了，但还有相当一部分大佬仍在孜孜不倦地挑战。他们是为了奖励？还是为了有趣？都不是，他们是为了那个头像框。阴阳师的头像框有各种获取方式：秘闻、氪金、活动，但只有两个头像框是玩家梦寐以求并且可以拿来装逼的，一个是月见黑，还有一个就是噬剑之蛇。真大蛇副本的高难度以及获得头像框的小概率，让我觉得官方其实是有意为之。按照一贯的作风，官方应该把头像框设计成通关十层即可获得，而不是现在这种“7－9层极小概率获得，通关十层小概率获得”。如果只是通关即可获得，那只能说明你有一定实力和运气，你有这个实力侥幸通关了真大蛇（荒川皮肤就是这个设定，但官方发现玩家并不会拿荒川皮装逼）。但如果是现在这种设定，你拿到了噬剑之蛇，那你就是大佬+欧皇！你大佬在于你可以反复通关这么多次真大蛇！你欧皇在于你居然拿到了小概率才能获得的头像框！这装逼的资本就大了。所以我认为真大蛇也是官方的一个测试，目的是了解这种低成本的东西是否有“骗肝骗氪”的潜力。,,,,2017-08-14,iPhone SE,12,7,4,,
4139632524743690,FgD1qjU38,夏日集结，为爱发电！我是第4802个为大天狗应援的阴阳师，快来和我一起为本命式神应援吧！ ,https://wx3.sinaimg.cn/large/83d61c19ly1fifzc87etwj20vk0hsadp.jpg,,,2017-08-11,阴阳师,1,0,0,,
4139065345939424,FgogCoV7a,不知道该说什么。我曾经被批评“在发表之前不要想被抄了会怎么样”。我能理解批评我的人其实是想鼓励我迈出第一步，不要瞻前顾后。但现在这样的环境，我真的要把自己的孩子亲手推进荒野丛林，而不去想他是否会被蛇虫虎豹吞噬吗？还是说这个孩子其实是个可消耗品，要是被吃掉了，别再生就行了？ ,https://wx4.sinaimg.cn/large/83d61c19ly1fie6741byuj20hs0vkdkk.jpg,,,2017-08-10,iPhone SE,0,0,0,,
