id,bid,正文,原始图片url,视频url,位置,日期,工具,点赞数,评论数,转发数,话题,@用户
4435843558740493,If2sbAFNH,为什么我当初没继续学画画不然我现在就可以把脑内狒狒14的粮产出来了！（拍大腿 ,,,,2019-11-07,iPhone客户端,1,0,0,,
4420378610789641,I8y8J3jq9,最后生还者2！！！！！！大家过年好！！！！！ ,,,,2019-09-25,iPhone客户端,3,0,0,,
4415091451291790,I6kB35q3k,吃瓜吃饱，mrfz和mdzs真是有异曲同工之妙 ,,,,2019-09-10,iPhone客户端,0,0,0,,
4402279048307582,I0XhSyRbg,打出一个大大的？ ,https://wx2.sinaimg.cn/large/83d61c19ly1g5pvv0focqj20k80dladl.jpg,,,2019-08-06,iPhone 8,2,1,0,,
4401221944822720,I0vMSkeBO,新泳装的男从者灵衣一个裹得比一个厚，梅林老贼连围巾都戴上了。泳装活动就请脱光好吗大家都是男的怕啥 ,https://wx2.sinaimg.cn/large/83d61c19ly1g5miexm64yj203m02g0sq.jpg,,,2019-08-03,iPhone 8,0,0,1,,
4400587531871784,I0fhD7QW4,我因为退血亏堡吃的封印已经有130个小时了 ,,,,2019-08-01,iPhone 8,1,0,0,,
4400097062215641,I02wy9io9,新转了一个职业后第一件事必是搞一套幻化先……每天就靠幻化治愈了555 ,https://wx3.sinaimg.cn/large/83d61c19ly1g5ix8dgfl3j20gp0s24qp.jpg,,,2019-07-31,iPhone 8,1,1,0,,
4399492919280439,HFKgrCWgv,yy和他的ncf真是可怕…… ,,,,2019-07-29,iPhone 8,0,0,0,,
4387491446071957,HAI3eptAN,全微博只有银教授发的段子底下的评论能放心点进去看了，其他评论看得让我小心谨慎地打出一个“？” ,https://wx2.sinaimg.cn/large/83d61c19ly1g4epjbvn9cj203w04674a.jpg,,,2019-06-26,iPhone SE,0,0,0,,
4384863450425388,HzBGx1MF6,🌚？官方这是图个啥啊 ,https://wx2.sinaimg.cn/large/83d61c19ly1g46bppjti1j20dx05fwfu.jpg,,,2019-06-19,iPhone SE,0,9,0,,
4383930293613691,Hzdprfa5l,龙神裤的设计师真是懂人心 ,https://wx2.sinaimg.cn/large/83d61c19ly1g43cimm3wrj214e0p6q6r.jpg,,,2019-06-16,iPhone SE,1,6,0,,
4379526429359498,HxmQqDgPE,生而为男，真是抱歉（才怪 ,,,,2019-06-04,iPhone SE,3,1,0,,
4362603360766424,HqgBa3dnG,最近new的这些金卡感觉无限池前都不可能练出来了…… ,https://wx2.sinaimg.cn/large/83d61c19ly1g27b600qmbj20vk0hsnpd.jpg,,,2019-04-19,iPhone SE,1,0,0,,
4361130832661207,HpEi7baiH,啊啊啊啊啊啊！！！！！！！！ ,https://wx2.sinaimg.cn/large/83d61c19ly1g22m1zvuerj20vk0hskjl.jpg,,,2019-04-15,iPhone SE,0,1,0,,
4361031561632448,HpBI06QFO,我觉得持以下两种言论的都是同一批人：1、我不支持也不反对同性恋，你们自己过自己的就好了，又没人逼你喜欢什么性别，出来跳什么跳。2、骗婚gay司马。 ,,,,2019-04-14,iPhone SE,0,4,0,,
4357064220683327,HnWv42RLp,一个小问题：粉丝自己知道路人很讨厌他们控评吗？ ,,,,2019-04-03,iPhone SE,1,5,0,,
4355685603057438,HnmDucPnw,啊！！！只要你看强风吹拂我们就是朋友！！！啊！！！！（仓鼠叫） ,,,,2019-03-30,iPhone SE,5,3,0,,
4353466489073380,HmqUgC4oQ,网络怪象：催别人早睡的人自己早睡吗？ ,,,,2019-03-24,iPhone SE,3,1,0,,
4345461059356133,Hj4EhDfXn,一些词汇在网络上已经被大幅度滥用了，只要审美不同就是ky，只要据理力争就是杠精，只要对游戏内容有一点记错或误解就是云玩家。我们本以为网络是一个畅所欲言的地方，实际上我们在发出一句话之前斟酌的时间越来越长…… ,,,,2019-03-02,iPhone SE,10,0,1,,
4342857281607724,HhYUE6Kf2,现在的心情就是：对方端上了一盘好菜，你大口吃完并夸赞不止，随后便从监控中发现对方上菜前往里面吐了一口痰，搅和搅和不让你看见。然后你回想起在吃菜的时候，对方默不作声微笑地看着你吃 ,,,,2019-02-23,iPhone SE,8,1,0,,
4336375132060392,Hfghz8E08,极月读吃死刑忘开减伤，物理换T大家新年快乐 ,,,,2019-02-05,iPhone SE,3,2,0,,
4322237295164613,H9kuBlFyd,很久很久以前，在b站看番是因为它有弹幕。现在，在b站看番是因为它没广告并且可以关弹幕 ,,,,2018-12-28,iPhone SE,14,0,0,,
4319485601278014,H8aUo5mt8,@盖伊传说 提一个小建议，贵游在两方面采取了矛盾的吸引用户群体的要素。一是大部分盖伊是肉熊这类面向基佬口味的外形，包括私照中也有白袜等基佬限定的喜好，而腐女/腐男大部分不接受此类。二是剧情中盖伊之间有大量cp要素，例如很明显的云顿和特林、艾迪和麦尔斯，这类cp要素对于腐女/腐男来说可能喜闻乐见，而对基佬群体来说会有种自己老公/老婆被当面ntr的不适感……如果贵游是想两方面的用户群体都吸引的话，这类操作可能导致两类用户都流失……,,,,2018-12-21,微博 weibo.com,3,7,0,,盖伊传说
4319265366235858,H85baqaem,特林真是过于可爱了，想🌞 ,"https://wx1.sinaimg.cn/large/83d61c19ly1fyd1uqcq60j20vk0hs4n4.jpg,https://wx1.sinaimg.cn/large/83d61c19ly1fyd1uquh16j20vk0hs1kx.jpg",,,2018-12-20,iPhone SE,5,2,0,,
4317022705591467,H78PYnsAX,我觉着我简直是站错cp的专业户（本来想说xiejiao，但渣浪不让发）。看盗墓笔记的时候站的胖邪，看星辰骑士站的雷克特x欧泊，看相见欢站的父子。就在刚刚看琅琊榜倒数第二集的时候，猝不及防吃了口景琰他爹（huangshang这个词也不让发……）和梅长苏的糖，回味觉得甚甜！！！我病入膏肓了 ,https://wx1.sinaimg.cn/large/83d61c19ly1fy5w7qhpq0j205i05i0si.jpg,,,2018-12-14,微博 weibo.com,1,9,0,,
4302442449522981,H11xqDXmt,欧洲魔术救我狗命，咳血 ,https://wx1.sinaimg.cn/large/83d61c19ly1fwvdsa1da9j20vk0hsb29.jpg,,,2018-11-04,iPhone SE,2,0,0,,
4296599859756330,GEx0dEW4a,有时候我也是蛮心疼阴阳师的式神，好不容易有件漂亮衣服穿，阿爸阿妈说不给买就不给买了，也不知道为啥。【纯吐槽，没有站队】 ,,,,2018-10-18,iPhone SE,12,11,1,,
4295414314541183,GE2a3j3mT,最近发现的玻璃心悖论：“怕你玻璃心，所以我跟你解释一下……，抱歉啦。” ,,,,2018-10-15,iPhone SE,1,3,0,,
4295175846754423,GDVXqsl8j,555终于出了 ,https://wx2.sinaimg.cn/large/83d61c19ly1fw878mu39wj20vk0hs1kx.jpg,,,2018-10-15,iPhone SE,3,0,0,,
4294456721699983,GDDfy78f5,我商店都快毕业了给我掉张礼装来 ,https://wx3.sinaimg.cn/large/83d61c19ly1fw5wmv3gmyj20vk0hs4qp.jpg,,,2018-10-13,iPhone SE,1,0,0,,
4292153695445987,GCFkZmQKv,读心go 读心go.jpg ,"https://wx3.sinaimg.cn/large/83d61c19ly1fvyk51kp6vj20vk0hse81.jpg,https://wx2.sinaimg.cn/large/83d61c19ly1fvyk527bcvj20vk0hse81.jpg,https://wx4.sinaimg.cn/large/83d61c19ly1fvyk52orcdj20vk0hse81.jpg",,,2018-10-06,iPhone SE,1,0,0,,
4291125441440897,GCeAw62Qh,对于铺天盖地的茨木sp节奏，我发表一句话观点：如果你真的是茨木厨，你理应喜欢茨木的各个阶段，那些刷要“一个剪影”回炉重造／只要女茨／只要幼茨的请收手吧。 ,,,,2018-10-03,iPhone SE,30,19,1,,
4291021045408252,GCbS8mGVS,#阴阳师沉浸式嘉年华# 快来认领你们的老公！ ,"https://wx4.sinaimg.cn/large/83d61c19gy1fvuy1w30cbj20ku0rs42z.jpg,https://wx1.sinaimg.cn/large/83d61c19gy1fvuy2att6wj20ku0rs42p.jpg,https://wx3.sinaimg.cn/large/83d61c19gy1fvuy2hnqy5j20ku0rsdk0.jpg,https://wx2.sinaimg.cn/large/83d61c19gy1fvuy2kn3mnj21110ku428.jpg",,,2018-10-03,iPhone SE,55,33,3,阴阳师沉浸式嘉年华,
4290940060837863,GC9Lw3vXV,“起床去吃早饭吧……”“还想再睡会儿……”“去吃早饭吧……”“想睡……”“吃……”“睡……”………………设好九点的闹钟，躺下闭眼。 ,,,,2018-10-03,iPhone SE,0,10,0,,
4289243314714757,GBrCPjMwt,对于《奇异人生2》的直播和录制我一直很纠结，一方面想自己体验剧情，一方面又想看C菌玩………… ,,,,2018-09-28,微博 weibo.com,0,1,0,,
4289210955868942,GBqMDoCMm,人面树退治初见实况：本质是地域鬼王。 UP主：定安元类 #bilibili# 人面树退治初见实况：本质是地域鬼王 （哔哩哔哩客户端下载网页链接） ,,,,2018-09-28,哔哩哔哩移动客户端,4,0,1,bilibili,
4289163182527145,GBpxAaBqp,萌新终于可以3t刷狗粮了555（我的良心不会痛的！ ,https://wx4.sinaimg.cn/large/83d61c19ly1fvp0nz8gljj20vk0hsnpd.jpg,,,2018-09-28,iPhone SE,0,2,0,,
4284118478581018,GziiXA0jw,四、四黄蛋！ ,"https://wx1.sinaimg.cn/large/83d61c19ly1fv8xam6fptj20vk0hsarq.jpg,https://wx4.sinaimg.cn/large/83d61c19ly1fv8xbl7xjtj205i05odgd.jpg",,,2018-09-14,iPhone SE,32,20,0,,
4273237892449870,GuJfDahk2,看图说话。p1第十层。p2-3番外。我没有鬼切。 ,"https://wx1.sinaimg.cn/large/83d61c19ly1fua7oj1zg0j20vk0hs1kx.jpg,https://wx3.sinaimg.cn/large/83d61c19ly1fua7ojm7oqj20vk0hsnpd.jpg,https://wx1.sinaimg.cn/large/83d61c19ly1fua7ok3pjzj20vk0hs1kx.jpg,https://wx2.sinaimg.cn/large/83d61c19ly1fua7okbnshj205i04ywem.jpg",,,2018-08-15,iPhone SE,4,18,0,,
4272505596198444,Guqcvq0uU,分享图片 ,"https://wx3.sinaimg.cn/large/83d61c19ly1fu7vlmq2kvj20hs0vk0v0.jpg,https://wx2.sinaimg.cn/large/83d61c19ly1fu7vlmip1oj20hs0vkwgb.jpg",,,2018-08-13,iPhone SE,3,3,0,,
4272499484782404,Guq2Ek47y,顺火暖喂屎，怪猎wg下架，屈辱地重新肝起了废狗 ,,,,2018-08-13,iPhone SE,1,5,0,,
4267689586853974,GsoUKsL1Y,咦……又是一发入魂 ,"https://wx1.sinaimg.cn/large/83d61c19ly1ftsihg5bc7j20vk0hskjl.jpg,https://wx2.sinaimg.cn/large/83d61c19ly1ftsihgr36ij20vk0hshdt.jpg",,,2018-07-31,iPhone SE,2,0,0,,
4267509358095459,Gske3xXZV,百无聊赖的我回了废狗坑，第一个十连就一发入魂……（当初是因为没抽到梅林弃的坑 ,"https://wx1.sinaimg.cn/large/83d61c19ly1ftrxqfa6yvj20vk0hskjl.jpg,https://wx4.sinaimg.cn/large/83d61c19ly1ftrxqg6z6vj20vk0hskjl.jpg",,,2018-07-30,iPhone SE,6,3,0,,
4266223141142019,GrMLw4N5F,⼀图流，懂的人都懂 ,https://wx4.sinaimg.cn/large/83d61c19ly1ftnu25jirqj21120kvwin.jpg,,,2018-07-27,iPhone SE,1,0,0,,
4263447182652613,GqCyab845,逆水寒你这是模拟经营游戏吧 ,,,,2018-07-19,iPhone SE,1,3,0,,
4260418053185668,GplKtdmJK,因为以前没怎么玩过这类点卡收费游戏，所以我不太好对逆水寒作什么评价。不过我挺疑惑的是在这款游戏里仍然是人民币玩家碾压平民玩家（我以为肝是变强的主体因素），那么它与免费游戏的本质区别在哪里呢……非杠，真心求教 ,,,,2018-07-11,iPhone SE,5,37,0,,
4258587033646307,GoA7dfizp,追命师兄，对不起，我变心了，我现在爱的是铁手师兄。 ,,,,2018-07-06,iPhone SE,1,17,0,,
4258082705787258,GomZMohwS,未觉醒皮的杀生丸，三技能图标和特效都与觉醒皮不一样。顺便修正一下我上一条微博说错的一点 背锅服玩家_定安元类的秒拍视频 ,,"http://f.us.sinaimg.cn/0038YuOQlx07lLHIRhUA01040200bSUn0k010.mp4?label=mp4_hd&template=852x480.28&Expires=1578099469&ssig=1frYyV7ZK%2B&KID=unistore,video",,2018-07-04,iPhone SE,51,23,114,,
4258013072195823,Golbt9dev,杀生丸免死特效被阉割，只剩了个orz小人图标……风格完全变了啊！太出戏了叭🙅♂️ 背锅服玩家_定安元类的秒拍视频 ,,"http://f.us.sinaimg.cn/001ukbZLlx07lLoUeJgc01040200pMnA0k010.mp4?label=mp4_hd&template=852x480.28&Expires=1578099469&ssig=KG44pO4E3o&KID=unistore,video",,2018-07-04,iPhone SE,7,10,1,,
4258008928267032,Gol4MyGDe,虽然有点对不住这位兄弟，但是，是的，我是来秀sp皮的 ,"https://wx3.sinaimg.cn/large/83d61c19ly1fsxmnlgnuzj20vk0hshdt.jpg,https://wx2.sinaimg.cn/large/83d61c19ly1fsxmnm77sdj20vk0hsayb.jpg",,,2018-07-04,iPhone SE,7,2,0,,
4258003987528304,GokWOvAsg,今天不仅不宜抽卡，还不宜反喂…… ,"https://wx1.sinaimg.cn/large/83d61c19ly1fsxm3oixdgj20vk0hsaqg.jpg,https://wx1.sinaimg.cn/large/83d61c19ly1fsxm3o05qgj20vk0hs199.jpg",,,2018-07-04,iPhone SE,1,0,0,,
4257994529384718,GokHyDnoq,有毒……我身边根本没人抽犬夜叉 ,https://wx1.sinaimg.cn/large/83d61c19ly1fsxl0lptp8j20w00iuju8.jpg,,,2018-07-04,iPhone SE,6,14,0,,
4257990423049944,GokAWcNqE,205抽+3000勾=1只杀生丸，7000勾=23犬夜叉碎片，其中有6次十连一个碎片都不给我，一句mmp辣鸡游戏正要破口而出，然后………………真香（是不可能真香的，这辈子都不可能真香的，辣鸡游戏！ ,"https://wx1.sinaimg.cn/large/83d61c19ly1fsxkii7yjtj20vk0hsx2h.jpg,https://wx2.sinaimg.cn/large/83d61c19ly1fsxkihfti8j20vk0hskij.jpg,https://wx4.sinaimg.cn/large/83d61c19ly1fsxkiizozfj20vk0hs7wh.jpg",,,2018-07-04,iPhone SE,12,15,0,,
4257555418625306,Go9hjAbPQ,图一：整容医生承诺的效果图二：实际的效果…………………………突然无语凝噎 ,"https://wx1.sinaimg.cn/large/83d61c19ly1fsw6jrbu5nj20kv112whv.jpg,https://wx3.sinaimg.cn/large/83d61c19ly1fsw6jt73u3j20kv112tc8.jpg",,,2018-07-03,iPhone SE,3,2,0,,
4256861455014658,GnRe1l2xA,逆水寒已经被我玩成galgame了……各种泡师兄 ,,,,2018-07-01,iPhone SE,4,5,1,,
4256661219156359,GnM13CpZd,现在逆水寒整个的情况就是，官方说你们去人少的服玩呀那里不用排队还不卡，玩家说人少的服鬼得快你当我们傻啊敲你吗，然后双方就这么僵持着 ,,,,2018-06-30,iPhone SE,13,6,0,,
4256169251756137,Gnzdz7mQN,第二次190速魔咒了。配的都是190速，睡猪永远在前面……上一个是猫掌柜 ,https://wx3.sinaimg.cn/large/83d61c19ly1fsrrd82e6hj20vk0hshdt.jpg,,,2018-06-29,iPhone SE,0,0,1,,
4256130303652730,GnycKfkf0,犬夜叉与封被动之间的关系：1、封印被动可以阻止犬夜叉继续反击进化。2、封印被动无法消除已进化的效果。总体来说和跳弟的被动比较像。 ,,,,2018-06-29,iPhone SE,5,4,0,,
4255940825645196,Gnth8nGzy,最后一个有分数要求的印记拿到了，我可以带着骚叉儿子去逢魔玩了，等抽出杀生丸了也带他去玩（是的犬夜叉你留家里） ,"https://wx3.sinaimg.cn/large/83d61c19ly1fsr13e8i7yj20vk0hsb1c.jpg,https://wx4.sinaimg.cn/large/83d61c19ly1fsr13eosqfj20vk0hsngd.jpg,https://wx1.sinaimg.cn/large/83d61c19ly1fsr13dofz4j20k00k50yt.jpg",,,2018-06-28,iPhone SE,7,5,0,,
4255651272044163,GnlK78zMn,犬夜叉的技能设计得非常用心，但不建议吹得太过，输出的弱点他都有，还非常看脸（这是最重要的，我有一局百鬼弈犬夜叉整局只反击了一次） ,,,,2018-06-27,iPhone SE,8,7,0,,
4254485603695176,GmRq0fvhC,为什么老有人把草人挂维修工上哦，抢伤害真的比翻车重要吗 ,,,,2018-06-24,iPhone SE,5,7,0,,
4253897054414395,GmC6JiwnV,又捏了个男九灵。说实话男九灵的默认脸妖到我了……于是我基本上就在致力于给他塑造一种清爽的邻家感（……），甚至擅自给人家毁了个容。从人设上来说大概是OOC的，捏到后来我都感觉我在捏碎梦或者神相而不是九灵…… ,https://wx1.sinaimg.cn/large/83d61c19ly1fskib1kllkj20js0j1dva.jpg,,,2018-06-23,微博 weibo.com,6,4,0,,
4253888486440492,GmBSUr1sU,又捏好一个，还拿到了最高的评级捏脸真好玩 ,"https://wx1.sinaimg.cn/large/83d61c19ly1fskhg3cb5zj20jc0jqnaz.jpg,https://wx3.sinaimg.cn/large/83d61c19ly1fskhg72fwnj21000l21hd.jpg",,,2018-06-23,微博 weibo.com,3,5,0,,
4253831699196903,GmApjCAx9,今天真是吃瓜吃爽了，钟灵都没刷。人家这造谣水平真是有技术含量，我们痒痒鼠的谣言就只有犬夜叉联动要出超鬼王这样子的 ,"https://wx1.sinaimg.cn/large/83d61c19ly1fskat24m06j20hs0vk77v.jpg,https://wx3.sinaimg.cn/large/83d61c19ly1fskav6b1oqj201i01jmx4.jpg",,,2018-06-22,iPhone SE,12,0,0,,
4253760744069226,GmyySh4AG,逆水寒捏了一下午的脸试图捏出康纳，只捏出了图一的效果怎么看怎么不像（东西方的骨骼差异是硬伤，没法调）。心态爆炸后随手捏了图二，居然还蜜汁有点像马库斯，两张脸一对比居然图一也有点开始像康纳了…… ,"https://wx4.sinaimg.cn/large/83d61c19ly1fsk2pcyyqaj20zz0l2qtw.jpg,https://wx4.sinaimg.cn/large/83d61c19ly1fsk2ph8zqbj20zz0l24pl.jpg",,,2018-06-22,微博 weibo.com,9,4,0,,
4253028024433636,Gmfv4iBog,因为资源有限（主要是懒）所以没测新玉弈的极限面板，以下面板的破势玉和心眼弈可以稳定魂十。（目前仅限体服）是的我一直在用一个没满爆的大舅。 ,"https://wx3.sinaimg.cn/large/83d61c19ly1fshqm4vk5xj20w00iu4ln.jpg,https://wx1.sinaimg.cn/large/83d61c19ly1fshqm6a2xdj20w00iue2n.jpg",,,2018-06-20,微博 weibo.com,3,4,2,,
4252321112222485,GlX6T9kax,佛爷逢魔食用指南：适合上的本：荒骷髅、胧车不适合上的本：蜃气楼、地震鲶、土蜘蛛佛爷对比大天狗的优势在于：被动推拉条，可推小怪和草人，间接伤害每段伤害都很可观而且能给佛爷拉条。不要小看那8%，每段间接伤害都能拉8%，佛爷唰唰唰就跑上来了。劣势在于没有免控，所以我弄了套蜃气楼稍微弥补一下。不适合打蜃气楼的原因是出小龙虾的阶段（不是镜像），小龙虾是血量共享模式，佛爷贴上间接伤害还把人家推回去，导致间接伤害难以结算，这一点上佛爷不如天狗。,"https://wx3.sinaimg.cn/large/83d61c19ly1fsfh4s1pxkj20o00ecjtu.jpg,https://wx4.sinaimg.cn/large/83d61c19ly1fsfh4sbs3xj20o00ec76s.jpg",,,2018-06-18,iPhone SE,6,6,0,,
4252317966415207,GlX1OqUT5,如果带了双单体输出的话，书翁可以舍弃暴击，速生生反堆生命，结算的伤害比我原来那套速生生反堆暴击的要高。当然我这不是抢伤害的阵容，抢伤害大多除了书翁不带奶，吞吞荒之类的…… ,"https://wx3.sinaimg.cn/large/83d61c19ly1fsfgzb64taj20o00ecq4r.jpg,https://wx1.sinaimg.cn/large/83d61c19ly1fsfgzbjfy0j20o00ecjto.jpg",,,2018-06-18,iPhone SE,2,2,0,,
4251512861399373,GlC5g5S2x,有没有靠谱的中速队输出推荐一下，不要那种靠大宝剑输出的（也不要跟我提花鸟 ,,,,2018-06-16,iPhone SE,3,18,0,,
4251233399256770,GluOvCQ6K, ,https://wx3.sinaimg.cn/large/83d61c19ly1fsc0iqfy8pj20so0hgdzr.jpg,,,2018-06-15,微博 weibo.com,1,9,0,,
4250810369720444,GljOcEMJm,现在的直男怎么一个个比基佬还会卖萌啊，好想肛他们啊 ,,,,2018-06-14,iPhone SE,9,32,1,,
4250499019058211,GlbI1C0sb,妖狐秘闻副本“狐生百媚”通关实况（攻略向） 定安元类 #哔哩哔哩# 妖狐秘闻副本“狐生百媚”通关实况（攻略向） ,https://wx1.sinaimg.cn/large/83d61c19ly1fs9o6bitfuj20o20f3dic.jpg,,,2018-06-13,哔哩哔哩移动客户端,9,0,0,哔哩哔哩,
4250404592300183,Gl9fJ9EnJ,妖狐本通啦，总体来说不难，但机制挺有意思的。官方评级是三星，但我感觉比鸟本简单。前八层可以双拉玉荒过，第九层带盾不带奶，我的阵容是椒图、匣中少女、一目连、犬神、酒吞。要带奶的话也不要带花鸟、日和坊、海坊主这样自动奶生命最低目标的，可以带桃花、虫师。第十层带个百目鬼其实很简单。兵俑实测不好用，开大减速很伤（我带了胧车套才扳回来），第三回目的御馔津、小小黑、妖狐是免控的（百目鬼的凝视对这三个式神有效）。我的阵容是椒图、陆生、惠比寿、日和坊、百目鬼。阴阳师推荐晴明，带言灵守，另一个技能随意。后期妖狐的AOE巨疼无比，晴明要看准时机开盾。希望实装正式服的时候不要加强难度！不然我感觉要被骂了！还有！我直播间的观众！特殊青吉鬼实际上没那么好用！只是我今天比较欧而已！我不是我没有青吉鬼你怎么打我脸啊！（我一直主张特殊青吉鬼无用论）开播的时候忘记录屏了，后面会补录一个上传到B站。,https://wx3.sinaimg.cn/large/83d61c19ly1fs9d32bonkj21hc0u0diw.jpg,,,2018-06-13,微博 weibo.com,14,1,2,,
4250374288928576,Gl8sQBsJi,开门啦，进来看更新和妖狐塔~我在看【2333】CC-定安元类 的直播，你也一起来看吧！网页链接 ,,,,2018-06-13,微博 weibo.com,0,2,0,,
4250367959461311,Gl8iDDHjN,还有30分钟开服，有点无聊。有人来预测一下妖狐塔的特殊机制吗？100突其实没意思，相似要素太多了，椒图能防的例如妖刀塔，椒图不能防的例如山兔镰鼬塔。ch其实从荒川本开始就一直在针对玩家另辟蹊径（不按他们预想的方式）过皮肤塔，针对的对象主要是四兔尬舞和国家队（我怀疑副本般若暗张成双封也是这个原因）。因上次吸血姬本中蜜桃的出色表现，说不定这次还会针对蜜桃尬舞。不过因为这次的妖狐本没有高难提示，所以也许并没有特别奇怪的机制。不过我倒是想到一个脑洞：妖狐将会对行动次数（包括反击）多于自身x次的敌方式神造成巨量间接伤害，突一次贴一层间接伤害buff，被攻击式神自身回合触发伤害。这个真是既克制尬舞队又克制国家队……,,,,2018-06-13,iPhone SE,0,4,0,,
4250191533892765,Gl3I5gkGx,明天九点例行直播打妖狐塔（怎么办我把桃花转下去了我好方啊以及这个赛季……肝又开始痛了 ,,,,2018-06-12,iPhone SE,5,5,0,,
4249838709106571,GkUx0Cd2b,晚上一小时用般佛火上了低保，我突然像原始人开了灵智一样感觉到我以前用雨御花艰辛地爬上低保是有多委屈…… ,,,,2018-06-11,iPhone SE,4,4,0,,
4249632765193035,GkPaQlMWD,正式服的弈老板也快来了，提醒一下还不知道这点的正式服小伙伴们：如果你换的是20w档的奖励（蓝票），尽量用现有的金币参与对弈竞猜，金币赌完了宁愿卖御魂也不要用勾玉换，不然亏成一匹马🐴 ,,,,2018-06-11,iPhone SE,2,5,0,,
4249430544679369,GkJUGjDjH,佛爷真的很6啊 ,https://wx4.sinaimg.cn/large/83d61c19ly1fs69gkartxj20vk0hsqtu.jpg,,,2018-06-10,iPhone SE,8,15,0,,
4249209055659751,GkE9rnKmj,翻完了NGA有关茨木逢魔加强的一个高楼贴，下面的人撕得五光十色。感觉又是一笔烂账。 ,,,,2018-06-10,iPhone SE,3,14,0,,
4248804142095315,GktCm8N5p,WONDERFUL！ ,https://wx3.sinaimg.cn/large/83d61c19ly1fs49imvla2j20og0se1kx.jpg,,,2018-06-09,iPhone SE,4,7,0,,
4248331867182411,GkhkCu8tl,第一次发现荒骷髅，结果因为太晚（体服）没人上车凉了 ,"https://wx2.sinaimg.cn/large/83d61c19ly1fs2r9a078kj20vk0hs1kx.jpg,https://wx4.sinaimg.cn/large/83d61c19ly1fs2r9aev8oj20vk0hs4kx.jpg",,,2018-06-07,iPhone SE,3,3,0,,
4248300871634369,GkgwD6RaN,垂死病中惊坐起。间接伤害这波大热，感觉卖药郎真的变成笑话了。尤其是体服这波鸩的改动。论压血线，鸩二技能压得比卖药郎又快又好。论隔着椒图涓流斩杀，鸩三技能的表现不比卖药郎差。鸩还能搭配凤凰火！那卖药郎干啥来的啊？我一脸懵逼。刚出卖药郎的时候，还觉得虽然前置条件苛刻，但能隔着涓流杀人还是有点小牛逼小厉害的。现在能做到这点的式神一抓一大把……,,,,2018-06-07,iPhone SE,1,6,0,,
4247852168785921,Gk4QUARCp,关于鸩的AI，当对面血量健康的时候，鸩会一直放二技能（结界五肉测试）。当对面出现残血后，鸩就开始放飞自我了（探索测试）…… 背锅服玩家_定安元类的秒拍视频 ,,"http://f.us.sinaimg.cn/004wgEOUlx07l2G4kivK01040200DTdq0k010.mp4?label=mp4_hd&template=852x480.28&Expires=1578099505&ssig=fBz%2BxgOc2U&KID=unistore,video",,2018-06-06,iPhone SE,5,14,2,,
4247841825704983,Gk4AenW7R,用青竹白雪返还的勾玉买了大舅 ,"https://wx1.sinaimg.cn/large/83d61c19ly1fs16zq4tl4j20vk0hswub.jpg,https://wx3.sinaimg.cn/large/83d61c19ly1fs16zqj0b9j20vk0hsx4k.jpg",,,2018-06-06,iPhone SE,2,1,0,,
4246104406677739,GjlnWs1bt,刷微博刷到了荷兰弟的颜，感觉我又活过来了。看啊有天使出现在我的首页上了 ,,,,2018-06-01,iPhone SE,6,1,0,,
4246091291516971,Gjl2N6mDh,说真的，我不斗技了，真的再也不斗技了。地狱空荡荡，孤儿在斗技。不管是嘴臭司马孤儿还是脏批阵容孤儿，斗技场上应有尽有。尤其是对面上了脏批阵容，还嘴臭开嘲讽，我还输给他的时候，真的手都在抖 ,,,,2018-06-01,iPhone SE,6,12,0,,
4245304331072786,Gj0zv4v50,向奶子势力屈服 ,"https://wx2.sinaimg.cn/large/83d61c19ly1frt3km5iw7j20vk0hs7ur.jpg,https://wx2.sinaimg.cn/large/83d61c19ly1frt3klex4uj20vk0hs4pg.jpg",,,2018-05-30,iPhone SE,5,2,0,,
4245303655626109,Gj0ypnBBH,实测眩晕可触发镰鼬多动，变形仍然不可以（直技封了被动，以及这张图毫无意义，我不会截gif……） ,https://wx3.sinaimg.cn/large/83d61c19ly1frt3gfzfkqj20vk0hshdt.jpg,,,2018-05-30,iPhone SE,6,9,2,,
4245300073810392,Gj0sDfZfW,嗯………… ,"https://wx4.sinaimg.cn/large/83d61c19ly1frt334h145j20vk0hs7wh.jpg,https://wx4.sinaimg.cn/large/83d61c19ly1frt334zctyj20vk0hs7wh.jpg,https://wx1.sinaimg.cn/large/83d61c19ly1frt333pj22j20vk0hs7wh.jpg",,,2018-05-30,iPhone SE,6,2,0,,
4245101724963343,GiViIkPbV,烟烟罗万年bug喜修复，般若封印穿盾得到官方承认。真蛇络新妇改回旧版鲤鱼精再失业，当事人表示我轮入道照样让你翻车。蜃气楼副本部分式神被抠三技能，炸车党抗议官方搞式神歧视 ,"https://wx4.sinaimg.cn/large/83d61c19ly1frsg6wkkdlj20hs0epmzb.jpg,https://wx1.sinaimg.cn/large/83d61c19ly1frsg6wcczjj20hs0aomyh.jpg",,,2018-05-29,iPhone SE,9,7,0,,
4245099284027166,GiVeMgTEi,30块钱30个嘤嘤饼+15御札，泥咋不去抢 ,https://wx2.sinaimg.cn/large/83d61c19ly1frsg00nm2gj20hs0fognr.jpg,,,2018-05-29,iPhone SE,3,6,0,,
4245078836989480,GiUHNtkhy,猝不及防突然被b站首页推送的视频标题剧透了底特律变人，现在我挥舞着手中的40米长刀不知道砍谁好。剧透真的是我最讨厌的行为之一了……（我看视频关弹幕一是因为nc多，二是因为被剧透了好多次和视频毫不相关的游戏，比如暴雨…… ,,,,2018-05-29,iPhone SE,2,1,0,,
