id,bid,正文,原始图片url,视频url,位置,日期,工具,点赞数,评论数,转发数,话题,@用户
4450478005750452,Ilba8o7Xe,营业了。福利还没想好，先转发里把图9抽了，片场顺回来的  抽奖详情 ,"https://wx1.sinaimg.cn/large/abd30746ly1g9znecrt2tj22wj4cskjw.jpg,https://wx4.sinaimg.cn/large/abd30746ly1g9zneg7v29j22wk4cue8c.jpg,https://wx1.sinaimg.cn/large/abd30746ly1g9zneisqctj22ga3oghe0.jpg,https://wx3.sinaimg.cn/large/abd30746ly1g9znemce4ej22wl4cvqvh.jpg,https://wx4.sinaimg.cn/large/abd30746ly1g9znep35cpj21vi2t8kjp.jpg,https://wx3.sinaimg.cn/large/abd30746ly1g9zneto1kgj24cv2wlhe6.jpg,https://wx4.sinaimg.cn/large/abd30746ly1g9znex6srxj22h63psb2h.jpg,https://wx4.sinaimg.cn/large/abd30746ly1g9zneztx5sj22in3rzu15.jpg,https://wx4.sinaimg.cn/large/abd30746ly1g9znf1lue4j22o03k0b2b.jpg",,,2019-12-17,HUAWEI Mate 20,15698,2044,2314,,
4449076219109156,IkAHbCdHS,是是是。。。 ,"https://wx1.sinaimg.cn/large/abd30746ly1g9v6gbpknhj20zk0gydhb.jpg,https://wx1.sinaimg.cn/large/abd30746ly1g9v6gbuo7kj20zk0k0wfi.jpg,https://wx1.sinaimg.cn/large/abd30746ly1g9v6gc2oekj20zk0qo0wh.jpg,https://wx2.sinaimg.cn/large/abd30746ly1g9v6niuoq9j212j0hsdwt.jpg,https://wx4.sinaimg.cn/large/abd30746ly1g9v6nj18uaj20zk0qowhz.jpg,https://wx4.sinaimg.cn/large/abd30746ly1g9v6njv10zj20zk0qogps.jpg",,,2019-12-13,HUAWEI Mate 20,38675,1368,299,,
4448387962792056,IkiN6bIla,呀。。。真没来得及准备福利。。我想想 ,,,,2019-12-11,HUAWEI Mate 20,20114,1160,57,,
4448069996846049,IkawfsIY9,这玩意怎么取出来我靠 ,,,,2019-12-10,HUAWEI Mate 20,54216,2359,469,,
4447978708080230,Ik890xU2i,告诉大家一个好消息我戴上隐形眼镜了啊，这该死的美貌 ,,,,2019-12-10,HUAWEI Mate 20,46174,2254,307,,
4447666115192275,Ik00PlMKn,别人玩剧本杀都在记笔记理逻辑，而我在画角色卡 ,"https://wx1.sinaimg.cn/large/abd30746ly1g9qogz7fdyj20u0140teg.jpg,https://wx4.sinaimg.cn/large/abd30746ly1g9qogztn3mj23282aokjm.jpg,https://wx1.sinaimg.cn/large/abd30746ly1g9qoh0psfyj22o03k0x6q.jpg",,,2019-12-09,HUAWEI Mate 20,21396,809,120,,
4447603565385707,IjYnWmB4f,小齐又不是鱼！！ ,https://wx1.sinaimg.cn/large/abd30746ly1g9qhbfp2bej20vk0hs1c7.jpg,,,2019-12-09,HUAWEI Mate 20,19822,600,115,,
4447190275246211,IjNDlm0Mj,#名侦探学院# 马上要开课了，院长发话学院里面要多开展交流活动，所以今天中午12点，我在@芒果tv 《名侦探学院》第6期课堂上，和大家一起上课解题聊弹幕 ,https://wx3.sinaimg.cn/large/abd30746ly1g9p5uy2muqj21g32klnpf.jpg,,,2019-12-08,HUAWEI Mate 20,10966,531,55,名侦探学院,芒果tv
4446644122528714,IjzqsaBPI,这也能是我？ ,https://wx4.sinaimg.cn/large/abd30746ly1g9nf3yg5u1j20zk0qo41v.jpg,,,2019-12-06,HUAWEI Mate 20,27451,979,135,,
4446575600134613,IjxDW0z1b,南方车站的聚会，非常有个人风格的犯罪类型片。大部分故事都发生在阴暗、潮湿的夜晚，加上精心设计的霓虹式的打光，对阴影的大量运用，构成了这部黑色却又光怪陆离的视觉系电影。留白的画面又和留白的叙事相呼应，恰到好处。最开始以为是一部悬疑片，但看完才发现其实情节并不复杂，很多地方甚至是我想多了。电影的悬念并没有提现在情节上，而体现在人物上。没有好与坏的二元对立，只有像野鹅湖一般表面平静内里汹涌，在三不管地带像原始生物一样野蛮生长的人性。#蒲师傅鉴片#,,,,2019-12-06,HUAWEI Mate 20,7167,350,201,蒲师傅鉴片,
4446496335980433,IjvA5p5MB,平原上的夏洛克，今年国产片最大的惊喜。成熟得不像是处女作，全业余演员跟影片的幽默风格相得益彰。用最土的环境、人物、情节表现最浪漫的气质。光是最后那个金鱼池的镜头就足四颗星了。中国唐吉诃德，河北荒野大镖客，农村超级英雄。都给我去看！#蒲师傅鉴片# ,,https://f.video.weibocdn.com/001fkEiblx07yI8U6FVm01041200a7250E010.mp4?label=mp4_ld&template=640x360.25.0&trans_finger=bdef57f06ae52835a2c783ca389e8517&tags=weibocard,,2019-12-06,HUAWEI Mate 20,3530,195,124,蒲师傅鉴片,
4445838212073918,IjesB8Hwi,"利刃出鞘，很久没在电影院里看过这么好看的推理电影了，相当本格，侦探了解到的线索不会比观众更多，看完之后回头细想发现所有的情节、线索都一定在前文留下了伏笔。故事真相和最终凶手并不难猜，但情节的层层递进反转，计划之外的变数，人性的图穷匕见仍然很抓人。而且就像电影里的台词，真相如何并不是最重要的：But the complexity and the gray, lie not in the truth,but what you do with the truth once you have it.觉得这部电影推理较弱的观众，可以尝试抱着“老爷子是什么时候知道一切真相”的想法再回想一遍全片，这是我觉得这部电影留下的最有意思的余味。#蒲师傅鉴片#",,,,2019-12-04,微博 weibo.com,6212,390,179,蒲师傅鉴片,
4445489087207945,Ij5nuuf7b,营业了。。。#明星大侦探# ,"https://wx2.sinaimg.cn/large/abd30746ly1g9jqfv9q4vj22wn4i1kjy.jpg,https://wx2.sinaimg.cn/large/abd30746ly1g9jqg1pjebj22wj4cs4r2.jpg,https://wx3.sinaimg.cn/large/abd30746ly1g9jqgabz02j25343e27ww.jpg,https://wx2.sinaimg.cn/large/abd30746ly1g9jqgilznoj23e2534npq.jpg,https://wx2.sinaimg.cn/large/abd30746ly1g9jqgovq7pj22yo4g0u1a.jpg,https://wx1.sinaimg.cn/large/abd30746ly1g9jqgt53isj24g02yo4qy.jpg,https://wx4.sinaimg.cn/large/abd30746ly1g9jqgyvaasj24cs2wjb2j.jpg,https://wx3.sinaimg.cn/large/abd30746ly1g9jqh6zblmj24cs2wje8c.jpg",,,2019-12-03,HUAWEI Mate 20,13119,657,135,明星大侦探,
4445091420670753,IiV262OuB,off the wall ,https://wx3.sinaimg.cn/large/abd30746ly1g9igs33u13j21o0190e82.jpg,,,2019-12-02,HUAWEI Mate 20,15955,597,63,,
4444061547099087,Iiuf0tMNp,点燃男孩一腔孤勇的是梦想，支撑男人步履不停的是责任。 作为男人，你敢跳出舒适圈去挑战新的自我吗？摆脱怯懦，追求自我#飞利浦电动剃须刀80周年#邀您来一场关于男人的真心话大冒险，那些没有勇气做的事情，堵在喉咙里不敢大声喊出来的话，这一次，你有机会为自己向全世界证明——我可以！ 在每个沉默的清晨，我都会用飞利浦电动剃须刀整理胡茬，那顺滑的手感，如时间之手般轻轻划过面部，却带走了满身风霜，让我能够面对真正的自己。 80周年限量典藏版礼盒的高级外观，就是为了满足每位男士对品质的追求，三层设计配备真心话礼盒与开瓶器套装，把工作与生活的压力在玩乐中尽情释放；摆在洗手台最显眼位置的剃须刀，外观设计采用金属复古黑，重现飞利浦第一把电动剃须刀“cigar”经典配色，岁月洗礼方能磨合出品牌的亲民度，重启复古标识，致敬不断前行精神，鼓励每位男士直面自我；尊享80个月VIP质保服务，是飞利浦给每位砥砺前行的中国男士最长情的告白。 Philips/飞利浦电动剃须刀三刀头充电式男士胡须刀多效理容S7880,"https://wx4.sinaimg.cn/large/abd30746ly1g9f3gobhd4j218z0u0e81.jpg,https://wx1.sinaimg.cn/large/abd30746ly1g9f3h9g4p9j21400u0npd.jpg,https://wx2.sinaimg.cn/large/abd30746ly1g9f3hjdtv7j21900u0e82.jpg,https://wx3.sinaimg.cn/large/abd30746ly1g9f3hpt428j21400u0u0x.jpg,https://wx4.sinaimg.cn/large/abd30746ly1g9f3hw4i6oj21400u0qv5.jpg,https://wx4.sinaimg.cn/large/abd30746ly1g9f3i3ogfnj21400u0qv5.jpg,https://wx3.sinaimg.cn/large/abd30746ly1g9f3ialpzvj21400u0qv5.jpg,https://wx4.sinaimg.cn/large/abd30746ly1g9f3ifocr5j21900u0hdt.jpg,https://wx1.sinaimg.cn/large/abd30746ly1g9f3ik3xp5j21400u0npd.jpg",,,2019-11-29,微博  weibo.com,9388,685,148,飞利浦电动剃须刀80周年,
4443974942855842,IirZkbYVY,有人帮我找找这位哥吗？想抱个佛腿 ,"https://wx4.sinaimg.cn/large/abd30746gy1g9esfu0boyj20n01dstbo.jpg,https://wx1.sinaimg.cn/large/abd30746gy1g9esfv0sopj20u01qce81.jpg,https://wx2.sinaimg.cn/large/abd30746gy1g9esfvko9tj20sj0xawjk.jpg",,,2019-11-29,HUAWEI Mate 20,23687,846,584,,
4443259986673035,Ii9oarZXB,说明一下那则短篇小说，其实充其量只能算个微型，现在估摸着撑死三四千字，评论叫我写三万字的可能对我有什么误解。。灵感来自当时录制的时候对于蒲水手这个角色的一些脑洞和感悟，所以不会有很强的剧情，我觉得也不会很好看，虽然动笔之后才发现工作量比预想的要大，但进度现在应该有三分之一，最快今天就能肝完,,,,2019-11-27,HUAWEI Mate 20,12823,780,74,,
4443011591429532,Ii2Vx5ZSY,突发奇想，想以蒲水手的视角写一则短篇小说 ,,,,2019-11-26,HUAWEI Mate 20,23848,1585,203,,
4441503750959331,IhpHx41z5,我只是一个连投票权都没有的外人，求放过 ,https://wx3.sinaimg.cn/large/abd30746ly1g970qd950cj20zk0qo1jx.jpg,,,2019-11-22,HUAWEI Mate 20,27145,716,138,,
4441410642083765,Ihnhm8K57,一名助理的最高待遇，在线上位！#明星大侦探# 明星大侦探第五季02案：海上钢琴师Ⅱ（上） (分享自@芒果TV) 明星大侦探第五季02案：海上钢琴师Ⅱ（上）  查看图片,,https://mobile.api.mgtv.com/v7/video/shareSource?value=M3ICfDN202mRZ8WrUzC4kxEArggAETHnP2JolqzVcMLeBPwIJ1Bhpl8D1CqjsVbcYvDpze~6ehclYYn~_Phy4gWLORmJ~DzsOGMAw4mnGSgHF0Nk,,2019-11-22,芒果TV.App,5798,331,66,明星大侦探,芒果TV
4439225762164478,Igsrm954W,走在大街上，听这首歌，我就是在这破败的世界里连接人心的快递员#死亡搁浅# 分享单曲 Don't Be So Serious (@网易云音乐) ,,,,2019-11-16,网易云音乐,3631,138,44,死亡搁浅,网易云音乐
4437800600026754,IfRmI06Xw,那是耳机！导演组用来cue流程和指路的！因为游轮很大很容易迷路！助听器我真的跪了42岁这个梗不能再提了 ,"https://wx3.sinaimg.cn/large/abd30746gy1g8v7gwtoc6j22yo4g07wu.jpg,https://wx1.sinaimg.cn/large/abd30746gy1g8v7etlijoj20pp0m3gme.jpg",,,2019-11-12,HUAWEI Mate 20,20092,708,228,,
4437221476315460,IfCiDquWg,恭喜FPX新王登基！！ ,,,,2019-11-10,HUAWEI Mate 20,6250,220,31,,
4436717316291380,IfpbtqoFS,哈哈哈哈哈各位都是人才 ,"https://wx3.sinaimg.cn/large/abd30746ly1g8rr1ztnj3j21400u0hcm.jpg,https://wx2.sinaimg.cn/large/abd30746ly1g8rr20de4bj21400u0q8b.jpg",,,2019-11-09,HUAWEI Mate 20,35792,923,609,,
4436347026404043,IffyeqRZ1,时隔一年，节目组神仙修图师再次上线！#明星大侦探# 水手带你疯狂划水！ ,"https://wx1.sinaimg.cn/large/abd30746ly1g8qkdj5dgmj21900u0gpk.jpg,https://wx1.sinaimg.cn/large/abd30746ly1g8qkdkn6ljj20u01900z1.jpg,https://wx3.sinaimg.cn/large/abd30746ly1g8qkdlps9wj20u01900wz.jpg,https://wx3.sinaimg.cn/large/abd30746ly1g8qkdmwbm3j20u01900x9.jpg,https://wx4.sinaimg.cn/large/abd30746ly1g8qkdo33acj21900u00x9.jpg,https://wx3.sinaimg.cn/large/abd30746ly1g8qkdpdhf2j21900u0q7n.jpg,https://wx3.sinaimg.cn/large/abd30746ly1g8qkdqjijnj21900u0795.jpg",,,2019-11-08,HUAWEI Mate 20,25365,949,384,明星大侦探,
4436334393139983,IffdRdaQT,录完回来在《死亡搁浅》里当一个快乐的快递员！啊，《天外世界》都还没通关呢。。 ,https://wx3.sinaimg.cn/large/abd30746ly1g8qiystsnhj22ao328hdw.jpg,,,2019-11-08,HUAWEI Mate 20,2809,102,9,,
4435982335886482,If641oHlg,昨晚睡不着觉，辗转反侧之间，我已经构思好了如果以后我要卖衣服，品牌该叫啥名。英文名想好了，就叫： T.I.E.意思是take it eazin设计理念自由率性淡定，一看就是我的牌子。这样一来中文名也起好了，就叫：贴这样一来，买家们收货之后就会在生活中发生如下对话：“你这衣服什么牌子的？”“贴牌的。”“贴牌的？就问你贴的啥牌的？”“不是贴牌的，是这品牌名就叫贴，人家还有英文名。”“英文名是啥？”“T.I.E.”“这不汉语拼音吗？”。。。。。。。。。。。。我好无聊第一条产品线也想好了，就叫“如切如磋”，走国潮路线。第二条叫“蓑笠翁”，走古风。,,,,2019-11-07,HUAWEI Mate 20,19613,840,235,,
4434273882453682,IenCsaijw,天气之子，画面很棒，音乐很棒，结尾处好似一堆mv往观众泪腺上砸，无论如何都会有点触动。但这一部仍然算是新海诚所有作品里最差的一部，想表达的一切都太过于直白了。男主帆高和小栗旬配音的大叔就是相对立的两面，一面是还能奋不顾身的少年，一面是被情绪和责任压垮的成年。面对你和整个世界，应该怎么选？成年人会选择世界。但少年会选择你。啊！说起来《少年的你》我还没看。。。#蒲师傅鉴片#,,,,2019-11-02,HUAWEI Mate 20,4095,281,68,蒲师傅鉴片,
4433152053321504,IdUr3dW4E,《镖人》以后真要拍电影希望能请我去客串一具尸体。我已经不知道多少次出镜/录节目/拍照/拍广告穿着那件镖人T恤了 ,https://wx3.sinaimg.cn/large/abd30746gy1g8gdl8141jj209g05qmx9.jpg,,,2019-10-30,HUAWEI Mate 20,4215,146,13,,
4432352887296999,IdzE4uChx,虽然现在看到明星的微博热搜，第一反应就是通稿或者塑造人设，但我还是被周震南听到李佳琦说“周震南送给大家万元红包”时一脸惊恐的表情给笑到了太可爱了 ,,,,2019-10-28,HUAWEI Mate 20,12784,724,276,,
4432155591122111,IduvR4HUz,上班、出差、录节目，作为一个巨懒的大忙人，每天早晨还是要学会成为一名精致直男。最近博朗送了“银须刀”给我，用了一段时间了感觉真的很不错！而且这次双十一，博朗剃须刀打骨折，这款银须刀下定尾款省758到手价才1999，怀疑博朗双十一不赚钱了！上天猫搜索“博朗银须刀”还有更多惊喜～网页链接 评论区有狐狸～ 芈十五减一的秒拍视频,,"http://miaopai.video.weibocdn.com/000o2Hz1lx07y7Pz8gOA01041200TcS30E013.mp4?label=mp4_hd&template=856x480.25.0&trans_finger=62b30a3f061b162e421008955c73f536&Expires=1581767457&ssig=g0gnsrEUJ9&KID=unistore,video",,2019-10-27,微博  weibo.com,7464,570,340,,
4432080794314617,Idszdi6qB,分享图片 ,"https://wx2.sinaimg.cn/large/abd30746ly1g8cyjjb5a9j20pu0wvh42.jpg,https://wx2.sinaimg.cn/large/abd30746ly1g8cyj5nrsnj20at0ci0t3.jpg",,,2019-10-27,HUAWEI Mate 20,22249,945,156,,
4431991719727261,IdqfxEOvj,再也不在剧本杀店说自己是大高玩了 ,,,,2019-10-27,HUAWEI Mate 20,6169,290,15,,
4431403691012560,IdaX74fpC,某节目组的服装老师到现在都没分清我跟gwt ,,,,2019-10-25,HUAWEI Mate 20,28733,789,660,,
4429493160338637,IcnfC1q5T,上周组团玩了一个丧尸主题的恐怖密室，芈老师拉来了一个知乎上认识的朋友，算卦大神，负责碰到丧尸的时候念咒辟邪。可能是因为东方的咒对西方的丧尸不管用，大神进门就抄起一把水弹维克多冲锋枪冲在最前面，枪枪爆头稳的一匹。结束后聊天，才发现算卦大神竟然是我东辰高中的学长，我母校真的出人才。至此，我的校友关系网正式从自然科学领域拓展至超自然领域。,,,,2019-10-20,HUAWEI Mate 20,7238,390,91,,
4429103392473650,Icd6XanvA,昨晚看完《仲夏夜惊魂》，于是夜里我做了一个超长的恐怖片级别的梦。主线剧情大概是我们一大帮子人要坐船去某个地方。于是我从出发前一晚的家长里短开始梦起，直到上了那搜用人体器官做发动机的船，在漆黑的海上航行。醒来我竟然完全不记得我们坐穿是要去哪里。我简直是理解到了恐怖电影的精髓。我现在才醒，做梦做得累死我了。,,,,2019-10-19,HUAWEI Mate 20,3732,201,18,,
4427708601489904,IbCPi6fAI,北京的天凉的真快 ,,,,2019-10-15,HUAWEI Mate 20,4988,421,15,,
4427091980093618,IbmMK0olY,#潘玮柏演唱会# 小学开始喜欢潘玮柏，今天第一次看演唱会。全场大合唱还是蛮有感触。原来追星是这种感觉啊 蒲熠星的微博视频 ,,"http://f.video.weibocdn.com/001WTLMQlx07xLzZeOfC01041203TXzt0E020.mp4?label=mp4_720p&template=1280x720.25.0&trans_finger=1f0da16358befad33323e3a1b7f95fc9&Expires=1581767457&ssig=JNXZj%2FAL4e&KID=unistore,video",,2019-10-14,HUAWEI Mate 20,5429,272,61,潘玮柏演唱会,
4427008807553628,IbkCAvH2I,分享我的故事 微博视频 ,,,,2019-10-13,微博视频,2977,204,13,,
4426158769102403,IaYvyCbWX,谢谢@AGF玩出名堂游戏博览会  @中国国际漫画节动漫游戏展  的邀请，谢谢热情的广州的朋友们！谢谢给力的王者队友带我电刀王昭君躺赢家暴局！白切鸡很好吃！下次再见！(ง •̀_•́)ง ,"https://wx3.sinaimg.cn/large/abd30746ly1g7u1i6m2p0j234k4oukjm.jpg,https://wx2.sinaimg.cn/large/abd30746ly1g7u1i8zbpmj23b327eu0x.jpg,https://wx1.sinaimg.cn/large/abd30746ly1g7u1ib1ohpj238j25pb2a.jpg,https://wx3.sinaimg.cn/large/abd30746ly1g7u1idgy7sj233a2274qq.jpg,https://wx1.sinaimg.cn/large/abd30746ly1g7u1iffr7sj237h24z7wi.jpg,https://wx1.sinaimg.cn/large/abd30746ly1g7u1ihoq0uj239i26c7wi.jpg,https://wx1.sinaimg.cn/large/abd30746ly1g7u1ijwepsj23hj2bpu0y.jpg,https://wx3.sinaimg.cn/large/abd30746ly1g7u1impg9wj23o42g3u0y.jpg",,,2019-10-11,HUAWEI Mate 20,3067,234,48,,"AGF玩出名堂游戏博览会,中国国际漫画节动漫游戏展"
4424472251157879,IagDn4Rdt,，宣传语叫“put on a happy face”，呈现的却是一步步卸下面具的过程。《致命玩笑》里的joker想要证明，普通人和joker之间只相差一天，最糟糕的一天。《joker》表示，一天不够，得差一辈子。亚瑟成为小丑的那一刻，也是在他终于意识到，“悲剧”已经不够用来形容他的一生了，他这辈子，只能是一场喜剧。这真是我今年来在电影院看得最认真的片子。ps：跟刘同学对了一下，确认了一个事实，越南上映的是删减版，我恨。#蒲师傅鉴片#,,,,2019-10-06,HUAWEI Mate 20,2654,175,62,蒲师傅鉴片,
4424148996559960,Ia8dZrwxO,这张照片是谁拍的？我想认识这名摄影师 ,https://wx2.sinaimg.cn/large/abd30746gy1g7nnla3j53j20ny0zkju8.jpg,,,2019-10-05,HUAWEI Mate 20,17763,1032,157,,
4423405786381102,I9OTgqM10,put on a happy face ,https://wx3.sinaimg.cn/large/abd30746gy1g7la8torp5j22402tce82.jpg,,,2019-10-03,HUAWEI Mate 20,9799,337,36,,
4422599406348741,I9tUEqDB3,攀登者(2019)，国庆三部电影先选了《攀登者》看，算是开了个好头。看了这么多电影，我总是很吃这一套：大时代背景下的个人命运沉浮。看到很多人说不明白为什么会有吴京和章子怡的感情戏，其实就是这个道理。60年代的爱情，不仅属于个人，还属于国家。章子怡演的徐缨为了方五洲去苏联留学研究气象，为的是一种虚无缥缈的希望——如果有一天，登山队重启，她能陪在他身边，并肩作战。从1960到1975，徐缨等到了。整个电影最让我感动的一幕，就是十五年后，两人在珠峰底下重逢，徐缨对方五洲说：“气象组徐缨……报道。”很多人说不明白徐缨为什么要死，她明明可以让自己的学生去山坡上跟方五洲通讯，而自己留在营地休息。但我能理解，她明白他的梦想有多重，她明白他的遗憾有多深，所以她容不下一丝错误的可能，必须要亲自告诉他气象实时动态，她才能安心。我从小接受的爱国教育告诉我，有国才有家，在大荧幕上看到具象化的家国情怀总是一件让人热血沸腾的事，但每次最让我感动的，其实都是这些英雄背后的故事。爱国不应仅仅是沉重的宏大的，当这种情怀渗透到骨髓，微小的，私人的举动也能作为爱国的体现。很多人都只知道英雄是英雄，而不知道英雄是谁。谢谢《攀登者》告诉我们，他们是谁。#蒲师傅鉴片#,,,,2019-10-01,HUAWEI Mate 20,3999,360,112,蒲师傅鉴片,
4422343646069621,I9ng8psZ7,国庆假期起飞 ,https://wx4.sinaimg.cn/large/abd30746ly1g7hw9hwsbpj22ao328b2a.jpg,,,2019-09-30,HUAWEI Mate 20,5559,207,10,,
4421951969550181,I9d4oE4rb,下面那条圈我我还能接受，至少原微博还有个视频，上面那条就直接叫我进来变形的吗？ ,"https://wx2.sinaimg.cn/large/abd30746ly1g7gn6bxbthj20u00wn437.jpg,https://wx3.sinaimg.cn/large/abd30746ly1g7gn6c6izoj20u01qctsx.jpg,https://wx4.sinaimg.cn/large/abd30746ly1g7gn8aig6jj20u01qc7fi.jpg",,,2019-09-29,HUAWEI Mate 20,7013,244,56,,
4420590011894661,I8DDH7WT3,又累又开心 ,,,,2019-09-26,HUAWEI Mate 20,10388,679,182,,
4417030339760697,I792hEXcB,晚安 英国·Edinburgh ,"https://wx4.sinaimg.cn/large/abd30746gy1g70y15qx1bj22ao328b2a.jpg,https://wx4.sinaimg.cn/large/abd30746gy1g70y17ipmvj21901o0kjl.jpg",,英国·Edinburgh,2019-09-16,HUAWEI Mate 20,5628,434,24,,
4416143337201413,I6LXDudpP,胡茬和鼻孔给大家道声中秋快乐 ,"https://wx2.sinaimg.cn/large/abd30746ly1g6y44cyl2yj22ao328b2a.jpg,https://wx1.sinaimg.cn/large/abd30746ly1g6y44omjesj21o0190qv6.jpg,https://wx2.sinaimg.cn/large/abd30746ly1g6y4527khxj22ao3281ky.jpg",,,2019-09-13,HUAWEI Mate 20,7503,439,36,,
4413943591897717,I5QJF7XGl,摄影师：@茶茶amazing 助理/化妆师：@芈十四 当时我头发还很长谢谢专业摄影师对职业面瘫的耐心调教  抽奖详情 ,"https://wx4.sinaimg.cn/large/abd30746ly1g6r3899ze6j22yo4g0npe.jpg,https://wx4.sinaimg.cn/large/abd30746ly1g6r38cnh5tj22yo4g0hdu.jpg,https://wx3.sinaimg.cn/large/abd30746ly1g6r38fpid0j22yo4g0e82.jpg,https://wx4.sinaimg.cn/large/abd30746ly1g6r39k23cyj22yo4g0u0y.jpg,https://wx3.sinaimg.cn/large/abd30746ly1g6r38mjqvuj22vs4bo4qs.jpg,https://wx1.sinaimg.cn/large/abd30746ly1g6r38qzzigj22fs3nob2a.jpg,https://wx2.sinaimg.cn/large/abd30746ly1g6r3hq7bruj226z3ahb2a.jpg,https://wx2.sinaimg.cn/large/abd30746ly1g6r39q7ixzj22aj3fsb2d.jpg,https://wx4.sinaimg.cn/large/abd30746ly1g6r39e872xj22ju3tqb29.jpg",,,2019-09-07,HUAWEI Mate 20,39905,3510,2209,,"茶茶amazing,芈十四"
4412953476573558,I5qYHrA58,在这狂混！许愿还有下一季吧！ ,"https://wx3.sinaimg.cn/large/abd30746ly1g6nxr6ojqoj22ao3281kz.jpg,https://wx1.sinaimg.cn/large/abd30746ly1g6nxrudkmlj20k00zk42f.jpg",,,2019-09-05,HUAWEI Mate 20,4156,228,24,,
4412875797748346,I5oXpwvHk,最后一天！ 网页链接 ,,,,2019-09-04,虎牙直播平台,1263,99,3,,
4412513191485479,I5fwz6erl,大师赛决赛！ 网页链接 ,,,,2019-09-03,虎牙直播平台,1034,74,6,,
4411326430178629,I4KEr0Kt7,"铤而走险(2019)，大鹏不演喜剧了有点意外，不仅不出戏还蛮惊喜。感觉现在犯罪类型片已经成为了中国新导演的培养基,作为新人导演来说这部电影完成度不错，开篇多线叙事，小人物被平白无故卷入命运的漩涡，节奏紧凑。重庆真适合拍犯罪片。如果是方言就更好了。欧豪是真滴帅，演技过关，全片最大的惊喜，加一星。#蒲师傅鉴片#",,,,2019-08-31,HUAWEI Mate 20,3405,333,225,蒲师傅鉴片,
4410701227034864,I4uo2tw5y,上周末跟@文韬Stefan一起去了#冠能科学营养研究所#，收货满满真的涨姿势。从不宠粉的我终于见到了我的真爱粉们，还学到了很多育儿，哦不育猫的小知识。冠能针对宠物不同体质、不同生命阶段研制出的营养搭配方案不仅带来了很棒的产品，也让我对于养宠有了新的思考，相比之后养宠能更得心应手！ 现场视频在此！ 蒲熠星的秒拍视频,,"http://miaopai.video.weibocdn.com/000GMfzElx07wBrflBVK01041201divs0E013.mp4?label=mp4_hd&template=852x480.24.0&trans_finger=ac6fb6d5c49a67fe2901ae638b222ab2&Expires=1581767471&ssig=h3TOFfnJeI&KID=unistore,video",,2019-08-29,微博  weibo.com,14775,532,1172,冠能科学营养研究所,文韬Stefan一起去了
4410330027203396,I4kJkudVO,欧乐B竟然在上海做了个密室。品牌的人本来请我去，但因为有工作安排要回北京没去成[捂脸]。这个密室是剧本杀的玩法，加入了角色扮演和NPC互动的沉浸式体验，背景横跨70年的历史，能一直从地堡玩到太空舱，还有一条类似《生化危机》的对抗病毒的剧情主线。 就在上海静安大悦城1层的欧乐B概念旗舰店，感兴趣的可以替我去打卡！现场还有欧乐B的AI电动牙刷体验以及限量周边礼品，我个人很喜欢的电动牙刷品牌，可以了解一哈网页链接 上海头条播报的秒拍视频,,"http://miaopai.video.weibocdn.com/0015JZNFlx07wzfKE5ag010412008mxF0E013.mp4?label=mp4_hd&template=720x404.24.0&trans_finger=ac6fb6d5c49a67fe2901ae638b222ab2&Expires=1581767471&ssig=zdrj2cziF9&KID=unistore,video",,2019-08-28,微博  weibo.com,5566,222,53,,
4409557352208338,I40D59gum,周末在上海去了一个小密室（还被老板认出来了），微恐主题，最后有一个门需要打开，机关在门的正对面，门打开后，只有在门正对面开机关的我看到了门后吊着的女鬼，另外三个怂货缩在墙角看着我瞳孔逐渐放大表情逐渐狰狞的过程。为什么总是我受到正面暴击啊 ,https://wx2.sinaimg.cn/large/abd30746ly1g6d3i94k9aj20kb0i1170.jpg,,,2019-08-26,HUAWEI Mate 20,11811,477,72,,
4409220286290239,I3RRqqont,已俨然成为一名谐星 ,https://wx1.sinaimg.cn/large/abd30746ly1g6c0oxsopoj20eb0d80tq.jpg,,,2019-08-25,HUAWEI Mate 20,9308,796,65,,
4408862020769856,I3IxA3eh2,听说今天现场出了无数表情包？ ,,,,2019-08-24,HUAWEI Mate 20,7267,375,34,,
4408079560486091,I3oby22sb,我差点就信了。。 ,"https://wx2.sinaimg.cn/large/abd30746ly1g68e1t902qj20q40icwfw.jpg,https://wx1.sinaimg.cn/large/abd30746ly1g68e1tcvf6j20k00zkjti.jpg",,,2019-08-22,HUAWEI Mate 20,19308,707,306,,
4407805346204869,I3h3gq2ax,京城大师赛最后一天常规赛啦！ 网页链接 ,,,,2019-08-21,虎牙直播平台,2309,135,8,,
