id,bid,正文,原始图片url,视频url,位置,日期,工具,点赞数,评论数,转发数,话题,@用户
3370230376447027,xtt0Nr3aj,日本收买汉奸策略（八条） 一、避免官吏蒙卖国的污名，保护其体面。 二、用金钱操纵，若他们表面有清廉君子名誉心，当用隐密方法收买。 三、对中国人应保持威严 四、与中国人交涉应注意其妥协性 五、要利用中国人自治精神及地方自治机关 六、应以地方官吏及自治团体以相当的委任 @_十八 @航标-大表哥 ,https://ww1.sinaimg.cn/large/6f9bca7egw1dm9emxnx4bj.jpg,,,2011-10-19,微博 weibo.com,0,0,2,,"_十八,航标-大表哥"
3370222784715350,xtsOyjMG2,日军1937年编印的《长江下流地方兵要地志拔萃》，对江南地区中国汉民族有十七条的概括性总结： 一、个人主义。爱钱财和储蓄观念强，缺乏国家观念，不关心政治。 二、同业者合作，同乡人团结紧密，商业道德观念强。 三、爱面子。 四、极富附合和雷同性。 五、保守而尊大。 六、实用主义强，恩义感薄弱。 ,https://ww3.sinaimg.cn/large/6f9bca7egw1dm9dte36cgj.jpg,,,2011-10-19,微博 weibo.com,0,0,0,,
3367725445919923,xspQAoQ2D,“重力场”喜玛拉雅跨媒介艺术节，雅昌做了个小专题，@冰逸创意 的文章主打，网页链接，另外还配了个图片集锦网页链接，感谢雅昌谢媛！@戴志康 @魏晋南北朝的 @麟子-AMeiZING @喜玛拉雅美术馆 ,,,,2011-10-12,微博 weibo.com,0,4,10,,"冰逸创意,戴志康,魏晋南北朝的,麟子-AMeiZING,喜玛拉雅美术馆"
3367673631359323,xsov15HCz,停在小区里，车牌被盗。报警，做笔录，出证明，用了一个多小时。饥肠辘辘！没了车牌的前脸！已经没精力愤怒了。 ,https://ww1.sinaimg.cn/large/6f9bca7ejw1dm1932j8usj.jpg,,,2011-10-12,S60客户端,0,15,0,,
3366697627305931,xrZ6OuEBB,洋河蓝花瓷口感也还不错，不过仍然更喜欢衡水老白干。今天喝了点蓝花瓷，顺便又解决了一罐啤酒。 ,,,,2011-10-09,微博 weibo.com,0,9,1,,
3365875036145688,xrDI3pMM0,奇了怪了，今天那群装B犯怎么没有谈滚石30年？[挖鼻屎][挖鼻屎] ,,,,2011-10-07,微博 weibo.com,0,9,0,,
3365534184098614,xruQihceG,手拿着Iphone悼念乔布斯，睹物思人，感谢他给自己带来了变化，好像Iphone就不是自己掏钱买的而只是乔布斯送的。。。一个成功的牛B的商人被提升到了神人般的地位，到底是因为他说的那些话，还是他背后庞大的并且还在源源不断吸金的财团让人折服。大家心里有数，不便说穿罢了。 ,,,,2011-10-06,S60客户端,0,5,0,,
3364388221150830,xr11Y4PnM,老家的枣树。据说去年结了有两三斤枣，今年产量不高。。。 ,https://ww4.sinaimg.cn/large/6f9bca7ejw1dlqrrep2clj.jpg,,,2011-10-03,S60客户端,0,1,0,,
3363837422388416,xqMHAa1kQ,【看宋】宋朝的皇帝在汉人历代正朔中最“窝囊”，皇帝额外要个竹篮子竟然还要大臣批准！大臣竟然还敢于不批准！不批准竟然还不能杀掉！皇帝要额外圈个地竟然还要小老百姓同意，小老百姓不同意皇帝竟然还不敢强拆！到后来出了个牛B的敢用强权的皇帝赵佶，强征花石纲，就把个国家给丢了。。。太窝囊啦！ ,,,,2011-10-01,微博 weibo.com,0,6,0,,
3363824078895052,xqMm3Bk0A,"我参与了投票【若有机会选择，你愿生活在哪个朝代？】　若有机会选择，你愿生活在哪个朝代？　投给""宋"" 这1个选项 ",,,,2011-10-01,投票,0,0,0,,
3363427091548373,xqC1L6uNL,许静的行动书法。书<<金刚经>>。 ,https://ww1.sinaimg.cn/large/6f9bca7ejw1dlnpdkjuugj.jpg,,,2011-09-30,S60客户端,1,3,6,,
3363386192932956,xqAXNciZK,重力场：喜玛拉雅多媒体艺术节现场。 ,https://ww3.sinaimg.cn/large/6f9bca7ejw1dlnkogx64rj.jpg,,,2011-09-30,S60客户端,0,3,1,,
3362352913917332,xqa5dgr4M,衡水老白干确实不错！我等平民之好酒！ ,https://ww2.sinaimg.cn/large/6f9bca7ejw1dlka0c8kpij.jpg,,,2011-09-27,S60客户端,0,0,0,,
3362269016851051,xq7TTsKgP,昨天和朋友聊天说到宜兴紫砂壶价格，除了资金关注这个原因外，老一辈紫砂工艺大师纷纷过世（新生代工艺师代工现象严重、过量使用模具）、宜兴陶土存储量日渐稀少，这两大因素造成了高品质紫砂壶的稀缺性越来越明显，价格也就容易被炒高。现在的艺术品热，最重要的就是艺术品的“稀缺性、唯一性”。 ,,,,2011-09-27,微博 weibo.com,0,8,0,,
3360437416526102,xpmfHrnJI,当代英国最杰出，也是当今世界最成功最受瞩目的雕塑家之一托尼.克拉格（Tony Cragg）谈<<1945年以来的西方雕塑发展趋势>>，现场人满为患。这些艺术家，包括昨天我牵头的法国批评家圣.吉洪，他们的风度完全比国内艺术家高出好多档次。不由得让我这种山野村夫都感觉到＂教养＂的有效 ,https://ww4.sinaimg.cn/large/6f9bca7ejw1dle60nc3edj.jpg,,,2011-09-22,S60客户端,0,1,6,,
3360099586709895,xpdsOs9y7,收藏是主观的，可以考虑但不是一定要考虑艺术品或艺术家的地位；投资是客观的，必须考虑艺术家或艺术品在市场或江湖中的位置。投机是一次短暂预判，只对市场反应有考量，可以不顾艺术品艺术家是什么。 ,,,,2011-09-21,S60客户端,0,0,0,,
3359717361723644,xp3wk7eoI,让我轻轻地告诉你，其实我不是个普通人哦，在我平凡低调的外表下，有着不为人知，惊天动地的卧底身份！快来看看你的卧底身份吧！对不起，我是卧底！_育儿网 ,https://ww3.sinaimg.cn/large/6f9bca7ejw1dlbvbir8c6j.jpg,,,2011-09-20,未通过审核应用,0,3,1,,
3359713100457882,xp3ps1V7c,我还有有4个新版微博邀请码，本来是5个，一不小心玩掉一个，需要的可以私信我。。。新版的主要在版式上有改变，功能上还没玩，不详。 ,,,,2011-09-20,微博 weibo.com,0,5,0,,
3359642105415983,xp1yWmIWz,好奇怪，动辄＂那个年代的人如何如何＂，难道现在就没人认真做事了？现在就没人讲究艺术观念了？很讨厌格非这种调调，整个名流腔，想占据着时间高地。你看不到有人认真做事，是表示视野还不够，那么，你自己是不是还认真在做？要是，那就不能轻率地耍这名流腔，有这点功夫多去对人施以援手吧！ //@余余 ,,,,2011-09-20,S60客户端,0,3,0,,余余
3359101456018697,xoNuVpfJL,关键是生意也有生意经，政治也要粉饰太平，而艺术则是做了婊子立牌坊，还要别人说高尚。 //@顶层杂志:转发微博。 ,,,,2011-09-18,S60客户端,0,0,0,,顶层杂志
3357953697394371,xojDHv1C3,@雪舞云端 要转这个 ,,,,2011-09-15,微博 weibo.com,0,0,3,,雪舞云端
3357562611806016,xo9sV7zPi,@顶层杂志 ,,,,2011-09-14,微博 weibo.com,0,0,0,,顶层杂志
3356916563238824,xnSEUdAz6,五维的烟花。也算是中秋的形式。 ,https://ww3.sinaimg.cn/large/6f9bca7ejw1dl2xnifqjqj.jpg,,,2011-09-12,S60客户端,0,0,0,,
3356588774207728,xnK8dhECA,人这种动物的无趣通常在：莫名其妙地好，莫名其妙地不好，莫名其妙地不解释，莫名其妙地掩饰，却又莫名其妙地曝露许多真相。潜藏在底下的许多东西，莫名其妙地冷落或者厌恶，莫名其妙的行为似乎目的就要激起对方的反感，而对方一开始还以为还是朋友。。。。 ,,,,2011-09-11,微博 weibo.com,0,11,3,,
3356446972845872,xnGrvbWla,果不其然，就算是讲艺术收藏和投资，老戴还是以＂911＂开场。。。 ,https://ww1.sinaimg.cn/large/6f9bca7ejw1dl1fpyx596j.jpg,,,2011-09-11,S60客户端,0,0,0,,
3356409174306533,xnFsxi4kd,艺术投资论坛即将开始，虚席以待。。。 ,https://ww1.sinaimg.cn/large/6f9bca7ejw1dl1bdos9o0j.jpg,,,2011-09-11,S60客户端,0,2,0,,
3356169654057294,xnzedh1ue,大家要看的、要听是，是看自己想看的、听自己想听的，而不是去看对的、去听对的。。。大家所接受的，也就是权力愿意给予的。是“权力”，不是“权利”。所以，屁民永远屁民，名流多么可疑。 ,,,,2011-09-10,微博 weibo.com,0,0,0,,
3356152487209312,xnyMwufte,我不想面对的两种行当，却离我最近。这两种行当里的大部分人，糟践着这两种行业。 ,,,,2011-09-10,微博 weibo.com,0,6,0,,
3354661360980930,xmVZu47bs,上海当代艺术博览会是越来越烂了！以前还有展位，今年只有菜市场。。。 ,https://ww3.sinaimg.cn/large/6f9bca7ejw1dkvqna8dqjj.jpg,,,2011-09-06,S60客户端,0,5,0,,
3353261172419591,xmlz7a9rF,难得一见的野生螳螂！ ,https://ww3.sinaimg.cn/large/6f9bca7ejw1dkr9u53iukj.jpg,,,2011-09-02,S60客户端,0,3,1,,
3353229966460127,xmkKMr6zB,这不是行为。。。也不是撒野。。。 ,https://ww1.sinaimg.cn/large/6f9bca7ejw1dkr694j0lyj.jpg,,,2011-09-02,S60客户端,0,8,5,,
3353185431661150,xmjAX6Y8K,还是刘永顺书法，左：开；右：散僧入圣。 ,https://ww2.sinaimg.cn/large/6f9bca7ejw1dkr14zwjwqj.jpg,,,2011-09-02,S60客户端,0,0,2,,
3353185024637047,xmjAijsj5,刘永顺书法：翠柳。 ,https://ww3.sinaimg.cn/large/6f9bca7ejw1dkr13b27dqj.jpg,,,2011-09-02,S60客户端,0,2,0,,
3353184445811948,xmjzmonX6,证大朱家角艺术馆，水墨方向三，刘永顺书法作品：一以贯之。个人比较喜欢他的作品。 ,https://ww2.sinaimg.cn/large/6f9bca7ejw1dkr10x3i8fj.jpg,,,2011-09-02,S60客户端,0,4,2,,
3352115388929892,xlRL4Bt4w,朱青生在讲中国抽象历史和它的障碍，手机拍照还是苹果的好啊。。。无奈！ ,https://ww4.sinaimg.cn/large/6f9bca7ejw1dknm8umdbdj.jpg,,,2011-08-30,S60客户端,0,2,0,,
3349235563681522,xkEQcfrJo,2011年，变形金刚结束了，哈利波特结束了，张谢也终于离婚了。网页链接 ,,,,2011-08-22,微博 weibo.com,0,1,0,,
3348982642448162,xkyggagSu,对@顾村言 说：看到发稿的报纸了，多谢多谢！ ,,,,2011-08-22,微博 weibo.com,0,0,0,,顾村言
3348514109432026,xkm4yDzHs,逛书展总觉得不能空手而归，最后还是买了本睿士。@王泰白 @后置前 ,https://ww4.sinaimg.cn/large/6f9bca7ejw1dkc4n7easlj.jpg,,,2011-08-20,S60客户端,0,1,0,,"王泰白,后置前"
3345574842370695,xj7BO9WJ1,"我参与了投票【测试：你的性渴求高不高？】　测试：你的性渴求高不高？　投给""果汁"" 这1个选项 ",,,,2011-08-12,投票,0,0,0,,
3343570342047234,xihsK8AzU,终于把梅超风等来了~~~~ ,,,,2011-08-07,微博 weibo.com,0,2,0,,
3340921387159975,pimv8c,还真有这种名字的店！！！ ,https://ww2.sinaimg.cn/large/6f9bca7ejw1djnwms0nozj.jpg,,,2011-07-30,S60客户端,0,2,0,,
3340659864090212,pdzlSk,各报纸被迫撤版，作为曾经的媒体人，不在其位，亦感同身受。情结仍在，有个想法：各媒体把今晚撤下的版集合起来，做成“合订本”。散落的版面那叫便签。。但不知各有算盘的媒体愿不愿去做。。。@后置前 @孙鉴 @王泰白 @李静天天过年 @金阙 @汪洋_FHM @老怡 @田田在下 @王帅Wangshuai @曹景行 ,,,,2011-07-30,微博 weibo.com,0,2,1,,"后置前,孙鉴,王泰白,李静天天过年,金阙,汪洋_FHM,老怡,田田在下,王帅Wangshuai,曹景行"
3340505430328770,p9dQSO,哭得厉害未必是孝子，沉默者未必心肠硬且忤逆——but，善用逻辑者会反诘：你不哭，怎能表明你的悲伤？心肠忤逆的，也常常会沉默。。。。是啊，缺乏边界、缺乏辨别的标准，什么都是可疑的。于是，可以用来制定规则的权力就变得重要起来。世界就是这样被“逻辑”戕害了。。。 ,,,,2011-07-29,微博 weibo.com,0,0,0,,
3340083651124421,oZaA7Z,他（安路生）在分析铁路部门的问题时说，在雷击造成温州南站信号设备故障后，电务值班人员没有意识到信号可能错误显示，安全意识敏感性不强；温州南站值班人员对新设备关键部位性能不了解，没能及时有效发现和处置设备问题——这狗日的又想只抓几个蚂蚁蒙混过关！！！值班人员又变成替罪羊?！！！ ,,,,2011-07-28,微博 weibo.com,0,0,0,,
3337351904618807,o1jMun,你有鬼斧神工，我有豆渣工程，who怕who~~~ ,https://ww4.sinaimg.cn/large/6f9bca7ejw1djcim2sr9fj.jpg,,,2011-07-20,微博 weibo.com,0,0,5,,
3336659110428786,nMfRja,——“我南朝地广人多，崇尚气节。俊彦之士，所在多有，自古以来，从不屈膝异族……”当开封被金兵洗劫成一座死城之后，宗泽，要钱没钱要人没人，可是他就是靠着“气节”一词，感化了附近的流民部队，成为他城防、抗金的中坚力量。气节，真没用吗？有用，看对谁用，看是不是真气节。 ,,,,2011-07-19,微博 weibo.com,0,1,1,,
3336656010756079,nMcvgy,有宋一代，不杀大臣、言官、士子，这是赵匡胤定下的祖训，刻在一块碑上，每当新皇帝即位，才由一个不识字的太监领去，由皇帝一个人默默地看。可是这一切是怎么为人所知的呢？是金兵破东京后，在皇宫里发现了这块碑。这么说来，金兵还干了件好事！ ,,,,2011-07-18,微博 weibo.com,0,0,0,,
2111107172466085,nzz01T,我师傅话很多，我随他。当年他在东吴舌战群儒，如今我在微博谈古论今。他鞠躬尽瘁，死而后已，我获得了【舌战群儒】勋章。 网页链接 ,https://ww3.sinaimg.cn/large/62015b43tw1di6ebt4tnqj.jpg,,,2011-07-17,勋章馆,0,0,0,,
3335953481753200,ny6blw,十二岁的赵煦经常把弟弟赵佶叫到宫里去玩，从陶罐中拿出自己的饼干给他吃。他们躲在帷幕后面，坐在地下，相顾不言。——可以想象这样的场景，又温馨，又辛酸。 ,,,,2011-07-17,微博 weibo.com,0,0,0,,
5629073762084535499,ndEvpg,金橘是在夏天开花的。这事儿去年就知道了。。。 ,https://ww4.sinaimg.cn/large/6f9bca7ejw1dj562zrf2fj.jpg,,,2011-07-14,S60客户端,0,1,0,,
5627999324301445692,mQmweA,在了解苏轼二次获罪遭贬岭南的前因后果之后，不由得想说一句：活该！之前他仗着一手好文章以皮里阳秋的笔法写制文，阴掉了好多人，还一度蒙蔽了历史，公报私仇，“三十年做刽子，今日方剐得一个有肉汉”，这种恶狠狠、小人得志的话，之前怎么也没想过他会说。而他在宋一代文人中，已经算好的了。。。。 ,,,,2011-07-11,微博 weibo.com,0,3,5,,
5627196620861222708,mzbpR4,赵顼说：我好孤寒。——《续资治通鉴长编三百五十二》 ,,,,2011-07-09,微博 weibo.com,0,0,0,,
5625716931442062879,m3bgCy,自己给自己办追悼会，表面上看是显示人生关怀，实际上，是另一种显摆：把生折腾掉了，现在来折腾死了。。。每一种放给世人看的总结，都是显摆。 ,,,,2011-07-05,微博 weibo.com,0,0,0,,
5624214594829338524,lzuZhU,"我参与了投票【您认为中国最恶心的食物是什么？】　 网页链接 　投给""老鼠三吱儿"" 等2个选项 ",,,,2011-07-01,投票,0,0,0,,
2111106304766089,lv3QZd,裸婚时代了，我的裸婚勇气是不是很给力，敢裸婚的人你伤不起，有木有？快来看看你有没有#裸婚勇气#： 网页链接 ,https://ww3.sinaimg.cn/large/6f9bca7ejw1dip733dd52j.jpg,,,2011-06-30,未通过审核应用,0,4,0,,
5623260059987078005,li7I6w,相信这也是滨江大道吗？ ,https://ww1.sinaimg.cn/large/6f9bca7ejw1din21cmcbyj.jpg,,,2011-06-28,S60客户端,0,1,1,,
5622802439654105524,l95w0u,这是什么世界！//@老怡:凤姐不要我了？？？？//@罗玉凤：帅哥哥昨天晚上爽吗？//@王帅Wangshuai :凤姐我爱你呀！ ,,,,2011-06-27,微博 weibo.com,0,4,3,,"老怡,罗玉凤,王帅Wangshuai"
5619957281682379277,kp4wDw,3、“我之留辫不剪，纯属个人爱好和审美的体现”。亮点是第七条。 ,https://ww2.sinaimg.cn/large/6f9bca7ejw1dicrj3hp5pj.jpg,,,2011-06-19,微博 weibo.com,0,1,1,,
5618086299435782353,jTnxsW,“尽管认识时间不长，却相当的敬佩，和你一起工作很高兴很快乐，祝福以后更好”二B甲说，“把这句话变成一个牛逼的诗句”。二B乙很有才，七步不到，口占一绝：尽管相识不算久， 却是相当地敬佩。 和你一起很开心， 祝福以后会更好。 ,,,,2011-06-14,微博 weibo.com,0,1,0,,
5617313712133747987,jG9UTK,打，打，打，打，打！！！ ,https://ww4.sinaimg.cn/large/6f9bca7ejw1di4j44uhz2j.jpg,,,2011-06-12,S60客户端,0,24,0,,
5613194881436953111,iD4YSO,看上去很一般的凳子，但是它的质感我挺喜欢。 ,https://ww3.sinaimg.cn/large/6f9bca7ejw1dhrp5rq1ukj.jpg,,,2011-06-01,S60客户端,0,3,0,,
5613192489140069697,iD33rU,在图书馆看到黑蓝文丛，感觉还是挺好玩的。。。而且查阅记录上还经常有人借出，更感觉自己曾经因为因以为的小众其实在绝对人数上并不是少数。 ,https://ww2.sinaimg.cn/large/6f9bca7ejw1dhrow4ga1nj.jpg,,,2011-06-01,S60客户端,0,1,0,,
5613184732428807992,iCCJ2Y,图书馆是党和人民的好帮手！[呵呵] ,https://ww3.sinaimg.cn/large/6f9bca7ejw1dhro0teslij.jpg,,,2011-06-01,S60客户端,0,2,0,,
5609429578106472060,hLnh3W,“再多各自牛逼的时光，也比不上一起傻逼的岁月” ,https://ww4.sinaimg.cn/large/6f9bca7ejw1dhfyurrfxxj.jpg,,,2011-05-22,微博 weibo.com,0,2,5,,
5606104319773513390,h4iYqW,妈的！车被划了！！！中国景区管理人员的素质，没法不让人产生＂恶向胆边生＂的感觉！！！ ,,,,2011-05-13,S60客户端,0,4,0,,
5606082213734266666,h42Lig,云媛水墨作品。 ,https://ww1.sinaimg.cn/large/6f9bca7ejw1dh5jfe5kk0j.jpg,,,2011-05-13,S60客户端,0,0,0,,
5606081307337713033,h425nw,加拿大艺术家杰克。杰弗瑞作品。混合多媒体雕塑。 ,https://ww4.sinaimg.cn/large/6f9bca7ejw1dh5jbqsenlj.jpg,,,2011-05-13,S60客户端,0,0,0,,
5606079314472794986,h40A6c,是不是每个古镇都有＂望江楼＂？ ,https://ww3.sinaimg.cn/large/6f9bca7ejw1dh5j3ouubnj.jpg,,,2011-05-13,S60客户端,0,5,0,,
5606078867954600084,h40eqy,水，桥，傍水而居的人家，乌蓬船。。。古镇也是可以批量生产的 ,https://ww2.sinaimg.cn/large/6f9bca7ejw1dh5j1w0zwwj.jpg,,,2011-05-13,S60客户端,0,2,0,,
5606078047615810554,h3FySw,如果不说，谁能知道这是哪个江南古镇呢？！ ,https://ww2.sinaimg.cn/large/6f9bca7ejw1dh5iykgyahj.jpg,,,2011-05-13,S60客户端,0,4,0,,
5604566081522986131,gGdKbT,卑微的初衷不一定会影响伟大的结果。 ,,,,2011-05-09,微博 weibo.com,0,2,1,,
5603456541155485266,gplbuG,命相上说今天是我的幸运日，可为什么直到现在，发生的事都昭示着今天是我的灾难日？？？ ,,,,2011-05-06,微博 weibo.com,0,2,0,,
5602699583222924405,gfjZr4,我给自己贴了[TAG]玩儿[TAG]、[TAG]八卦[TAG]、[TAG]文学[TAG]、[TAG]一些事一些情[TAG]、[TAG]艺术[TAG]、[TAG]小说[TAG]、[TAG]电影[TAG]标签。 ,,,,2011-05-04,微博 weibo.com,0,1,0,,
5601978114625117157,g5h0Nc,威廉婚了，拉登死了，世界的噱头，只剩中国了。。。 ,https://ww2.sinaimg.cn/large/6f9bca7ejw1dgsr4hddvaj.jpg,,,2011-05-02,微博 weibo.com,0,1,1,,
5599734286262661227,fA1QRr,昨天下午突然鼻塞嗓子疼，就感觉大事不好。果然，今天嗓子如刀割般。。。身体也有点摇摇晃晃。。。可惜了那一盘豆豉鸡翅。。。。 ,,,,2011-04-26,S60客户端,0,6,1,,
201110420447482628,fac0UC,@越野泉哥@路平路庙，看这质感。。。 ,https://ww2.sinaimg.cn/large/6f9bca7ejw1dgf2gpixqej.jpg,,,2011-04-20,微博 weibo.com,0,1,0,,"越野泉哥,路平路庙"
221110420441842360,f8yxKe,对@航标-大表哥 说：LOOK！ ,https://ww1.sinaimg.cn/large/6f9bca7ejw1dgesur2yzyj.jpg,,,2011-04-20,微博 weibo.com,0,9,0,,航标-大表哥
201110416352309229,eQmhMC,<像走马灯一样活着>之三，左一即这个展览的主角王纯杰老师 ,https://ww2.sinaimg.cn/large/6f9bca7ejw1dgadojnlxlj.jpg,,,2011-04-16,S60客户端,0,0,0,,
201110416352423034,eQlIDc,<像走马灯一样活着>之二 ,https://ww3.sinaimg.cn/large/6f9bca7ejw1dgadl0p0itj.jpg,,,2011-04-16,S60客户端,0,0,0,,
201110416351970770,eQliDy,王纯杰个展<像走马灯一样活着>之一 ,https://ww4.sinaimg.cn/large/6f9bca7ejw1dgadictx1lj.jpg,,,2011-04-16,S60客户端,0,0,0,,
221110406119412895,e68GuG,【十二星座女最容易快乐方法】射手：爱上双子男。双鱼：爱上双子男。白羊：爱上双子男。金牛：爱上双子男。双子：爱上双子男。巨蟹：爱上双子男。狮子：爱上双子男。处女：爱上双子男。天平：爱上双子男。天蝎：爱上双子男。水瓶：爱上双子男。摩羯：爱上双子男。 ,,,,2011-04-06,微博 weibo.com,0,0,1,,
221110406110591405,e4ftfB,一个不成熟的男子的标志是他愿意为某种事业英勇地死去，一个成熟的男子的标志是他愿意为某种事业卑贱地活着。------塞林格 ,,,,2011-04-06,S60客户端,0,1,0,,
201110328414193658,dhunC9,成功就像怀孕，大家都来恭喜你，但是没人知道你被操了多少次。——据说也是爱因斯坦的话。 ,,,,2011-03-28,微博 weibo.com,0,1,1,,
201110328413823201,dhly65,据环境保护部网站消息，继3月26、27日在黑龙江省东北部监测点的气溶胶样品中检测到了极微量的人工放射性核素碘-131之后，28日，中国东南沿海江苏省、上海市、浙江省、安徽省、广东省、广西壮族自治区部分地区的监测点气溶胶样品中也检测到了极微量的人工放射性核素碘-131。 ,,,,2011-03-28,微博 weibo.com,0,0,0,,
221110321267083471,cCBg5j,回头想想，为什么这个国家，从来没有人口自律的意识？这是为什么？在大局上隐秘的祸害被细节的“优秀”遮盖，那么，细节越“优秀”，就越是卑劣。 ,,,,2011-03-21,微博 weibo.com,0,0,0,,
221110321266623972,cCAqol,一个没有人口自律的民族，无论如何都跟“素质好”挂不上边。小小的几个岛屿，人口密度全世界第一，近两百年来，我们看不到日本有任何自律的动作，只有充满了扩张的野心。宇宙能量、资源也是一定的，对资源的消耗，是对全体人类的屠杀，这样的民族，谈什么高素质？ ,,,,2011-03-21,微博 weibo.com,0,2,3,,
221110321267517959,cCzqJJ,日本地震，大家都在说日本的素质好。果真如此吗？懂得自救、懂得礼让，这就是素质好的全部？错了，一个民族最优秀的素质，最重要的是有控制人口的自律。人类在地球上，是最大的掠夺者、最大的破坏者、最大的扩张者、最大的侵略者。只要有人群，大的方面来说就会充满战争、阴谋，在小的方面就会充满嘈杂 ,,,,2011-03-21,微博 weibo.com,0,1,1,,
201110315122679804,c8FlDZ,介个……狗和人的传说……要……流传……和……发……展……到什么时……候？ ,https://ww3.sinaimg.cn/large/6f9bca7ejw6df96ivqcoxj.jpg,,,2011-03-15,微博 weibo.com,0,1,3,,
20111031262503977,bWnK2t,香花石艺术基金两年准备，但看今朝。推动者沈其斌低头看到更广阔的路了吗？脸上表情一如既往 ,https://ww2.sinaimg.cn/large/6f9bca7ejw6df5vbo283uj.jpg,,,2011-03-12,S60客户端,0,0,2,,
20111031261994018,bWmUJP,＂香花石＂艺术基金启动进入倒计时了。。。。。。 ,https://ww4.sinaimg.cn/large/6f9bca7ejw6df5v66eydrj.jpg,,,2011-03-12,S60客户端,0,2,1,,
22111031148470183,bTwZwL,我参与了投票【作为作者，您更希望自己的作品以何种方式出版？】　 网页链接　投给“以纸质图书出版”这1个选项 ,,,,2011-03-11,投票,0,0,0,,
20111031138803399,bRDxSp,"我刚加入了 @文交所 的微群 “文交所”,推荐大家也来看看~  网页链接 ",,,,2011-03-11,新浪微群,0,0,0,,文交所
2211103092510475,bKdSfj,井回同学洗的鳊鱼。原意是＂把鱼腮鱼胳肢窝弄弄干净＂。我们一致认为他这样做成秃鱼是有模板的。。。 ,https://ww4.sinaimg.cn/large/6f9bca7ejw6df2mfmq70hj.jpg,,,2011-03-09,S60客户端,0,0,0,,
2011103092327878885,bIpfRD,对@田田在下 说：马俊有没有开微博啊？ ,,,,2011-03-09,微博 weibo.com,0,0,0,,田田在下
2011103072662405258,bzz7JD,世上还会有这么无聊的事。。。。 ,,,,2011-03-07,S60客户端,0,0,1,,
2111103042924225,bqraCF,　　马牛居然有这等超能力！隐藏的实在太深了…我正在玩#美图秀秀超能力#测试，地址： 网页链接 ,https://ww2.sinaimg.cn/large/6f9bca7ejw6dex1rjlsyjj.jpg,,,2011-03-04,美图秀秀超能力,0,0,1,,
2111103042916195,bqqA83,　　每一个淡定的外表下，都拥有高深莫测的超能力！快来#美图秀秀超能力#测试自己有什么超能力吧！地址是： 网页链接 ,https://ww2.sinaimg.cn/large/6f9bca7ejw6dex1oihtd8j.jpg,,,2011-03-04,美图秀秀超能力,0,4,1,,
2111103042914821,bqqtbT,　　戴志康居然有这等超能力！隐藏的实在太深了…我正在玩#美图秀秀超能力#测试，地址： 网页链接 ,https://ww2.sinaimg.cn/large/6f9bca7ejw6dex1nxwy0yj.jpg,,,2011-03-04,美图秀秀超能力,0,0,0,,
2111103042912797,bqqkt1,　　沈其斌居然有这等超能力！隐藏的实在太深了…我正在玩#美图秀秀超能力#测试，地址： 网页链接 ,https://ww4.sinaimg.cn/large/6f9bca7ejw6dex1n8xl2hj.jpg,,,2011-03-04,美图秀秀超能力,0,1,0,,
2111103042909011,bqq2M1,　　天啊，井井回居然拥有这种超能力！快来#美图秀秀超能力#测试自己有什么超能力吧！地址是： 网页链接 ,https://ww3.sinaimg.cn/large/6f9bca7ejw6dex1ltleh9j.jpg,,,2011-03-04,美图秀秀超能力,0,0,0,,
2111103042904283,bqpIqp,　　天啊，张骁居然拥有这种超能力！快来#美图秀秀超能力#测试自己有什么超能力吧！地址是： 网页链接 ,https://ww4.sinaimg.cn/large/6f9bca7ejw6dex1k5lm6jj.jpg,,,2011-03-04,美图秀秀超能力,0,2,3,,
