id,bid,正文,原始图片url,视频url,位置,日期,工具,点赞数,评论数,转发数,话题,@用户
3806859658213710,C2SrXysLc,以前一个人在家的时候翻翻书啊刷刷屏啊敲敲文字啊看看电影啊喝喝咖啡啊；现在有了娃好不容易能挨到一个人在家的时候那是火速拖地洗衣刷鞋收拾东西，恭喜我成功转型吧，从一个走路带风的小文青晋升为穿着大花睡衣乱发磐髻的家庭腐女#钱是越花越少家务怎么就越做越多呢# ,,,,2015-02-05,iPhone 5s,6,4,2,钱是越花越少家务怎么就越做越多呢,
3803033584843341,C1gUSkjYp,二十多年前我就料到会有今天@小眯眼的TOTORO小姐 ,https://ww2.sinaimg.cn/large/72255befjw1eom5g7jcy1j20zk0qodmk.jpg,,,2015-01-25,iPhone 5s,3,8,0,,小眯眼的TOTORO小姐
3794899356956017,BDOLttbzP,从娃娃抓起 ,https://ww4.sinaimg.cn/large/72255befjw1enw7a5hyq7j20dc0hs0vo.jpg,,,2015-01-03,iPhone 5s,1,4,0,,
3794603096683195,BDH3Ds2Bt,这个世界有时候你所付出的和得到的并不相等。2015，看淡一点，轻装上阵。 ,,,,2015-01-02,iPhone 5s,1,2,0,,
3793891830580619,BDoyr2r2P,2014最后一天有点low[懒得理你] ,,,,2014-12-31,iPhone 5s,1,1,0,,
3791748096870019,BCuMNsPcL,生蛋节这个点儿能在我大合肥找到这样的路也是醉了 ,https://ww3.sinaimg.cn/large/72255befjw1enm5c99r9oj20dc0hsgn6.jpg,,,2014-12-25,iPhone 5s,1,3,0,,
3791270961154116,BCine4QeM,不上课的日子比上课还忙见到的同事比平时都多 ,https://ww3.sinaimg.cn/large/72255befjw1enkmjjal0jj216o0w0gys.jpg,,,2014-12-24,iPhone 5s,0,8,0,,
3789894944191597,BBIzQhAqp,还是麻麻比较美 ,https://ww3.sinaimg.cn/large/72255befjw1eng8j72ezmj20d30hsgo8.jpg,,,2014-12-20,iPhone 5s,5,12,0,,
3788719838606587,BBe0vA6XV,熬完本周，进入寒假模式，oh yeah ,https://ww2.sinaimg.cn/large/72255befjw1enchknnqedj20dc0hs0vg.jpg,,,2014-12-17,iPhone 5s,2,5,0,,
3786919068774668,BAta2AOGU,在单位白忙活了一上午，心情爆low，食堂补补#阿姨问了我好几遍真的要两个鸡腿么# ,https://ww3.sinaimg.cn/large/72255befjw1en6qq8aun7j20dc0hsacl.jpg,,,2014-12-12,iPhone 5s,0,4,0,阿姨问了我好几遍真的要两个鸡腿么,
3786243680919999,BAbAI3RkH,一对耍宝母女 ,https://ww4.sinaimg.cn/large/72255befjw1en4l4kaf4xj20tt15p45y.jpg,,,2014-12-10,iPhone 5s,4,8,0,,
3785957818082126,BA49DxUwS,秀个恩爱吧[炸鸡和啤酒] ,https://ww4.sinaimg.cn/large/72255befjw1en3ockmruzj20cp0hsac0.jpg,,,2014-12-09,iPhone 5s,2,7,0,,
3785839152922438,BA14fcgg6,年底了各种大节来临还要跨年，我决定给自己买点礼物压压惊缓缓心情🎁 ,https://ww4.sinaimg.cn/large/72255befjw1en3ap2ifomj20c80gadhc.jpg,,,2014-12-09,iPhone 5s,0,2,0,,
3785633082690190,BzVHSbhQa,一个女人要流过多少泪吃过多少苦受过多少难才会坚强的像个男人，才会把自己武装成刀枪不入，每每想到这，心里会隐隐作痛，晚安 ,,,,2014-12-08,iPhone 5s,0,9,0,,
3783703979713317,Bz7wpEKSp,这个天重感冒的时候喝这个好爽！😄😄 ,https://ww2.sinaimg.cn/large/72255befjw1emwhhr73fvj20w016oqdf.jpg,,,2014-12-03,iPhone 5s,1,6,0,,
3781155831113684,By3ev4FIE,本人已累死，有事请到教室门口烧香 ,,,,2014-11-26,iPhone 5s,0,3,0,,
3780069363522781,BxAY8eMr3,后排坐好了么，拿钥匙，点火，挂档，走起 ,https://ww4.sinaimg.cn/large/72255befjw1emkw21jh3ej20uo15ogzk.jpg,,,2014-11-23,iPhone 5s,3,8,0,,
3778615739383664,BwZ9zDn7q,最近的工作重心就是这个。。。。。不知道可有奖金思密达 ,https://ww2.sinaimg.cn/large/72255befjw1emg94g7byzj20d30hswg7.jpg,,,2014-11-19,iPhone 5s,2,4,0,,
3778018588206570,BwJCqyqU2,一切烦恼不安焦躁抑郁其实都只源于我们想要的太多，晚安 ,,,,2014-11-17,iPhone 5s,0,1,0,,
3777838652179453,BwEWd98Yt,办公室里部署羽毛球比赛战略，某同事满眼放光无比决绝的说：Ms tan一定要打女单，她那么暴力。。。。。。。。¥》@“&^_^其实我很纤弱经常以泪洗面的好不好 ,,,,2014-11-17,iPhone 5s,3,9,0,,
3777655403070441,BwAaEcSLf,很多时候对人或者对事，一“认真”就“输”了 ,,,,2014-11-16,iPhone 5s,1,3,1,,
3772780128624454,BuxliAbC6,生完孩子的傻缺健忘状态最近达到顶峰 ,,,,2014-11-03,iPhone 5s,1,2,0,,
3771081368647857,BtP9mAhHz,巨脚姑凉 ,https://ww3.sinaimg.cn/large/72255befjw1els7tmhq2tj20hs0no77i.jpg,,,2014-10-29,iPhone 5s,4,3,0,,
3769916866156870,BtkR8pPGm,家庭海底捞啊哈哈哈哈 ,https://ww4.sinaimg.cn/large/72255befjw1eloi2uh8opj218g0xctm2.jpg,,,2014-10-26,iPhone 5s,3,7,0,,
3767789007432886,Bsrv6vbDg,我们在经历了很多丑恶和坎坷后最终会变得强大，然而这种蜕变却带走了我们最美好的年华。原来，选择遗忘比选择原谅更艰难。 ,,,,2014-10-20,iPhone 5s,1,3,0,,
3767346299133359,BsfZ3Ck0f,受某人生日愿望启发，要努力做一个安静乐观不讨人嫌的中年已婚麻麻#写于阳光下的秋天# ,,,,2014-10-19,iPhone 5s,1,7,0,写于阳光下的秋天,
3766070953542894,BrIO3eRFs,初中有一帮假小子经常大清早约着打篮球课后讨论灌篮高手放学交换BSB的专辑磁带。。。15年后曾经这帮短发飞扬的女孩们有的成为自由职业者有的在家相夫教子有的成为教师有的在巴黎做服装设计有的异国联姻，每个人都有自己的精彩，也都有自己的辛酸，致青春，致匆匆那年。 ,,,,2014-10-15,iPhone 5s,0,6,0,,
3764942673188061,Brfsfdnml,快乐的来源有时候挺简单的，比如一部电影，一段对话，或者一个笑容，但有时候你却发觉想挽留昨日的那一点点快乐真是。。。。。只剩下叹气了 ,,,,2014-10-12,iPhone 5s,1,2,0,,
3762714222888652,BqjtYc7ta,再见大海 ,"https://ww1.sinaimg.cn/large/72255befjw1el1is4sapaj20dc0hs0u8.jpg,https://ww1.sinaimg.cn/large/72255befjw1el1isgym9bj20hs0dcjvx.jpg",,,2014-10-06,iPhone 5s,4,1,0,,
3761977312867151,Bq0jpc1Sn,小盆友出门非常给力，哪儿都能睡，吃嘛嘛香 ,"https://ww2.sinaimg.cn/large/72255befjw1ekz63a4gxlj20hs0dcq56.jpg,https://ww4.sinaimg.cn/large/72255befjw1ekz68bov88j20bu0hswfk.jpg",,,2014-10-04,iPhone 5s,3,4,0,,
3760077343464157,BpcSWexbv,这个点估计很多人刚开始一天的工作但我已经下班啦啦啦整装待发为伟大祖国母亲庆生思密达 ,https://ww1.sinaimg.cn/large/72255befjw1ekt411dgp2j20d30hsq4x.jpg,,,2014-09-29,iPhone 5s,3,12,1,,
3759383475424164,BoUPNmL4w,现实版绝世奶爸 ,https://ww1.sinaimg.cn/large/72255befjw1ekqw2fhxasj20uo15onau.jpg,,,2014-09-27,iPhone 5s,3,2,0,,
3759108509688801,BoNGiEEuZ,日子过的越来越有盼头了 ,https://ww1.sinaimg.cn/large/72255befjw1ekq0qf8mytj20f00qodhf.jpg,,,2014-09-26,iPhone 5s,0,5,0,,
3757573763712655,Bo9KUfzPx,最近新闻好丰富，尤其娱乐版。。。。 ,,,,2014-09-22,iPhone 5s,0,0,0,,
3755398882446250,Bnfb2agnE,上学篇 ,https://ww1.sinaimg.cn/large/72255befjw1eke6plpyrzj20uo15o4cs.jpg,,,2014-09-16,iPhone 5s,3,9,0,,
3754656046106979,BmVQUpCHF,课间无聊瞥一眼QQ，一码色黑头像，哦，原来今天只有我上班#伤心太平洋# ,https://ww4.sinaimg.cn/large/72255befjw1ekbteg0zeaj20f00qotbi.jpg,,,2014-09-14,iPhone 5s,0,2,0,伤心太平洋,
3754517562874341,BmSfyc3Kl,最近这个点睡觉就是常态，自己的事情家人的事情工作的事情总之就是各种事情忙的跟狗一样也没落着什么好想想人一辈子就是这么屁颠颠忙碌着最后还把自己忙进一抔土里，今夜无眠了 ,,,,2014-09-14,iPhone 5s,0,5,0,,
3752887228151501,BmbPYyczP,一对双胞胎呀谐星范儿十足呀 ,https://ww3.sinaimg.cn/large/72255befjw1ek668m3litj20ts15o7lb.jpg,,,2014-09-09,iPhone 5s,1,4,0,,
3752651982374274,Bm5Iy9XEK,炸。。。炸。。。炸个雷子！走一个！！ ,https://ww2.sinaimg.cn/large/72255befjw1ek5f7eaouuj20uo15owr4.jpg,,,2014-09-08,iPhone 5s,4,6,0,,
3751824270543127,BlKbx2hi7,养娃的过程就是不断挑战自己精力体能极限的过程，以前上学时候熬夜看书看电影K歌白天蒙头大睡觉得年轻真牛逼啊，现在连续几天不睡白天照样上班四处奔波也还头脑清醒四肢敏捷。出来混总是要还的，真不知道哪天就过劳嗝儿屁了[挖鼻屎] ,,,,2014-09-06,iPhone 5s,1,2,0,,
3751176493779244,BltkJfR9y,疲劳驾驶就是作死的最高境界#瞌睡虫附体# ,,,,2014-09-04,iPhone 5s,0,3,0,瞌睡虫附体,
3749572541308110,BkNBI5uiy,早餐是咖啡+馒头，以纪念我假期的美好生活彻底到头了#满满都是泪# ,,,,2014-08-31,iPhone 5s,0,6,0,满满都是泪,
3748212739848163,BkeetFjXl,终于在一起了！亲妈和干妈都很欣慰 ,https://ww4.sinaimg.cn/large/72255befjw1ejr9dlj9k7j20uo15oqe6.jpg,,,2014-08-27,iPhone 5s,3,7,0,,
3747817447677633,Bk3WUwdiN,你是我的包呀包子脸儿，怎么拍你都萌吐血#旋律哼起来呀# ,https://ww3.sinaimg.cn/large/72255befjw1ejpzxayseoj20tt15ptgc.jpg,,,2014-08-26,iPhone 5s,1,12,0,旋律哼起来呀,
3744910035708031,BiQjxnWV1,真想给自己立一墓碑：此人已困死[打哈气]大家路过飘过多给烧点信用卡吧 ,,,,2014-08-18,iPhone 5s,0,9,0,,
3743881990936031,Bipzp3Vvh,我95岁高龄的外公时不时跟我唠叨：听说银泰的外婆家不错啊哪天去尝尝。。。。。巧克力要买Kisses的啊。。。。雪糕还是梦龙的好吃啊#我真是完败给老太爷啊# ,,,,2014-08-15,iPhone 5s,0,5,0,我真是完败给老太爷啊,
3743819126581659,BinW0rCbN,街边看到一位肥妈给自己5、6个月大的娃塞了一口麻辣烫，真是[挖鼻屎]。。。。。。无脑父母尤其多 ,,,,2014-08-15,iPhone 5s,1,4,0,,
3742441926642775,BhO6IrS5x,认真等待，萌萌嗒 ,https://ww3.sinaimg.cn/large/72255befjw1ej8um7vjobj20no0vkgs3.jpg,,,2014-08-11,iPhone 5s,2,16,0,,
3742025843554474,BhDhCeUGe,越来越不像我了[挖鼻屎][挖鼻屎] ,https://ww4.sinaimg.cn/large/72255befjw1ej7iu0ge9dj20dc0hsq53.jpg,,,2014-08-10,iPhone 5s,0,7,0,,
3735622701654998,BeWHY6Wxw,难得在家想整点小可爱情调，也没能躲过闺女的魔掌[挖鼻屎][挖鼻屎] ,https://ww3.sinaimg.cn/large/72255befjw1ein3ashvv6j20no0hs0vt.jpg,,,2014-07-23,iPhone 5s,1,1,0,,
3735498206373571,BeTtaqK3x,家有爱劳动的小菇凉 ,https://ww1.sinaimg.cn/large/72255befjw1eimp4rji1tj20uo15ona3.jpg,,,2014-07-23,iPhone 5s,4,7,0,,
3728547665765994,BbYECobZU,家里的老太后没事就微信我这样的链接。。。。真是后脊梁骨阴冷阴冷的[挖鼻屎] ,https://ww1.sinaimg.cn/large/72255befjw1ei0iueol9dj20hs0vkn0u.jpg,,,2014-07-04,iPhone 5s,2,8,0,,
3726359363028583,Bb3J6cHS7,有朋友劝我没事多跟闺蜜们傻乐呵乐呵，别动不动就一猛子扎进怎么也想不明白的问题里折磨别人也折磨自己。想想也是啊，人生苦短，一天再长也活不出25小时。快快乐乐or凄凄艾艾都是一辈子，选择前者还是后者，决定权在自己手里。#大清早思考人生真是绳井病啊# ,,,,2014-06-28,iPhone 5s,0,5,0,,
3725285969298462,BaBNOD0Xc,嗲的流油，当娃娃真好 ,https://ww3.sinaimg.cn/large/72255befjw1ehq4a35d3nj216o0w0ws0.jpg,,,2014-06-25,iPhone 5s,2,8,0,,
3722494576111047,B9rbzpDLh,继@老驴的加菲 家米团之后又一位体坛新秀崛起了，希望在下一届奥运会的体操赛事中有杰出表现 ,https://ww1.sinaimg.cn/large/72255befjw1ehh7m45g8rj20ck0hs76k.jpg,,,2014-06-17,iPhone 5s,3,9,0,,老驴的加菲
3721372641894552,B8Y007WRi,一进考场就肚子疼，心理素质和年龄成反比MD！#监考也不例外# ,,,,2014-06-14,iPhone 5s,0,3,0,监考也不例外,
3719980338278493,B8nMlyJC5,没有理解的尊重是讨好，没有尊重的理解是迎合，That is it ,,,,2014-06-10,iPhone 5s,3,3,0,,
3719218098973595,B83WVBErp,我儿子真是MB帅啊啊啊啊啊啊啊 ,https://ww3.sinaimg.cn/large/72255befjw1eh6rdf7v7xj20dc0hs0ud.jpg,,,2014-06-08,iPhone 5s,3,18,0,,
3719137463789063,B81QSfTHV,最烦站着讲话不要疼的人 ,,,,2014-06-08,iPhone 5s,0,0,0,,
3718924472532146,B7WjlaCJ4,今天打车司机师傅叨叨高考：“孩子们今天开战啊有没有实力就看出来啦！”我嗯嗯应付着，接着后一句彻底亮了“看你估计高考完也没几年吧，你那时候。。。。。。。。”#哎哟师傅立马多付你10块# ,,,,2014-06-07,iPhone 5s,3,5,0,哎哟师傅立马多付你10块,
3718410616086263,B7IWxpxjx,每每对孩子失去耐心的时候我就读几页周国平的《妞妞》，原来能对孩子发脾气也是一种幸福只要她平安健康的活着。 ,,,,2014-06-06,iPhone 5s,0,1,0,,
3717667540546445,B7pC22i9D,有些所谓传统害死人 ,https://ww2.sinaimg.cn/large/72255befjw1eh1tbc94czj20hs0vkwjh.jpg,,,2014-06-04,iPhone 5s,5,1,12,,
3717018975433183,B78JXmNpZ,幸福吧就是，家人健康爱人同心闺蜜三三两两闺女快乐成长，其他神马都扯蛋啊 ,,,,2014-06-02,iPhone 5s,2,2,0,,
3716433169226293,B6Tv6CIbb,其实我当年生了俩，藏了一个，这是我儿子，请大家多多支持 ,https://ww3.sinaimg.cn/large/72255befjw1egxvj7rnfgj211218gn6x.jpg,,,2014-05-31,iPhone 5s,3,5,0,,
3713820143010497,B5NwycDap,“死开！不要抢我麻麻” ,https://ww2.sinaimg.cn/large/72255befjw1egpjg71mzsj20dc0hsgog.jpg,,,2014-05-24,iPhone 5s,4,10,0,,
3710835866289059,B4xTcqo4r,感觉生活步入瓶颈，越想挣扎的逃出来反而被卡的更紧不能呼吸，索性平静下来把身边的小事一点点做好吧。今晚一定要敷个面膜嗯嗯一定。 ,,,,2014-05-16,iPhone 5s,1,2,0,,
3709922447607603,B4a7WvV5h,坚挺了两年没吃过药，终于在这阳光明媚的初夏抵不过洪水猛兽般的病毒重新踏上了药路历程 ,,,,2014-05-14,iPhone 5s,0,4,0,,
3709863140160246,B48Ai0FGC,教师是一个挺残酷的职业，我们的学生永远那般年轻而我们每一分每一秒都在变老，会不会有一天当我路过空荡荡的教室就已经伤感到无法自拔#那些年我们一起呆过的教室# ,https://ww4.sinaimg.cn/large/72255befjw1egcwncwobjj218g0xck28.jpg,,,2014-05-13,iPhone 5s,1,12,1,那些年我们一起呆过的教室,
3705120132782034,B29chbFJw,说到底人都是自私的，这无关品质，却是人性 ,,,,2014-04-30,iPhone 5s,0,2,0,,
3702201824820773,B0Vhkke6p,每每听到女生们大呼小叫“我先回寝室啦”之类的就花自会虎的觉得年轻真好 ,,,,2014-04-22,iPhone 5s,0,3,0,,
3701913428655765,B0NMaAjL7,女人就是wu～～逛吃逛吃逛吃逛吃wu～～逛吃逛吃逛吃逛吃 ,https://ww3.sinaimg.cn/large/72255befjw1efnjxyafkhj20uo15ok51.jpg,,,2014-04-21,iPhone 5s,1,6,0,,
3699344291088678,AFGoJ4zdk,我的我的我的我的就是我的#俗人一枚# ,https://ww3.sinaimg.cn/large/72255befjw1effcx0v8uoj20dd0hswgj.jpg,,,2014-04-14,iPhone 5s,3,4,0,俗人一枚,
3699000232886475,AFxrNc6U3,马哥哥亲自给做的寿面啊哈哈哈哈@老驴的加菲 @小眯眼的TOTORO小姐 @大香草  ,https://ww4.sinaimg.cn/large/72255befjw1efe9e4yim9j20hs0dc41a.jpg,,,2014-04-13,iPhone 5s,0,2,0,,"老驴的加菲,小眯眼的TOTORO小姐,大香草"
3698573075628672,AFmkPnCh2,好有喜感的展会 ,https://ww3.sinaimg.cn/large/72255befjw1efcwc2zqbmj20hs0dcac4.jpg,,,2014-04-12,iPhone 5s,0,3,0,,
3697378340642096,AERfQ2H2o,大号蛋饼一枚+Pepsi激浪一罐，开启我热血奋进的一天 ,https://ww2.sinaimg.cn/large/72255befjw1ef933omevpj218g0xcnbo.jpg,,,2014-04-09,iPhone 5s,1,6,0,,
3697167363596338,AELLyf5zs,你们土豆锅锅大开杀戒了@爱喝白开水的大球 @肥YO屁屁枕 @FF-丫 @孬孬的Minami酱 @王小能大肚腩 @肇小昕  ,https://ww4.sinaimg.cn/large/72255befjw1ef8ewyify8j20dc0hsdj1.jpg,,,2014-04-08,iPhone 5s,0,10,0,,"爱喝白开水的大球,肥YO屁屁枕,FF-丫,孬孬的Minami酱,王小能大肚腩,肇小昕"
3696863125712542,AEDQQnY5M,娃穿啥真是随妈，总是运动休闲球鞋style，不象某位娃娃已经开始各种开衫打底雪纺小皮鞋了，你说是吧@小眯眼的TOTORO小姐  ,https://ww1.sinaimg.cn/large/72255befjw1ef7fvcdk2rj20ul15otk5.jpg,,,2014-04-07,iPhone 5s,2,15,0,,小眯眼的TOTORO小姐
3691411608550083,ACm24zSgz,终于捯饬好自己的小家了，真正属于自己的家哦哈哈 ,https://ww4.sinaimg.cn/large/72255befjw1eeq1ukv175j20tt15pn4o.jpg,,,2014-03-23,iPhone 5s,7,16,0,,
3690711843206350,AC3Pqds7k,各类新闻头条开始变成某某夫人访华orCBA总决赛扒拉扒拉，那不知去向的飞机不再那么吸引人眼球，就是这样残酷，再大的事情被时间冲刷的也会慢慢淡了印迹，即使是性命攸关。 ,,,,2014-03-22,iPhone 5s,0,1,0,,
3688842110867839,ABhbJ3DLp,刚才听到一句话：人还是念旧情的。呵呵，我只能呵呵了 ,,,,2014-03-16,iPhone 5s,0,2,0,,
3687319758763033,AADAjALFf,您说这还没剥壳的蛋您啃个什么劲儿啊 ,https://ww3.sinaimg.cn/large/72255befjw1eeczxpdfcjj20no0vkdnr.jpg,,,2014-03-12,iOS,1,5,0,,
3686525584143753,AAiVohnYJ,最近真是情场赌场各种失意，生活工作都不在状态 ,,,,2014-03-10,iPhone 5s,0,8,0,,
3684430160538922,AzqpG2gci,有时候很怀念那种看到对方难过然后写一张纸条传过去再然后就成为好朋友的学生时代 ,,,,2014-03-04,微博 weibo.com,0,4,0,,
3683325841998183,AyXGw8nOL,对那种不愿送上门的快递我竟然脱口而出：你要不方便送我就下楼拿吧#我就是活该被气死累死的人# ,,,,2014-03-01,iPhone 5s,0,3,0,,
3682878280034925,AyM2E095j,感觉全世界今天都在追大结局 ,,,,2014-02-28,iPhone 5s,0,7,0,,
3682157027566610,AythkvKq6,那种瞪牛眼噘猪嘴的自拍模式，我也顺势来一张#戴帽子显脸小哈哈# ,https://ww3.sinaimg.cn/large/72255befjw1edwj03z9ooj20qo0zkwlw.jpg,,,2014-02-26,iPhone 5s,1,15,0,戴帽子显脸小哈哈,
3680196727275930,AxEhyuwNI,时间，是治愈一切的良药 ,https://ww1.sinaimg.cn/large/72255befjw1edq9v7fxh3j218g0xcthq.jpg,,,2014-02-20,iPhone 5s,0,2,1,,
3679397179778127,AxjtXF1JJ,漫天飞雪的校园里就我一辆大破车孤零零的杵在那里，加班妈蛋啊 ,,,,2014-02-18,iPhone 5s,2,0,0,,
3678589885383897,AwYtSmAB3,明天抽到要被大boss听课，这几率跟中500万差不多了吧，恨恨的去买彩票 ,,,,2014-02-16,iPhone 5s,0,1,0,,
3676788129414769,AwdBODvd7,某人说的对，幼儿园里放眼望去没有不长牙不走路不说话不好好吃饭不好好拉臭臭还整天粘着麻麻要neinei 喝的娃儿，所以，把一切交给时间，耐心等待吧 ,,,,2014-02-11,微博 weibo.com,0,6,0,,
3672517703124913,Auqw2d6VP,一马平川的芜湖路，每天都这样就笑死 ,https://ww4.sinaimg.cn/large/72255befjw1ed1rxz5b05j20no0vk7at.jpg,,,2014-01-30,iOS,0,1,0,,
3671864264158572,Au9w6hrPK,我觉得每天撅着腚扶娃练走路+不停弯腰捡她往地上扔的东西的强度不亚于跳郑多燕啊亲们@老驴的加菲 @小眯眼的TOTORO小姐  ,,,,2014-01-28,iPhone 5s,0,4,0,,"老驴的加菲,小眯眼的TOTORO小姐"
3670626978070902,AtDktxRBQ,鞍前马后屁颠颠努力给人当贤妻良母到头来还被人说不会这个不会那个，女人真TM贱 ,,,,2014-01-25,iPhone 5s,1,1,0,,
3669572416457205,AtbTzr5Ot,我跟同事聊天说超级讨厌那种吃饭的时候旁边有一帮唱歌走调身材走样的人对你抛媚眼献媚笑的泰国餐厅啊超级倒胃口啊，结果同事很客观的评论我说，你需要的是韩国人，不是东南亚大叔。哈哈哈哈，you hit the point. 欧巴才是王道！PS.明天周四~~ ,,,,2014-01-22,微博 weibo.com,0,7,0,,
3668140477334381,AsADZuM0t,我期待的周末却给了我非常操蛋的feel ,,,,2014-01-18,iPhone 5s,0,2,0,,
3667299154313765,AseL1i6cR,坐马桶上打开百度视频更新@小眯眼的TOTORO小姐 @老驴的加菲  ,,,,2014-01-16,iPhone 5s,0,2,0,,"小眯眼的TOTORO小姐,老驴的加菲"
3666318253538711,ArPeVeQzZ,现阶段最开心的事情就是闺女愿意吃我做的饭哈哈！#好吧不是特别非常难吃的#麻麻会加油的来 ,,,,2014-01-13,iPhone 5s,4,5,0,,
3665530777210748,AruKNufQo,被娃闹夜的人白天真是不能开车真心困的要追尾了 ,https://ww2.sinaimg.cn/large/72255befjw1ecfhhlavphj20dc0hswg7.jpg,,,2014-01-11,iPhone 5s,0,5,0,,
3664025693250396,AqRBfdDzK,班里有两个女生，相似的清秀活泼成绩都不错经常干什么都一起，突然觉得她们能成为很好的朋友。大学时代的友谊就是这样，走着走着，就一辈子了。 ,,,,2014-01-07,iPhone 5s,0,3,0,,
3663010411421930,AqrbH5XUm,全城热堵阶段，市政是不是该考虑路边多设几个流动厕所？ ,,,,2014-01-04,iPhone 5s,3,2,0,,
3662414808048580,AqbH2xLNO,寻一种与世无争的心态，送给2014的自己 ,https://ww2.sinaimg.cn/large/72255befjw1ec5jn2h82lj20xc18gk02.jpg,,,2014-01-02,iPhone 5s,1,1,0,,
3661163051482447,ApF856dEr,DAY365天，希望你永远这么开心的笑着生活，一颗牙小盆友 ,https://ww4.sinaimg.cn/large/72255befjw1ec1jtecf89j20lb0ptwii.jpg,,,2013-12-30,iPhone 5s,4,10,3,,
3658417741163355,AovIa4SDN,我们有时候会以爱之名让对方不堪重负#我想和你好好的# 默认专辑 ,https://ww1.sinaimg.cn/large/72255befjw1ebsski6ba8j20a00a03yn.jpg,,,2013-12-22,微相册,0,2,1,我想和你好好的,
3658289420218766,Aosnc0UUu,家有熊孩子一枚，瞬间键盘就这样了 ,https://ww3.sinaimg.cn/large/72255befjw1ebsdsfflnxj20hs0dcta9.jpg,,,2013-12-22,iPhone 5s,1,8,0,,
3657904613920463,AoimxgrTh,前段时间逛店偶然入手一件性价比还不错的外套，怎么着过几天就发现它在淘宝上铺天盖地成了爆款。。。。走哪儿都跟人撞衫是我太超前了还是太Out了[悲催] ,,,,2013-12-21,iPhone 5s,0,1,0,,
3656024836166736,AnvsDpSfu,我这是上夜班的节奏么[睡觉][睡觉][睡觉] ,https://ww4.sinaimg.cn/large/72255befjw1ebl5ri6o75j20dk0mo0tb.jpg,,,2013-12-16,HTC Phone,0,3,0,,
3651716836615051,AlHofrKSn,男人时不时抽个软中就感觉很奢侈了，但对比女人动辄成百上千的各种美白保湿啫喱精华面膜面霜的，软中算个shit啊 ,,,,2013-12-04,微博 weibo.com,0,6,0,,
3647192323338059,AjNGEe0nF,多理解，多体谅，很多事情也许就迎刃而解了。谈麻麻，加油。 ,,,,2013-11-21,搜狗高速浏览器,0,4,0,,
3645894623221531,AjfVAdw4b,从没吃上早饭到开车打瞌睡我预感今天会是状态很糟糕的一天，what a bad day  ,,,,2013-11-18,HTC Phone,0,0,0,,
3643780806241471,AimWcqbGT,过去一个女人带几个孩子也都一串溜拉扯大了，现在几个大人围一个小孩转还忙的屁股冒烟，这到底是我们变得无能了还是孩子变得精贵了 ,,,,2013-11-12,搜狗高速浏览器,1,2,0,,
3640699793153443,Ah4MPdelZ,抓米团姐姐的头发抢甜瓜姐姐的玩具扯邻桌小哥哥的衣服掐陌生阿姨的胳膊。。。看什么看！？说的就是你！皮蛋蛋同学！！ ,https://ww1.sinaimg.cn/large/72255befjw1ea89pfugwyj20dk0moq3g.jpg,,,2013-11-03,HTC Phone,0,12,2,,
3638869788626499,AgjbcAc95,小姑娘现在会得瑟的很，嗲的流油 ,https://ww3.sinaimg.cn/large/72255befjw1ea2fj7zlyij20a70hrmxl.jpg,,,2013-10-29,HTC Phone,2,5,0,,
3638096636011840,AfZ4bpdXa,最小钢琴学员#真是她自愿的# ,https://ww4.sinaimg.cn/large/72255befjw1e9zyql21ncj20dk0mogmk.jpg,,,2013-10-27,HTC Phone,0,7,0,真是她自愿的,
3631767946983651,AdkqCtiLx,不是我矫情，睡不好我就是情绪不好，就是想吵架就是想发火就是想摔门，没有理由，就是想。 ,,,,2013-10-10,HTC Phone,0,4,0,,
3631070220515857,Ad2hg2ach,最近挫败感尤重 ,,,,2013-10-08,HTC Phone,0,4,0,,
3630479331190294,AcMUd4ZEi,人和人之间的相处是有默契的，比如你不喜欢的人十有八九也不喜欢你 ,,,,2013-10-06,HTC Phone,0,6,0,,
3627838488266488,AbGcMyGus,使唤@松岛肉肉子子给我端这个端那个真是件极具快感的事情啊哈哈哈 ,https://ww2.sinaimg.cn/large/72255befjw1e938lu87tjj20mo0dk0tl.jpg,,,2013-09-29,HTC Phone,0,1,0,,松岛肉肉子子给我端这个端那个真是件极具快感的事情啊哈哈哈
3627526440240219,Aby5u10uv,给自己鼓鼓劲儿，乐观一点积极一点 ,,,,2013-09-28,HTC Phone,0,0,0,,
3627056963518834,AblSgeLpo,每天早晨都要为娃穿什么衣服舌战群雄，我永远只重复一句话“她真的不冷”。不要穿的太暖不要吃的过饱，每个麻麻都有自己的坚持 ,,,,2013-09-27,HTC Phone,0,7,0,,
3625807061091492,AaPmi4zWI,吃喝拉撒睡任何一个环节出的问题归结到中医里十有八九都是“上火”，难怪我一看到中医就上火。。。。 ,,,,2013-09-23,HTC Phone,1,4,0,,
3624664796765966,AalDVso8u,年轻的时候，应该说特别年轻的时候，把很多真话当玩笑；如今在慢慢不再年轻的道路上，把越来越多的玩笑当真话。是我们在这虚虚实实的世界里开始认不清自己认不清别人，还是最终归结于一句“输不起”。 ,,,,2013-09-20,HTC Phone,1,4,0,,
3623575900716539,A9TjE30p5,男人一进门说给我买了个5s，鸡冻的热血倒流，结果。。。。感觉这辈子都不会再爱了 ,https://ww3.sinaimg.cn/large/72255befjw1e8pn1z9oggj20dk0modgq.jpg,,,2013-09-17,HTC Phone,0,17,10,,
3623227911807996,A9Kgn7Ale,俯卧撑，搞起！#这体能真是我亲闺女# ,https://ww1.sinaimg.cn/large/72255befjw1e8oj2mzhtej21kw11t0zq.jpg,,,2013-09-16,微博 weibo.com,1,7,1,,
3622595218063702,A9tNTxPJI,北京遇上西雅图，一部很温暖的电影。用力去爱一个人，真好。 ,,,,2013-09-15,HTC Phone,0,5,0,,
3622198978229556,A9juNywSM,虽然技术到NBA差远了，但现场还是很解馋啊，又燃起了我对生活的热情 ,https://ww4.sinaimg.cn/large/72255befjw1e8l8x1hj7ej20mo0dkwg7.jpg,,,2013-09-13,HTC Phone,0,3,0,,
3621614313125897,A94hNd7bH,频频看周围人去北京去上海去海南去青岛去韩国去美国去欧洲。。。而我已经一年多没离开过这生我养我的鬼地方了，要么在家，要么就在回家的路上 ,,,,2013-09-12,HTC Phone,0,7,0,,
