id,bid,正文,原始图片url,视频url,位置,日期,工具,点赞数,评论数,转发数,话题,@用户
5618256440274011492,jVfBPO,【哪种安静你最爱？】1.坐在沙滩上看大海， 吹海风；2.在雨中漫步，不打伞；3.在博客/其他玩的网站写自己的心情；4.以各种方式发呆；5.一个人塞着耳机漫步；6.看着书，听着歌；7.脑袋一 片空白，什么都不想；8.和恋人背靠着背坐在一起，不说话；9.托着腮帮想心事；10.一个人，听着歌，喝点酒..... ,https://ww4.sinaimg.cn/large/6dcb555dtw1di7guef0azj.jpg,,,2011-06-15,微博 weibo.com,0,80,579,,
5617981321839869100,jR15CE,有时候莫名地不想说话，有时候莫名地心情不好，就想一个人静静地待着，谁也不理，什么事也不管。也许是这个世界太压抑，也许是我们我们沾染了太多的浮华，我们始终无法轻松地面对现在的生活。我只是希望，有一个人能够在我失落时能够对我说“别怕，有我在”。 ,https://ww2.sinaimg.cn/large/6dcb555dtw1di6lzm0vnkj.jpg,,,2011-06-14,微博 weibo.com,0,27,204,,
5617882584848832880,jOtqfK,"A person who truly loves you will never let you go, no matter how hard the situation is. --------- 真心爱你的人永远不会放你走，不管遇到多大的困境。 ",https://ww1.sinaimg.cn/large/6dcb555dtw1di6awzcpr7j.jpg,,,2011-06-14,微博 weibo.com,0,42,462,,
5617715794085288880,jN2jWS,一件事，就算再美好，一旦没有结果，就不要再纠缠，久了你会倦，会累；一个人，就算再留念，如果你抓不住，就要适时放手，久了你会神伤，会心碎。有时，放弃是另一种坚持，你错失了夏花绚烂，必将会走进秋叶静羌。任何事，任何人，都会成为过去，不要跟它过不去，无论多难，我们都要学会抽身而退。 ,https://ww3.sinaimg.cn/large/6dcb555dtw1di5s79sfyaj.jpg,,,2011-06-13,微博 weibo.com,0,76,601,,
5617631844650166809,jLj02W,我，不会问，不会提，难过了就一个人不停地走。我，不会吵，不会闹，心痛了用沉默代替一切。我，不会哭，不会笑，累了我就会消失一下。我知道，每条路都难走，我知道，那条路就注定了要坎坷。我知道，我不可以去强求任何人。说好不再流泪就不会流，即使心再痛泪就在眼眶。这条路，我一个人走。 ,https://ww1.sinaimg.cn/large/6dcb555dtw1di5iskruagj.jpg,,,2011-06-13,微博 weibo.com,0,28,311,,
5617501101561634426,jIpmCC,我们结婚吧，好不好。那样我们就可以不再对着电话诉说想念，就可以每天清晨起来看见你的睡脸，然后一起吃一顿不太丰盛却很温暖的早餐。我们结婚吧，好不好。那样我们就可以拿着民政局发的红色小本子四处炫耀，我们可以在房间里挂满结婚照，看着看着就会不自觉的微笑。我们结婚吧。 ,https://ww3.sinaimg.cn/large/6dcb555dtw1di544ox2voj.jpg,,,2011-06-13,微博 weibo.com,0,55,494,,
5617137055826123863,jCjVui,麦兜说：不开心睡一觉，就让它过去吧。伤心还好，伤胃就不好了。 麦兜说，要懂得珍惜守护，身边的每个人，因为前世扭断脖子的回眸，我们才换来了今生的相遇！ 麦兜说，有事情是要说出来的，不要等着对方去领悟，因为对方不是你，不知道你想要什么，等到最后只能是伤心和失望，尤其是感情。 ,https://ww3.sinaimg.cn/large/6dcb555dtw1di3zapkrjoj.jpg,,,2011-06-12,微博 weibo.com,0,54,430,,
5616948682866446924,jA42JM,我想有一所房子，面朝大海，春暖花开，4M宽带，能叫外卖，快递直达，不还房贷！ 有一个朋友，评评小说，侃侃明星，不愁房贷，能去买菜，可以喝茶，还能恋爱！想要的请举手！！ ,https://ww2.sinaimg.cn/large/6dcb555dtw1di3e68ojf3j.jpg,,,2011-06-11,微博 weibo.com,0,46,319,,
5616768603469462460,jwl2lg,睡眠的拼音是shuimian，失眠的拼音是shimian，辗转反侧夜不能寐，只因少了一个u ! [满月] ,https://ww2.sinaimg.cn/large/6dcb555dtw1di2tz3ycbzj.jpg,,,2011-06-11,微博 weibo.com,0,33,239,,
5616517966366378122,jtDeLi,【2011年最有用的小众网站】 这个个性时代，你拼死拼活在主流搜索引擎也拼凑不来的精华。好多你想都想不到的小网站。收藏吧！ ,https://ww1.sinaimg.cn/large/6dcb555dtw1di21v4o305j.jpg,,,2011-06-10,微博 weibo.com,0,52,830,,
5616391367904761931,jrBe5t,"You don't always have to be nice. Sometimes, just show your bad side and you will know who can accept the real you ------- 你不必时时刻刻都表现得那么完美。有的时候需要要把自己不好的一面展现出来，这样你就会知道谁能接受一个真正的你。 ",https://ww1.sinaimg.cn/large/6dcb555dtw1di1no07e8xj.jpg,,,2011-06-10,微博 weibo.com,0,65,687,,
5616130727806628965,joFe2u,"【经营人脉的十条铁律】 1、想钓到鱼,就要像鱼那样思考;2、不要总显示比别人聪明;3、让对方做主角,自己甘愿做配角;4、目中无人,让你一败涂地;5、常与人争辩,你永难赢;6、锋芒太露,下场不好;7、刺猬原则-保持适当距离;8、树一个敌,等于立一堵墙;9、谦虚不虚伪,不苛求完美;10、失言不如无言。 ",https://ww3.sinaimg.cn/large/6dcb555dtw1di0ufl15hyj.jpg,,,2011-06-09,微博 weibo.com,1,65,647,,
5616023302096737595,jmrsfY,人最软弱的地方，是舍不得。舍不得一段不再精采的感情，舍不得一份虚荣，舍不得掌声。我们永远以为最好的日子是会很长很长的，不必那么快离开，但就在我们心软和缺乏勇气的时候，最好的日子毫不留情地逝去了。 ,https://ww4.sinaimg.cn/large/6dcb555dtw1di0idsr2orj.jpg,,,2011-06-09,微博 weibo.com,0,57,492,,
5615860428343689072,jl12wi,【五种方法 让女人永远不再痛经】 特别提醒如果出现以下情况中的任何一种，就不是几种食物或止痛药所能解决的了，应赶紧去看医生。1.疼痛逐渐减轻，但最近又加剧；2.经期体温升高；3.经期过长或过短(正常为3-7天)；4.越接近经期下腹疼痛越明显；5.若经血颜色呈淡茶褐色，或气味发生变化，应及早诊治。 ,https://ww2.sinaimg.cn/large/6dcb555dtw1di0042549tj.jpg,,,2011-06-08,微博 weibo.com,0,15,267,,
5615654411637750266,jg4Zqi,麦兜说：不开心睡一觉，就让它过去吧。伤心还好，伤胃就不好了。 麦兜说，要懂得珍惜守护，身边的每个人，因为前世扭断脖子的回眸，我们才换来了今生的相遇！ 麦兜说，有事情是要说出来的，不要等着对方去领悟，因为对方不是你，不知道你想要什么，等到最后只能是伤心和失望，尤其是感情。 ,https://ww1.sinaimg.cn/large/6dcb555dtw1dhzd0euzbxj.jpg,,,2011-06-08,微博 weibo.com,0,50,492,,
5615489141309680689,jemAp0,【很多男生的基本想法】 感情是需要双方一起维持的，女孩们，来看下大部分男生的基本想法，好好维护你们的感情。男生们可以看看，鉴定一下是否的确如此，如果她能理解并且做好一大部分，你真的该好好珍惜她，因为她是那么的爱你和珍惜你！ ,https://ww3.sinaimg.cn/large/6dcb555dtw1dhyugry1uej.jpg,,,2011-06-07,微博 weibo.com,0,35,392,,
5615294549217369626,ja5o2g,如果你哭，你只能一个人哭，没有人在意你的懦弱，只有慢慢地选择坚强。如果你笑，全世界都会陪着你笑，你给世界一缕阳光，世界还你一个春天。很多时候，我们都是在寂寞中行走，不要期望他人来解读你的心灵，认同你的思想，要知道，你只是行走在世界的路上，而世界却给了你全部天空... ,https://ww3.sinaimg.cn/large/6dcb555dtw1dhy8ne7uuoj.jpg,,,2011-06-07,微博 weibo.com,0,31,321,,
5614945587424889090,j4uxai,【穿衣颜色搭配学问】 1.红色配白色、黑色、蓝灰色、米色、灰色。2.咖啡色配米色、鹅黄、砖红、蓝绿色、黑色。 3.黄色配紫色、蓝色、白色、咖啡色、黑色。4.绿色配白色、米色、黑色、暗紫色、灰褐色、灰棕色。 5.蓝色配白色、粉蓝色、酱红色、金色、银色、橄榄绿、橙色、黄色。 ,https://ww4.sinaimg.cn/large/6dcb555dtw1dhx5hrryr1j.jpg,,,2011-06-06,微博 weibo.com,0,57,847,,
5614558980241630693,iYaY2m,【古代灵魂出窍的方法，你敢试吗？】 方法：首先，准备一張紙，在上面写20遍自己的名字（毛笔、黑笔皆可）。然后，在睡前放在枕頭下，就ok了。注意：紙不可以折，似乎只有晚上9~11點可以成功，心中默想要去哪里（比如，要去学堂）。 似乎八字重的人不容易成功。出窍的灵魂会在凌晨1~3点自然归位。 ,https://ww3.sinaimg.cn/large/6dcb555dtw1dhvy5719w7j.jpg,,,2011-06-05,微博 weibo.com,0,124,636,,
5614173429604493092,iS6saa,那个人，一定会在过马路时牵着我的手，对我说，跟我走；那个人，一定会明白老婆是用来疼的，而且会吹着快乐的口哨和我一起做家务；那个人，一定会在我哭的时候为我擦眼泪，然后告诉我：乖，不哭，有我在呢；那个人，一定会在我累的时候，伸出手臂对我说：抱抱；那个人，一定会在睡前对我说晚安。 ,https://ww1.sinaimg.cn/large/6dcb555dtw1dhuqwq7rywj.jpg,,,2011-06-04,微博 weibo.com,0,54,500,,
5614007768434619392,iQp8Q4,耶稣在星期五被钉死在十字架上，那是全世界最绝望的一天。可是三天后就是复活节——所以，人在困境中应学会，至少再等三天！ ,https://ww1.sinaimg.cn/large/6dcb555dtw1dhu8bwkel7j.jpg,,,2011-06-03,微博 weibo.com,0,55,398,,
5613927130419689764,iOuOIk,那一年她爱上了他，她是一个优雅而漂亮女人，而他是个一无所有且懒惰的男人。朋友都不看好 ，他们父母也说她这是用自己的幸福在赌。交往后，他像变了个人似的奋发上进，若干年后他有了自己的事业和魅力，她问:他当年怎么会突然像变了个人一样，他回答：你用一生幸福做赌注，我怎么舍得让你输。 ,https://ww4.sinaimg.cn/large/6dcb555dtw1dhtza6tgc6j.jpg,,,2011-06-03,微博 weibo.com,0,71,647,,
5613809452604694851,iLwYRm,我想嫁给一个视我如宝贝的男人。 他会宽容我的小毛病，体贴我的不周到，他能照顾我，他能溺爱我，仿佛我是他的小宠物。 他能赶走我偶尔冒出来的坏情绪，他能抱着我睡觉，给我做枕头。 让我永远有安全感。 ,https://ww3.sinaimg.cn/large/6dcb555dtw1dhtm32x5ffj.jpg,,,2011-06-03,微博 weibo.com,0,64,586,,
5613627839925260559,iJzeow,"Sometimes, tears is sign of unspoken happiness. And smile is sign of silent pain  --------- 眼泪，有时候是一种无法言说的幸福，微笑，有时候是一种没有说出口的伤痛。 ",https://ww3.sinaimg.cn/large/6dcb555dtw1dht1pvi58ej.jpg,,,2011-06-02,微博 weibo.com,0,34,422,,
5613436602203192423,iG3meq,我们执着什么，往往就会被什么所骗；我们执着谁，常常就会被谁所伤害。所以我们要学会放下，凡事看淡一些，不牵挂，不计较，是是非非无所谓。无论失去什么，都不要失去好心情。把握住自己的心，让心境清净，洁白，安静。------ 放下不等于放弃，执着不等于坚持。 ,https://ww1.sinaimg.cn/large/6dcb555dtw1dhsg9pn6jqj.jpg,,,2011-06-02,微博 weibo.com,0,45,408,,
5613249229955635351,iEc9Qi,两男生同时向一女生表白，女生淡定道：“你们周游世界后再回来跟我说。”一男生立马收拾包裹准备出发，另一男生绕女生转了一圈，说出历史性的一句：“you are my world.”瞬间秒杀…… ,https://ww4.sinaimg.cn/large/6dcb555dtw1dhrv94q0ozj.jpg,,,2011-06-01,微博 weibo.com,0,41,231,,
5613162767965153686,iCkGvS,别人拥有的，你不必羡慕，只要努力，你也会拥有；自己拥有的，你不必炫耀，因为别人也在奋斗，也会拥有。多一点快乐，少一点烦恼，不论富或穷，地位高或低，知识浅或深。每天开心笑，累了就睡觉，醒了就微笑，闲了就发微博，赞同就转发。 ,https://ww3.sinaimg.cn/large/6dcb555dtw1dhrlk09kx3j.jpg,,,2011-06-01,微博 weibo.com,0,53,376,,
5613056862673600500,iAbyDU,世界真的很小，好像一转身，就不知道会遇见谁；世界真的很大，好像一转身，就不知道谁会消失。 ,https://ww3.sinaimg.cn/large/6dcb555dtw1dhr9og5dozj.jpg,,,2011-06-01,微博 weibo.com,0,31,242,,
5612883869976479415,iya2xI,【键盘上F1—F12的作用你都知道吗？】 天天坐在电脑面前，天天与键盘打交道，那么键盘上F1—F12的一些使用技巧你都知道吗？果断收藏吧！ ,https://ww3.sinaimg.cn/large/6dcb555dtw1dhqqa03g6ej.jpg,,,2011-05-31,微博 weibo.com,0,45,598,,
5612829182155385768,ix3730,"Nobody can go back and start a new begining, but anyone can start now and make a new ending.  -------- 没有人可以回到过去重新开始，但谁都可以从现在开始，书写一个全然不同的结局。 ",https://ww4.sinaimg.cn/large/6dcb555dtw1dhqk4yc0ibj.jpg,,,2011-05-31,微博 weibo.com,0,38,347,,
5612685180502823609,iucEmm,【罕见千年美容古方】：你知道老姜可以治斑秃吗？你知道鸡蛋和番茄冲食可以增肥吗？你知道杏仁可以除雀斑吗？一起来看看14条美容偏方吧！ ,https://ww3.sinaimg.cn/large/6dcb555dtw1dhq3zqkfxxj.jpg,,,2011-05-31,微博 weibo.com,1,47,533,,
5612505341628289178,ishU60,More smaller than their glory years of the time with the silly. ---------- 再多各自牛逼的岁月也比不上一起傻逼的时光。 ,https://ww2.sinaimg.cn/large/6dcb555dtw1dhpjtnavolj.jpg,,,2011-05-30,微博 weibo.com,0,33,335,,
5612310268500707003,iorFxK,"【牛津大学给女人提出的14条健康指南】1.远离碳酸饮料 2.别太瘦 3.不吸烟 少饮酒 4.30岁前完成生育 5.坚持负重训练 6.当心胃部赘肉 7.一年200次性生活 8.不要太干净 9.长期服用短效口服避孕药 10.喝红茶,多吃香蕉 11.服叶酸 12.避免使用激素替代治疗 13.想要孩子多晒太阳 14.当心你的处方药。 ",https://ww1.sinaimg.cn/large/6dcb555dtw1dhoxxuo4a6j.jpg,,,2011-05-30,微博 weibo.com,0,89,735,,
5611975385611761800,ijq7Je,当一个男的真正喜欢你的时候，他会主动发信息或者打电话给你，因为他很想你。他会在乎你的一举一动，因为他怕他随时会失去你。他看到你心情不好，就会来安慰你，尽管你对他发脾气，他还是忍了。他会对你说些他的秘密，甚至有些连他最好的朋友也不知道的秘密。爱的最高境界是经得起平淡的流年。 ,https://ww3.sinaimg.cn/large/6dcb555dtw1dhnwdqv490j.jpg,,,2011-05-29,微博 weibo.com,0,87,861,,
5611760826219769530,igzUsI,【挑准时间吃水果】 ①早上最宜，苹果、梨、葡萄。②餐前别吃，圣女果、橘子、山楂、香蕉、柿子。香蕉中的钾、镁含量较高，空腹吃会使血中镁量升高对心血管产生抑制作用。③ 饭后应选，菠萝、木瓜、猕猴桃、橘子、山楂。 富含大量有机酸，能增加消化酶活性，帮助消化。 ④夜宵安神，吃桂圆。 ,https://ww1.sinaimg.cn/large/6dcb555dtw1dhn8bgmwxhj.jpg,,,2011-05-28,微博 weibo.com,0,27,336,,
5611661260283772523,ifnDVU,身边的人那么多，懂自己的有几个。不要对我说，我是个好人，我很可爱，我很活泼。我只是个，会自卑，会伤心，会小心眼的普通人。 ,https://ww4.sinaimg.cn/large/6dcb555dtw1dhmx4p9fltg.gif,,,2011-05-28,微博 weibo.com,0,27,345,,
5611602646879562212,ieDYg0,【面膜伤肤5误区，你避开了吗】 如何正确敷面膜的频率，时间。选择面膜的成分...快看看吧！ ,https://ww4.sinaimg.cn/large/6dcb555dtw1dhmqktv7r6j.jpg,,,2011-05-28,微博 weibo.com,0,23,381,,
5611402557233664732,idvxzs,人最软弱的地方，是舍不得。------ 舍不得一段不再精采的感情，舍不得一份虚荣，舍不得掌声。我们永远以为最好的日子是会很长很长的，不必那么快离开。就在我们心软和缺乏勇气的时候，最好的日子毫不留情地逝去了。 ,https://ww4.sinaimg.cn/large/6dcb555dtw1dhm44xz7n3j.jpg,,,2011-05-27,微博 weibo.com,0,50,389,,
5611307204660481809,icpZ7k,柏拉图说：若爱，请深爱，如弃，请彻底，不要暧昧，伤人伤己。 柏拉图说，人生最遗憾的，莫过于轻易地放弃了不该放弃的，固执地坚持了不该坚持的。 柏拉图说，我以为小鸟飞不过沧海，是因为小鸟没有飞过沧海的勇气，十年以后我才发现，不是小鸟飞不过去，而是沧海的那一头，早已没有了等待。 ,https://ww4.sinaimg.cn/large/6dcb555dtw1dhltfwl09mg.gif,,,2011-05-27,微博 weibo.com,0,88,610,,
5611210589367042729,ibiN8O,The best friend is the silent company when you are sad and the reminder of your time together when you are apart. --- 最好的朋友是那种在你难过时，默默地陪着你，什么也不用说的人，而当他离开时，你却会怀念和他一起的时光。 ,https://ww1.sinaimg.cn/large/6dcb555dtw1dhliltc68cj.jpg,,,2011-05-27,微博 weibo.com,0,47,624,,
5611036948147557793,i9zfZG,"Life is really simple, but we insist on making it complicated. --------- 生活一直都很简单，但是我们也一直都忍不住要把它变得很复杂。 ",https://ww1.sinaimg.cn/large/6dcb555dtw1dhkz4qvebpj.jpg,,,2011-05-26,微博 weibo.com,0,18,200,,
5610981963973604826,i8p8mQ,我们执着什么，往往就会被什么所骗；我们执着谁，常常就会被谁所伤害。所以我们要学会放下，凡事看淡一些，不牵挂，不计较，是是非非无所谓。无论失去什么，都不要失去好心情。把握住自己的心，让心境清净，洁白，安静。------ 放下不等于放弃，执着不等于坚持。 ,https://ww4.sinaimg.cn/large/6dcb555dtw1dhksykdkwoj.jpg,,,2011-05-26,微博 weibo.com,1,57,543,,
5610824201228456938,i5t6wy,有时候，莫名的心情不好，不想和任何人说话，只想一个人静静的发呆；有时候，突然觉得心情烦躁，看什么都觉得不舒服，拼命想寻找一个出口；有时候，感觉自己与世界格格不入，曾经一直坚持的东西一夜间面目全非；有时候，别人突然对你说，我觉得你变了，然后自己开始百感交集！ ,https://ww2.sinaimg.cn/large/6dcb555dtw1dhkb9lukocj.jpg,,,2011-05-26,微博 weibo.com,0,42,341,,
5610654391103166705,i4kKKf,"Trust is like a paper. Once it's crumbled, it can't be perfect. -------- 人与人间的信任，就像是纸片，一旦破损，就不会再回到原来的样子。 ",https://ww3.sinaimg.cn/large/6dcb555dtw1dhjs83lrvpj.jpg,,,2011-05-25,微博 weibo.com,0,55,661,,
5610467826326993762,i3b73O,我想嫁给一个视我如宝贝的男人。 他会宽容我的小毛病，体贴我的不周到，他能照顾我，他能溺爱我，仿佛我是他的小宠物。 他能赶走我偶尔冒出来的坏情绪，他能抱着我睡觉，给我做枕头。 让我永远有安全感。 ,https://ww4.sinaimg.cn/large/6dcb555dtw1dhjjfv20udj.jpg,,,2011-05-25,微博 weibo.com,0,45,513,,
5610156780486299353,hX1vde,你忙，忘了我需要人陪；你忙，忘了我会寂寞；你忙，忘了我在等你电话；你忙，忘了你对我的承诺。但你知不知道，爱情不是等你有空的时候，再去珍惜的。 ,https://ww1.sinaimg.cn/large/6dcb555dtw1dhi8ex1no7j.jpg,,,2011-05-24,微博 weibo.com,0,40,339,,
5610123941164838555,hWdH8o,【学会每天问自己10个问题】1、我拥有什么？2、我为什么感到自豪？3、我应对什么心存感激？4、我怎样才能充满活力？5、我今天能解决什么问题？6、我能抛下过去的包袱吗？7、我怎么换个角度看待问题？8、我怎样过好今天？9、今天我要拥抱谁？10、我现在就开始行动？问，只为审视自我，完善自我。 ,https://ww1.sinaimg.cn/large/6dcb555dtw1dhi4qdtrf4j.jpg,,,2011-05-24,微博 weibo.com,1,59,537,,
5610100894386130629,hVAMyI,【TVB剧里的英文插曲】 总有那么几首是你喜欢的！ ,https://ww2.sinaimg.cn/large/6dcb555dtw1dhi259lvu8j.jpg,,,2011-05-24,微博 weibo.com,0,59,666,,
5609908497026622047,hTxSWQ,Save your heart for someone who cares. ------ 为了某个在乎你的人，请节约你的真心！ ,https://ww2.sinaimg.cn/large/6dcb555dtw1dhhgkj51zmj.jpg,,,2011-05-23,微博 weibo.com,0,40,387,,
5609728460579740660,hQ9XaY,当朋友忽略你时，不要伤心，每个人都有自己的生活，谁都不可能一直陪你。 ,https://ww2.sinaimg.cn/large/6dcb555dtw1dhgwdfrjg8j.jpg,,,2011-05-23,微博 weibo.com,0,121,823,,
5609503262569313263,hN981G,【告诉你C盘里的每个文件夹都是干什么用的】 了解以后，就不要再误刪一些重要的文件夹了！ ,https://ww1.sinaimg.cn/large/6dcb555dtw1dhg74baeeoj.jpg,,,2011-05-22,微博 weibo.com,0,57,783,,
5609378201704969000,hKjAFy,"If you're brave enough to say GOODBYE, life will reward you with a new HELLO. ---- 只要你勇敢地说出再见，生活一定会赐予你一个新的开始。 ",https://ww3.sinaimg.cn/large/6dcb555dtw1dhft37pborj.jpg,,,2011-05-22,微博 weibo.com,0,75,646,,
5609051603806086916,hH3ktk,【10个你可能不知道的小众网站！】 需要的童鞋果断收藏！ ,https://ww2.sinaimg.cn/large/6dcb555dtw1dhesgne521j.jpg,,,2011-05-21,微博 weibo.com,0,127,1659,,
5608994124256034365,hFCo34,【12星座外遇几率】 白羊座：★★★★★；金牛座：★；双子座：★★★★★；巨蟹座：☆；狮子座：★★★；处女座：★★；天秤座：★；天蝎座：★；射手座：★★★★★；摩羯座：★；水瓶座：★★★★★；双鱼座：★★★★★。你是··· ,https://ww1.sinaimg.cn/large/6dcb555dtw1dhelz66a0kj.jpg,,,2011-05-21,微博 weibo.com,0,141,743,,
5608652996482525892,hAkMlO,【12部让你笑喷的电影，开心一下吧！】 《神探飞机头》《我盛大的同志婚礼》《幸运库克》《校园卧底》《我的野蛮老师》《美女也烦恼》《疯狂的石头》《谋杀快乐》《少儿不宜》《我为玛丽狂》《美国派》《偷天情缘》。提示：吃饭喝水的时候勿看，小心噎着，本人因看《神探飞机头》差点儿进医院··· ,https://ww1.sinaimg.cn/large/6dcb555dtw1dhdjqzia5cj.jpg,,,2011-05-20,微博 weibo.com,0,131,1508,,
5608629399931016193,hzELPT,【童鞋们，这5个文件夹要定时清理！提升内存！】 如果有一天你发现你的硬盘空间越来越小了，是不是会感觉到莫名其妙，开始怀疑是中病毒了还是怎样。 一定记得到这5个文件夹看看，是不是已经塞满了好多垃圾！ ,https://ww1.sinaimg.cn/large/6dcb555dtw1dhdh3yhus6j.jpg,,,2011-05-20,微博 weibo.com,0,95,1147,,
5608306160696784616,hv1ahw,【女孩子应该做的一些事】 1、想办法努力挣钱，而不是如何省钱；2、喜欢的东西自己买，不要指望别人送；3、不要认为找个有钱男人就什么都有了；4、真正看中的东西就买，不要借钱；5、银行卡的密码不要用男友的生日；6、永远不会再有第二个男人像爸爸这样爱你，所以最爱的男人当然是爸爸。 ,https://ww4.sinaimg.cn/large/6dcb555dtw1dhcgunnkcdj.jpg,,,2011-05-19,微博 weibo.com,0,44,333,,
5607959415089528575,hqyU6s,【每天喝水的正确时间】 第一杯水:6:30（排毒又养颜）；第二杯水:8:30（体贴又健康）；第三杯水:11:00（解乏又放松）；第四杯水:12:50（减负又减肥）；第五杯水:15:00（提神又醒脑）；第六杯水:17:30（消化又吸收）；第七杯水:22:00（解毒，排泄，消化增进血液循环）。 ,https://ww1.sinaimg.cn/large/6dcb555dtw1dhbdys56juj.jpg,,,2011-05-18,微博 weibo.com,0,72,625,,
5607876397679417053,hpeWy3,【你身体最需要哪种水果】 1.过度用脑——香蕉；2.染发烫发——鳄梨；3.过度用眼——番木瓜；4.牙龈出血——猕猴桃；5.长期吸烟——葡萄；6.肌肉拉伤——菠萝；7.预防皱纹——芒果；8.脚气困扰——柳橙。经常上微博的人，长时间盯着电脑屏幕，过度用眼，维生素A大量消耗，得吃番木瓜补充哦！ ,https://ww3.sinaimg.cn/large/6dcb555dtw1dhb4njo9tej.jpg,,,2011-05-18,微博 weibo.com,0,94,918,,
5607640161586100264,hnrMf7,我没有很想你，只是在早上醒来时，看看有没有你发来信息和未接来电； 我没有很想你，只是把你来电调成唯一的铃音； 我没有很想你，只是在听歌时，被某句歌词击中，脑中出现短暂的空白； 我没有很想你，只是想看看你的样子，听听你的声音； 我没有很想你，只是每次醒来时，总想能看到你的身影。 ,https://ww1.sinaimg.cn/large/6dcb555dtw1dhae5mqe19j.jpg,,,2011-05-17,微博 weibo.com,0,44,398,,
5607529626302709659,hmjuZc,【最美的笑】 1.被人误解的时候微微一笑，是一种素养；2.受委屈的时候坦然一笑，是一种大度；3.吃亏的时候开心一笑，是一种豁达；4.无奈的时候达观一笑，是一种境界；5.危难的时候泰然一笑，是一种大气；6.被轻蔑的时候平静一笑，是一种自信；7.失恋的时候轻轻一笑，是一种洒脱。 ,https://ww1.sinaimg.cn/large/6dcb555dtw1dha1rehzf0j.jpg,,,2011-05-17,微博 weibo.com,0,107,773,,
5607132891585965118,hiyMEu,【最般配的星座情侣】 很准哦~有男朋友/女朋友的快来看看，你们的星座是否最般配；还没推销出去的记得要找那个最合适的哦~ ,https://ww1.sinaimg.cn/large/6dcb555dtw1dh8t9ledukj.jpg,,,2011-05-16,微博 weibo.com,0,86,702,,
