id,bid,正文,原始图片url,视频url,位置,日期,工具,点赞数,评论数,转发数,话题,@用户
3457681182337055,yocya9NYr,老师提问学生；人生最高的境界是什么？学生答；能拿沙特的工资，住英国的房子，戴瑞士的名表，娶上韩国的女人，包养日本的二奶，做泰国的按摩，开德国的轿车，坐美国的飞机，喝法国的红酒，吃澳洲的海鲜，抽古巴的雪茄，买俄罗斯的别墅，老师批语：啰嗦，你不就想当个中国干部嘛！   ,https://ww1.sinaimg.cn/large/6dcb555djw1du0eb4vwrkj.jpg,,,2012-06-16,小鸟定时,0,31,133,,
3457324674544078,yo3h9j47A,我相信，真正在乎我的人，是不会被别人抢走的。无论是友情，还是爱情。    ,https://ww4.sinaimg.cn/large/6dcb555djw1dtz9d66h4ij.jpg,,,2012-06-15,小鸟定时,0,7,102,,
3456852802995512,ynR04czgI,感动得一塌糊涂的话语：1. 我不怕下地狱，我怕的是地狱里没有你。2. 只要你要，只要我有。3. 即使全世界都背叛你，我也会站在你身边背叛全世界。4. 我们的爱情好像两个人喝酒，我干杯！你随意。5. 我不需要什么未来，你就是我的未来。6. 全天下都可以是你的，但你只能是我的。   ,https://ww3.sinaimg.cn/large/6dcb555djw1dtxr66kmmyj.jpg,,,2012-06-14,小鸟定时,0,2,91,,
3456835069343000,ynQxsDcxy,#选择体# #优雅自驾#当人生遇到困难和挫折时候，有人选择破罐子破摔，有人选择苦苦追求甜甜的享受。 或许可以试着去旅游感受人土风情，调整自己的心态，在乡间的小路上， 在周庄的小镇里，在繁华的南京路上，也可以来到网页链接 环游世界，还有意想不到的礼物。 ,https://ww1.sinaimg.cn/large/6dcb555dtw1dtxp16aizjj.jpg,,,2012-06-14,微博 weibo.com,0,4,340,"选择体,优雅自驾",
3456588339465413,ynK7vDInX,【送给自己的5句话】 1，再难也要坚持。2，再好也要淡泊。3，再差也要自信。4，再多也要节省。5，再冷也要热情。 ,https://ww4.sinaimg.cn/large/6dcb555djw1dtwwsrht1xj.jpg,,,2012-06-13,小鸟定时,0,10,105,,
3456450560840153,ynGxi3wyR,我不贪心，也不等待。我找到感觉对的人，就决定了。我不喜欢左顾右盼，我的时间有限，我想用有限的时间跟另一个人过Better life，而不是用我的Life，去找一个Better的人。   ,https://ww2.sinaimg.cn/large/6dcb555djw1dtwgz3qbzkj.jpg,,,2012-06-13,小鸟定时,0,7,92,,
3456177083800115,ynzqcfWAb,人都是逼出来的。一个人，如果不逼自己一把，根本不会知道自己有多优秀。每个人都有潜能的，所以当面对压力时，要相信自己，一切都能处理得好。人只有压力才会有动力，穷者思变，时世造英雄，逼急了好汉可以上梁山。一个人的成长，必须通过磨炼。有时候，必须对自己狠一次，否则永远也活不出自己。    ,https://ww3.sinaimg.cn/large/6dcb555djw1dtvlkejlosj.jpg,,,2012-06-12,小鸟定时,0,11,109,,
3455776288503185,ynoZKzG49,因为你，我每天很晚入睡，只为了等你，和你说说话；因为你，我会时不时拿手机，看有没有你的未接来电，有没有你的短信；因为你，我会莫名的生气，莫名的无理取闹；因为你，我变得很纠结，变得不知如何是好。你的一句话可以改变我一天的心情，你的一条短信可以左右我一天的情绪… 一切都只是因为你…   ,https://ww1.sinaimg.cn/large/6dcb555djw1dtubja24rmj.jpg,,,2012-06-11,小鸟定时,0,3,104,,
3455462525253731,yngPGm2JB,狗很傻，一根骨头它就认定你爱它，死心塌地对你摇尾巴；猫很倔，万千宠爱有时也留不住它。在猫的眼里，狗花心，谁对它好谁就是主人；在狗的眼里，猫绝情，一次欺凌会悄悄恨你一辈子。猫不懂狗，狗其实不是花心，是善良；狗也不懂猫，猫不是不会爱，是不敢爱。猫狗如此，男女亦然。    ,https://ww1.sinaimg.cn/large/6dcb555djw1dttbi0ng23j.jpg,,,2012-06-10,小鸟定时,1,11,108,,
3455103581210990,yn7uK5526,【哪个最让你觉得开心】 1、下雪后踩出第一个脚印。2、一下子将废物扔进了垃圾箱，太准了；3、电话响了，拿起听筒发现正是刚才在想的人；5、坐公车一直是绿灯，不堵车；5、摸摸口袋，竟然发现里面有钱；6、看到这条据说10秒内转走，幸福不断，好运连连财源滚滚。。。    ,https://ww4.sinaimg.cn/large/6dcb555djw1dts69y9bhxj.jpg,,,2012-06-09,小鸟定时,0,4,89,,
3454310933069594,ymMShcSxA,【为人之道】1、有人缘则有福，结好人缘就是最大修行。2、君子为目标，小人为目的。3、得理应饶人，理直应气和。4、欣赏别人，就是庄严自已。原谅别人就是善待自已。5、人为善，福虽未至，祸已远离；人为恶，祸虽未至，福已远。6、待人退一步，爱人宽一寸。7、改变自已是自救，影响别人是救人。    ,https://ww3.sinaimg.cn/large/6dcb555djw1dtpn8pl454j.jpg,,,2012-06-07,小鸟定时,0,7,93,,
3454236979107136,ymKWZCdbi,这是一尊吉祥龙，1分钟内转发此龙图，龙年好运连连，福气冲天！财源滚滚！转个吉祥吧！！！    ,https://ww2.sinaimg.cn/large/6dcb555djw1dtpeqxl1wrg.gif,,,2012-06-07,小鸟定时,0,11,137,,
3453930631118148,ymCYT4GSE,我几乎从来不生气，因为我认为没必要，有问题就去解决，不要让别人的错误影响自己。这是我大多时候感到快乐的秘诀。但是，我不生气，不代表我没脾气。我不计较，不代表我脾气好。如果你非要触摸我的底线，我可以告诉你，我并非善良。    ,https://ww3.sinaimg.cn/large/6dcb555djw1dtofkc579bj.jpg,,,2012-06-06,小鸟定时,0,3,76,,
3453599906387809,ymunsqNLb,对自己的女人要宠，对别人的女人要冷。你疼她关心她，她就温柔如水；你怪她冷落她，她就坚硬如冰；你对她不冷不热，她自对你不温不火。别总怪女人现实，女人之所以现实，只因经历过爱情的伤、生活的磨砺。好女人都是宠出来的，只有懂她的男人，才会知道女人为何现实，才配拥有她。姑娘们，同意吗？    ,https://ww3.sinaimg.cn/large/6dcb555djw1dtndky4pimj.jpg,,,2012-06-05,小鸟定时,0,7,89,,
3453345001546927,ymnKk6uqr,【一流极品女人的八大特征】 一.有大女人素质，有小女人情怀；二.大事清楚，小事糊涂；三.自强自立；四.能温柔似水，也能坚强如钢；五. 喜欢孩子；六.上得厅堂，入得厨房；七.爱美，会美；八.拥有浪漫情怀。   ,https://ww2.sinaimg.cn/large/6dcb555djw1dtmkb0o0sej.jpg,,,2012-06-04,小鸟定时,0,5,97,,
3453296696400830,ymmupqR9c,风靡全球的的水宝宝，偶也忍不住败了一瓶。擦上很清爽，一点也不油腻～不怕晒黑啦～好大一瓶估计这个夏天够用啦！！ 正品代购65元还买二送三，分享给需要的MM～地址在这里：网页链接 ,https://ww2.sinaimg.cn/large/6dcb555dgw1dtmer87rzqj.jpg,,,2012-06-04,微博 weibo.com,0,2,4,,
3453141167045519,ymirytyRp,没有结局的感情，总要结束；不能拥有的人，总会忘记。人生没有永远的伤痛，再深的痛，伤口总会痊愈。人生没有彩排，好好珍惜现在，把握生命中的一分一秒。人生没有如果，过去的不再回来，回来的不再完美。没有过不去的坎，只有过不去的人。慢慢地，不再流泪；慢慢地，一切都会过去。    ,https://ww2.sinaimg.cn/large/6dcb555djw1dtlww9oiorj.jpg,,,2012-06-04,小鸟定时,0,2,93,,
3452939349578784,ymdc2EbSw,【网上传幸福女人的新特征】 一、圆脸(对人际关系及财运都有加分)；二、下巴丰满（可能会拥有两个以上的房产）；三、臀大(代表有财运、长寿)；四、腿不能细（腿长脚瘦，奔走不停，苦相也）；五、小腹稍有脂肪(是一种福寿之相)。六、微胖的女孩子 性格开朗、乐观大方（工作有前途、事业有发展）    ,https://ww4.sinaimg.cn/large/6dcb555djw1dtl9pu3a4zj.jpg,,,2012-06-03,小鸟定时,0,7,105,,
3452450893263880,ym0uddH5e,女生只有在自己喜欢的男生面前可以变成女生，其他时候必须像个爷们儿一样去奋斗！   ,https://ww2.sinaimg.cn/large/6dcb555djw1dtjpmavlrdj.jpg,,,2012-06-02,小鸟定时,0,5,76,,
3452150623372927,ylSFUe9s3,有时候，我们活得很累，并非生活过于刻薄，而是我们太容易被外界的氛围所感染，被他人的情绪所左右。行走在人群中，我们总是感觉有无数穿心掠肺的目光，有很多飞短流长的冷言，最终乱了心神，渐渐被缚于自己编织的一团乱麻中。其实你是活给自己看的，没有多少人能够把你留在心上。    ,https://ww4.sinaimg.cn/large/6dcb555djw1dtir4tp4hij.jpg,,,2012-06-01,小鸟定时,0,8,103,,
3452110962364382,ylRDW9V5c,风靡全球的的水宝宝，偶也忍不住败了一瓶。擦上很清爽，一点也不油腻～不怕晒黑啦～好大一瓶估计这个夏天够用啦！！ 正品代购65元还买二送三，分享给需要的MM～地址在这里：网页链接 ,https://ww4.sinaimg.cn/large/6dcb555dgw1dtimkhn6j5j.jpg,,,2012-06-01,微博 weibo.com,0,1,3,,
3451868728376174,ylLlez91A, 药师佛  ，一分钟内转发请过去，保自己及家人身体健康，延年益寿。。。    ,https://ww3.sinaimg.cn/large/6dcb555djw1dthurbgkgdj.jpg,,,2012-05-31,小鸟定时,0,15,253,,
3451461528683561,ylAKsAqZr,2012年桃花运一共有多少次？ 双子（3次）天秤（6次） 金牛（8次）天蝎（2次）射手（9次）水瓶（无，注定单身） 双鱼（负数一次）白羊座（5次） 摩羯座（无，缺爱） 巨蟹：（没人爱） 处女（最多，一直未被超越） 狮子：（7次）巫婆说这条心情具有魔力、看完不转者、一辈子不走桃花运…    ,https://ww1.sinaimg.cn/large/6dcb555djw1dtgjzqaretj.jpg,,,2012-05-30,小鸟定时,0,9,141,,
3451171429350305,yltcyDern,人生如梦，岁月无情。蓦然回首，才发现人活着是一种心情。穷也好，富也好，得也好，失也好。一切都是过眼云烟。不论昨天、今天、明天，能豁然开朗就是美好的一天。不论亲情、友情、爱情，能永远珍惜就是好心情。   ,https://ww4.sinaimg.cn/large/6dcb555djw1dtfmoan628j.jpg,,,2012-05-29,小鸟定时,0,7,62,,
3451042945272150,ylpRkm7wG,"Sometimes you have to smile and act like everything is okay, hold back the tears and walk away. -------- 有时候你不得不笑，表现得好像一切OK，然后，忍着眼泪走开。   ",https://ww2.sinaimg.cn/large/6dcb555djw1dtf7x2wcwtj.jpg,,,2012-05-29,小鸟定时,0,7,71,,
3451030665030364,ylpxwl6CU,"秒杀所有的智能手机 HTC首款搭载720p HD屏幕的Android智能手机耀世发布--它不仅仅是手机屏幕高端,双核1.5G处理器, 1G RAM+4G ROM,Beats高端魔音耳机的帮忙,再加上对LTE 4G网络的支持, 都令G25成为了HTC的年度大作。网页链接 ",https://ww4.sinaimg.cn/large/6dcb555dgw1dtf6hpiaeej.jpg,,,2012-05-29,微博 weibo.com,0,3,4,,
3450979246426064,ylocAqXIc,【一流极品女人的八大特征】 一.有大女人素质，有小女人情怀；二.大事清楚，小事糊涂；三.自强自立；四.能温柔似水，也能坚强如钢；五. 喜欢孩子；六.上得厅堂，入得厨房；七.爱美，会美；八.拥有浪漫情怀。   ,https://ww4.sinaimg.cn/large/6dcb555djw1dtf0lpsvdqj.jpg,,,2012-05-29,小鸟定时,0,6,94,,
3450787944085163,ylje2h8JJ,700年前一天，北威尔士王子出去打猎，留狗在家看护婴儿。王子回来后，看见血染被毯，却不见婴儿。而狗呢，正舔着嘴边的鲜血，高兴地望着他。王子大怒，抽刀刺入狗腹。狗惨叫一声，惊醒了睡熟在血迹斑斑的毯子下面的婴儿。这时，王子才发现屋角躺着一条死去的恶狼。—— 很多错误，都是在冲动时做出的。 ,https://ww3.sinaimg.cn/large/6dcb555djw1dteemrlnh6j.jpg,,,2012-05-28,小鸟定时,0,4,127,,
3450679924693110,ylgpOjGTk,心是个口袋，什么都不装时叫心灵，装一点时叫心眼，多装时叫心计，装更多时叫心机，装得太多就叫心事。我们常常执著于近在咫尺的功利，执著于绚丽的生活，执著于没有结果的爱情，很容易陷入不堪重负的状态。其实，放下一点，就会得到更多；会放下的人，才是真正懂得生活的人，才会活得更洒脱.    ,https://ww2.sinaimg.cn/large/6dcb555djw1dte2857tfij.jpg,,,2012-05-28,皮皮时光机,0,3,80,,
3450612735902376,yleFroLtC,佛说：今生种种皆是前生因果。佛说：一切有为法，尽是因缘合和，缘起时起，缘尽还无，不外如是。佛说：凡事都是有定数的，不能强求。佛说：握紧拳头，你的手里是空的；伸开手掌，你拥有全世界。佛说：千灯万盏，不如心灯一盏。佛说：人就是苦今生修来生。佛说：苍生难渡。   ,https://ww4.sinaimg.cn/large/6dcb555djw1dtduichrg8j.jpg,,,2012-05-28,皮皮时光机,0,2,72,,
3450599951741114,ylekP7iWu,谁说阳光与完美肌肤不可兼得？要阳光，要清爽，更要水灵灵的完美肌肤！炎炎夏日不可怕，因为我有美国水宝宝防晒喷雾！ 小女人夏天出门首选护肤品，[阳光]再大的太阳都不会被晒黑，满满一瓶，防晒整个夏天！美国进口，假一赔万！官方正品购买地址： ,https://ww4.sinaimg.cn/large/6dcb555dgw1dtdt0u5ickj.jpg,,,2012-05-28,微博 weibo.com,0,1,4,,
3450427242859568,yl9QgbZU4,是什么偷走了中国人的快乐：第一、缺乏信仰。第二、总是和别人比较。第三、对美好的事物不感动。第四、不懂得施舍。第五、不知足。第六、焦虑。第七、压力大、标准高。第八、不敢坚持做自己。第九、得失心强，就是患得患失。----- 吕宁思 ,https://ww1.sinaimg.cn/large/6dcb555dgw1dtd974ypnaj.jpg,,,2012-05-27,微博 weibo.com,0,9,130,,
3450396389647086,yl92uEtEa,谁说阳光与完美肌肤不可兼得？要阳光，要清爽，更要水灵灵的完美肌肤！炎炎夏日不可怕，因为我有美国水宝宝防晒喷雾！ 小女人夏天出门首选护肤品，[阳光]再大的太阳都不会被晒黑，满满一瓶，防晒整个夏天！美国进口，假一赔万！官方正品购买地址： ,https://ww4.sinaimg.cn/large/6dcb555dgw1dtd5npzdrrj.jpg,,,2012-05-27,微博 weibo.com,0,1,3,,
3450256790548998,yl5pl2iOO,儿子被爸爸修理了，跑去找妈妈诉苦：“妈妈，有人打你儿子你会怎样？” 妈妈：“我会打他的儿子报仇！” 儿子：“……………”    ,https://ww4.sinaimg.cn/large/6dcb555djw1dtcpmob1pbj.jpg,,,2012-05-27,皮皮时光机,0,5,86,,
3450070080995113,yl0yc4aSd,想要忘记一段感情，方法永远只有一个：时间和新欢。要是时间和新欢也不能让你忘记一段感情，原因只有一个：时间不够长，新欢不够好。--- 张小娴    ,https://ww2.sinaimg.cn/large/6dcb555djw1dtc46pubtnj.jpg,,,2012-05-26,皮皮时光机,0,2,75,,
3450014699494004,ykZ6RDPP6,有一天女孩问男孩：ABCDEFG是什么意思？男孩回答：A boy can do everything for girl. 女孩很感动。有人告诉她别忘了后面还有HIJK ——He is just kidding! 女孩回答：就算他骗我也没关系，后面还有LMNOPQ——Love must need our patience.    ,https://ww2.sinaimg.cn/large/6dcb555djw1dtbxtqgyszj.jpg,,,2012-05-26,皮皮时光机,0,6,89,,
3449958135257014,ykXDDm3Ay,骄阳如火，和老公一起去三亚小小浪漫一下，还好用了小S推荐的美国水宝宝Coppertone防晒乳 效果一级棒，一点不油腻。半个下来 皮肤还是白白的，一点也没晒黑噢~再看老公，已成了黑包公了~ 就是在这家买的58元包邮呦！戳这里>>网页链接 ,https://ww2.sinaimg.cn/large/6dcb555dgw1dtbrbqyabdj.jpg,,,2012-05-26,微博 weibo.com,0,2,4,,
3449913981830454,ykWuq7Gbs,1、数学不好的人都比较爱笑，因为没有数学就没有烦恼。2、数学不好的人都比较天真浪漫，比较感性。3、数学不好的人都比较幽默，生活充满乐趣，感情和想象力都比较丰富。4、数学不好的人都比较直爽，实在，不会拐弯抹角。5、数学不好的人长的都比较漂亮。 你的数学好吗？    ,https://ww2.sinaimg.cn/large/6dcb555djw1dtbm9bwmlzj.jpg,,,2012-05-26,皮皮时光机,0,8,89,,
3449882902059793,ykVGi8DQt,炎炎夏日不可怕，因为我有美国水宝宝防晒喷雾！ 小女人夏天出门首选护肤品，[阳光]再大的太阳都不会被晒黑，满满一瓶，防晒整个夏天！ 美国进口，假一赔万！官方正品购买地址： ,https://ww2.sinaimg.cn/large/6dcb555dgw1dtbiobcq9tj.jpg,,,2012-05-26,微博 weibo.com,0,1,4,,
3449694196103545,ykQLVpBOh,"Never so sensible, will never understand love. ———— 永远那么理智，就永远不会懂得爱情了。   ",https://ww4.sinaimg.cn/large/6dcb555djw1dtax0m6zp2j.jpg,,,2012-05-25,皮皮时光机,0,3,92,,
3449180066569858,ykDoGrz7s,假如，你想要一件东西，就放它走。它若能回来找你，就永远属于你；它若不回来，那根本就不是你的。   ,https://ww1.sinaimg.cn/large/6dcb555djw1dt99yx1a5gj.jpg,,,2012-05-24,皮皮时光机,0,6,78,,
3449151079669245,ykCDVEzpz,炎炎夏日不可怕，因为我有美国水宝宝防晒喷雾！ 小女人夏天出门首选护肤品，[阳光]再大的太阳都不会被晒黑，满满一瓶，防晒整个夏天！店家承诺美国进口，假一赔万！分享官方购买地址：网页链接 ,https://ww2.sinaimg.cn/large/6dcb555dgw1dt96m71idxj.jpg,,,2012-05-24,微博 weibo.com,0,2,5,,
3448969508463163,ykxV4zvED,"I give you my heart, you are deceived me -------- 世界上最心痛的感觉，不是失恋，而是我把心给你的时候，你却在欺骗我。    ",https://ww1.sinaimg.cn/large/6dcb555djw1dt8lsd6cmrj.jpg,,,2012-05-23,皮皮时光机,0,5,112,,
3448962449555607,ykxJGE5QH,炎炎夏日不可怕，因为我有美国水宝宝防晒喷雾！ 小女人夏天出门首选护肤品，再大的太阳都不会被晒黑，满满一瓶，防晒整个夏天！官方正品购买地址：网页链接 ,https://ww1.sinaimg.cn/large/6dcb555dgw1dt8kykvnoqj.jpg,,,2012-05-23,微博 weibo.com,0,2,4,,
3448881440515902,ykvD22ad0,你总是天真地以为，你把我看得很透彻。其实，我把快乐挂在脸上，把伤痛藏在心里，我的表情可以表达千种心情，但那最伤最痛的部分，不是你轻易就能看得到的。你说的无心的一句话，做的不经意的一件事，或许就是致我伤痛的利刃。因为在乎，所以受伤。    ,https://ww1.sinaimg.cn/large/6dcb555djw1dt8bo8dkfsj.jpg,,,2012-05-23,皮皮时光机,0,5,85,,
3448592448813536,yko6UAYNO,【英国一项调查显示，2000位受访者认为以下十项事物最快乐】：1.欢笑；2.和知心朋友共进美食；3.拥抱；4.太阳照在脸上的感觉；5.读一本好书；6.沿海滩漫步；7.盖干净的床单入睡；8.看日落；9.翻阅老照片追忆往昔；10.闻到刚修剪过的青草的味道。——人生最美好的瞬间其实都是免费的。    ,https://ww2.sinaimg.cn/large/6dcb555djw1dt7ehe1o2qj.jpg,,,2012-05-22,皮皮时光机,0,5,100,,
3448569166197597,yknvmq0hf,炎炎夏日不可怕，因为我有美国水宝宝防晒喷雾！ 小女人夏天出门首选护肤品，再大的太阳都不会被晒黑，满满一瓶，防晒整个夏天！美国进口，假一赔万！官方正品代购地址：网页链接 ,https://ww2.sinaimg.cn/large/6dcb555dgw1dt7bsu3xnzj.jpg,,,2012-05-22,微博 weibo.com,0,2,5,,
3448262403508780,ykfwAeINe,如果真有那种一拍即合的爱情就好了，不需要暧昧的你来我往，不需要花太多时间去培养，我已经没有力气去玩猜测的游戏，因为我怕会受伤害。” 我们想要的，大概就是那种，你看一眼就知道，是这个人，没错了。 --- 舒淇    ,https://ww4.sinaimg.cn/large/6dcb555djw1dt6ckstafvj.jpg,,,2012-05-21,皮皮时光机,0,5,68,,
3448101576911420,ykblbsZYw,有事情是要说出来的，不要等着对方去领悟，因为对方不是你，不知道你想要什么，等到最后只能是伤心和失望，尤其是感情。——麦兜   ,https://ww3.sinaimg.cn/large/6dcb555djw1dt5u3uyixfj.jpg,,,2012-05-21,皮皮时光机,0,9,105,,
3448079460174856,ykaLw0Jug,谁说阳光与完美肌肤不可兼得？[阳光]要阳光，要清爽，更要水灵灵的完美肌肤！炎炎夏日不可怕，因为我有美国水宝宝防晒喷雾！ 小女人夏天出门首选护肤品，再大的太阳都不会被晒黑，小小一瓶，美好整个夏天！官方正品代购地址：网页链接 ,https://ww3.sinaimg.cn/large/6dcb555dgw1dt5rk0jp8hj.jpg,,,2012-05-21,微博 weibo.com,0,2,5,,
3447874740608148,yk5rk2ycQ,如果开心和悲伤时，首先想到的都是同一个人，那就最完美，如果开心和悲伤时，首先想到的不是同一个人，你应该选择想和ta共度悲伤的那个，人生本来是苦多於乐。开心有太多人可以和你分享，不一定是情人，悲伤却不是很多人可和你分担。 你愿意把悲伤告诉他，他才是你最想亲近珍惜的人—— 张小娴    ,https://ww4.sinaimg.cn/large/6dcb555djw1dt5420cramj.jpg,,,2012-05-20,皮皮时光机,0,4,74,,
3447504949766928,yjVOSEYP6,不同的人，为你做同一件事，你会感到天壤之别。因为我们在意的，往往不是人做的事，而只是做事的人。爱在心里，绝口不提爱你，不是不爱，而是因为太爱。太爱，所以怕伤害；太爱，所以甘愿受伤害；太爱，所以容易错过爱。 走得最急的，都是最美的风景；伤得最深的，也总是最真的感情。    ,https://ww3.sinaimg.cn/large/6dcb555djw1dt3xl2rpojj.jpg,,,2012-05-19,皮皮时光机,0,7,97,,
3447149985966550,yjMAmp2aG,金菩提叶，一分钟内转发，霉运尽除，好运相伴！ ,https://ww2.sinaimg.cn/large/6dcb555dgw1dt2stb7jiij.jpg,,,2012-05-18,微博 weibo.com,0,6,130,,
3446695033732292,yjAKzfEWg,人不一定信佛，但一定要有佛性，佛性，即“自觉”，和“觉他”的德行。佛性，最讲一个“善”字；禅境，最讲一个“淡”字。 用佛待人，自己即佛；用佛性悟人，人可兼佛。善心，点亮心灯；慧心；使心灯长明。善良的人，往往可以逢凶化吉；觉慧的人，常常可以化险为夷。    ,https://ww3.sinaimg.cn/large/6dcb555djw1dt1ckfoq6ng.gif,,,2012-05-17,皮皮时光机,0,7,98,,
3446099224327135,yjlfAi9Gv,【心态决定你人生】  1.再烦:也别忘记微笑；2.再急:也要注意语气；3.再苦:也别忘坚持；4.再累:也要爱自己；5.低调做人你会一次比一次稳健；6.高调做事你会一次比一次优秀；7.成功的时候不要忘记过去；8.失败的时候不要忘记还有未来；9.有望得到的要努力;10.无望得到的不介意 则无论输赢姿态都会好看。 ,https://ww2.sinaimg.cn/large/6dcb555djw1dszg51gq37g.gif,,,2012-05-15,皮皮时光机,0,5,97,,
3445728221557419,yjbBc6x9F,凌晨四点的哈佛大学图书馆。——真正的精英并不是天才。 压力不是有人比你努力，而是比你牛叉几倍的人依然比你努力。    ,https://ww2.sinaimg.cn/large/6dcb555djw1dsy9j504iej.jpg,,,2012-05-14,皮皮时光机,0,12,67,,
3445373501118910,yj2n44H4W,母亲节，祝天下妈妈永远健康美丽：「感谢妈妈」的十月怀胎，「感谢妈妈」的多年养育，「感谢妈妈」的嘘寒问暖，「感谢妈妈」的严加教育！「感谢妈妈」的每一顿饭，「感谢妈妈」的每一件衣，「感谢妈妈」温情的抚摸，「感谢妈妈」永远的牵挂，「感谢妈妈」给我一个家。   ,https://ww2.sinaimg.cn/large/6dcb555djw1dsx4sio2n9j.jpg,,,2012-05-13,皮皮时光机,0,1,38,,
3444642827922840,yiJmyxf5K,我想你了，可是我不能对你说，就像开满梨花的树上，永远不可能结出苹果。我想你了，可是我不能对你说，就像高挂天边的彩虹，永远无人能够触摸。我想你了，可是我不能对你说，就像火车的轨道，永远不会有轮船驶过。我想你了，可我，真的不能对你说。怕只怕，说了，对你，也是一种折磨。 ,https://ww1.sinaimg.cn/large/6dcb555dgw1dsusvb6q98j.jpg,,,2012-05-11,微博 weibo.com,0,13,106,,
3444528122320909,yiGny9JM1,男人，要有一个男人的样子，利利索索痛痛快快，不要扭扭捏捏婆婆妈妈。男人，要保护女人尊重女人，不要强迫她做不愿意的事；不要打女人，无论她伤过你还是骗过你。男人，要说话算话，吐出去的东西再咽回来，自己都觉得恶心。男人，可以不帅，但一定要有风度修养内涵底蕴。男人，可以丑，但决不能丑陋。 ,https://ww3.sinaimg.cn/large/6dcb555djw1dsufp99nj4g.gif,,,2012-05-11,皮皮时光机,0,4,97,,
3444265638578850,yizybzZKy,有时候，夜深人静，突然觉得不是睡不着，而是固执地不想睡。有时候，莫名的心情不好，不想和任何人说话，只想一个人静静的发呆。有时候，很想放纵自己，希望自己彻彻底底醉一次，醒来后就能把什么都忘记。------人累了就休息，心累了就淡定。丢了自己，只能慢慢捡回来。    ,https://ww4.sinaimg.cn/large/6dcb555djw1dstlk0506oj.jpg,,,2012-05-10,皮皮时光机,0,8,107,,
3443905913300333,yiqbZdQzb,这是一幅西藏古老而神秘的福寿绵长符。见者得福增寿！九九八十一秒内关注转发者，更是能量加倍，福报长久！ 母亲节快要到了！ 为父母转发吧！    ,https://ww1.sinaimg.cn/large/6dcb555djw1dssg8puev0j.jpg,,,2012-05-09,皮皮时光机,0,8,158,,
