id,bid,正文,原始图片url,视频url,位置,日期,工具,点赞数,评论数,转发数,话题,@用户
4379027668400886,Hx9RYzfsa,[2019暑假？✈️]🇹🇷 DAY 7 Göreme格雷梅这边的人目前遇到的都很热情友善。物价低天气好，吃的也还不错！！唯一不好的是尘土过多晚上出去兜风体会到了什么叫”灰头土脸”。今天上午从伊斯坦布尔坐飞机到了格雷梅，到了之后洗澡洗头换衣服，下午五点半左右才出门。租了一辆老爷车，司机带去了玫瑰谷和爱情谷。本来还要看日落的，结果云层太厚没看到晚上太阳落山之后特别凉快，吹着风超级超级舒服因为住在洞穴里所以没有空调电扇也完全不热土耳其真香！！！！#土耳其##格雷梅#土耳其·格雷梅 杰瑞有只小黄狗的微博视频,,"https://f.us.sinaimg.cn/001yvyuXlx07um1SsdbG01041201lSiO0E010.mp4?label=mp4_hd&template=852x480.28.0&Expires=1578067491&ssig=swM%2FNe%2FYdI&KID=unistore,video",土耳其·格雷梅,2019-06-03,咸鱼的日常0v0超话,7,3,0,"土耳其,格雷梅",
4378569428318763,HwXWSyU5B,到土🦢其惹土耳其·伊斯坦布尔 ,"https://wx4.sinaimg.cn/large/006Z3UHSgy1g3m8tpm2vqj33402c0qv6.jpg,https://wx2.sinaimg.cn/large/006Z3UHSgy1g3m8qfv1eaj33402c0hdu.jpg",,土耳其·伊斯坦布尔,2019-06-02,咸鱼的日常0v0超话,3,2,0,,
4378470387506790,HwVn8vuRg,西班牙天气好，人热情，东西又不难吃，我超喜欢这里der唯一遗憾的是昨晚他们聚众蹦迪超级嗨，但是因为太晚了我们就没去因为我现在要去伊斯坦布尔了今天就是寄明信片，去机场，等飞机，坐飞机的过程所以没有什么有意义的日常。(最有意思的大概是我早上出门找邮局的时候，街上的球迷很多手里拿着”need ticket”的牌子求票，然后我在这些人里面看到一位大哥举了一张”I need kisses”的牌子叭,https://wx3.sinaimg.cn/large/006Z3UHSgy1g3lx5zi4y5j321y2qmnpl.jpg,,,2019-06-01,咸鱼的日常0v0超话,5,3,0,,
4378466893635911,HwVhvffRJ,小号阴界过50轮了 ,https://wx1.sinaimg.cn/large/006Z3UHSgy1g3lx34jnhqj31pc0yiqv5.jpg,,,2019-06-01,阴阳师手游超话,3,3,0,,
4378310811018437,HwRdL4gWp,美图秀秀的美术馆滤镜也太棒了叭！！！可以印出来当明信片了！！！ ,"https://wx1.sinaimg.cn/large/006Z3UHSgy1g3ldb0b1rbj31qh1qhqv6.jpg,https://wx3.sinaimg.cn/large/006Z3UHSgy1g3lf4vm41yj33402c01lf.jpg,https://wx4.sinaimg.cn/large/006Z3UHSgy1g3ldadlhugj33402c0x72.jpg,https://wx2.sinaimg.cn/large/006Z3UHSgy1g3lf5tudsvj326a2601l9.jpg",,,2019-06-01,咸鱼的日常0v0超话,5,9,0,,
4378265848100800,HwQ3exZo4,[2019暑假？✈️]🇪🇸 Day 5 马德里(我突然发现我昨天的视频国旗是不是搞错了)今天这个视频里我基本只是拼接了一堆蹦迪现场。西班牙的球迷太热情了可惜明天下午的飞机，不能跟他们浪到欧冠决赛后惹今天一出门就遇到了champions festival大家都是汉子全部顶着烈日蹦迪超级有活力还遇到了据说女儿很喜欢K-pop结果自己跑过来跟我合影让女儿拿相机的父亲。上衣颜色是粉色，说我俩颜色很搭要一起照相的外国老大爷。以及超级热情的穿着玩偶服的人们晚上去看了弗朗明戈表演。西班牙真棒！！！ 杰瑞有只小黄狗的微博视频,,"https://f.us.sinaimg.cn/000zLQT5lx07uiFZhOIM01041200VQAc0E010.mp4?label=mp4_hd&template=852x480.28.0&Expires=1578067494&ssig=j8uujyvJe2&KID=unistore,video",,2019-06-01,咸鱼的日常0v0超话,9,2,0,,
4378131688897763,HwMyQBkIj,今天两点多才出的门，因为太热现在躲在商场里逛街。晚上去看弗朗明戈，没什么日常好发，所以不确定会不会剪视频但是今天拥有了一直想要的粉毛！！！耶！！！！！(花臂上半段被我搓了，但是在另一个胳膊和大腿上贴了新的纹身贴 ,https://wx3.sinaimg.cn/large/006Z3UHSgy1g3kuiulqgmj32c02c0hdt.jpg,,,2019-05-31,咸鱼的日常0v0超话,5,1,0,,
4377885445516242,HwG9Gn91E,[2019暑假？✈️]🇵🇹 DAY 4 Granada今天马德里和格拉纳达当天往返就为了去阿尔罕布拉宫。没有买到宫殿的门票，所以去了几个花园之类的地方。是很好看的花园，但是花一天时间特意去还是觉着有点浪费了晚上去了San Miguel Market。比英国的东西好吃太多惹(封面图是我做的非主流特别款(等回到英国我就开始减肥！！！ 杰瑞有只小黄狗的微博视频,,"https://f.us.sinaimg.cn/0026sZi3lx07uh0bgtMs01041201CWm60E010.mp4?label=mp4_hd&template=852x480.28.0&Expires=1578067495&ssig=pBKekBaTFL&KID=unistore,video",,2019-05-31,咸鱼的日常0v0超话,6,6,0,,
4377487960264784,HwvOA16SI,Day 3今天离开葡萄牙惹此刻正在马德里吃火锅🍲中国人成长的某一个标志大概是从以前每到一个地方就去品尝当地美食渐渐的变成每到一个地方就去找中餐吃叭葡萄牙脆皮卡士达面糊糊不好吃，真的不好吃。除此以外葡萄牙真的超好里斯本是一个很棒的地方，阳光好，人热情，游客不多。没什么著名景点，除此以外都挺好的。这边的路非常的emmmm跌宕起伏地图上搜两地的路程经常都是直来直去，但是高低落差很大。司机开车看到狭窄的下坡也完全不带犹豫的就往下冲，踩着油门往下冲跟坐过山车一样，真的刺激(暴脾气年轻司机尤其喜欢这样)够刚，我喜欢(我的照片都太沙雕了，但我觉得我裙子很好看我一定得发一下所以选择了相比最不沙雕的,"https://wx4.sinaimg.cn/large/006Z3UHSgy1g3iht87dhpj32c02c0npe.jpg,https://wx1.sinaimg.cn/large/006Z3UHSgy1g3isk5pb99j32c02c0kjl.jpg,https://wx4.sinaimg.cn/large/006Z3UHSgy1g3ihtkkhyrj33402c0hdv.jpg,https://wx3.sinaimg.cn/large/006Z3UHSgy1g3isj0kdtmj32c03401l5.jpg,https://wx2.sinaimg.cn/large/006Z3UHSgy1g3ihtqzw87j32c02c0qv8.jpg,https://wx1.sinaimg.cn/large/006Z3UHSgy1g3isifk1wxj30oe0mzagk.jpg,https://wx2.sinaimg.cn/large/006Z3UHSgy1g3ii3d7ndmj32c0340kjn.jpg,https://wx1.sinaimg.cn/large/006Z3UHSgy1g3ihsyhmxuj32c02c04qq.jpg,https://wx2.sinaimg.cn/large/006Z3UHSgy1g3iscs6cdvj33402c0x6p.jpg",,,2019-05-30,咸鱼的日常0v0超话,9,0,0,,
4377189665664884,Hwo3snLH6,[2019暑假？✈️]🇵🇹 DAY 2 Sintra今天去了辛特拉，里斯本隔壁的一个地方，有超~级多的城堡。起的太晚了所以只去了两个(我觉得可能)最好看的。(然后因为熬夜➕没睡好今天也肿成了球是坐盘山公路的公交车坐到崩溃的一天但是交到了新的猫猫朋友(成功调整成旅游模式，从今天开始放飞自我#辛特拉##葡萄牙#葡萄牙·辛特拉 杰瑞有只小黄狗的微博视频,,"https://f.us.sinaimg.cn/0040u7zAlx07udWjob0Q01041201uoDH0E010.mp4?label=mp4_hd&template=852x480.28.0&Expires=1578067511&ssig=7tjpE6gAXU&KID=unistore,video",葡萄牙·辛特拉,2019-05-29,咸鱼的日常0v0超话,8,0,0,"辛特拉,葡萄牙",
4376997906051186,Hwj4apobM,[2019暑假？✈️]🇵🇹 DAY 1是昨天的视频，今天才剪好。在里斯本。葡萄牙游客少，景色不错。适合待个三五天走走大街小巷。景点是没什么特别著名或者好玩的景点的。葡式蛋挞emmmm，还是吃国内肯德基的叭葡式卡士达蛋坨坨真的就很一般#葡萄牙##里斯本#葡萄牙·里斯本 杰瑞有只小黄狗的微博视频,,"https://f.us.sinaimg.cn/000tuK2ulx07ud5Z0hi801041201tJ4e0E010.mp4?label=mp4_hd&template=852x480.28.0&Expires=1578067512&ssig=KXySL2%2F715&KID=unistore,video",葡萄牙·里斯本,2019-05-28,咸鱼的日常0v0超话,7,0,0,"葡萄牙,里斯本",
4376718275753970,HwbN9o8RY,看到我在拍影子后一秒凹造型的日天(日天真的很做作 ,"https://wx4.sinaimg.cn/large/006Z3UHSgy1g3gc9f1by8j32c02c0x6q.jpg,https://wx4.sinaimg.cn/large/006Z3UHSgy1g3gc98oo71j32c02c0qv6.jpg",,,2019-05-28,咸鱼的日常0v0超话,6,3,0,,
4376403032631966,Hw3AHb2H4,旅行的第0天这位靓仔的戒指顺着洗脸盆滚呀滚呀滚呀滚进了被封死的下水道前一秒欣赏着在洗脸盆里绕着圈滑行的戒指还在想没事有东西堵着掉不下去，下一秒这个洗脸盆用实际行动跟我说，”想不到吧“我大概是跟细戒指八字不合(并且因为这位靓仔的裤子买大了今天裤子一直在掉 ,"https://wx4.sinaimg.cn/large/006Z3UHSgy1g3fbtub9n5j32c02c0qgp.jpg,https://wx4.sinaimg.cn/large/006Z3UHSgy1g3fbug8xjlj32c02c0tw2.jpg,https://wx2.sinaimg.cn/large/006Z3UHSgy1g3fbuc6tr7j32bn340e87.jpg",,,2019-05-27,咸鱼的日常0v0超话,2,0,0,,
4376050211189969,HvUpD4Zz3,大佬生日说想要 big mac一样的蛋糕所以接受了挑战黑色是巧克力慕斯，为了做出肉的颗粒感混入了坚果碎，用盘子做了绿色果冻，然后铲下来做生菜，奶油奶酪加色素当酸黄瓜。(表面铺了芝士是因为放凉的时候把皮粘掉了(本来准备做大片芝士的，时间关系没弄了(虽然跟广告图差别挺大，但是店里的就是这么简陋的big mac,"https://wx3.sinaimg.cn/large/006Z3UHSgy1g3e7e8eh3qj33402c0e82.jpg,https://wx1.sinaimg.cn/large/006Z3UHSgy1g3e7ebv88yj33402c0hdu.jpg,https://wx2.sinaimg.cn/large/006Z3UHSgy1g3e7eei0xgj32c0340kjl.jpg,https://wx4.sinaimg.cn/large/006Z3UHSgy1g3e7e688ucj30jg0djdqa.jpg",,,2019-05-26,咸鱼的日常0v0超话,12,0,1,,
4375595775300757,HvIAFmeY5,纪念一下小号第一次上三段 ,"https://wx3.sinaimg.cn/large/006Z3UHSgy1g3crcanxn9j31pc0yie83.jpg,https://wx1.sinaimg.cn/large/006Z3UHSgy1g3crc7y1dmj31pc0yikjo.jpg",,,2019-05-24,阴阳师手游超话,7,3,0,,
4375274302532829,HvAeaaCU5,过两天就要出去玩了，我不仅没减肥成功，甚至还更胖了 ,,,,2019-05-24,咸鱼的日常0v0超话,3,0,0,,
4374876951214672,HvpTh55Zu,由我基友给大家激情报一段火影里的人名(其实那个袖子的火焰花纹很像烈焰兽就是V仔兽用勇气数码装甲蛋进化出来的那个 杰瑞有只小黄狗的微博视频 ,,"http://f.us.sinaimg.cn/003Pgryjlx07u3Lddz840104120080IW0E010.mp4?label=mp4_720p&template=720x1280.24.0&Expires=1578067510&ssig=E2b2tvKfd0&KID=unistore,video",,2019-05-22,咸鱼的日常0v0超话,5,3,1,,
4374871951546426,HvpLd6uim,恭喜Q弹小海豹和大佬喜提新名字小海豹血赚👏🏻👏🏻👏🏻(起因是我给他俩带吃的，用保鲜盒装的，一个圆柱形的一个长方体的。 ,"https://wx2.sinaimg.cn/large/006Z3UHSgy1g3ag0534f0j30xf0s0amh.jpg,https://wx2.sinaimg.cn/large/006Z3UHSgy1g3ag086wo9j30rs2kfx6p.jpg,https://wx1.sinaimg.cn/large/006Z3UHSgy1g3ag09kck4j30yi0l10wg.jpg",,,2019-05-22,咸鱼的日常0v0超话,6,0,1,,
4374257125319100,Hv9LymjJW,跟一个没有血缘关系的哥哥的聊天记录。两家算是世交了。突然意识到这段关系里我们家一直在给人当干儿子？？？嗯？？？ ,https://wx3.sinaimg.cn/large/006Z3UHSgy1g38hkdhcxyj30rs2epe81.jpg,,,2019-05-21,咸鱼的日常0v0超话,5,0,0,,
4374249056030531,Hv9yxpiOD,五个人一起去喝啤酒结果因为啤酒太难喝走的时候桌面上是这样的每个人都没喝完(除了大佬，那个弟弟点的是果酒 ,https://wx2.sinaimg.cn/large/006Z3UHSgy1g38glr0gj7j33402c04qr.jpg,,,2019-05-21,咸鱼的日常0v0超话,5,0,0,,
4373872058616295,HuZKtA9uv,每次别人问我专业，我说电子电气工程，他们都会说”哇，女孩子学工科呀！好厉害呀！”只有我自己知道我学的跟💩一样(我一直以来想学的都是音乐，家里不让，然后我就随手抓阄抓出了我的大学和专业 ,,,,2019-05-20,咸鱼的日常0v0超话,8,3,0,,
4373424241391075,HuO6c5PSH,得到了许可的我突然又不想染头发了，可能我根本就不是想染头发，我只是想叛逆 ,,,,2019-05-18,咸鱼的日常0v0超话,4,0,0,,
4373422689623439,HuO3GEnuL,今天视频，我跟我妈说我想染头发，回国就给染回黑色（我想把这玩意儿染成绿的.jpg）我妈正在跟我姑姑们打麻将，然后大家就“这孩子真让人不省心”“你非要标新立异跟别人不一样”对我进行了diss我妈说我管不到你，你到时候跟你爸说，你看你爸说不说你，你爸今天喝了酒然后过了一会我爸回家了我： 爸我想染头发我爸：染头发对头皮不好我： 我就染一次，用温和的那种染发剂我爸： 啊那你想染就染吧，你姑姑还把头发染红了，你妈也染头我：（我爸喝了酒以后变得莫名的好说话（我爸今天还把视频对着我家阳台的天花板大声的问我，你看我现在的头发！（我说我看不到你的脸啊。（我爸说，茂不茂密！（行吧您说什么就是什么吧,,,,2019-05-18,咸鱼的日常0v0超话,7,0,0,,
4373189700047037,HuHZU0ceF,今天是暴躁穿lo的猫猫头裙子是dc家的猫什么的教授？拉链在交界处有点卡，今天三个人帮我拉的拉链感谢各位老铁 ,"https://wx1.sinaimg.cn/large/006Z3UHSgy1g352linfzsj30u00u0do3.jpg,https://wx4.sinaimg.cn/large/006Z3UHSgy1g352p178ohj30u00u0n40.jpg",,,2019-05-18,咸鱼的日常0v0超话,5,4,0,,
4373061401300598,HuEEY5slo,看不透看不透大佬的钱也太好挣了叭一开始只是想问大佬能接受的价格，毕竟乐器和书都是我非常喜欢的东西，身边如果有认识的人愿意收的话我是特别乐意出给他们的也算是对我阴魂不散的心愿的一种延续叭？后来就变成”哇这个憨批的沙雕下线到底在哪里啊”希望大佬好好读完PhD，好好挣钱，以后万一我混的不好了就去找他骗钱,"https://wx4.sinaimg.cn/large/006Z3UHSgy1g34nx9nsexj30rs95y4qv.jpg,https://wx4.sinaimg.cn/large/006Z3UHSgy1g34o0zc13wj30b90b9gmf.jpg,https://wx3.sinaimg.cn/large/006Z3UHSgy1g34o8rw7thj30rs1yqhdt.jpg",,,2019-05-17,咸鱼的日常0v0超话,4,5,0,,
4372768868990217,Hux38BILv,我可真是一个p图鬼才 ,https://wx4.sinaimg.cn/large/006Z3UHSgy1g33qofnfutj30rs1ev4qp.jpg,,,2019-05-17,咸鱼的日常0v0超话,5,0,0,,
4372619517580223,HutafvNXF,我早上几点醒完全取决于快递几点来敲我家门 ,,,,2019-05-16,咸鱼的日常0v0超话,3,0,0,,
4372344300439820,Hum0m1QpS,虽然我只有两只jio，但我拥有5种不同鞋码的鞋(早期是买uk3.5码，后来发现不好使，所以不看鞋码看鞋长，选23.5cm左右的。直到后来发现匡威的4码是23cm(但它明明比我一些23.5cm的鞋还松 ,https://wx2.sinaimg.cn/large/006Z3UHSgy1g32dsve39vj30rs4xxu0z.jpg,,,2019-05-15,咸鱼的日常0v0超话,5,0,0,,
4371752836603132,Hu6CnrHM8,哈哈哈哈哈哈哈哈哈哈我翻QQ空间看到我爸跟我的聊天记录哈哈哈哈哈哈哈哈哈(17年10月 ,"https://wx1.sinaimg.cn/large/006Z3UHSgy1g30hzlf7gvj30u01hc7wh.jpg,https://wx1.sinaimg.cn/large/006Z3UHSgy1g30hzigbu5j30u01hc7vp.jpg",,,2019-05-14,咸鱼的日常0v0超话,4,0,0,,
4370991901365900,HtMP45JkE,这个设计真的用心了#Human fall flat# ,https://wx3.sinaimg.cn/large/006Z3UHSgy1g2y2liaktsj32c02c0kji.jpg,,,2019-05-12,,6,5,0,Human fall flat,
4370662137047329,HtEfbtzkB,分享了一个轻快的步伐 ,https://wx3.sinaimg.cn/large/006Z3UHSgy1g2x0nzgwfrj30rx0rxaf6.jpg,,,2019-05-11,咸鱼的日常0v0超话,5,0,0,,
4370273249670087,Htu7WEzD9,今天买到了好看的红色头圈(我一开始写的是头绳，结果百度上的头绳都是很细的那种，所以我寻思着这种粗的应该叫头圈？(我拿手机的那个手上还戴了一个黑的(有弹力的皱布圈？ ,https://wx1.sinaimg.cn/large/006Z3UHSgy1g2vrsk6j1fj30u00u0jx3.jpg,,,2019-05-10,咸鱼的日常0v0超话,4,2,0,,
4369929719227300,HtlbRCIrq,我！我今晚去了pub！！！ ,"https://wx3.sinaimg.cn/large/006Z3UHSgy1g2uokroq1jj31400u0wod.jpg,https://wx3.sinaimg.cn/large/006Z3UHSgy1g2uoksl63ij30u014011l.jpg",,,2019-05-09,咸鱼的日常0v0超话,4,4,0,,
4369804137624279,HthVjvZqf,我: 我今天早上在家换衣服换了一个多小时大佬: 所以你就穿了这么厚的外套底下加个(看不出形状的)裙子再配个球鞋？(我也是没想到有一天会被大佬这种直男说穿的不好看 ,,,,2019-05-08,咸鱼的日常0v0超话,4,1,0,,
4369448284518062,Ht8FmiXlY,终于是把我做的一坨💩给交上去了从文件的名字都能感受出我的焦急真刺激现在事情过去了所以我可以说我享受这种玩火的感觉(其实今天之前哭到捶桌子 ,https://wx1.sinaimg.cn/large/006Z3UHSgy1g2t5a1aud1j309306l0t2.jpg,,,2019-05-07,咸鱼的日常0v0超话,1,0,0,,
4369356974548093,Ht6i5j5al,我，两天睡一个小时不到我，还没写完(但我相信自己能写完的 ,"https://wx2.sinaimg.cn/large/006Z3UHSgy1g2susur05dj30rs353x6p.jpg,https://wx4.sinaimg.cn/large/006Z3UHSgy1g2suswwt70j30rs1nv4qp.jpg,https://wx4.sinaimg.cn/large/006Z3UHSgy1g2susxrb52j30yi0rgtek.jpg",,,2019-05-07,咸鱼的日常0v0超话,1,2,1,,
4369023141932027,HsXBE86BJ,破产三姐妹的衣服都有买过。就性价比来说jk制服>lo裙>汉服jk制服只买过时光机家的两套，一套四百多。很厚实的料子，像是西装的那种材质，要等工期，但不拖。而且到货了会发现等工期都是值得的！！！lo裙是之前二月底突然想买之后一次性买了十二套，(买的全是白菜款，因为现阶段对lo裙毫无审美)有的尾款都还没到时间付。目前转运过来拿到手的dc家两套，甜心贩售机两套。甜心一套两百多，dc一套七百多。但是价格不一样的裙子，细节以及布料有肉眼可见的差别。汉服最早是15年开始买的，第一件是重回汉唐的齐胸。早期买了很多司南阁，后来开始买别家的。汉服的性价比是真的emmmmm，很多商家为了追求飘逸的感觉料子都非常的emmmmm。还有死亡绣花，我是挺不能理解网上尬吹一些绣花的。明明机绣没修好周边布料都皱了一件卖几百上千还有人”啊啊啊啊啊啊啊你们看看这优秀的绣花”emmmm。大概是人傻钱多还容易满足的傻白甜叭。然后因为油水太多谁都想来做汉服生意，做出来的都是些什么几把玩意儿。(有做的好的商家，但其中也有很大一部分定价过高(我寻思着一件平裁香云纱手工旗袍也才一千多(主要还是现在的店太多太杂了叭,,,,2019-05-06,咸鱼的日常0v0超话,5,0,0,,
4368750176243720,HsQvnqcha,到年纪了，该改口了 ,https://wx2.sinaimg.cn/large/006Z3UHSgy1g2qx4qjb2zj30rs1fc4qp.jpg,,,2019-05-06,咸鱼的日常0v0超话,2,1,0,,
4368747798359478,HsQrxz4Gi,卖假货的找我是因为我之前微博提到了莆田鞋。领券卖衣服的找我是因为我喜欢看微博推荐的演技浮夸的脑残广告。刷单的找我大概是因为我是在校学生。但我怎么也想不通为什么我最近被卖片的盯上了我最近天天躺在家里吃薯片而已啊 ,,,,2019-05-06,咸鱼的日常0v0超话,1,0,0,,
4368684748915724,HsONQBpo0,报告没写几个字，零食倒是吃了不少 ,https://wx2.sinaimg.cn/large/006Z3UHSgy1g2qpkcjamcj32c02c0kjm.jpg,,,2019-05-05,咸鱼的日常0v0超话,1,0,0,,
4368637051474236,HsNyV6bw0,跟几年前相比，买的夏装裤子越来越长，上衣领子越来越高，袖子越来越长。去年整个暑假三条菜市场大妈长裤换着穿。我曾一度以为是自己年纪大了浪不动了。前两天出门的时候才发现是因为懒得涂防晒懒，可以战胜一切 ,,,,2019-05-05,咸鱼的日常0v0超话,2,0,0,,
4368447192236301,HsICH9nLn,这一切都是命运的正常发挥罢了 ,https://wx2.sinaimg.cn/large/006Z3UHSgy1g2pybxxwbaj30rs26vnpd.jpg,,,2019-05-05,咸鱼的日常0v0超话,1,0,0,,
4367956031070563,HsvQv4uv9,等我以后自立门户了第一件事就是把我所有的黑照全部打包起来带走。我爸今天回老家了，给我发来了我初中毕业时候拍的，挂在老家墙上我爆炸头死亡蓝色眼影珠光粉口红的照片我当年觉得还挺好看我怎么想的 ,,,,2019-05-03,咸鱼的日常0v0超话,0,0,0,,
4367287353907294,HserZgosS,你永远不知道，明天和意外哪个先来 ,https://wx1.sinaimg.cn/large/006Z3UHSgy1g2m9380m68j30rs17dn59.jpg,,,2019-05-01,咸鱼的日常0v0超话,4,0,0,,
4367267729472378,HsdWkDKci,回到英国啦我以后出门再也不带这种大包了毛毛如果能帮我背包就好了 ,https://wx4.sinaimg.cn/large/006Z3UHSgy1g2m6ty1ospj31400u0wq1.jpg,,,2019-05-01,咸鱼的日常0v0超话,3,0,0,,
4367057476420600,Hs8tdqWi4,因为提到某些东西被新浪限流了，所以干脆改成了好友圈可见。最早是因为发朋友圈的时候有人跟我说喜欢看我发日常，说可以发到微博上面去。所以后来一直都在微博发日常，从文字到图到开始学着搞视频。初衷就是希望别人刷到我微博的时候能轻松一点。所以负面情绪基本没有(这就是为什么我之前丧得要死的仅自己可见的微博突然有了阅读量那天会那么暴躁)，可能引战的话题也尽量不发，非日常类的感想也尽量写的非常详细怕别人误解或者看不懂。微博已经尽量做到公开的都是比较积极开心的日常了。极少转发别人的微博或者公开实事评论之类的。脾气过于暴躁的日常也会及时删掉。所以爱看看不看滚。别我偶尔发点别的看不懂还跑来膈应人看不惯的有意见说，有问题提，别一上来就阴阳怪气最后还怪我没好脸色。再来你都看不惯了直接取关呗我俩都清净,,,,2019-05-01,咸鱼的日常0v0超话,6,4,0,,
4366972096923827,Hs6fvt3cD,抛开让人糟心的人和游客多这两点来说。梵蒂冈真的超级好看(但也真心建议你们如果对圣经之类的不感兴趣，看不出各个博物馆，教堂区别的。真的别去了。人太太太太太太太太太太太太太多了 ,"https://wx2.sinaimg.cn/large/006Z3UHSgy1g2l8vkrbf7j32c02c01ky.jpg,https://wx3.sinaimg.cn/large/006Z3UHSgy1g2l8v6ql9tj32c03401l1.jpg,https://wx1.sinaimg.cn/large/006Z3UHSgy1g2l8vbrdjkj32c02c0u0y.jpg,https://wx2.sinaimg.cn/large/006Z3UHSgy1g2l8uz64m3j32c03407wl.jpg,https://wx1.sinaimg.cn/large/006Z3UHSgy1g2l8vgi4b6j32c02c0x6p.jpg,https://wx1.sinaimg.cn/large/006Z3UHSgy1g2l8uegfcoj32c0340npf.jpg,https://wx4.sinaimg.cn/large/006Z3UHSgy1g2l8upx9ppj32c02c0u0y.jpg,https://wx2.sinaimg.cn/large/006Z3UHSgy1g2l8vpkcyqj32c02c04qq.jpg,https://wx3.sinaimg.cn/large/006Z3UHSgy1g2l8ujbs27j32c02c0npe.jpg",,,2019-05-01,咸鱼的日常0v0超话,6,0,0,,
4366971518867201,Hs6ezBcLn,[2019复活节✈️]🇻🇦Day 3”出了博物馆才惊觉买skip the line的票真是沙雕。其实整个逛博物馆的过程就是一个排队缓慢前进的过程。你以为你走快速通道进入了博物馆？不，你其实从入口到出口一直都在排队而已。今天看遍了不同肤色不同国家人的胳膊，被人像乒乓球一样在背包间撞来撞去，撞到灵魂出窍。(对于梵蒂冈被称为最接近上帝的国家有了新的认知。世界上最遥远的距离，大概是导游大爷就就在我前方一米左右的地方，而我却没办法接近他。(后来导游大爷消失在了岔路口，而我不出意外的走错了方向(这大概是上帝对于我学导游大爷的意大利口音的惩罚下次谁说欧洲人少我实名建议他去梵蒂冈看看看看什么叫pmpc#梵蒂冈#梵蒂冈 杰瑞有只小黄狗的微博视频,,"https://f.us.sinaimg.cn/003ns7E0lx07tuXV70Ok010412012z5l0E010.mp4?label=mp4_hd&template=852x480.28.0&Expires=1578067520&ssig=i0d9S28Zwn&KID=unistore,video",梵蒂冈,2019-05-01,咸鱼的日常0v0超话,4,1,0,梵蒂冈,
4366866522708535,Hs3vebmC3,梵蒂冈门口的那些旅游团是真的骚，如果不是特别想要了解里面东西的真的，不要去买tour guide。因为景点人超多，离导游稍微远一点根本听不到耳机里在说什么。而且导游也不点人数，中途如果丢了或者跑去喝茶上厕所导游就跑了tour guide就作废了(除非事后还能找到导游，但人真的超级多，概率不大)唯一的好处是去church之类的地方基本不用排队，入场超级快。(church本身不需要门票，如果有人跟你说要买票或者可以skip the line那肯定是借机给你卖tour guide的没跑了)(前提是景点和景点之间的时候不要把导游跟丢了(我出门不跟团就是为了自由的走走停停，吃吃喝喝，上厕所。结果今天还是大意了(但是不用排队和可以自由吃吃喝喝我真的难以抉择 意大利·Vatican City,,,意大利·Vatican City,2019-04-30,,5,0,0,,
4366822075051345,Hs2lxlc5j,去前台换票。是个白头发的欧洲大爷。看了我给他的换票信息后念了我的名字，还念对了！(我名字拼音里有Q，每次欧洲人读那个字母基本都是”克”的音)我正在准备夸他流啤呀居然说对了。然后大爷突然用陆星材的语调给我来了一句”有没有护jiao”我才知道原来他是在跟我说中文(后来就有了欧洲大爷说着中文和一个中国人说英文交流的奇特场面(因为他说中文我肯定能懂，但我不确定我说中文他会不会懂,,,,2019-04-30,咸鱼的日常0v0超话,4,0,0,,
4366654656042199,HrXZvplQP,天晴的时候真的是很棒的地方至于下雨天。。。我今天都淋成狗了我还能对它的雨天有什么好印象？？？如果说最喜欢的景点的话大概可能还是真香山吧真香(果然还是逃不过”不管去哪都要爬坡”这个定律罗马超话意大利·罗马 ,"https://wx4.sinaimg.cn/large/006Z3UHSgy1g2k8bhe47yj32c03401l0.jpg,https://wx1.sinaimg.cn/large/006Z3UHSgy1g2k8bxwp8kj32c02c04qq.jpg,https://wx1.sinaimg.cn/large/006Z3UHSgy1g2k8bs6wrwj33402c0qv8.jpg,https://wx2.sinaimg.cn/large/006Z3UHSgy1g2k8c5ulg2j32c02c0u10.jpg,https://wx4.sinaimg.cn/large/006Z3UHSgy1g2k8b7r1zqj335s146e82.jpg,https://wx4.sinaimg.cn/large/006Z3UHSgy1g2k8c9cwxzj32c02c0u0x.jpg,https://wx2.sinaimg.cn/large/006Z3UHSgy1g2k8b0zmymj32c02c07wi.jpg,https://wx4.sinaimg.cn/large/006Z3UHSgy1g2k8cgmvslj32c03401ky.jpg,https://wx2.sinaimg.cn/large/006Z3UHSgy1g2k8ccqhfoj32c02c0u0x.jpg",,意大利·罗马,2019-04-30,咸鱼的日常0v0超话,4,0,0,,
