id,bid,正文,原始图片url,视频url,位置,日期,工具,点赞数,评论数,转发数,话题,@用户
4353696626567292,HmwTsrys4,一边在造谣绯闻满天飞的时候叫唤“谁黑我们家姑娘赶紧辟谣”，一边在别人辟谣之后疯狗一样的叫唤不许辟谣必须继续捆着被造谣绯闻黑，也是很有意思的，按照这家的逻辑，告造谣不是该拍手叫好吗？还是潜意识里就特么希望别人被你家拉着炒作呗 ,,,,2019-03-25,iPhone 8 Plus,23,1,0,,
4353632184662871,Hmvdwjz1B,李易峰超话#李易峰# 紫色西装都穿得这么好看！！！！嗷！！！ ,"https://wx1.sinaimg.cn/large/6cf6cb5fly1g1eov0jck3j20j60y2n10.jpg,https://wx4.sinaimg.cn/large/6cf6cb5fly1g1eov0c37kj20j60x9whx.jpg,https://wx3.sinaimg.cn/large/6cf6cb5fly1g1eov0sckej20j60y2jt8.jpg",,,2019-03-25,iPhone 8 Plus,15,2,0,李易峰,
4353272804115991,HmlRShgKX,#找对象不如养只龟系列# 刚看到那个什么男人不喜欢女人爱旅游、要求女人相亲说“我没有爱好只喜欢陪着男人伺候他的爱好”的狗屁文章，想起来这么一事儿，我有个基友前两天相亲相了一朵奇葩，堪称石家庄版平成废宅：住在石家庄一环，这辈子去过最远的地方就是三环，目前没固定工作是因为辞职没多久，辞职的原因是单位搬到三环了他感觉太远，辞职想找个离家不超过五百米的地方，没有任何爱好，不看电影不看书，不考驾照不会开车，原因是驾校在二环太远了——注意是石家庄的二环，这个二环有多小石家庄人都知道。声称这辈子就生活在骑自行车十分钟能到的圈子里就行，一听见我基友喜欢看电影和旅游那表情都变了，批判了一顿电影和旅游有多累有多苦多么无聊，顺便提了一句他把55寸的电视机放在了卧室床头就为了在床上就可以躺一天，相亲到30大几岁还没对象的主要原因是嫌人女孩子离得太远，哪怕二环都嫌人家远，要求女孩子必须开车过来在他步行五分钟能到的地方约会，相亲都要女方跑腿他坐在离家五分钟步程的地方等，女孩子不愿意跑要求他多走几步那他就提分手，理由是懒得去讨好女生，倒是相信自己总会遇到一个跟他一样当乌龟的，所以单身到现在，呵呵。,,,,2019-03-24,iPhone 8 Plus,14,20,21,找对象不如养只龟系列,
4353256781563408,Hmls26yIg,直男癌是这样的：需要享受权利的时候：我是男人我付出更多我该享受更多！需要承担义务的时候：男女平等你们女人也该付出我凭什么付出！#傻吊姓傻一辈子都傻# ,https://wx3.sinaimg.cn/large/6cf6cb5fly1g1dhqtjtjcj20dw08mzo4.jpg,,,2019-03-24,iPhone 8 Plus,39,2,3,傻吊姓傻一辈子都傻,
4353110975361136,HmhERmuFW,刚才梳理微博的时候发现很多转发的原博都变成了“已删除”，于是只能把自己的转发也删掉，有些看转发能推测出来原博是啥，有的已经毫无痕迹可寻了，一边删一边略微怅惘，很多东西就像沙滩上划下的字，海浪一拍就全没了…… ,,,,2019-03-23,iPhone 8 Plus,29,1,1,,
4353086153556853,Hmh0PeViB,#吴京自曝可以拿残疾证#我记得他战狼前后有一段时间都是拄拐的，有时还坐轮椅，啥都是要付出的，得到越多付出越多…… ,,,,2019-03-23,iPhone 8 Plus,17,0,1,吴京自曝可以拿残疾证,
4353049658902911,Hmg3XBm3l,#腾讯服务器崩溃#旗下游戏全崩，简直了，基友告诉我说光纤挖断了？ ,,,,2019-03-23,iPhone 8 Plus,2,0,0,腾讯服务器崩溃,
4353046610129605,HmfZ30xIp,我的手游咋都登陆不上去了…… ,,,,2019-03-23,iPhone 8 Plus,1,2,1,,
4353043024243069,HmfTghNOB,我一个在法院工作的基友今天八了一个事儿：法院执行庭经常会遇到被执行人跑路的情况，有个法官小哥，找一个被执行人一直没找到，今天打开淘宝看自己的快递信息，发现派件的快递小哥居然就是那个被执行人，法官小哥乐的呀，high high的拿着手续蹲在门卫室，快递一到，得嘞您呐，一手拿货一手执行 ,,,,2019-03-23,iPhone 8 Plus,65,4,44,,
4353013914766546,Hmf8jjZZM,渣浪你耍我？？？ ,https://wx4.sinaimg.cn/large/6cf6cb5fly1g1cpur7heaj20yi1pcb0t.jpg,,,2019-03-23,iPhone 8 Plus,4,14,2,,
4353012753057382,Hmf6rcPmC,铁打的卡包流水的爱豆封面……呃顺便问一句，林彦俊小哥是哪个节目出来的？ ,https://wx2.sinaimg.cn/large/6cf6cb5fly1g1cppl3mkuj213z0u07wh.jpg,,,2019-03-23,iPhone 8 Plus,4,12,2,,
4352969858440484,HmdZfzpKQ,#体育课选了太极的你#上大学时候我们班最柔弱那个妹子，因为选课失误进了足球班，还全班就她一个女的，她出现在操场上的时候老师沉默了很久，然后说以后上课你自由活动吧，期末考试记得来就行了。到了期末考那天，老师拿球往地上一搁，妹子一脚踢出去三米远，老师给了一个及格，就此结课 ,,,,2019-03-23,iPhone 8 Plus,24,12,2,体育课选了太极的你,
4352598968854842,Hm4l2B9y2,#东方神起SJ合体#活、活久见？？？？ ,,,,2019-03-22,iPhone 8 Plus,2,1,0,东方神起SJ合体,
4352268452583428,HlVJXaQ4c,嗯，当你得知一个想也想不到的资深流量小鲜肉居然是吴京的迷弟时不时就对着电视机里的战狼发出男儿何不带吴钩的感慨并且发自内心画和偶像合作的饼并且表示不怕吃苦的时候，我居然要对这个流量要转粉了怎么办有时候真的是人不可貌相谁说花美男没有一颗纯爷们儿英雄梦的心 ,,,,2019-03-21,iPhone 8 Plus,18,22,9,,
4350827353264077,HlkfBdH8p,你要说学校食堂不干净、不卫生，这个我信，要说几百号学生一起吐血便血、家长被学校逼到跳楼，这个我不信；你要说幼儿园老师打孩子虐待孩子，这个我信，你要说什么军人组团去侵犯孩子，你他妈给谁上智商税呢？有些东西一开始未必是假的，但是有些手插进来之后就不一定了，脑子必要的时候还是凉一凉的好，起码逻辑上明显过不去的谣言你是能分辨出来的——是的，不需要什么鉴定，只凭常识你就可以分辨的谣言。,,,,2019-03-17,iPhone 8 Plus,161,16,91,,
4350225823086862,Hl4BocX26,#315晚会# 高利贷真可怕…… ,,,,2019-03-15,iPhone 8 Plus,2,0,0,315晚会,
4350216360457334,Hl4m81UYm,#315晚会#说到纸尿裤了，擦 ,,,,2019-03-15,iPhone 8 Plus,0,0,0,315晚会,
4350206725807137,Hl46AomHv,正在看315晚会，简直就是每年毁三观必备 ,,,,2019-03-15,iPhone 8 Plus,6,1,0,,
4349838474141194,HkUwDhnjs,作为一个教育工作者，我最大的希望当然是教育平等，通过教育让孩子一分耕耘一分收获去改变命运是最有成就感的事，也是我认为教育最大的意义所在。可是如今的教育使我感到迷茫，阶级化似乎是一个不可逆转的趋势，就算你送再多老师下乡也没用，你再整什么划区划片也没用，这是整个社会洪流下无法对抗的洪水压顶，窒息。,,,,2019-03-14,iPhone 8 Plus,31,9,9,,
4349708350926250,HkR8L3SXw,求助美妆基友：雪花秀的人参精华和后家的迷贴精华哪个更好 ,,,,2019-03-14,iPhone 8 Plus,2,26,0,,
4349708141174103,HkR8q4Vr9,我开始写一个娱乐圈原单，我说亲爱的基友帮我写个里番吧，我把故事梗概一说。基友甲：你要我写，那就是一竿子给你支到他俩七十岁。基友乙：你要我写，那就是相见在其中一方的葬礼，黑色风衣白发苍苍冷冷一瞥。我：……你们是不是对里番两个字有什么误会…… ,,,,2019-03-14,iPhone 8 Plus,11,8,8,,
4349115456661373,HkBItrWVv,这几天一直没有跟着吃瓜的原因是因为我在艰难的补课我这才发现短短几年功夫好像韩流又换了一拨人，我的最近的记忆还停留在EXO上，原来已经更新换代这么多了么……真的是岁月不饶人啊…… ,,,,2019-03-12,iPhone 8 Plus,8,25,1,,
4349089732759048,HkB2ZbzKM,哟，这么看得起我呀？侵犯名誉权？意思就是你能瞎折腾别人不能说呗？ ,https://wx4.sinaimg.cn/large/6cf6cb5fly1g1075ztkalj20u00n8wm3.jpg,,,2019-03-12,iPhone 8 Plus,7,15,2,,
4348987023088233,HkynkcXod,又透气又柔软适合做贴头枕套的布料叫啥名字……想到头秃…… ,,,,2019-03-12,iPhone 8 Plus,0,14,0,,
4348973408162297,Hky1myfnX,论什么叫十几年甩不脱的狗皮膏药 ,https://wx4.sinaimg.cn/large/6cf6cb5fly1g0ztt3wqqvj20yi1pcb2c.jpg,,,2019-03-12,iPhone 8 Plus,17,14,4,,
4348609338131605,Hkoy9y7oV,我上次看网络综艺，有个小姑娘挺好看，我就顺嘴在微博夸了一句，然后，这家粉跑过来给我买赞，这家黑跑过来给我科普黑料我真的没想粉也没想黑，我只是看到漂亮小姑娘就夸一句而已，大家戏不要这么多好吗…… ,,,,2019-03-11,iPhone 8 Plus,10,5,1,,
4348608390741797,HkowD36Yt,#武大靖 让短道速滑的场地干净一点#为什么棒子脏得举世皆知还能这么肆无忌惮？为什么我们面对棒子的时候除了运动员教练员据理力争其他官员仿佛都是死的？ ,,,,2019-03-11,iPhone 8 Plus,26,2,3,武大靖 让短道速滑的场地干净一点,
4348440643713799,Hkka4fA7Z,有一种弯叫做循序渐进的弯，真的，我特么耳听眼见的看着一小哥儿从还肯跟妹子约一下过一夜只是偶尔和男人勾搭进化到如今被一心撮合的前辈把他跟姑娘关屋里都能砸门出来了 ,,,,2019-03-10,iPhone 8 Plus,9,4,0,,
4348336696044980,HkhsppmzG,电视剧播出期间，男一女一真·夫妻结伴上热搜。某家粉丝：你们男一女一上热搜就是迫害我们家哥哥！某颁奖礼，男艺人甲和男艺人乙亲热握手上热搜。某家粉丝：他俩上热搜就是迫害我家哥哥！嗯……这个逻辑基本可以理解成，只要她家哥哥插一脚的，别人不能宣传自己也不能和别人宣传，只要别人【宣传自己】就等于迫害她家哥哥。嗯，也是很棒棒哦～～～,,,,2019-03-10,iPhone 8 Plus,62,8,9,,
4348296917566019,HkgqfvKgz,掰头热搜一般都是某家为了碰瓷蹭热度买的，你好我好一起好的热搜，如果两边有哪一边不同意那都是出不来的，换句话说——人家俩帅哥营销共赢呢关你屁事，替人家某一方个屁呀你。 ,https://wx1.sinaimg.cn/large/6cf6cb5fly1g0xo3zd5dbj20j60wdn07.jpg,,,2019-03-10,iPhone 8 Plus,67,10,21,,
4348283553766839,Hkg4HfNVt,#王凯黄轩握手# ,"https://wx3.sinaimg.cn/large/6cf6cb5fly1g0xmkmox9bj20yi1pce81.jpg,https://wx1.sinaimg.cn/large/6cf6cb5fly1g0xmknpc2zj20yi1pc7wi.jpg,https://wx3.sinaimg.cn/large/6cf6cb5fly1g0xmkr8l78j20yi1pcqv5.jpg,https://wx4.sinaimg.cn/large/6cf6cb5fly1g0xmkpmu7gj20yi1pcqv6.jpg,https://wx4.sinaimg.cn/large/6cf6cb5fly1g0xmkvdpg5j20yi1pcqv6.jpg,https://wx4.sinaimg.cn/large/6cf6cb5fly1g0xmks80ycj20yi1pckjm.jpg,https://wx1.sinaimg.cn/large/6cf6cb5fly1g0xmkvqxkfj20j60wdn07.jpg",,,2019-03-10,iPhone 8 Plus,59,53,62,王凯黄轩握手,
4348242189407365,HkeZYDthH,其实说到底吧，娱乐圈也是人组成的，有事业心强风生水起的，也有朴实无华的上班族，是的上班族那是真的把演戏包括演艺当职业，注意是当职业不是当事业，朝九晚五按点上下班，有工作就干没工作就算，不指望混个领导层或者行业标兵，就特么养家糊口等退休，那不是装逼作态的低调不争，那是发自内心的就特么不争说无趣确实无趣，上节目也不知道抢镜抢梗；说踏实也确实踏实，嫁给他就跟嫁个普通人没两样，不必担心今天开房明天看剧本的破事儿，就看你打算过什么样的日子人生百态，娱乐圈也不外如此，所以粉一个事业心强的你就跟着折腾，粉一个上班族你就跟着养老，看你要啥，跟上班族要事业心，他也很痛苦啊,,,,2019-03-10,iPhone 8 Plus,17,7,6,,
4347922466130942,Hk6GipIWa,这叫：如意云纹镶红枣高精粉蒸糕 ,"https://wx3.sinaimg.cn/large/6cf6cb5fly1g0wh1fbp8rj213z0u0npd.jpg,https://wx2.sinaimg.cn/large/6cf6cb5fly1g0wh1mhqhmj213z0u0kjl.jpg",,,2019-03-09,iPhone 8 Plus,14,5,0,,
4347310538775776,HjQLjAOYM,造谣人家艺人有艾滋病、造谣跟艾滋病人握手会传染，然后被人家防艾博给挂了，然后人被造谣的艺人家没说话、被抹黑歧视的艾滋病人没说话，这家粉跑到防艾博下撒泼打滚说人家防艾博挂他家造谣屁话就是引战就是黑他家就是找茬，你犯贱别人说不得？你造谣别人说不得？蛮神奇的哦…… ,,,,2019-03-07,iPhone 8 Plus,68,22,15,,
4347305895760699,HjQDPoaCv,我确定一定以及肯定，腾讯和剑三西山居那个云裳羽衣就是特么的奇迹暖暖加上恋与制作人，尼玛叶英能这么爱我？！ ,,,,2019-03-07,iPhone 8 Plus,5,6,2,,
4347131584054862,HjM6Gh0R0,观众都是垃圾，票房不重要，那你拍电影干啥呢？票房不好你急扯白脸干嘛呢？ ,"https://wx3.sinaimg.cn/large/6cf6cb5fly1g0ty99qn8rj20qj0xediv.jpg,https://wx1.sinaimg.cn/large/6cf6cb5fly1g0ty9zu8j2j20dw0fgjst.jpg",,,2019-03-07,iPhone 8 Plus,40,30,45,,
4346886120815150,HjFIM3q3A,#宁泽涛退役#啊？这就退役了？ ,,,,2019-03-06,iPhone 8 Plus,3,6,0,宁泽涛退役,
4346232149379638,HjoHYDm4u,今晚看创2的仓库大宿舍听着微信群基友各种吐槽脑洞简直哈哈哈哈哈哈哈哈哈全程，这种大通铺旁边摆着健身房哈哈哈哈哈哈哈哈哈哈哈什么沙雕操作啊哈哈哈哈哈哈哈哈哈哈哈哈哈哈 ,,,,2019-03-04,iPhone 8 Plus,6,1,0,,
4346220006535629,Hjooorqdn,下载了百度地图moss语音导航之后今天第一次用，走一路感觉自己中二度爆表一口一个“拯救地球的勇士不要闯红灯”“拯救地球的勇士不能违章”，我都快入戏了忍不住想我要是万一不小心压个线它会不会来一句“让人类不违章果然是一件困难的事” ,,,,2019-03-04,iPhone 8 Plus,27,11,16,,
4346090537550746,Hjl1zvGie,尽管这个叫张莹的记者竭力给小畜生一家洗白，但是狐狸尾巴藏不住，纸里也保不住火，真相略想想就能推敲出来，到底是什么样的家庭养出这么个小畜生：家处一个闭塞愚昧把女人当祸水的农村，父亲是个村干部有点小势力，反复强调“独子”女儿不算人，重男轻女下溺爱无度，在城市或者开明农村，若是要独子成 ...全文,"https://wx3.sinaimg.cn/large/6cf6cb5fly1g0qmpio487j20yi1pcqhz.jpg,https://wx4.sinaimg.cn/large/6cf6cb5fly1g0qmphvq1dj20yi1pce81.jpg,https://wx3.sinaimg.cn/large/6cf6cb5fly1g0qmpnhjqlj20yi1pckjo.jpg,https://wx2.sinaimg.cn/large/6cf6cb5fly1g0qmpod3zuj20yi1pc4cb.jpg,https://wx2.sinaimg.cn/large/6cf6cb5fly1g0qmppf25fj20yi1pcdu8.jpg,https://wx3.sinaimg.cn/large/6cf6cb5fly1g0qmpq8s9sj20yi1pc7iu.jpg,https://wx1.sinaimg.cn/large/6cf6cb5fly1g0qmpqsrcgj20zc22ok0n.jpg",,,2019-03-04,iPhone 8 Plus,163,48,272,,
4346076234989186,HjkEvkVUK,#涞源反杀案一家团聚# 记住这个叫张莹的贱人记者。看名字是个女的吧？对无辜被害的同性的恶意简直溢出屏幕，反复暗示女孩是祸水害了无辜的小恶霸，还给女孩泼脏水“花了男人很多钱”，对于小畜生又是“老实人”又是“有礼貌”恨不得给贴了金追认个烈士，看这形容，别是死的这个是她姘头吧？ ,"https://wx3.sinaimg.cn/large/6cf6cb5fly1g0ql0m9hm8j20zc22ok0n.jpg,https://wx4.sinaimg.cn/large/6cf6cb5fly1g0ql0mlan4j20yi1pc7iu.jpg,https://wx1.sinaimg.cn/large/6cf6cb5fly1g0ql0mvov7j20yi1pcdu8.jpg,https://wx4.sinaimg.cn/large/6cf6cb5fly1g0ql0n6n3uj20yi1pc4cb.jpg,https://wx3.sinaimg.cn/large/6cf6cb5fly1g0ql0lxzxpj20yi1pckjo.jpg,https://wx4.sinaimg.cn/large/6cf6cb5fly1g0ql0nnwcxj20yi1pce81.jpg,https://wx1.sinaimg.cn/large/6cf6cb5fly1g0ql0o0ehzj20yi1pcqhz.jpg",,,2019-03-04,iPhone 8 Plus,65,27,132,涞源反杀案一家团聚,
4346033058445176,HjjwRzqYw,顺便看到那个小恶霸他爹是个什么屯长，可别小看这个芝麻大的破官儿，在农村里，这种小官儿权力已经很大了，这个小恶霸是个什么德行怎么长大的都可以推算出来，无非就是村里有点势力的恶霸家庭溺爱养出来的独生子，自幼在村子里仗着爹横行霸道，不上学不读书，父母一味溺爱不教是非对错，村里人看着他爹有点权势平时也让着他，出去打工还以为外面的世界是他的那个小破村子由着他当土皇帝为所欲为，女孩子不顺从他对他来说那就是死罪，“我从小在村里都没人敢对我说个不字你居然敢拒绝我看我不弄死你”就是他的心态，他刚出事的时候他爹一口一个“这是我家独子”“杀人偿命”，这个口气也知道这货平时怎么教导儿子的，“你是我的独子你爹我是村里数得着的人你想怎样就怎样”，农村基层恶霸+独子+溺爱，这种能养出好人来才真是太阳打西边出来了。,https://wx4.sinaimg.cn/large/6cf6cb5fly1g0qg4gdqi8j20zc22ok0n.jpg,,,2019-03-04,iPhone 8 Plus,30,15,53,,
4345869563970105,HjfhagENX,#涞源反杀案一家团聚#恕我直言，这事儿还没完呢，别忘了养出那个死鬼小恶霸的那个老恶霸爹，扬言要人家姑娘一家给他那个死畜生陪葬，姑娘一家是放回来了，以后呢？老恶霸重走儿子路天天去人家家里闹事怎么办？再防卫一次拼命一次再折腾一圈吗？有没有措施可以阻止那个老恶霸？ ,,,,2019-03-03,iPhone 8 Plus,165,34,57,涞源反杀案一家团聚,
4345330986821253,Hj1gusCwd,吴京大大这是个什么神奇人设战狼筹拍前找个片子让他演散散心，对方投资商扯张空白支票说只要你肯演钱随你填，然后吴师傅很生气地跑掉了……跑掉了……这什么杰克苏的神奇剧情 ,https://wx2.sinaimg.cn/large/6cf6cb5fly1g0o7h3dxibj20u014a16r.jpg,,,2019-03-02,iPhone 8 Plus,97,27,128,,
4344724070963601,HiLtB42FX,哦哦哦哦哦刘培强中校！ ,https://wx4.sinaimg.cn/large/6cf6cb5fly1g0m9s16s5qj22c03407wh.jpg,,,2019-02-28,iPhone 8 Plus,7,16,12,,
4344361405439960,HiC2EmPbi,【战狼2】张翰肩扛吴京 吴京：我刚吃完饭！！！。——这么看张翰那个小身板子劲儿也不小#bilibili# 【战狼2】张翰肩扛吴京 吴京：我刚吃完饭！！！ （哔哩哔哩客户端下载网页链接） ,,,,2019-02-27,iPhone 8 Plus,4,2,3,bilibili,
4344353687993495,HiBQcxxtl,电视剧偷懒另说，看到金老名字上加了黑框，心里还是突然难过了一下，原来真的已经不在了…… ,https://wx3.sinaimg.cn/large/6cf6cb5fly1g0l38n7xh0j20u00gyn9v.jpg,,,2019-02-27,iPhone 8 Plus,9,1,1,,
4344054781336935,Hiu465BNt,今天在微信群里和小伙伴说起吴京，提到他的各种电视剧，大家都是各种的“哎呀这个我看过”“哎呀那个我也看过”，什么太极宗师小李飞刀水浒后传倩女幽魂，不知不觉才发现原来吴京也算是占据了我这种电视儿童童年生活的半壁江山了 ,,,,2019-02-26,iPhone 8 Plus,39,7,7,,
4344030928538137,HitrCzP9T,话说，娱乐圈最近是在进行比婊大赛吗？男的女的一个个恨不得把婊字贴脸上了，比着赶着秀自己那份儿不要脸呀 ,,,,2019-02-26,iPhone 8 Plus,11,6,0,,
4343991686486999,Hisqkrdz1,某些low吊总埋怨自己娶不到公主，问他择偶的标准就说要求女人会做家务，试问公主需要做家务？你的眼界和胸襟决定了你能娶到什么样的女人，指望娶女人回家就为了找个保姆伺候自己的，下八辈子也别做驸马爷的梦了，能找个肯为你做家务的女人都是你祖坟上冒青烟，不，你祖坟都特么成苏拉威西发动机了。 ,,,,2019-02-26,iPhone 8 Plus,55,16,22,,
4343923029907591,HiqDAFzpR,真性情啊真性情，多少犯贱以你之名 ,,,,2019-02-26,iPhone 8 Plus,23,2,1,,
4343612449730520,HiiyEEPlS,别人家用真相澄清谣言，这家用谣言“澄清”事实也是很神奇了另外别急着给人家小孩子甩锅带节奏了，大浪退后谁裸泳、谁是微博特供“一线当红”谁心里清楚，着什么急呢 ,,,,2019-02-25,iPhone 8 Plus,29,9,4,,
4343264654480674,Hi9vHiNCW,渣浪你丫装什么大头蒜呀？联合资本洗脑一群脑残货刷榜刷数据买东西割韭菜、资本捧人你得热度无本万利的不是你吗？ ,,,,2019-02-24,iPhone 8 Plus,45,2,2,,
4343225433063384,Hi8urcQVq,刚去赛凡家众筹页面看看还有没有什么可以捡漏，发现一片灰色，刘培强毫无疑问最能打，我记得他的徽章是3000增了3000又增了10000，紧急通讯牌3000+10000，全部卖空，连帆布袋啊书签啊都卖光了，就一个刘启的徽章加了一次之后没卖完，还剩4000多，其他全部卖空了，首页上孤零零就这一个没变灰的 ,https://wx4.sinaimg.cn/large/6cf6cb5fly1g0hhldrkldj20u01byk5b.jpg,,,2019-02-24,iPhone 8 Plus,10,6,2,,
4343139554570596,Hi6fVjb1i,央视新闻点名流量造假的不止蔡一个，然而微博上却好像罪大恶极的就他一个，另外被点名的在微博上看就好像新闻里没提他似的，对蔡本人感觉一般般，不过这种资本操纵舆论真是厉害了，可以把一个人推出来游街，也可以把另一个本该一起游街的好好藏起来。 ,,,,2019-02-24,iPhone 8 Plus,45,11,2,,
4343001344375608,Hi2F0imik,吴京当年宣传战狼2，参加了一期开心剧乐部，所有人都拿着剧本，除了他2333333全程懵逼脸+神控场来回切换还附送各种吐槽自带弹幕，全程头都要笑飞了！ 冰下有鱼的微博视频 ,,"http://f.us.sinaimg.cn/000FWirRlx07rNtlPCaQ0104120ef2Z00E060.mp4?label=mp4_720p&template=1280x720.20.0&Expires=1578060197&ssig=gTvoDHshsS&KID=unistore,video",,2019-02-23,搜狗高速浏览器,55,5,68,,
4342974583938641,Hi1XQgwCt,邮局港剧，你跪美帝跪西方粑粑我勉强算你个慕强，跪弯弯是个什么狗屁操作？慕贱吗？ ,,,,2019-02-23,iPhone 8 Plus,25,2,2,,
4342941344570097,Hi16ejaTf,CZ这个破事儿和什么言论自由都没有关系，就是又想赚钱又要犯贱被人发现了而已，非要把犯贱等同于言论自由，以为表达言论自由只能靠犯贱，那只能说明你就是个贱人，完毕。 ,,,,2019-02-23,iPhone 8 Plus,97,10,34,,
4342485889531868,HhPfCDZFO,死丫头是朵奇葩：你觉得他是人的时候总要干点儿不是人的事儿，你觉得他不是人的时候又会突然干点儿人的事儿，在是人和不是人之间来回固涌…… ,https://wx3.sinaimg.cn/large/6cf6cb5fly1g0f4q4wll4j20dw08mzo4.jpg,,,2019-02-22,iPhone 8 Plus,35,12,2,,
4342202588514737,HhHSGzJ4t,李一一同款get，没想到还挺沉……我这个小爪子玩儿起来有点吃力 ,https://wx4.sinaimg.cn/large/6cf6cb5fly1g0e86up6hdj22c0340b29.jpg,,,2019-02-21,iPhone 8 Plus,9,7,3,,
4342060587086728,HhEbEtJA4,我为什么讨厌现在的很多穿越小说穿越剧？女主回到古代，比古代的女人还热衷于宅斗宫斗，热衷于封建道德压迫他人来获取所谓的胜利感成就感，整个一比古人还标准的活体贞节牌坊。在靠劳动谋生的现代社会混的平平，回到古代马上如鱼得水投入封建宅斗混的风生水起，这不叫穿越，这就是一个穿越到现代的僵尸终于死回她的时代了。,,,,2019-02-21,iPhone 8 Plus,217,79,108,,
4341967368659736,HhBLiAkNa,南方的天潮湿到什么地步？我一个南方基友妹子，今天跟我吐槽说她家放在地下室的被子长蘑菇了……长蘑菇了……蘑菇…… ,,,,2019-02-21,iPhone 8 Plus,11,9,0,,
4341945092974867,HhBbnctTJ,自尊是靠自己争取的，但是不等于你看见啥吐槽都觉得是在说你、看见什么批评都要自我代入、别人说一句不好那就是全盘否定了你那就等于你的杀父仇人——我就很纳闷了，为什么好话不觉得是在说你，有一句不好听的马上就来认领，还自己脑补那么多被迫害戏码，自我定位就这么讨人嫌吗？ ,,,,2019-02-21,iPhone 8 Plus,10,0,1,,
4341940915237175,HhB4DlYqz,想知道这个微博配的GIF动图表情是固定的呢还是可以自己选配的？ ,,,,2019-02-21,iPhone 8 Plus,0,6,0,,
4341865615105880,Hhz7blqgU,资本捧的人和观众喜欢的人很多时候并不是一回事，但是资本可以买很多网上的嘴“代表”观众去吹捧资本的人，同时捂住观众的眼耳口让观众喜欢一个人都说不出来、甚至看都看不到他、也看不到同样喜欢这个人的观众，最后资本自说自话的宣布自己捧的人就是观众喜欢的人，要不说资本是爸爸呢 ,,,,2019-02-20,iPhone 8 Plus,55,8,6,,
4341857180138704,HhyTA0A5a,现在有人开始踩小破球里的吴京戏份少、没有票房贡献度、只是噱头之类的了，目前还没敢说“没有票房号召力”这种屁话，我就是很好奇，他对小破球没有贡献的话，那贡献算给谁呢？谁这会儿子就急不可耐的想出来摘果子了？40亿的果子，小心别噎死你 ,,,,2019-02-20,iPhone 8 Plus,134,82,135,,
4341521144537626,Hhq9Aj2rw,从罗云熙到张艺兴，今年元宵晚会男艺人都流行穿成红包吗 ,,,,2019-02-19,iPhone 8 Plus,8,2,0,,
4341519638871156,Hhq79BdNa,#电影流浪地球# 踩点恭喜小破球！填补中国电影票房40亿档空白！ ,https://wx4.sinaimg.cn/large/6cf6cb5fly1g0c1r62uyxj20yi1pcdr6.jpg,,,2019-02-19,iPhone 8 Plus,32,0,1,电影流浪地球,
4341502488581573,HhpFuA0st,@洗桐女史 @荒村野店老板娘 元宵晚会有你们家罗云熙啊！ ,,,,2019-02-19,iPhone 8 Plus,0,6,0,,"洗桐女史,荒村野店老板娘"
4341188498990768,Hhhv3BIUo,“骂我等于骂我爱豆”这种傻逼一时半刻是死不绝的。 ,,,,2019-02-18,iPhone 8 Plus,27,7,12,,
