id,bid,正文,原始图片url,视频url,位置,日期,工具,点赞数,评论数,转发数,话题,@用户
4139178965402772,FgrdSmFvu,#战狼2#战狼2 刚才看见豆瓣小清新又高潮了：看吧，吴京被小粉红逼捐了，让他爱国，被爱国反噬了吧，真活该！爱国就没有好下场！看我们不爱国多正确呢！让你们说我们豆瓣打低分就是不爱国，让你们道德绑架非要我们豆瓣爱国，看吧宣传爱国的被爱国反咬一口啦！——嗯，首先逼捐的键盘侠并不是爱国的，他们逼捐和豆瓣小清新本质上是一样，看见爱国俩字就不舒服，总要想法证明爱国是傻子才干的事、爱国没有好下场；其次，能拿着这个幸灾乐祸，说要你爱国就是道德绑架的，这个国也不缺你这点装逼的爱；最后，逼捐才是道德绑架，爱国从来不是道德绑架，把爱国这一基本道德视为绑架，要你爱国就是迫害你，躲在爱国之名背后行祸国之事的和借此对爱国冷嘲热讽的，都是你大爷的大傻逼，完毕。,https://wx1.sinaimg.cn/large/6cf6cb5fly1fiej8yvui0j20gp0gpgmk.jpg,,,2017-08-10,iPhone 6 Plus,103,18,61,战狼2,
4138606627478923,FgckKvnBN,今晚地震之后，各方面反应迅速有条不紊，救援即时启动，各种信息渠道畅通，其中有科技发展的功劳，也有当年血泪积攒下的经验，这些经验是用命换来的，在现在和将来的日子里会救更多人的命，我既希望每个人都能有这些经验作保障，可是又希望这些经验永远没有用到的那一刻，望一切平安。 ,,,,2017-08-08,iPhone 6 Plus,44,0,9,,
4138217844910975,Fg2dGkBzh,目前收集到的某区🐶局粉所谓的举报模版，还在不断更新中，现在把这些运动员教练员和反体制反改革甚至某功挂钩，言必称这些运动员教练员是反D反国，立誓要把这些运动员教练员送进监狱铁窗泪不算，还把乒乓球这个项目敲死是反改革的反面典型，要把整个项目搞死搞臭。 ,"https://wx4.sinaimg.cn/large/6cf6cb5fly1fibgv4ocm4j209d0go0ty.jpg,https://wx3.sinaimg.cn/large/6cf6cb5fly1fibgv4d2baj20f00ndjwj.jpg,https://wx1.sinaimg.cn/large/6cf6cb5fly1fibgv50fn2j20ez0o1aew.jpg,https://wx1.sinaimg.cn/large/6cf6cb5fly1fibgv5b23yj20hs0vmq8o.jpg,https://wx1.sinaimg.cn/large/6cf6cb5fly1fibgv6oxyzj20yi1pctjj.jpg",,,2017-08-07,iPhone 6 Plus,36,63,233,,
4138209434712541,Fg207jLWJ,说到三生三世羊毛锁场这事儿，其实我始终没搞清楚这个逻辑：票房是用票额累计的，排片率不代表票房，你一张票锁场，这个场里的空座们也变不成票房，你锁上四万多场，这四万多场也变不成累计票房，反而让所有人看到这四万多场惨不忍睹的一张票上座率，就算院线不追究，你这特么也是傻逼啊 ,https://wx4.sinaimg.cn/large/6cf6cb5fly1fibfw6ej3cj20gp0gpgmk.jpg,,,2017-08-07,iPhone 6 Plus,56,30,4,,
4138181886316420,Fg1hGqvbK,原来这个世界上还真的有🐶局粉、真心实意要帮着🐶局修理打压国胖的呢——又是代表广大群众了又是代表外界舆论了又是代表球迷了，🐶局粉跟🐶局一样这么喜欢替人灵魂代言啊？大家注意了，下次🐶局拿出来的所谓民意就是这些玩意儿。 ,"https://wx2.sinaimg.cn/large/6cf6cb5fly1fibcp5wwkcj209d0go0ty.jpg,https://wx2.sinaimg.cn/large/6cf6cb5fly1fibcp5ngmuj20f00ndjwj.jpg,https://wx4.sinaimg.cn/large/6cf6cb5fly1fibcp67epaj20ez0o1aew.jpg,https://wx1.sinaimg.cn/large/6cf6cb5fly1fibcp6g9ymj20hs0vmq8o.jpg",,,2017-08-07,iPhone 6 Plus,61,157,329,,
4138016903519060,FfWZAeLt2,江苏卫视在放吴京的特种兵第二部啊 ,https://wx2.sinaimg.cn/large/6cf6cb5fly1fiatsbziq5j20gx0gx0ut.jpg,,,2017-08-07,iPhone 6 Plus,21,7,1,,
4137853313033323,FfSJJcJ6z,刚在中国戏曲大会节目上看见一个推理帝，张梦洁……仅仅凭台上出现过哪些嘉宾就推理出最后一道线索题的正确答案是裘盛戎老先生，简直了这脑子…… ,,,,2017-08-06,iPhone 6 Plus,16,3,4,,
4137851584792366,FfSGWk6Ie,上午看见有羊毛说拿着三生三世的票可以去他那里换战狼2的枪版资源，某区算了个帐：一样的30块钱，我不拿去看正版战狼2，我在你三生三世这里受虐？完了只能得一个我想看的电影的枪版？ ,"https://wx2.sinaimg.cn/large/6cf6cb5fly1fiaaqozg9qj20kl0et7aw.jpg,https://wx1.sinaimg.cn/large/6cf6cb5fly1fiaask54xgj20k00zkgo4.jpg",,,2017-08-06,iPhone 6 Plus,29,6,7,,
4137363171580594,FfFZb6Dbs,#战狼2# 战狼我对得起你了…… ,https://wx1.sinaimg.cn/large/6cf6cb5fly1fi8qp9cy9qj20qo0qoq8w.jpg,,,2017-08-05,iPhone 6 Plus,55,10,6,战狼2,
4137362328292453,FfFXOyNff,呼啦啦一厅的人都进去了，战狼真可怕…… ,https://wx2.sinaimg.cn/large/6cf6cb5fly1fi8qlqkycjj20qo0qodkt.jpg,,,2017-08-05,iPhone 6 Plus,19,5,1,,
4137361007328408,FfFVGuKs8,#战狼2# 看看战狼2这恐怖的上座率……空位1、空位0、空位0…… ,https://wx3.sinaimg.cn/large/6cf6cb5fly1fi8qgjp4xuj21w02ioe83.jpg,,,2017-08-05,iPhone 6 Plus,21,8,6,战狼2,
4136998702977395,Ffwvkcuyv,噗哈哈哈哈哈哈哈哈哈哈这是有多烂 ,https://wx3.sinaimg.cn/large/6cf6cb5fly1fi7kug8icxj20yi1jotr0.jpg,,,2017-08-04,iPhone 6 Plus,16,5,26,,
4136976326402278,FfvVeqRwy,我小姐妹是杨洋路人颜粉，本来打算请我看三生三世十里桃花，经过昨晚一夜朋友圈洗礼爆冲，刚给我打电话：“豆豆，明天不看三生三世了，我想还是改看战狼吧，你能陪我去看吗？”我表面冷静，心里那个呐喊哟～～～～～ ,https://wx1.sinaimg.cn/large/6cf6cb5fly1fi7i8virxoj21pc0yihdu.jpg,,,2017-08-04,iPhone 6 Plus,59,16,0,,
4135933063775445,Ff4MyfQah,客观的说啦，吴京哪里眼睛小了，他就是没睁开而已。 ,"https://wx3.sinaimg.cn/large/6cf6cb5fly1fi46gmlr27j209h0dw3zo.jpg,https://wx2.sinaimg.cn/large/6cf6cb5fly1fi46gmuhntj20af0cdgnm.jpg,https://wx2.sinaimg.cn/large/6cf6cb5fly1fi46gmf23jj20dw099aax.jpg,https://wx3.sinaimg.cn/large/6cf6cb5fly1fi46gn1u16j20i207sjsf.jpg,https://wx4.sinaimg.cn/large/6cf6cb5fly1fi46gnr86xj20dw0afgmm.jpg,https://wx4.sinaimg.cn/large/6cf6cb5fly1fi46gnzj6fj208c08ct96.jpg",,,2017-08-01,iPhone 6 Plus,12,6,1,,
4135923400429506,Ff4wY1NJw,像吴京、张晋、杨俊毅们，真的就是行家一出手就知有没有……杨俊毅的枪耍出来那叫一个梨花纷飞，张晋可以平地无起跳辅助动作直接跳起踢到人头、吴京长城上一段太极拳简直惊艳，这是他们多年苦练的回报。吴京现在的担心不无道理，小鲜肉很多、演员也很多，但是像他们这样的真功夫越来越少了，吴京张晋之后，还有谁呢？,,,,2017-08-01,iPhone 6 Plus,79,52,25,,
4135915670460129,Ff4kv1VHr,你们看《太极宗师》吴京长城上打太极啊@冰蛇陛下 @豢龙有道 秒拍视频 ,,"http://f.us.sinaimg.cn/001d5Tdxlx07d5ZVYp0c010f0100gO2N0k01.mp4?label=mp4_hd&template=template_6&Expires=1578067163&ssig=fLVDb8P0GP&KID=unistore,video",,2017-08-01,搜狗高速浏览器,543,168,103,,"冰蛇陛下,豢龙有道"
4135875438977311,Ff3hBBFpl,万万没想到伊朗杯们还有这样的历史啊 ,https://wx2.sinaimg.cn/large/6cf6cb5fly1fi3zuda74nj20qo0qogqr.jpg,,,2017-08-01,iPhone 6 Plus,15,6,36,,
4135702364488112,FeYMsiPyU,#吴京# 话说，他这些年，是怎么从图123的病骄苍白锐利少年孟星魂变成图456的糙爷们儿冷锋的最后三张是福利，以及最后一图台词是我的心声 ,"https://wx1.sinaimg.cn/large/6cf6cb5fly1fi3fy0xqj4j20k00f0ta6.jpg,https://wx4.sinaimg.cn/large/6cf6cb5fly1fi3fy1i8wmj20eu08ct8u.jpg,https://wx3.sinaimg.cn/large/6cf6cb5fly1fi3fy4ner5j20jk0g0q3i.jpg,https://wx4.sinaimg.cn/large/6cf6cb5fly1fi3fy2rkmbj20dw099t9e.jpg,https://wx1.sinaimg.cn/large/6cf6cb5fly1fi3fy3g5kjj20rs0ijn1m.jpg,https://wx1.sinaimg.cn/large/6cf6cb5fly1fi3fy451u8j20jg09qdhi.jpg,https://wx3.sinaimg.cn/large/6cf6cb5fly1fi3fy5wstuj20ci09e74g.jpg,https://wx3.sinaimg.cn/large/6cf6cb5fly1fi3fy25so2j20g40cd0ta.jpg,https://wx4.sinaimg.cn/large/6cf6cb5fly1fi3fy5aunlj20dw0afq4b.jpg",,,2017-07-31,搜狗高速浏览器,35,19,145,吴京,
4135665128147345,FeXOoybuN,重看小李飞刀，发现阿飞叔叔和熊孩子龙小云的互动也挺有意思啊，整个剧集就是两种画风，上半部小云使劲忽悠阿飞，下半部就阿飞叔叔阿飞叔叔的不离口了，跑前跑后、泡妞把妹，也是替他阿飞叔叔操碎了心23333333333 ,"https://wx4.sinaimg.cn/large/6cf6cb5fly1fi3bfhynk5g20b408chdu.gif,https://wx4.sinaimg.cn/large/6cf6cb5fly1fi3aw2272mg20b408cnpd.gif,https://wx4.sinaimg.cn/large/6cf6cb5fly1fi3bjg872kg20b408c7wi.gif",,,2017-07-31,搜狗高速浏览器,11,5,13,,
4135654751340685,FeXxF5CLX,重新看小李飞刀发现亮点噗哈哈哈哈哈哈，惊鸿仙子和上官金虹你们很热么 ,https://wx1.sinaimg.cn/large/6cf6cb5fly1fi3ahy0as4j20ky0fr772.jpg,,,2017-07-31,搜狗高速浏览器,4,2,0,,
4135643233313595,FeXf5dU15,#吴京# 很多人爱阿飞，我却很喜欢当年那个孟星魂，《策马啸西风》这片确实有毒，满身小广告的西门吹雪简直就是那些年必备嘲讽，但是孟星魂却实实在在是里面一股清流，他苍白、纯粹、锋利而又脆弱。他爱着姐姐，姐姐死了，他也就成了行尸走肉，我一直都觉得他其实并不爱明月心，姐姐死了，孟星魂也活不久的。吴京那时候真的很嫩，娃娃脸掐一掐全是胶原蛋白，和俞飞鸿在里面简直绝配，毫不会串戏到小李飞刀，真真的一对璧人，我最喜欢的姐弟恋之一。,"https://wx3.sinaimg.cn/large/6cf6cb5fly1fi394b9hn4j20k00f0ta6.jpg,https://wx1.sinaimg.cn/large/6cf6cb5fly1fi394cgzhqj20ci09et8w.jpg,https://wx1.sinaimg.cn/large/6cf6cb5fly1fi394btyubj20fa0bht98.jpg,https://wx2.sinaimg.cn/large/6cf6cb5fly1fi394d4c1mj20k008s0ua.jpg",,,2017-07-31,搜狗高速浏览器,311,73,55,吴京,
4135592864274316,FeVVQhVWA,#战狼2# 二刷可以看一些细节了，吴京真是苏啊，当年的孟星魂苍白皮肤小弟弟还在眼前，转头就能撩妹大叔了 ,,,,2017-07-31,iPhone 6 Plus,9,6,0,战狼2,
4135554754735400,FeUWnjRTq,#战狼2# 拉上闺蜜二刷啦！！！ ,https://wx3.sinaimg.cn/large/6cf6cb5fly1fi2z0i58t9j20ku0kuac7.jpg,,,2017-07-31,iPhone 6 Plus,11,1,0,战狼2,
4135331919713949,FeP8XEL2B,闪光少女冷门到什么程度？你搜遍了百度都没枪版资源 ,,,,2017-07-30,搜狗高速浏览器,13,4,1,,
4134938107711923,FeETMwmdR,哪位大神手速这么快23333333333333【战狼2】【吴京/张翰】最烈的酒vs最翰的人（冷锋/卓亦凡）#哔哩哔哩动画# 网页链接 ,,,,2017-07-29,哔哩哔哩,15,9,26,哔哩哔哩动画,
4134921812928737,FeEtvchTH,#战狼2# 对了我要说一句，结尾那里有个海军小哥长得好像胖儿！ ,,,,2017-07-29,搜狗高速浏览器,6,1,1,战狼2,
4134864763086969,FeCZucX3P,#战狼2# 非常好看！真正的全程无尿点，节奏紧凑，吴京作为非专业导演能做到这一步实属难得。以撤侨为背景，看到中国国旗飘扬下国人能得国家庇护，对比非洲的战乱流离，真的觉得一个强大的祖国是多么难得。场面火爆，紧张刺激，个别镜头有点乱但是不妨碍观影体验。热血程度比第一部要差一点，不过离开了理想主义回归一部分现实是正确的，有的地方挺无奈，没有逃避现实问题，国人的某些阴暗面也没有刻意美化。血腥度提高，未成年观众建议家长陪同观看。吴京这个岁数了还硬桥硬马的扛打，真心不容易，老班长很可爱，张翰的角色全程简直就是熊孩子历险记，强行装逼失败笑点担当，最后还以为他要和老班长一起牺牲，还好老天爷没有欺负熊孩子,,,,2017-07-29,iPhone 6 Plus,93,73,33,战狼2,
4134825131058229,FeBXz4rid,#战狼2# 开刷 ,https://wx4.sinaimg.cn/large/6cf6cb5fly1fi0n7v1xmsj20qo0qowhf.jpg,,,2017-07-29,iPhone 6 Plus,15,0,0,战狼2,
4134795741642597,FeBca6Tjv,一个星期了终于看见太阳了…… ,,,,2017-07-29,iPhone 6 Plus,1,4,0,,
4134627163562835,FewOgeWR5,就这个建国建党建军三部曲来说，艺术性和主旋律兼顾最好的还是建党伟业。客串也很多，还有小品喜剧演员集体变北洋军阀，但是并不让人觉得太出戏，而其他客串的也基本演技不怎么掉线，演技抱歉那几位偶像也算是巧妙的藏拙没有硬往上顶，关键戏份那几个演员都很给力，冯远征的陈独秀是我见过最合适的，把陈独秀那种书生意气和内在的高傲近似偏执表现的很好，他和李大钊那种高山流水遇知音演绎的非常到位，建军里面的于和伟就逊色了一些，哭李大钊好像刘备哭刘璋，没啥感情。,,,,2017-07-28,iPhone 6 Plus,20,5,0,,
4134580833913812,FevBxgqa0,明天去接着看电影，在二刷闪光少女和刷战狼2之间纠结 ,,,,2017-07-28,iPhone 6 Plus,0,20,0,,
4134579965052340,FevA8lclm,#闪光少女# 同一期的闪光少女专题 ,"https://wx3.sinaimg.cn/large/6cf6cb5fly1fhzv1lhdw5j20qo0qojxx.jpg,https://wx1.sinaimg.cn/large/6cf6cb5fly1fhzv1uaq4oj20qo0qo10a.jpg,https://wx1.sinaimg.cn/large/6cf6cb5fly1fhzv26esjaj20qo0qoagi.jpg",,,2017-07-28,iPhone 6 Plus,7,2,0,闪光少女,
4134579155315578,FevyPmiP8,#建军大业# 这是最新一期看天下里面的专题报道，把关于导演的这三段重点勾一下：找刘伟强导演此片是因为412这段就是黑帮故事，觉得他能拍；刘伟强按照自己熟悉的感觉拍这部电影，说叶剑英是无间道；为了视觉刺激“一次炸到爽”还专门设法助长炸后的火焰高度——能把412说成黑帮故事、导演只遵从自己熟悉的感觉主观重置历史；罔顾“小米加步枪”的历史真实弄200个炸点就为了爽，你觉得我还能说啥？,"https://wx2.sinaimg.cn/large/6cf6cb5fly1fhzuys865vj21f01f5kjm.jpg,https://wx4.sinaimg.cn/large/6cf6cb5fly1fhzuyqrc0jj21f00lf1kx.jpg,https://wx2.sinaimg.cn/large/6cf6cb5fly1fhzuyr8ktmj21f00b2k75.jpg",,,2017-07-28,iPhone 6 Plus,86,54,213,建军大业,
4134573182770241,FevpcbCFj,马格机哟这雨下了一整天了噜……从早上四五点到现在，妈哟这还是我石家庄吗…… ,,,,2017-07-28,iPhone 6 Plus,0,1,0,,
4134385089720489,FeqvOEMK5,又下雨了……这一星期每天早起都下雨啊…… ,,,,2017-07-28,iPhone 6 Plus,1,0,0,,
4134216499734267,Fem7TEQkj,发布了头条文章：《《建军大业》当人物为艺人服务，当历史事件为娱乐公司让路》 《建军大业》当人物为艺人服务，当历史事件为娱乐公司让路 ,,,,2017-07-27,微博 weibo.com,134,62,98,,
4134205908326859,FelQOyWcb,顺便说一句，亲，改了名并且禁止让别人用曾用名搜到你这个做法确实挺高明，你家其他脑残也确实认为你做的天衣无缝于是来找我茬说是我捏造的你来黑你家爱豆，但是……亲，你真的以为搜不到你了？？？ ,"https://wx4.sinaimg.cn/large/6cf6cb5fly1fhyo3cg9f4j20pq0f577o.jpg,https://wx3.sinaimg.cn/large/6cf6cb5fly1fhyo3ea7tvj20t60d840z.jpg,https://wx2.sinaimg.cn/large/6cf6cb5fly1fhyo3dm2toj20t2086q31.jpg,https://wx3.sinaimg.cn/large/6cf6cb5fly1fhyo3d0k2bj20gv0a1wgf.jpg,https://wx3.sinaimg.cn/large/6cf6cb5fly1fhyo3lrv2ij20gn0603z9.jpg,https://wx3.sinaimg.cn/large/6cf6cb5fly1fhyo3lx4y0j20gr07x3zn.jpg",,,2017-07-27,搜狗高速浏览器,8,9,9,,
4134204109260536,FelNUCR5u,我是个爱较真的人，某个张天爱粉丝说宋美龄是交际花，被我挂了，然后这丫改名了或者销号了我不知道，然后她家这个粉丝就蹦出来说这个脑残压根不存在是我捏造的，这锅我不背，亲，销号了就当没事了？就可以让你家其他脑残来翻脸不认账了？ ,"https://wx3.sinaimg.cn/large/6cf6cb5fly1fhynw425xvj20gv0a1wgf.jpg,https://wx1.sinaimg.cn/large/6cf6cb5fly1fhynudh7r4j20j80gwacx.jpg,https://wx2.sinaimg.cn/large/6cf6cb5fly1fhynue0zqhj20j80dbgnp.jpg,https://wx2.sinaimg.cn/large/6cf6cb5fly1fhynuemqruj20gn0603z9.jpg,https://wx4.sinaimg.cn/large/6cf6cb5fly1fhynufa6vcj20gr07x3zn.jpg",,,2017-07-27,搜狗高速浏览器,18,7,5,,
4134187105370049,FelmumwZH,从“我只知道欧豪不知道叶挺”到“我爱张天爱演的年轻交际花因为宋美龄是交际花。”，有些粉儿的存在真的让我想问问这些偶像是欠你钱吗当你智商欠费的证据。 ,https://wx4.sinaimg.cn/large/6cf6cb5fly1fhylxwr6wvj20gv0a1jv1.jpg,,,2017-07-27,vivo X5·K歌之王,156,150,286,,
4134182592816228,FelfdbOD2,#建军大业# 这里面老戏骨黄志忠张涵予于和伟们不论，其他的年轻演员艺人偶像里，值票价的：刘烨朱亚文周一围马浴柯李沁宋佳；值一半票价的：马伊琍关晓彤周冬雨白客陈晓等：值三分之一票价的：余晓群霍建华刘昊然陈赫（他真的是被曾小贤拖累的），剩下的……哪儿凉快哪儿呆着去吧 ,,,,2017-07-27,iPhone 6 Plus,30,18,20,建军大业,
4134177740371423,Fel7o1yCH,#建军大业# 妹子们演技基本全面盖过小鲜肉，小宋佳马伊琍打头，周冬雨关晓彤都不错，李沁尤其表扬，跟刘烨演的毛爷爷诀别时候那句“不要回头，走。”不仅仅是一个妻子送别丈夫，也是一个战士在送别她的战友，真真是柔中带刚女中豪杰。唯一差评张天爱，那个宋美龄不忍直视，宋美龄不是祸国妖姬好吗？人家是大家闺秀好吗？你扭腰摆胯的毫无气质内涵好么。,,,,2017-07-27,iPhone 6 Plus,236,230,74,建军大业,
4134166474131691,FekPdhkQb,#建军大业# 这里面的小鲜肉有一个算一个，包括我喜欢那个在内，台词表演各方面真的是负数∞大每当我以为这个是底线的时候就会蹦出另一个底线，一个赛一个尴尬癌晚期，跟专业演员放一起简直就是公开处刑游街，喊个口号底气不足，站在那里仪态不忍卒睹，算我ball ball你们安心刷脸吧，还是可以爱的……,,,,2017-07-27,iPhone 6 Plus,30,25,32,建军大业,
4134158278248674,FekBZyBR8,#建军大业# 看完第一场首映，感觉还可以，没什么尿点，节奏还算紧凑。只是战争场面看出导演功力还有点力不从心，有些节奏混乱。全程年轻毛爷爷周总理嘴炮Max，俩人嘴炮一个比一个给力还气势十足；蒋搬运大队长居然只干了一件事：忙着追妹子结婚，你不失败谁失败；手下一群猪队友，南昌唯一能打的周一围演的那哥们儿完全就是被猪下属坑死的啊！跟这电影讲历史细节可以算了明显看出来人物为演员服务，历史戏份为娱乐公司服务认真追究的要气死在影院里，真的。说演员，演员艺人偶像真是泾渭分明三个次元空间的存在，峰峰张艺兴欧豪马天宇们那个台词……不忍直视，跟刘烨朱亚文们站一起尴尬癌都要犯了陈伟霆配音拯救，周冬雨们虽然也不行但是起码不尴尬，李沁那句“不要回头，走”我眼泪都下来了，一群男生的演技被妹子盖了。总体还凑合，长度将近两个半小时，还可以。,,,,2017-07-27,iPhone 6 Plus,114,189,164,建军大业,
4134120671878208,FejDl7SBG,建军大业开刷第一场首映 ,https://wx4.sinaimg.cn/large/6cf6cb5fly1fhyeb8aj8mj20qo0qojve.jpg,,,2017-07-27,iPhone 6 Plus,7,10,0,,
4133800117969921,Febijxrl7,这星期跟下星期的气温真不是一个画风 ,"https://wx2.sinaimg.cn/large/6cf6cb5fly1fhxdhsej8gj20yi1pc4jf.jpg,https://wx3.sinaimg.cn/large/6cf6cb5fly1fhxdhsyhm3j20yi1pc1cw.jpg",,,2017-07-26,iPhone 6 Plus,3,0,0,,
4133681524791698,Fe8d2k6xs,又下雨了哗啦啦啦 ,,,,2017-07-26,iPhone 6 Plus,5,1,1,,
4133358915450651,FdZOHmRXJ,以前能拿10块金牌，🐶局来了，拿5块金牌。然后🐶局说：看吧！一改革弊端都显现出来了！丢金都是这些教练运动员之前不改革的错！幸亏有我改革，才保住了5块金牌！看我多有能力！ ,https://wx3.sinaimg.cn/large/6cf6cb5fly1fhvytiocjaj20hs0zm7r5.jpg,,,2017-07-25,iPhone 6 Plus,32,6,49,,
4133067608560916,FdSeQzV5i,#闪光少女# 粉肠好看！全程无尿点，节奏明快，合格，不，优秀的青春电影，中二直白的励志，但是就是让人觉得不造作不矫情的舒服，很值票价！决定二刷！斗琴很燃！全程抖腿预警！ ,,,,2017-07-24,iPhone 6 Plus,12,2,1,闪光少女,
4133026109648208,FdR9UEtWg,妈呀晴天出太阳了！说好的雨呢！！！ ,,,,2017-07-24,iPhone 6 Plus,4,0,0,,
4133014361181741,FdQQY4Xql,做了一个梦，梦见说明天要到38度以上，活活吓醒 ,,,,2017-07-24,iPhone 6 Plus,3,4,3,,
4132984904386861,FdQ5sipdP,今天下午去看闪光少女 ,,,,2017-07-24,iPhone 6 Plus,5,9,0,,
4132842251911263,FdMnn81cP,其实国人确实有一个见了啥雕像啊树啊石头啊大件摆设啊都要摸一摸的毛病，还有各种说头，什么摸一摸万事如意恭喜发财顺心随喜心想事成乃至于摸一下生女儿摸两下生儿子都有也罢这些都还算好理解，直到我见到高考前有学生家长居然去摸学校里的杜甫雕像求孩子金榜题名…… ,https://wx2.sinaimg.cn/large/6cf6cb5fly1fhubhka1qxj20b40g4dgi.jpg,,,2017-07-24,iPhone 6 Plus,7,3,30,,
4132837332302825,FdMfr9F4l,#孙杨闪耀布达佩斯##孙杨夺冠# 王者就是王者啊，实力就是一切，把所有的质疑用金牌扇回去是体育圈不变的法则。顺便也要恭喜一下霍顿，你虽然输了比赛，但是以后每次盘点孙杨的胜利都会特意鞭尸一下你的贱的 ,https://wx2.sinaimg.cn/large/6cf6cb5fly1fhuax6ck8mj20hs0zm7r5.jpg,,,2017-07-24,iPhone 6 Plus,42,2,3,"孙杨闪耀布达佩斯,孙杨夺冠",
4132803765001199,FdLnikZ2v,从没有一次看综艺看得心里堵得很想去玉林过个狗肉节 ,,,,2017-07-23,iPhone 6 Plus,7,11,24,,
4132724333811805,FdJjbfZCJ,不过就是买菜站在路边讲了两分钟的价蚊子就给我腿上来了四个包 ,,,,2017-07-23,iPhone 6 Plus,4,5,0,,
4132587494477600,FdFKtiMPm,真不是我性别歧视，发现了一些有趣的事情就忍不住说咯：男同性恋骗婚被揭穿就说大家歧视同性恋；男艾滋病患者道德绑架大家为啥不跟他拥抱；男恋童癖攻击这个社会为什么不包容他——不管性向性癖如何，这些归根结底还是觉得自己性别优越，还是觉得自己长根那玩意儿就高人一等，吊癌亚变种而已。 ,https://wx3.sinaimg.cn/large/6cf6cb5fly1fhti888mkoj20ao07v767.jpg,,,2017-07-23,iPhone 6 Plus,41,14,20,,
4132403758328105,FdAY7yWwh,这个大暑中伏对石家庄居然如此友好？？？ ,https://wx2.sinaimg.cn/large/6cf6cb5fly1fhsx4kptaij20qo1bfjxl.jpg,,,2017-07-22,iPhone 6 Plus,4,1,0,,
4131656278740869,FdhwvAFTL,这就是鼠标模具妈哒花了我20多块钱就这么个我还以为会和真的一般大 ,https://wx2.sinaimg.cn/large/6cf6cb5fly1fhqja3hwflj20u00u0aoa.jpg,,,2017-07-20,iPhone 6 Plus,4,7,1,,
4131180934292433,Fd59Pi0EN,李乐天若有情cut27#哔哩哔哩动画#终于把天若有情里面李乐的部分上传了，因为审核的原因一集放一个单独的链接，想看全部的就麻烦一下多点点吧2333333 李乐天若有情cut27 ,,,,2017-07-19,哔哩哔哩,6,2,2,哔哩哔哩动画,
4130148838050881,FcEj9xMoV,#置顶加急##看到的亲友请转##哪里可以定制鼠标形状的巧克力##没有巧克力蛋糕饼干都可以##加急加急##别问我原因##问了我也不说# ,https://wx2.sinaimg.cn/large/6cf6cb5fly1fhlq5hg3yfj205706fq3e.jpg,,,2017-07-16,iPhone 6 Plus,10,33,35,"置顶加急,看到的亲友请转,哪里可以定制鼠标形状的巧克力,没有巧克力蛋糕饼干都可以,加急加急,别问我原因,问了我也不说",
4130106618229212,FcDd3ywNe,我已为captain龙投票！快来为你支持的体育明星提高排名吧！运动员势力榜 ,,,,2017-07-16,微博体育,0,1,1,,
4130098204548715,FcCZuj5kn,琳酱家为了证明他年龄甩童年彩色照片心疼琳酱但是更想笑怎么办 ,"https://wx1.sinaimg.cn/large/6cf6cb5fly1fhlkc4mvwjj20yi0xb7kq.jpg,https://wx2.sinaimg.cn/large/6cf6cb5fly1fhlkc3s8qcj20dw09zafc.jpg",,,2017-07-16,iPhone 6 Plus,17,2,10,,
4129904611828539,FcxXf7FGz,我免费围观了 @吴敬平教练 的回答，问题价值 66.00 元，快来一起免费围观~ 微博问答 ,,,,2017-07-15,微博 weibo.com,2,0,0,,吴敬平教练
4129897456578271,FcxLHrBj9,下雨啦，下雨啦……淅沥沥沥沥哗啦啦啦啦…… ,,,,2017-07-15,搜狗高速浏览器,2,0,0,,
4129660340120907,FcrBg0vs7,暑假的最大特点就是想什么时候睡就什么时候睡想什么时候醒就什么时候醒 ,,,,2017-07-15,iPhone 6 Plus,7,2,0,,
4129654539446211,FcrrTDDof,大早起发现脸又成了大油田各种控油补水都没有啊简直要 ,,,,2017-07-15,iPhone 6 Plus,3,2,0,,
4128689899920360,Fc2m1FCJO,刚在小区楼下看到一个大爷跳着脚骂一男一女，听了听，说是他儿媳妇，前一阵子生了个孙子，老头子怎么看都觉得跟他儿子不像，就天天蹲守，终于给他等到儿媳妇的外遇了，老头叫来了儿子老伴，蹦着高的骂狗男女啊偷汉子啊越骂越难听，儿媳妇刚开始没吭声，后来骂急眼了，一步跳过去指着老头鼻子骂“我偷汉子？你老婆才偷汉子呢！别说孙子不是你的，儿子也不是你的！不信你问你老婆，那XXX是谁的爹！”老头转头看着老伴，老太太哇地一声哭了，老头子嘎的一声抽了，然后保安赶紧叫了救护车拉走了，妈蛋三伏天小区门口看狗血剧。,,,,2017-07-12,iPhone 6 Plus,490,519,604,,
4127739490966997,FbDD743yJ,对丁宁苏州世乒赛女单夺冠相关谣言的澄清 kaaggy #哔哩哔哩# 对丁宁苏州世乒赛女单夺冠相关谣言的澄清 ,https://wx1.sinaimg.cn/large/6cf6cb5fly1fhe1fz1yfjj20nm0erab0.jpg,,,2017-07-09,哔哩哔哩移动客户端,20,5,4,哔哩哔哩,
